video_id,title,publishedAt,channelId,channelTitle,categoryId,trending_date,tags,view_count,likes,comment_count,thumbnail_link,description
"AndytaBBKrg","SUBSCRIBER KO 50,000 💎DIAMONDS DE DIYE #shorts #freefireshorts #ashortaday #chillgamer","2022-06-05T08:10:43Z","UCr3gKMzLLCYire9obCUSkMQ","chill gamer","20","22.06.06","[none]","3435710","367735","1029","https://i.ytimg.com/vi/AndytaBBKrg/default.jpg",""
"PYYWWivHORQ","Bacche ne Namak Pani Pila Diya.😂😂#shorts #funny #funnyvideo #comedy #pradeeplifevlogs","2022-06-04T04:38:18Z","UCBOIHREYqq_YWsl1a4Bh59Q","Pradeep life vlogs","24","22.06.06","short|Short video|short funny video|funny short video|funny|comedy|comedy short video|short feed|short break|mujjuu___14","9015717","358750","503","https://i.ytimg.com/vi/PYYWWivHORQ/default.jpg","Dosto aapko yah funny video kaisa laga. Agar aapko yah funny video accha laga ho to ek like jarur karna. 🙏@Pradeep life vlogs My vloging channel link 👇https://youtube.com/channel/UCbplguKrNU-rWaakLWhJXiwMy Instagram link👇https://instagram.com/pradeeplifevlogsMy Facebook page link👇https://www.facebook.com/pradeeplifevlogs/#shorts #funny #funnyvideo #comedy #shortfeed #pradeeplifevlogs"
"fPX0C-g5xpU","JAWAN | Title Announcement | Shah Rukh Khan | Atlee Kumar | 02 JUNE 2023","2022-06-03T08:30:04Z","UCjJKg01HAP01xCLVhDmnLhw","Red Chillies Entertainment","24","22.06.06","SRK|Shah rukh khan|shahruh khan|Srk movies|SRK new movie Jawan|Javan|Atlee Shah rukh khan Jawan|Nyanthara|Jawan Action film|Jawan 2023|SRK new release","23697016","726095","69011","https://i.ytimg.com/vi/fPX0C-g5xpU/default.jpg","Red Chillies Entertainment presents Shah Rukh Khan in and as #JAWANAn Atlee filmRed Chillies Entertainment announces JAWAN, the highly anticipated film starring the megastar #ShahRukhKhan and helmed by the superstar director #AtleeKumar, the biggest action entertainer is set to release 2nd June 2023 across five languages - Hindi, Tamil, Telugu, Malayalam and Kannada."
"Mu_a7sp7ES8","ഡോക്ടർ റോബിൻ മനസ് തുറക്കുന്നു | Doctor Robin First Exclusive Interview | Bigg Boss Dr. Robin","2022-06-05T08:25:35Z","UCRRSXs4VcnLt2Kk5nmNmPZQ","Mazhavil Keralam","24","22.06.06","[none]","1836525","130351","7610","https://i.ytimg.com/vi/Mu_a7sp7ES8/default.jpg","Doctor Robin First Exclusive Interview | Bigg Boss Malayalam Season 4 | Bigg Boss Malayalam Asianet | Bigg Boss Malayalam Doctor Robin First Exclusive Interview | Bigg Boss Malayalam Dilsha Prasannan | Bigg Boss Malayalam Dr Robin Family Interview |  Bigg Boss Malayalam Dr. Robin | Bigg Boss Malayalam Dr Robin Dilsha |  Bigg Boss Malayalam Dr Robin Family | Bigg Boss Malayalam Blesslee | Bigg Boss Malayalam Blessley | Bigg Boss Malayalam Doctor Robin Family Interview🔔 Subscribe us to catch up on the latest Trends and News.🔔പിന്തുണയ്ക്കുന്ന എല്ലാവർക്കും നന്ദി.                              Contact Us                                     🔻🔻             Email: mazhavilkeralam@gmail.com             Whatsapp: +91 635760614Facebook   : https://www.facebook.com/mazhavilkerlamTwitter    : https://www.twitter.com/mazhavilkeralamInstagram  : https://www.instagram.com/mazhavilkeralam________________________________________________DISCLAIMER:- All the content published on this channel is protected under the COPYRIGHT LAW and should not be used / reproduced in full or part without the creator's (MAZHAVIL KERALAM) prior permission.________________________________________________#biggbossdoctorrobininterview#doctorrobininterview#bbdrrobin#doctorrobinbiggboss#robindoctor#doctorrobininterview#doctorrobinairport#robinairport#doctorrobinairportscene#biggbossdoctorrobinradhakrishnan#doctorrobinradhakrishnan#biggbossmalayalamseason4#biggbossmalayalam4#biggbossmalayalam #hotstarbiggbossmalayalam #biggbossseason4malayalam #biggbossasianet #BBS4MALAYALAM"
"QRGF4HB1QCo","Living in the World's Smallest City!! *Overnight Challenge* दुनिया का सबसे छोटा शहर!!","2022-06-05T06:45:12Z","UCBu8GHpHy9vX8ixdTb38kIQ","Pragati Verma","24","22.06.06","Pragati verma|Pragati|Pragati Verma new videos|Mini city|Tiny city|Small city|Chota sahar pragati verma|Tiny pragati verma|Mini challenge|Giant vs mini|Fun|Funny|Funny challenge|24 hours in|Superpower|Shorts superpower|New video|New vlog today|Nee vlog|Living in a mini city|Living in tiny city","2530977","111978","12209","https://i.ytimg.com/vi/QRGF4HB1QCo/default.jpg","Tinyyyyyyyyyy Cityyyyyy😛Follow me on Instagram @pragati.vermaa Subscriber Count : 3,977,406 🌸"
"ZPnGlxMtfWQ","கணவரிடம் இருந்து ஒரு முழம் மல்லி பூ | பல பெண்களின் ஏக்கம் | உண்மை என நினைத்தால் ஷேர் பண்ணுங்க 🙏🏼","2022-06-04T12:30:10Z","UCpc7YF6furyBXrHRPll0C9g","Komalies","22","22.06.06","[none]","1692526","157580","1201","https://i.ytimg.com/vi/ZPnGlxMtfWQ/default.jpg",""
"Fn9bnOhnvN4","Samsung S22 Ultra 100X Zoom-ന്റെ രഹസ്യം #shorts #mrperfecttech","2022-06-05T12:46:46Z","UCCya-YUszMuiTAR3lfYMuog","Mr Perfect Tech","28","22.06.06","[none]","545056","64691","147","https://i.ytimg.com/vi/Fn9bnOhnvN4/default.jpg",""
"DVdwSc-X6YI","Virata Parvam Trailer | Rana Daggubati, Sai Pallavi, Priyamani | Venu Udugula","2022-06-05T12:33:04Z","UCiWKEIAFbdMIEicYBwKfi0g","SLV Cinemas","1","22.06.06","virata parvam trailer|rana daggubati|sai pallavi|rana virata parvam|virata parvam teaser|Virata Parvam|latest movie virata paravam|slv cinemas|rana movies","6776855","197739","5929","https://i.ytimg.com/vi/DVdwSc-X6YI/default.jpg","Watch the intense Trailer of Virata Parvam.Cast - #RanaDaggubati, #SaiPallavi, Priyamani, Nivetha Pethuraj, Nandita Das, Naveen ChandraWriter & Director: Venu UdugulaProducer: Sudhakar CherukuriBanner: Suresh Productions, SLV CinemasPresented by Suresh BabuDOP: Dani Salo, Divakar ManiEditor: Sreekar PrasadProduction designer: Sri Nagendra Music: Suresh BobbiliStunts: Peter Hein, Stefan RichterChoreography: Raju Sundaram & Prem RakshithTrailer Cut : RaviPRO: Vamsi - SekharExecutive producer: Vijay Kumar Chaganti Publicity Design: Dhani AelayMarketing: First ShowFor more updates about Sri Lakshmi Venkateswara Cinemas:Twitter :- https://twitter.com/SLVCinemasOfflInstagram :- https://www.instagram.com/slv_cinemas/Facebook :- https://www.facebook.com/SLVCinemasOfficial/"
"iEUMMbT4EOQ","തന്റെ പെങ്ങൾ സംങ്കടത്തോടെയും പ്രാർത്ഥനയോടെയും Shihab Chotur നു വേണ്ടി പാടിയത്. ഫോണിൽ Shihab. 4 ആംday","2022-06-05T08:31:33Z","UCdRSsqz0m-l0RAfjr40C1RA","jilshad vallapuzha Official","10","22.06.06","noufal ftkd|jilshad vallapuzha|vallapuyzha videos|vlog malayalam|ansar ansu|kasarkode mrrge fumction|malayalam new ebulljet videos|mallufamily videos mallu travaler videos|news malayalam|today news malayalam|trending videos|jilshad umma song|entummakoru marumol|feeling status|happy status malayalam\|ummayum monum videos noufal|shihab chottur songs videos|shihab chottur video today|shihab day walking|kerala to makkah shihab chotur walking","659564","18223","1040","https://i.ytimg.com/vi/iEUMMbT4EOQ/default.jpg",""
"Hwybp38GnZw","I Built Willy Wonka's Chocolate Factory!","2022-06-04T20:00:02Z","UCX6OQ3DkcsbYNE6H8uQQuVA","MrBeast","24","22.06.06","[none]","39379412","2889968","121766","https://i.ytimg.com/vi/Hwybp38GnZw/default.jpg","MILK Chocolate 🍫 Win a Tesla or be in a MrBeast video - Buy now ▸ https://feastables.comGet Honey for FREE today ▸ https://joinhoney.com/mrbeast  Honey finds coupons with one click. Thanks to Honey for sponsoring!SUBSCRIBE TO GORDON!! @Gordon Ramsay SUBSCRIBE OR I TAKE YOUR DOG╔═╦╗╔╦╗╔═╦═╦╦╦╦╗╔═╗║╚╣║║║╚╣╚╣╔╣╔╣║╚╣═╣ ╠╗║╚╝║║╠╗║╚╣║║║║║═╣╚═╩══╩═╩═╩═╩╝╚╩═╩═╝----------------------------------------------------------------follow all of these or i will kick you• TikTok - https://www.tiktok.com/@mrbeast• Twitter - https://twitter.com/MrBeast• Instagram - https://www.instagram.com/mrbeast• Facebook - https://www.facebook.com/MrBeast6000/• Official Merch  - https://www.shopmrbeast.com/• Beast Philanthropy - https://www.beastphilanthropy.org/Text me @ +1 (917) 259-6364 I'm Hiring! - https://www.mrbeastjobs.com/--------------------------------------------------------------------Oh and Honey’s lawyers said we need this disclaimer: “Members received compensation for their participation. Testimonials reflect the real life experience of individuals who used our products. Individual results may vary."
"fnQMgCqgrOw","TRYING WIERD INDIAN FOOD (Maggi Milkshake)","2022-06-04T13:44:19Z","UCx6F-rETGiz7xf_vkMmX2yQ","Mythpat","24","22.06.06","mythpat food video|wierd food hacks|maggi food|chocolate food|cooking funny","3064877","280248","11647","https://i.ytimg.com/vi/fnQMgCqgrOw/default.jpg","Download Public app - https://bit.ly/publicapp_MythpatToday we try Weird Indian Food with @lali We make funny food like Maggi Milkshake, Gulab Jamun Pizza, Chocolate Biryani and many more.Aloo Ka Paratha song by Legend Baba Sehgal!Thank you @Slayy Point and @Thugesh for free content :pfollow - https://www.instagram.com/mythpatspotify - https://spoti.fi/TheMythpatPodcast#MythCooks"
"i60pup4wvKs","relatable ആണോ?","2022-06-05T11:31:18Z","UCLa-ASLMIpWEOlZsJ4_CLUg","Akhil Nrd","22","22.06.06","[none]","1515610","197303","513","https://i.ytimg.com/vi/i60pup4wvKs/default.jpg",""
"CVTqAQD5bFA","Chomtu or gullu ki jodi ! Pasta party !! #shorts #ashortaday #rajatp_here","2022-06-03T14:10:27Z","UCsVLjuLlsIsmIIQMW2s_zag","Rajat shorts !!","24","22.06.06","[none]","6167452","341211","158","https://i.ytimg.com/vi/CVTqAQD5bFA/default.jpg",""
"IuQpJUO8Yak","GUESS THE LOGO CHALLENGE BROTHER VS BROTHER | Rimorav Vlogs | BABY QUEEN","2022-06-05T13:30:19Z","UCW-p-Cpqph_-56eGvIYksCw","Baby Queen","22","22.06.06","Rimorav|Rimorav vlogs|Baby queen|Diksha Sharma|Guess the logo challenge|Guess the logo baby queen|Guess the logo rimorav vlogs|Rishi dev|Ri vlogs|Sanjay Dutt|Springspoon|Fudge","1072119","139152","2899","https://i.ytimg.com/vi/IuQpJUO8Yak/default.jpg","Watch GUESS THE LOGO CHALLENGE | BROTHER VS BROTHER by BABY QUEEN from Rimorav Vlogs presents RI VlogsMake meaningful connections without stepping out of your house. Download happn now http://gethap.pn/ZylQ"
"YYVzWHFTg5M","Bhagya Lakshmi","2022-06-05T15:00:13Z","UCqSlPR1Da1S8_hhMcQnRSuw","ZEE TV USA","24","22.06.06","ZEE|TV","957049","10612","0","https://i.ytimg.com/vi/YYVzWHFTg5M/default.jpg","Virendra ji hain Lakshmi se naraaz, par kya woh kabhi samajh paayenge uski majboori? Dekhiye #BhagyaLakshmi, sirf #ZeeTVUSA par. #LakshmiKaSaahas #BhagyaLakshmi #BhagyaKiMarzi #AishwaryaKhare #RohitSuchanti #BhagyaLakshmi #ZeeTV"
"qpgDcX1-oQk","ഒറ്റയ്ക്ക് canteen🍱 ൽ കയറിയ ഞാൻ..🙂 #Shorts","2022-06-05T12:30:21Z","UCeRKth3iQejgL05hMSScFJw","Yadav Moko","24","22.06.06","[none]","1097939","135299","242","https://i.ytimg.com/vi/qpgDcX1-oQk/default.jpg","Comedy video by yadav moko.#Shorts"
"PckSjSKAQyI","Mere Humsafar Episode 22 | Presented by Sensodyne (English Subtitles) 2nd June 2022 | ARY Digital","2022-06-02T16:01:40Z","UC4JCksJF76g_MdzPVBJoC3Q","ARY Digital HD","24","22.06.06","ary digital|ary digital drama|ary drama|pakistani drama|Mere Humsafar Episode 22 drama|watch new Episode Mere Humsafar Episode 22|Mere Humsafar Episode 22 New Episode|ary digital Mere Humsafar Episode 22|ary digital drama Mere Humsafar Episode 22|pakistani new drama Mere Humsafar Episode 22|ary digital drama Mere Humsafar Ep 22|ary digital drama Mere Humsafar|ary digital Pakistani Drama Mere Humsafar|Mere Humsafar Episode 22 2nd June 2022|Farhan Saeed|Hania Aamir","17179934","356256","14386","https://i.ytimg.com/vi/PckSjSKAQyI/default.jpg","Mere HumSafar Episode 22| Farhan Saeed | Hania Amir | 2nd June 2022 | ARY DigitalWatch All Episodes of #MereHumSafar Here : https://bit.ly/35j7UzOMere Humsafar | The Poetic Tale Of Hala & Hamza | Presented By SensodyneMere Humsafar is the life story of Hala, born to a Pakistani father and foreign mother who leaves them after her birth.Written By: Saira RazaDirected By: Qasim Ali MureedCast:Farhan Saeed ,Hania Aamir,Waseem AbbasAly KhanSamina AhmedSaba HameedAamir QureshiTara MehmoodZoya NasirUmer ShehzadWatch #MereHumsafar Every Thursday,at 8:00 pm, only on ARY Digital.#MereHumSafar #HaniaAmir #FarhanSaeedSubscribe: https://www.youtube.com/arydigitalasiaDownload  ARY ZAP :https://l.ead.me/bb9zI1Pakistani Drama Industry's biggest Platform, ARY Digital, is the Hub of exceptional and uninterrupted entertainment. You can watch quality dramas with relatable stories, Original Sound Tracks, Telefilms, and a lot more impressive content in HD. Subscribe to the YouTube channel of ARY Digital to be entertained by the content you always wanted to watch.#ARYDigital #entertainment #ARYNetwork #PakistaniDrama #HaniaAmirDrama #MereHumsafarBestScenes #HaniaAmirBestScenes"
"kwlGsNyr5e8","Watch till the end (Bewafa) 😎🔥 #shorts #bewafa","2022-06-01T03:51:36Z","UC5apxzE3aEOpvP0XkeuW8mw","Bobby chourasiya","22","22.06.06","[none]","35474958","3216673","6211","https://i.ytimg.com/vi/kwlGsNyr5e8/default.jpg",""
"CP259Ny_epg","HIMLANDS - FalanaG HELPED ME AGAINST WIZARD | Minecraft [S-4 part 9]","2022-06-04T06:24:00Z","UCZ9lCUhUOUrwqVJmfBkN92A","YesSmartyPie","20","22.06.06","Yes smarty pie|SmartyPie|Smarty pie|YesSmartyPie Minecraft|yessmartypie himlands|yessmartypie himlands new video|revenge from friends in Minecraft|revenge|YesSmartyPie revenge|YesSmartyPie revenge series|my friends Minecraft hindi|friends revenge series|himland new video|hogalalla vs yessmartypie|my friends minecraft hindi|HIMLANDS WIZARD|himlands season 4|himlands season 4 ep 9|FalanaG Helped Me Against Wizard|wizard is scared","2684117","296267","29360","https://i.ytimg.com/vi/CP259Ny_epg/default.jpg","#Minecraft #HimlandsPrevious Episode ~ https://youtu.be/3kk2D7nBtj4HIMLANDS - FalanaG Helped Me Against Wizard| Minecraft [S-4 part 9]Follow me on Instagram ~ https://www.instagram.com/hitesh.khangtaVlog Channel ~Hitesh Khangta Vlogs ~ https://www.youtube.com/channel/UCwCk4ZRlwu5mX_i_CckcWvwYesSmartyPie Shorts ~https://youtube.com/channel/UCjWM0iY1NoLJE4MHwy2J9QgFollow me on Loco ~ https://loco.onelink.me/65Kg/YesSmartyPieOPBecome a Channel Member for some extra benefits 😁.https://www.youtube.com/channel/UCZ9lCUhUOUrwqVJmfBkN92A/joinDiscord link ~ https://discord.gg/Hc5x6vDB7ZGame Name - MinecraftMusic in Background ~ By Kevin MacLeod & Epidemic Soundsif you see this ~ comment #YesSmartyPie"
"1cxKaYK2CmI","கொஞ்சம் சந்தோசமா இருந்துட்டோம்னா அந்த ஆண்டவனுக்கு பொறுக்காது...இது எனக்கு மட்டும் தானா? 🤔 ManiKani","2022-06-03T12:30:01Z","UCpc7YF6furyBXrHRPll0C9g","Komalies","22","22.06.06","[none]","2658606","0","372","https://i.ytimg.com/vi/1cxKaYK2CmI/default.jpg",""
"DH3UlDUoxiQ","LADY Dr. SALUNKHE | Stand Up Comedy | Crowd Work | Gaurav Kapoor","2022-06-06T05:30:59Z","UCeP5_FL11TnvXuvrFvALJyA","Gaurav Kapoor","23","22.06.06","stand up comedy|indian stand up comedy|crowd work comedy|Gaurav Kapoor new stand up|hindi stand up comedy|indian comedian|new stand up comedy|gaurav kapoor new video|laugh store|stand up","677399","63948","920","https://i.ytimg.com/vi/DH3UlDUoxiQ/default.jpg","Hi Guys. This is an on-spot interaction video with audience. I hope you like it. If you liked the video. Do subscribe to the channelJoin e-mail list for all the early updates about live shows in your city, new vides etc. - https://bit.ly/3HIUviOUpcoming Show Details:Delhi (Dwarka) - 10th June - https://in.bookmyshow.com/events/gaurav-kapoor-live/ET00317331Ahmedabad - 11th June - https://in.bookmyshow.com/events/gaurav-kapoor-live/ET00328077Surat - 12th June - https://in.bookmyshow.com/events/gaurav-kapoor-live/ET00328071Chennai - 18th June - https://in.bookmyshow.com/events/gaurav-kapoor-live/ET00327559Mumbai - 19th June - https://in.bookmyshow.com/events/gaurav-kapoor-live/ET00322373Delhi (Auditorium Show) - 26th June - https://in.bookmyshow.com/events/gaurav-kapoor-live-delhi/ET00329469Credits:Venue: The Central Club of Comedy, GurgaonVideo Recording: Vedanshi & Team, The Central Club of ComedyEdit: Neona FilmsSound Mix & Master: Srijith Do fill the form to get the update on mail, phone or Insta DM - https://bit.ly/3HIUviOKeep checking this space of follow on Insta for regular show updateVlog Channel - https://www.youtube.com/c/GauravKapoorVlogsInstagram: https://www.instagram.com/gauravkpoor/"
"M_F4KPh009k","Garena Freefire Sent Me A Mysterious Gift 🤯😱 #shorts #graduateff #freefireprank","2022-06-04T06:30:18Z","UC4a_sBDB0DQiRw9hOmBXxBg","Graduate ff ","20","22.06.06","shorts|garena freefire sent me mysterious gift|freefire best funny gifts|amazing prank of freefire|viral freefire funny jokes|graduate ff best gifts|random gifts from freefire|graduate ff vs freefire|graduate ff|mysterious gift|gw manish|youtube short|freefire gifts unboxing","1892881","449124","1526","https://i.ytimg.com/vi/M_F4KPh009k/default.jpg","Garena Freefire Sent Me A Mysterious Gift 🤯😱 #shorts #graduateff #freefireprankMatch Making In Same Match With Proof 😱 OMG Experiment 🤯 #shorts #graduateff #freefireprankInstagram 👇👇 - https://instagram.com/graduate_ff?utm_mediumI Scam Big Youtuber I'd 🤣😝 #shorts #graduateff #freefireprankBig Youtuber Call Me Noob 🤣😝 #shorts #graduateff #freefireprankCollection Verses With Random Players 😂😝 #shorts #graduateff #freefireprankCan I Save My Teammates Life InSide Zone 😱🥺 #shorts #freefireprank #graduateffTop Mysterious I'd In Freefire !! 😱👻 paraSAMSUNG,A3,A5,A7,A6,J2,J4,J5,J7,S9,A10,A20,A30,A40,A50Most Ammo Gun Of Freefire || #shorts #freefirefactviralIn This Video - Freefire Unknown Facts #shorts #viralThanks For Watching ❤️❤️ Love You All 😍❤️#Shorts #Garenafreefire #viralfreefirefact #freefirefactshort #amazingfact #viralshort #shortvideo #freefire #ytshorts #youtubeshortbeta"
"729IHXFhpyo","Eruma Saani | Il Thaka Saiya | EP - 4 | 2022 Tamil Romance Comedy Family Web Series | @Eruma Saani ​","2022-06-05T14:37:07Z","UCPyFYlqbkxkWX_dWCg0eekA","Eruma Saani","23","22.06.06","Eruma Saani|Tamil Comedy Videos|Films|Movies|Harija|Short|Film|Eruma Sani|Eruma Saani Videos|Eruma Saani Short Film|Eruma Saani Comedy|Eruma Saani Harija","764532","57860","1927","https://i.ytimg.com/vi/729IHXFhpyo/default.jpg","Download RummyCircle App Now and Get upto ₹ 2000* Welcome Bonus!  https://bit.ly/RummyCircle_ErumaSaani Episode 4 Il Thaka SaiyaThank you all for you support throughout our journey. Extend your love and support for our new series. Written and Directed by- @prabhakaran_2403Cinematographer - @karikkalanajiEditor - @the_cuts_makerDI Colorist - @siva.mp4Music - @jen_marttinLyrics - @pole_star10Singer - @musician_forever and @jen_marttinSound design - @_elltu Dubbing - @updatestudios @fxstudiotz Lee media Public designs - @shynumashVFX - I-matte media Associate Director @raamkiran__mAssistant Directors@mimi_kert@sumeshvariath@iamkamalesh_28Assistant cinematographers@kamz_lee_@lalithkumar.18Executive Producer @nitheashvzStill photographer - @nishaanthshivaMakeup @abi_makeup_artistStyling @shyn_fascinoEquipments Rental @aaviiraa_pictures_officialCast @vijayviruz @harijaofficial @badavagopi@reshmikarthigeyan@harithabadavagopi@kevinfelson@jaiseelan_sivaram@ebirajhn@amar.keerthi@_sania_s_@_kevin_roz@dhiviyathirunavukarasu@s.e.r.i.a.l_c.h.i.l.l.e.rFor brand collaboration & advertising drop a mail to erumasaaniads@gmail.comSubscribe to our YouTube ChannelCatch our updates on our social media pages:https://www.fb.com/ErumaShithttps://www.twitter.com/Eruma_Saanihttps://www.instagram.com/ErumaSaaniSocial Media PartnerCinema Calendar: https://www.youtube.com/cinemacalendarDigital Partner: Luxe Entertainmenthttps://www.instagram.com/luxeentin"
"0h9GDCoyyJs","JHADUWALA BHOOT PART 2 | #Horror Comedy Movie #Family | Ruchi and Piyush","2022-06-04T08:30:00Z","UC0H6I4rKiHmtceSdTCM-DKQ","Ruchi and Piyush","24","22.06.06","ruchi and piyush show|comedy family|hindi family short movie|Ruchi and Piyush new video|Ruchi and Piyush 2022|Hindi sitcom|Ruchi and Pihu show|Indian family drama|ghost stories|funny ghost stories","1829415","47075","3421","https://i.ytimg.com/vi/0h9GDCoyyJs/default.jpg","Aapne Jhaduwala Bhoot Part -1 mein dekha hoga ki, hamare ghar mein bhoot hai!! Woh pakda gaya ki nahi!!Jaanne ke liye video end tak zaroor dekhna !!Jhaduwala Bhoot Part 1 👻 - https://youtu.be/1ihCLKquBCQWe make family-friendly content, which the whole family can watch and enjoy together.Hope you will support us and share the videos with your loved and dear ones.Ruchi and Piyush - https://bit.ly/2K3cd5OOur Family channel - https://goo.gl/EHTnu3You can follow us hereWebsite - https://bit.ly/3EgX4rrInstagram - https://www.instagram.com/ruchiandpiyush/Face book - https://www.facebook.com/ruchiandpiyush/We are always open to suggestions...Copyright @ Ruchi and Piyush Any unauthorized reproduction of this content (videos / small clips/pictures) in any form will result in immediate action against the concerned video/channel.#horrorstories #family #comedy #funny #ruchiandpiyush #ghost #youtube #youtubevideo #youtubechannel #situationcomedy"
"AmufkeiEPmg","जैन इतने अमीर कैसे बने? | 10 कारण | Case Study | Dr Vivek Bindra","2022-06-05T11:32:19Z","UCR-foyF-C6VuAlwy3KZMkgA","Dr. Vivek Bindra: Motivational Speaker","27","22.06.06","Jain Community|Bada Business|Case Study|Dr Vivek Bindra|Motivational Speaker|Vikram Sarabhai|jain community by vivek bindra","917373","56263","4127","https://i.ytimg.com/vi/AmufkeiEPmg/default.jpg","Watch this case study in which Dr. Vivek Bindra explains why the Jain community in India is so successful in the business world. He further explains ten reasons why their Business acumen is at par. Watch this video till the end. ============================================================================Dr. Vivek Bindra is the Founder CEO Of Bada Business Pvt. Ltd., One Of The Most Progressive Ed-Tech platforms in South East Asia.He is the Only Business Mentor In The World To receive 8 Guinness World Records.This Is the World's Most Subscribed Entrepreneurial YouTube Channel, With a Viewership of 1.2 billion+ viewership.Business Coaching Programs (BCP) are specially designed courses to give a holistic view of business operations that will enable you to build high-performing business frameworks, curate powerful strategies that will drive innovation, and boost profitable growth with the hand-holding support of a Personalized Business Coach.To Join Business Coaching Program : Call -  9810544443Website - https://www.badabusiness.com-----------------------------------------------------------------BB Junior is here!Get ready to experience a new revolution that will turn the tables in the education industry!To Know More - https://www.badabusiness.com/bb-junior?ref_code=Youtube-----------------------------------------------------------------To Download Bada Business App Click on This Link -  https://tinyurl.com/nhav2kp6------------------------------------------------------------------Follow our Official Social Media pages-Facebook -  https://www.facebook.com/DailyMotivationByVivekBindraTwitter - https://twitter.com/DrVivekBindraLinkedIn - https://www.linkedin.com/in/vivekbindraInstagram - https://www.instagram.com/vivek_bindraAnd, get updates of recent happenings, events, seminars, blog articles, and daily motivation.#CaseStudy #DrVivekBindra #JainCommunity #Growth #Motivation #Jain #Jainism #BadaBusiness"
