video_id,title,publishedAt,channelId,channelTitle,categoryId,trending_date,tags,view_count,likes,comment_count,thumbnail_link,description
"QuJ5_0IvVQw","CRAZY MAKEUP TRANSFORMATIONS..! | Soloviner","2022-06-03T08:30:04Z","UC-0UdGMHGwl4WrNUzHQEDSA","SoloViner / Aduaith","23","22.06.06","soloviner","327571","46202","948","https://i.ytimg.com/vi/QuJ5_0IvVQw/default.jpg","In this video, we are reacting to crazy makeup transformations.INSTAGRAM - https://www.instagram.com/soloviner/Thankyou..."
"ILxEizaJWyY","റോബിൻ ബിഗ് ബോസ് ഹൗസിന് പുറത്തേക്കോ ?","2022-06-04T09:48:23Z","UCp_r6Z-Oh0YTf-ym71z5Nqg","Asianet","24","22.06.06","[none]","2065374","57928","51098","https://i.ytimg.com/vi/ILxEizaJWyY/default.jpg","റോബിൻ ബിഗ് ബോസ് ഹൗസിന് പുറത്തേക്കോ ?Bigg Boss : Season 4 || Today at 9 PM || Asianet#BiggBoss #BiggBossMalayalam #Asianet  #BiggBossAsianet #BiggBossSeason4 #BBMS4 #BB4 #Mohanlal #Lalettan"
"NYknO17wNh0","#Unstoppable Top 6 with #NBK on Telugu Indian Idol | Thaman |Nithya Menen |Karthik","2022-06-02T08:12:35Z","UCmO-jDLU-KUcweCzktuDsbg","aha videoIN","24","22.06.06","telugu indian idol aha|aha telugu indian idol|telugu indian idol|thaman telugu indian idol|indian idol telugu|telugu indian idol contestants|telugu indian idol songs|aha indian idol|indian idol|telugu indian idol nithya menen|indian idol Wedding special|sriram telugu indian idol|indian idol Top 8 special|Indian idol episode 28|srinivas darimisetty|Usha uthup|Vaishnavi|Indian idol Episode 29|unstoppable top6|Nandamuri balakrishna|balayya|Nbk","1295039","36664","1362","https://i.ytimg.com/vi/NYknO17wNh0/default.jpg","Balayya Babu 🦁 ichina josh tho Bomma Blockbuster performances kottesina top-6 contestants 💥One last chance to vote for your favourite contestants. Voting lines open this week and will remain open until June 6th. Do vote for your favourite contestants 🤞🏽Watch episode 27 here : https://watch.aha.video/TeluguIndianIdolEp27Watch episode 28 here : https://watch.aha.video/TeluguIndianIdolEp28#TeluguIndianIdol #NandamuriBalakrishna  #UshaUthup #Thaman #NithyaMenen #Karthik #SreeramaChandra #Aha #ahavideoINTelugu Indian Idol, 'Telugu Paataki World's Biggest Stage' is an exclusive singing reality show on     @aha videoIN     in association with Freemantle. Telugu Indian Idol is co-presented by Zepto & Chandana Brothers. Co-powered by leading brands Instagram, Tenali Double Horse & Happi MobilesNew Episode Premieres every Friday & Saturday at 9PM.  Click here to watch:Okka last chance to vote for your favourite contenstants : https://www.youtube.com/watch?v=JlGjOhOFrZkKarthik & Sreerama Chandra rendition of Vedam Song : https://www.youtube.com/watch?v=DZo6mVmrGmMVaishnavi's Bomma Blockbuster 'Chakkori' song performance : https://www.youtube.com/watch?v=aUWgAAkZjFYConnect with us► Website: https://www.aha.video​​​► Subscribe to us on YouTube: https://watch.aha.video/YouTube​​​► Like us on Facebook: https://watch.aha.video/Facebook​​​► Follow us on Twitter: https://watch.aha.video/Twitter​​​► Follow us on Instagram: https://watch.aha.video/Instagram"
"C_fwiVgXXXA","Pop The Balloons & Win Big Prizes🤑| गुब्बारे फोड़ो और जीतो बड़े इनाम |","2022-06-04T13:37:09Z","UCebC4x5l2-PQxg46Ucv9CsA","Crazy XYZ","28","22.06.06","balloon challenge|pop the balloon and win prize|balloon popping game|balloon game|best balloon challenge for kids|win big prize|गुब्बारे फोड़ो और जीतो बड़े इनाम|Pop The Balloons|balloon popping challenge|best challnge|kids challenges|gifts for kids|big gifts for children|children play balloon game and win prizes|best challenge channel in india|crazy xyz|the indian unboxer|tiu","3338838","272914","8363","https://i.ytimg.com/vi/C_fwiVgXXXA/default.jpg","Hello guys, is video me humne gubbare fod ke gifts ka challenge kiya hai.Our Unboxing Channel- https://www.youtube.com/channel/UCIcKN-VXhkZNpf5DRdHp9JAOur Shorts Channel- https://www.youtube.com/channel/UC7bZ8U3-WqDzHiyz6Hc6TmAFollow Me on Instagram- https://www.instagram.com/amit.yt/Follow Us On Facebook- https://www.facebook.com/CrazyXYZfb/"
"VKIYBGVBXLg","Naino Ki Jo Baat Naina Jaane hai | Heart Touching Love Story | Sad Song | Ft. Maahi Queen & Aryan","2022-06-03T06:32:39Z","UC5hrMQx_OLBfTmkAODbcITQ","Maahi Queen","24","22.06.06","naino ki baat naina jaane hai female version|naino ki baat naina jaane hai female version lyrics|naino ki baat naina jaane hai|naino ki baat|naino ki baat naina jaane|naino ki baat naina jaane ha|heart touching Love Story|School Love Story|cute school love story|naino ki jo baat|naino ki toh baat song|shade of love|new hindi song|Hum Deewane Ho Gaye Hai|premkazi|hearttouching|Lovestory|Maahi queen|school love story|crush love story|sad|love|songs","800592","18323","371","https://i.ytimg.com/vi/VKIYBGVBXLg/default.jpg","Maahi Queen Present A Heart touching Love Story Video On Naino Ki Jo Baat Naina Jaane Hai(Hum Deewane Ho Gaye Hai Apke) Song Which Is Beautifully Sung By  Altaaf Sayyed. The song is composed and penned by Chandra Surya. Hit 'LIKE' if you ♥ this song.🎬Maahi Queen Presents Heart Touching Love Story.:Cast : Maahi , Aryan, Anita & JeetuDirector : Arvind ChauhanStory By : Jeetu Producer : Jeetu Bhai Cinematography & Editor : Arvind Chauhan (8850636912)Thumbnail By : PK EditingMaahi  Instagram Id :- https://www.instagram.com/143_maahi/🎧 Song Credits:✓Audio Credit : Affection Music Records✓Music :  Chandra surya✓Singer : Altaaf sayyed & Chandra surya✓Composer : Chandra surya✓Music director : Chandra Surya✓ Song : Naino ki jo baat naina jaane hai (Hum Diwaane hai Aapke )✓Lyrics : Akhtar nafe✓Music Lable : Affection music records Lyrics :Naino ki to baat naina jaane haiSapno ke raast rena jaane haiNaino ki to baat naina jaane haiSapno ke raast rena jaane haiDil ki baatein dhadkan jaane haiJispe guzari woh dil jaane hai.Hum deewane ho gaye hai aapkeHum to bas itna jaane haiTu mera hai sanamTu mera hum dum.Tere sang jeena ab sathon janamTu mera hai sanamTu mera hum dum.Tere sang jeena ab sathon janam.Nazare ye aapki karne lagi hoshiyariaKahi kare de na ye. mere liye dushwariaNazare ye aapki karne lagi hoshiyariaKahi kare de na ye. mere liye dushwariaHusan ki baat to husan hi jaane haiRoop ke naaz to roop hi jaane haiSahi galt to darpan jaane haiJispe guzari woh dil jaane hai.Hum deewane ho gaye hai aapkeHum to bas itna jaane hai.Tu mera hai sanamTu mera hum dum.Tere sang jeena ab sathon janamTu mera hai sanamTu mera hum dum.Tere sang jeena ab sathon janam.Sukhe patton ki tarhathi meri ye zindagiOsa ki bundon ke jaiseJab se mujhpe tu geeriSukhe patton ki tarhathi meri ye zindagiOsa ki bundon ke jaiseJab se mujhpe tu geeriRuh ki baat to saans hi jaane haiHonton ki khwaishein pyaas hi jaane haiKyu jogi ho jogan jaane haiJispe guzari woh dil jaane hai.Hum deewane ho gaye hai aapkeHum to bas itna jaane hai.Tu mera hai sanamTu mera hum dum.Tere sang jeena ab sathon janamTu mera hai sanamTu mera hum dum.Tere sang jeena ab sathon janam.------------------------------------------------------------------------------Thanks For Watching         Jaani Log   Video Achhi Lagi Ho    Toh Share Karna       Na Bhulna#nainokijobaatnainajaane #Maahiqueen #cover #LoveStory #bestcoversong #lnewvideo2019 #HumDeewaneHoGayeHaiApke #bestsong2018 #hearttouching"
"jG4oQbroN3c","Surviving 200 Years as KING KONG In GTA 5!","2022-06-02T06:41:13Z","UCS8uIXvlSK3HtC0p0VIWyTQ","TheLoudDude","20","22.06.06","gta|gta 5|funny gta 5 gameplay|grand theft auto|grand theft auto 5|funny gta gameplay|funny gta 5 online|funny gta 5 moments|grand theft auto v|Gta 5 mods|gta spiderman|spider man|birth to death gta|gta birth to death|gta 5 iron man|gta school|iron man school|gta iron man|playing as iron man|spider man school|avengers school|ultron|black widow|captain america|thor|tony stark|thelouddude|kingkong|200 years as kingkong|99 years as kingkong","1146791","26119","390","https://i.ytimg.com/vi/jG4oQbroN3c/default.jpg","Surviving 200 Years as KING KONG In GTA 5!Don't forget to leave a Like, Comment and Favorite, helps out a lot!!FOLLOW, LIKE AND JOIN ME ON:Discord : https://discord.gg/NFHrCrmyDR​Instagram - https://www.instagram.com/thelouddude/Facebook - https://www.facebook.com/DudeGamerz"
"U6zqIrdzQdM","Laal Singh Chaddha Spoof | The Screen Patti","2022-06-02T07:17:23Z","UCNyeSfUfffmJXwA2_tmNG9A","The Screen Patti","24","22.06.06","Laal Singh Chaddha|Laal Singh Trailer|Laal Singh Chaddha Trailer|Aamir Khan|Kareena Kapoor Khan|laal singh|new hindi movie trailers|kareena kapoor|mona singh|chaitanya akkineni|aamir khan productions|bollywood movies 2022|main ki karaan|aamir movie 2022|2022 films india|aamir and kareena|tseries|The Screen Patti|Anant Singh Bhaatu|Shivankit Parihar|Spoof|TVF|berozgaar singh chaddha|berozgaar|tsp new video|tsp spoof|tsp laal singh chaddha spoof","1383366","119600","6921","https://i.ytimg.com/vi/U6zqIrdzQdM/default.jpg","Watch our Berozgaar Singh Chaddha : An Ordinary graduate Indian whose berozgaari bhari journey will fill you with disappointment and joblessness. Watch Berozgaar Singh Chaddha's not so beautiful journey.For more updates, Follow us on Instagram: https://www.instagram.com/thescreenpa...Like us on Facebook:  https://www.facebook.com/TheScreenPattiFollow us on Twitter: https://twitter.com/TheScreenPattiCredits:Produced by: Arunabh Kumar Channel Head: Anandeshwar Dwivedi Creative Director: Anant Singh 'Bhatu' Creative Head: Pratish Mehta Written by: Team TSPDirected By: Pratish Mehta Associate Director: Saksham Arora Executive Producer: Vijay Koshy Creative Producer: Akshat Vijaywargiya DOP: Jay Kulkarni Edited by: Sarvesh Bhat Music: Vishal Patil Art Director: Deepak Thorat Assistant Director: Omkar Samant, Kunal Banerjee Costume Designer: Prachi Nikhra Costume Assistant: Gaurav Jaiswal Supervising Producer: Akash Dubey Line Producer: Niharika Rathore Production Manager: Kishore Pawar HMU: Deepak Pawar & TeamPost Production Supervisor: Garvit Janshali Post Production Assistant: Abhishek Sharma Graphics: Lengdon Phukan & Rishi BhaumikTalent Head: Shivani Bengani Talent Team: Aishwarya, Abhimanyu Tripathi Marketing Head: Yogesh Saini Marketing Team: Ankita Jalvi, Shivansh Sarin, Manya Srivastava, Anirudh Iyer, Jatin Sharma, Siddhanta Abhishek, Yasharth Singh Finance: Manish Saini, Nikita Joshi, Pragati Chandak, Nishit Gogri, Ankit Singh, Anil Harijan Legal: Megha Gupta, Shikha Guleria, Chaitrali Dhurandhar Cast: Anant Singh Bhaatu, Anandeshwar Dwivedi, Nidhi Sahu, Aakanksha Singh, Vaibhav Shukla, Prakhar Sharma, Charu Gupta, Prachi Nikhra#laalsinghchaddha #aamirkhan #tsp---This channel is owned, operated, and managed by, Contagious Online Media Network Private Limited."
"6h4u7NzHo68","Mystery Man Attacked Us In FLEET SMP 😱 | Minecraft","2022-06-06T04:00:03Z","UCPjaNv8GlIamrxCbqincG_g","Anshu Bisht","20","22.06.06","minecraft gameplay in hindi|minecraft gameplay|minecraft in hindi gameplay|minecraft|survival|minecraft hindi|minecraft hindi gaming|live insaan|mythpat|gamerfleet|latest update changes|techno gamerz|minecraft bedrock|minecraft android gameplay|anshu bisht|smartypie|yessmartypie|ujjwal|total gaming|herobrine smp|funny minecraft video|smp india|Minecraft survival series 33|fleet empire|Gold Farm|fleet smp|anshu bisht smp|fleet smp 9","1154320","99510","3844","https://i.ytimg.com/vi/6h4u7NzHo68/default.jpg","Mystery Of BARBARIAN AXE In FLEET SMP 😱 | Minecraft #9🤗 Follow Me On Instagram: ​https://www.instagram.com/gamerfleetog/ ❤️️Vlogging Channel: https://www.youtube.com/Anshubishtvlogs🤗Streaming Channel: https://www.youtube.com/gamerfleet❤️️Join Our Discord Server!: https://discord.gg/gamerfleet🤗Twitter: https://www.twitter.com/gamerfleetog/ ❤️️Facebook: https://www.facebook.com/gamerfleetog/I hope you enjoyed the video if you did Please Do Subscribe For New Videos, like & share. 🤗❤️️#GamerFleet #Minecraft #MinecraftHindiCopyright Disclaimer under section 107 of the Copyright Act of 1976, allowance is made for “fair use” for purposes such as criticism, comment, news reporting, teaching, scholarship, education, and research.Fair use is a use permitted by copyright statutes that might otherwise be infringing."
"LpiEP7Qx0fE","We Preserve Watermelon For Six Months | क्या तरबूज बच पायेगा ?","2022-06-05T07:07:56Z","UCSiDGb0MnHFGjs4E2WKvShw","MR. INDIAN HACKER","28","22.06.06","[none]","4715330","466245","27015","https://i.ytimg.com/vi/LpiEP7Qx0fE/default.jpg","Love You Titanium Army Follow Us on -INSTAGRAM: https://www.instagram.com/dilraj_singh_rawat/FACEBOOK: https://www.facebook.com/mrindianhacker00TWITTER: https://twitter.com/MR_INDIANHACKERThanks For Visit Have Fun"
"nQTq2qkeU84","petrol la 🙄 #shorts #comedy #own #funny #reality #new #twist #viral #tamil #trending #youtube #end","2022-06-01T14:07:01Z","UC0-xPTwPhfXnuiI7QIcev3A","Harrish krish","28","22.06.06","[none]","1680312","180502","130","https://i.ytimg.com/vi/nQTq2qkeU84/default.jpg",""
"Yyail_NFJhA","SURPRISE Dr Robin Ejected News Asianet promo Doctor Machan Bigg Boss Malayalam S4 Yoo Too Cee Media","2022-06-04T12:51:34Z","UC8W9ngui9D0ooN9QUxsIt8w","Yoo Too Cee Media","24","22.06.06","[none]","223423","7808","2514","https://i.ytimg.com/vi/Yyail_NFJhA/default.jpg","#bigbossmalayalamseason4 #drmachan #biggboss #jasmine #dilsha #dilshaprasannan"
"r370WnBkF7Y","GTA 5 SLIPPERY TRUCK RACE","2022-06-04T08:30:14Z","UC0IWRLai-BAwci_e9MylNGw","CarryisLive","24","22.06.06","CarryMinati|Carryminati gaming|carrisLive|Gaming|Livestream|Indian gamingpubgpubg mobile","523342","64806","1168","https://i.ytimg.com/vi/r370WnBkF7Y/default.jpg","The PRESTIGE MEMBER OF THE HOMO-BAKCHODIAN SOCIETY:GO TO▶️https://www.youtube.com/channel/UC0IWRLai-BAwci_e9MylNGw/join For Business related queries: workforcarry@gmail.comCarryMinati Channel► https://www.youtube.com/user/AddictedA1Instagram► https://www.instagram.com/carryminati/Facebook ► https://www.facebook.com/CarryDeol/Snapchat► heyAjeyTwitter ► https://twitter.com/CarryMinatiGame.tv guild link ► https://www.game.tv/p/carryminatiDiscord▶ https://discord.gg/CarryisliveSnapchat► heyAjeyInstagram► https://www.instagram.com/carryminati/Facebook ► https://www.facebook.com/CarryDeol/Twitter ► https://twitter.com/CarryMinatiPC SpecsProcessor: AMD Ryzen 9 5900X (12Core, 24 Threads, Upto 4.8 Ghz)Motherboard: ASUS CROSSHAIR-VIII-FormulaRAM: 32 GB G.Skill Trident Z Neo RGB DDR4 4000MHz Graphic Card: MSI GeForce RTX 3090 Suprim 24 GBSSD: 1TB Samsung 980 PRO GEN4 NVMe m.2 SSDPower Supply: Antec HCG1000W 80+CPU Cooler: Lian Li Galahad 360 BlackCabinet – Lian LI O11 Dynamic Razer EditionAbout CarryMinati: Youthoob certified memberThat's all Folks!"
"n7s_ym_NzB8","Dice Media | Army Web Series | Bravehearts | Episode 1 - Masterji ft. Shakti Kapoor, Omkar Kulkarni","2022-06-04T06:30:13Z","UCC89oVFqenaffhBoyqxd6qw","Dice Media","24","22.06.06","Dice Media|Webseries|Hindi Webseries|Indian Army|Indian Navy|Indian Airforce|Army Webseries|New Webseries|Webseries 2022|YouTube Webseries|Bravehearts|Dice Bravehearts|Shakti Kapoor|इंडियन आर्मी|इंडियन एयरफोर्स|आर्मी वेबसीरीज|Crushed|Crime Patrol|savdhaan india|operation mbbs|cds aspirants|nda|nda aspirants|Bravehearts Episode 1|Dice Media Bravehearts Episode 1|Braveharts Episode 1|braveheart episode 1|bravehart epiosde 1|braveheart e1","395883","24290","965","https://i.ytimg.com/vi/n7s_ym_NzB8/default.jpg","Kishore, an orphan has only one dream, to join the #IndianArmy. When he gets thrown out of his orphanage, Masterji, an ex-army officer who left the army and is now working as a tailor, reluctantly adopts him. The khadoos Masterji and Kishore have only two things in common, their dream to serve the nation and their lonely lives. Will Masterji help Kishore achieve his own unfulfilled dreams to become a soldier, and will Kishore find a father in Masterji?Unacademy presents #DiceBravehearts: The Untold Stories of Heroes starring #ShaktiKapoor, #OmkarKulkarni and #SayandeepSen is India's first army anthology dedicated to the humans behind the heroes in the Indian army.Just like Kishore, you too can crack your exam with Unacademy. Download the Unacademy app here: https://bit.ly/EP01-DiceXUnacademyA DICE MEDIA ORIGINAL SERIES (A DIVISION OF POCKET ACES)PRODUCERADITI SHRIVASTAVAPRODUCERSASHWIN SURESHANIRUDH PANDITASTUDIO HEADVIDYUTH BHANDARYDIRECTED BYHAPPIE MONGIAWRITTEN BYHARMAN SINGHA SANKALP RAJ TRIPATHISTARRING SHAKTI KAPOOR As MasterjiOMKAR KULKARNI As Kishore CREATIVE DIRECTORSANKALP RAJ TRIPATHISUPERVISING PRODUCERSANKALP RAJ TRIPATHICREATIVE PRODUCERARNAV CHAKRAVARTYDIRECTOR OF PHOTOGRAPHYABHIJEET CHAUDHARIHEAD OF PRODUCTIONSANKET KUNDEEXECUTIVE PRODUCERPRACHI JOSHIWRITERS ROOMPRACHI JOSHIEDITORPUNEET MEHTAPOST PRODUCTION HEADPRASHANT OBEROIPOST PRODUCTION SUPERVISORUDIT CHANDRAULDESIGN & ANIMATIONANUJ DABRALAKSHAY TAMBESHRUTI JALGAONKARSNEHA KANEKARORIGINAL BACKGROUND SCOREKARTHIK RAOBUSINESS DEVELOPMENTADITI SHRIVASTAVAPRIYANKA PADODEDICE SOCIAL CHANNELS HEADNISHAAD JAVERIMARKETINGSIMRAN LULLAHARDIK SHARMAPRITIKA MATHURDISTRIBUTIONTUSHAR KOULCASTING DIRECTORSHRUTI DUTTASHISH CHAWLACASTING ASSOCIATEKUNAL PATELCREATIVE CONSULTANTLT GEN IS SINGHAPRODUCTION FINANCESHAILESH KINJALEPRODUCTION DESIGNSNEHI SHAHCOSTUME DESIGNAKANSHA C GOSHHAIR & MAKE-UP DESIGNERPRAVIN NANA ADSULESUPPORTING CAST (IN ALPHABETICAL ORDER)DHARMENDRA JAISWAL As CaretakerMOHAMMAD HUSSAIN As Orphan Friend 1 PALASH KAMBLE As Orphan Friend 2RAVI PANDEY As Orphan Friend 3SAYANDEEP SENGUPTA As Major BhanuPRODUCTION CONTROLLERSHAGUN KAZANIAPRODUCTION MANAGERROHAN TIWARIPRODUCTION ASSISTANTYOGESH BAJRANGLOCATION MANAGERRAJU GASTECHIEF ASSISTANT DIRECTORVIKASH GAURKEY 2ND ASSISTANT DIRECTORKUNAL NIROLASECOND 2ND ASSISTANT DIRECTORSHAMIKA TATHE3RD ASSISTANT DIRECTORRISHI CHAUHANINTERN ASSISTANT DIRECTORJERRY RAJVANSHISCRIPT AND CONTINUITY SUPERVISORARUNISH RAAJ ROHILLASECOND DIRECTOR OF PHOTOGRAPHYVAIBHAV D LONKAR1ST ASSISTANT CAMERAKUSHAL DESAI CAMERA INTERNTEJAS DESHMUKHFOCUS PULLERSGOPAL SHARMASHER SINGH PALGAFFERNARSING KAMBLEART DIRECTORBAJRANG YADAVASSISTANT PRODUCTION DESIGNERSDHEERAJ YADAVAHMAR KHANCHANDRAKANT BELPATREASHUCOSTUME ASSISTANTMONIKA YADAVPRITI GUPTAHEAD DRESSMANMAHENDRA R PRASADHAIR & MAKE-UP ASSISTANTSSUNIL SINGHPRATHAMESH CHAVANMRUNAL THORASKAR PRODUCTION SOUND MIXERNITIN K SHARMABOOM MANRAJEEV NISHADSOUND ATTENDANTDHARMENDRA KUMARSOUND DESIGNABINASH MISHRARE-RECORDING MIXING ENGINEERRITOBAN BASUDIALOUGE EDITORASHUTOSH JENASOUND EFFECTS EDITORPALLAB BHOREFOLEY EDITORVARUM BISOISOUND MIXING STUDIOSOUND GARAGEASSOCIATE EDITORAVIRUP DAMASSISTANT EDITORANKIT TOPPODITRIZWAN KHURSHID SHAIKHSUBTITLESANTARA  ANANDSUBTITLES QCARNAV CHAKRAVARTY SUPERVISING DI COLORISTPRAKASH NIKHARGE DI COLORISTSANGRAM VALANJOOBTS VIDEOGRAPHERONKAR JADHAVBTS PHOTOGRAPHERARMAAN GUPTAHEAD SPOT BOYPRITAM KUMARSPOT BOYSLALU SINGHRAHUL KUSHWAHANIRAJ KUMARMUKESH YADAVSUDHIR CHOUPALRITIK KUMARHAIR & MAKE-UP GOVIND SHAM DASSPOT BOYSHARWAN MUKHIYAJUNIOR SUPPLIERRAVINDRA SURI & COMPANYBRAND PARTNERSHIPSKUNTAL BHOIRKARISHMA NANDI POST PRODUCTION & CINEMATOGRAPHYOSHEEN PATHAKNIKHIL GHAMREPRANKITA TULSHYANKHYATI MODIFINANCEKUNAL LAKHARAPRABHAKAR MAURYAAMAR TRIVEDINIDHI KHETANLEGALSONU VARGHESESONG - 'Ladna Toh Phir Bhi Hai'SINGER & MUSIC - KARTHIK RAOLYRICS - RAKESH TIWARIRECORDING ENGINEER - PARTHA PROTIM DASRECORDING STUDIO - EUPHONY STUDIOSONG - 'Raja Hum Hi Hai'SINGER & MUSIC - KARTHIK RAOLYRICS - RAKESH TIWARIRECORDING ENGINEER - ASHISH ANANDRECORDING STUDIO - BLUE CASSETTE STUDIOCOPYRIGHT © 2022POCKET ACES PICTURES PVT. LTD."
"YjdoaSVrDdc","Shooting In Helicopter 🚁 😍 New Song","2022-06-04T02:30:17Z","UCjvgGbPPn-FgYeguc5nxG4A","Sourav Joshi Vlogs","22","22.06.06","sourav joshi|sourav joshi vlog|sourav joshi arts|vlog|vlogs|daily vlogger|daily vlogs|lifestyle vlogs|funny vlogs|family vlogs|travel videos|15 Million Celebration|song shoot vlog|shooting in helicopter|helicopter vlog","7374429","653973","16429","https://i.ytimg.com/vi/YjdoaSVrDdc/default.jpg","Follow me on Instagram- https://www.instagram.com/souravjoshivlogs/?hl=en I hope you enjoyed this videohit likes.And do subscribe to my channelThank you so much for watchinggod bless you all.lots of  ❤️( For Collaboration - officialsouravjoshivlogs@gmail.com"
"3WkWqhF4DiI","Root Leads The Chase! | Highlights | England v New Zealand - Day 3 | 1st LV= Insurance Test 2022","2022-06-04T18:48:24Z","UCz1D0n02BR3t51KuBOPmfTQ","England & Wales Cricket Board","17","22.06.06","England|England vs. New Zealand|New Zealand|england cricket|england new zealand test live|england new zealand cricket|england new zealand 2022|england new zealand highlights|matthew potts bowling|potts bowling|anderson bowling|jimmy anderson|stuart broad|kane williamson|eng vs nz 2022|eng vs nz test 2022|eng vs nz test|eng vs nz highlights|eng vs nz test highlights 2022|eng vs nz test highlights|Daryl Mitchell|Tom Blundell","4105509","85438","2280","https://i.ytimg.com/vi/3WkWqhF4DiI/default.jpg","Go to ecb.co.uk to join We Are England Cricket Supporters for free and get priority access to tickets and much more!Watch match highlights from Day 3 the 1st LV= Insurance Test between England and New Zealand at Lord’s."
"9Qjn0gG0Jhk","INDIANS IN RESORT || JaiPuru","2022-06-03T06:38:30Z","UCByS1f-QpAsgUbFb6qSNGZw","JaiPuru","24","22.06.06","jaipuru|jaipuru new video|jaipuru latest video|indians in hotel|middle class family in resort|indians and resort|family videos|kids videos|5 star hotels|swimming pool|pool videos|trending videos|youtube trending|jai bajrangbali|guru ji|ssdn|radhe radhe|jaipur videos|krishna|baba rijak das ji|jai bawa lal ji|jai mata di","336368","4775","156","https://i.ytimg.com/vi/9Qjn0gG0Jhk/default.jpg","For Behind The Scenes & MoreFollow us on Instagram @JaiPuru https://www.instagram.com/jaipuru/​​​...Also Follow us on Facebook : https://www.facebook.com/officialJaiP...Twitter : https://twitter.com/jai_puru?lang=en​...Instagram : https://www.instagram.com/jaipuru/​​​...SubscribeJaiPuru : https://www.youtube.com/c/jaipuruvine...----------------------------------------------------------------------------------CAST -RinkyMohitGunnuHridaagJai BatraEdited By : Sahil arora DOP : Nitish GoelThumbnail : Raj Sharmahttps://www.instagram.com/iamrajsharm....."
"sY9Xt2js6sI","Is this Radium? 😲 #science #physics #ashusir #facts #sciencefacts #scienceandfun #scienceexperiment","2022-05-31T12:21:21Z","UCACU6FM4RgOgX0IHB7dudFA","Science and fun","28","22.06.06","[none]","3700521","307769","854","https://i.ytimg.com/vi/sY9Xt2js6sI/default.jpg",""
"yqgm9hkJ1FE","BRAHMĀSTRA Part One: Shiva | TRAILER OUT ON JUNE 15 |  Hindi | Ranbir | Alia | Ayan","2022-05-31T08:42:21Z","UC56gTxNs4f9xZ7Pa2i5xNzg","Sony Music India","10","22.06.06","Brahmastra|Ranbir Kapoor|Alia Bhatt|New movie 2022|New song 2022|Sony Music|Sony Music India|Latest Hits|Alia Bhatt New Movie|brahmastra|alia bhatt ranbir kapoor|alia bhatt new song|Kesariya|alia bhatt wedding|alia new movie|Bhool Bhulaiyaa 2|Trending Songs|New Music Hindi|Latest Hit Song|Latest Bollywood Song|Songs 2022|New Song|New Hindi Song|Best Bollywood Song|New Song 2022|Best Hindi Song|Mouni Roy|Amitabh Bachchan|Nagarjuna Akkineni","6172981","231635","13837","https://i.ytimg.com/vi/yqgm9hkJ1FE/default.jpg","In just 100 days, BRAHMĀSTRA: Part One will be all yours 💥But before that, don’t miss the Brahmāstra TRAILER on JUNE 15TH!! 💥💥"
"FPOkvnDxLj8","ഞാൻ പെട്ടു😭sangeethkumar #shorts","2022-06-04T04:30:03Z","UCdce_0JccaDtpuv5x9Gjdyw","Sangeeth Kumar","22","22.06.06","[none]","1018599","89925","463","https://i.ytimg.com/vi/FPOkvnDxLj8/default.jpg","#Sangeeth Kumar With familyOur Second Channel🥰 : https://www.youtube.com/channel/UCrctIDHsZtZ4QqK2gJgVr4A**** Follow us on ****Facebook: https://www.facebook.com/CHEMBARATHI1/Instagram:https://instagram.com/sangeethkumar706?utm_medium=copy_linkSayooj Channel : https://youtube.com/channel/UCKl4RXS1LWtxq-LXopEW-pAInsta 👉 https://www.instagram.com/invites/contact/?i=bqlwzliyjne6&utm_content=hlu4e8vEnquire : mvsangeethkumar@gmail.comsangeeth kumar mvsayoojyam housethillenkery [po]palliam670702kannurkerala"
