video_id,title,publishedAt,channelId,channelTitle,categoryId,trending_date,tags,view_count,likes,comment_count,thumbnail_link,description
"Yx9_G_aFWAE","New trick😎😜😆😂#funny #shorts #comedy #koushalmonga","2022-05-18T05:30:08Z","UCgsdrGox82hP4o97-kt8sjg","Koushal Monga","22","22.18.05","[none]","9959616","477772","1364","https://i.ytimg.com/vi/Yx9_G_aFWAE/default.jpg",""
"QqnbJovbaiQ","Indian railway rules 🚂 #shivammalik #shorts","2022-05-17T16:13:06Z","UCGNFqULihCOrP3-hOQ-rNEw","Shivam Malik","27","22.18.05","[none]","8366988","653591","2173","https://i.ytimg.com/vi/QqnbJovbaiQ/default.jpg","Source- Abp"
"gtnnUO_coJE","MANZOORE NAZAR: Sourav Joshi Vlogs, Priya Dhapa | Saaj Bhatt, Srishti Bhandari | Amjad Nadeem Aamir","2022-05-18T02:45:11Z","UCLsMef624nZ4ME6WoSElPTg","Voilà! Digi","10","22.18.05","manzoore nazar|manzoore nazar sourav joshi|sourav joshi vlogs|sourav joshi|sourav joshi arts|priya dhapa|dhapa sisters vlogs|saaj bhatt|official video|sourav joshi new song|sourav joshi song|sourav joshi songs|sourav joshi new vlog|mauja|jhoota lagda|love songs|romantic songs|love song|romantic song|hindi song|new songs|hindi songs|new songs 2022|tera ho raha hoon|sourav joshi vlogs song|sourav joshi vlogs new song|sourav joshi music video","3690550","451681","22860","https://i.ytimg.com/vi/gtnnUO_coJE/default.jpg","Voilà! Digi presents 'Manzoore Nazar', the most awaited love song, starring Sourav Joshi Vlogs & Priya Dhapa and sung by Saaj Bhatt & Srishti Bhandari. 'Manzoore Nazar' signifies acceptance of love purely through the eyes ♥️  #SouravJoshiVlogs #SouravJoshi #PriyaDhapa #DhapaSistersVlogs #SaajBhatt #SrishtiBhandari #VoilaDigiLet us know your favourite line from the song in the comments below. If you like the song, do leave a like and share the song with your friends and family. Also, make YouTube shorts and reels on the song and tag the 'Manzoore Nazar' team. We would love to see your creativity and would even repost the best ones! Watch this love song and seed it in your New Hindi Songs 2022 playlist, romantic songs playlist, romantic song playlist, love songs playlist, romantic music playlist, love music playlist, romantic Hindi songs playlist, romantic hindi songs playlist, Hindi new songs playlist, hindi new song playlist, indian songs playlist, new song playlist, romantic hindi songs, hindi romantic songs playlist sourav joshi new song playlist, sourav joshi all songs playlist, sourav joshi songs playlist, sourav joshi song playlist, sourav joshi music video playlist and all your other Hindi song and new songs playlists.‘Manzoore Nazar’ is available on all audio platforms.Credits:Starring: Sourav Joshi & Priya DhapaSingers: Saaj Bhatt & Srishti BhandariMusic Composers: Amjad Nadeem AamirLyrics: Amjad NadeemProducers: Girish Jain & Vinit JainSpecial Thanks: Karishma ChhajerAudio Credits:Arrangement & Programming: Aamir KhanLive Guitars: Indrajit ChetiaVocals/Song Recorded at: Amjad Nadeem Aamir Studio by Aamir KhanMixed & Mastered by: Prithvi SharmaVideo Credits:Director: Garry VilkhuDOP: Raman RD Edit & Color: Prince Sethi Line Production: Fateh Film ProductionCostumes: KhushOnline Promotions: Mediaone Network & Voilà! DigiLabel: Voilà! DigiFollow Voilà! Digi:Instagram: https://www.instagram.com/voila_digi/...Facebook: https://www.facebook.com/voiladigi/Twitter: https://twitter.com/VoilaDigiSaaj Bhatt and Srishti Bhandari are exclusively managed by Voilà! Digi. For enquiries: contact@voiladigi.in"
"gim2kprjL50","Official Trailer | She-Hulk: Attorney at Law | Disney+","2022-05-17T21:54:57Z","UCvC4D8onUfXzvjTOM-dBfEA","Marvel Entertainment","24","22.18.05","marvel|comics","14076688","634224","38905","https://i.ytimg.com/vi/gim2kprjL50/default.jpg","You’ll like her when she’s angry.She-Hulk: Attorney at Law, an Original series from Marvel Studios, starts streaming August 17 on Disney+. ► Watch Marvel on Disney+: https://bit.ly/2XyBSIW► Subscribe to Marvel on YouTube: http://bit.ly/WeO3YJFollow Marvel on Twitter: ‪https://twitter.com/marvelLike Marvel on Facebook: ‪https://www.facebook.com/marvelWatch Marvel on Twitch: https://www.twitch.tv/marvelReward your Marvel fandom by joining Marvel Insider!Earn points, then redeem for awesome rewards.Terms and conditions apply. Learn more at https://www.marvel.com/insider?Osocial=YT&CID=MarvelInsiderFor even more news, stay tuned to:Tumblr: ‪http://marvelentertainment.tumblr.com/Instagram: https://www.instagram.com/marvelPinterest: ‪http://pinterest.com/marvelofficialReddit: http://reddit.com/u/marvel-official"
"AcHufSl9dMU","English BiBi | the mridul | Pragati | Nitin","2022-05-17T13:45:00Z","UC0zXnLIFedO97pFsyMxZcFg","The MriDul","23","22.18.05","the mridul|the mridul comedy|nitin mridul comedy|pragati|pragati new video|english bibi|mridul|mridul comedy|nitin mridul video|nitin mridul new video|pragati comedy|best comedy video|funny video|new comedy videos|viral comedy|entertainment comedy|the mridul show|nitin mridul show","3568292","203096","11444","https://i.ytimg.com/vi/AcHufSl9dMU/default.jpg","Signup on Relevel & Register for Test: https://relvl.co/cs84 Hello Doston👋🏻🥰“ आप हँसते रहो, हम हँसाते रहेंगे “ Follow MriDul on instagram ~ https://www.instagram.com/themridul_/Follow Nitin on instagram ~ https://www.instagram.com/i.am.nitin_/ English BiBi - the mridul - Pragati - NitinPRODUCTION ~ The MriDul Production SCRIPT ~  The MriDul DIRECTED BY ~ Nitin, MriDulSHOOT & EDIT ~ Maan Gujjar ASSISTANT DIRECTOR ~ Ujjwal ARTIST MANAGEMENT ~ Rajeev BidhuriLOCATION ~ Aadesh BaisoyaBANQUET HALL ~ Stardom Banquet (GN)MAKEUP ~ Pragati & Team MUSIC ~ Maan Gujjar CROWD MANAGEMENT ~ Nitin, MriDulTHUMBNAIL ~ Vishal Rana ( Phoenix )PRODUCER ~  Nandu Bhaiya CAST ( Male )                  CAST ( Female)MriDul                              Pragati ( Mummy )Nitin                                Akmalova ParizodaUjjwal ( Mastani )           Queen Victoria Nani  Aarav ( Bakra )               Kavya (Mehndi girl)Prashnt ( Khatka )         Geeta ji ( aunty ) Smack That ( papa )Sushant ( auto Driver )Ramdhan Bidhuri Special Thanks To All Team & Crowd 🙏🏻PLEASE SUBSCRIBE -  राम राम जी"
"fZfSGwI2nAQ","Kids 👧 vs Legends 😂 ~ Mobile Charging Time ⏰ #dushyantkukreja #shorts","2022-05-16T14:30:13Z","UCo6y9hnRawAqtyWhRhblXqg","Dushyant kukreja","24","22.18.05","Legends|kids|charging|apple|pubg|bgmi|free fire","6396462","390654","3467","https://i.ytimg.com/vi/fZfSGwI2nAQ/default.jpg","@Dushyant Kukreja Life"
"mh6Uf10UHcM","കിട്ടിക്കൊണ്ടിരുന്നതും കൂടെ പോയി😅🤣 #shorts #comedy #youtubeshorts","2022-05-17T09:30:06Z","UCj48m7NJ7zbM5UzoOV41Dzg","AmmaMon","2","22.18.05","[none]","1232407","83933","181","https://i.ytimg.com/vi/mh6Uf10UHcM/default.jpg","#shorts #comedy #malayalamvines #ammamon"
"-SIbwvSineg","Judwaa Brother's Vs Twin Brother's Racing Challenge ?? 😂😂 || #shorts #factfire #freefireprankvideo","2022-05-17T08:08:01Z","UC0akkKufX_PZMZ_14213X1A","Fact Fire","20","22.18.05","fact fire|free fire prank video|free fire funny video|free fire unknown prank|free fire amazing prank|free fire interesting prank|free fire mytsterious prank|free fire funniest prank|total gaming|Total Gaming|Gyan Gaming|Raistar|Badge 99|Lokesh Gamer|Desi Gamer|shorts prank video of free fire|shorts feed|shorts video|shorts viral|shorts trending|youtube feed|youtube video|youtube viral|youtube trending|youtube shorts","2160154","385696","1367","https://i.ytimg.com/vi/-SIbwvSineg/default.jpg","Short Free Fire Video | Free Fire Short video | Free Fire #shorts WhatsApp StatusFree Fire Short videoFree Fire Short TikTok VideoFree Fire WhatsApp StatusFree Fire Short solo vs squad Gameplay Free Fire Funny Video Free Fire Funny GameplayFree Fire Top Country1.Garena Free Fire Indonesia Live2.Garena Free Fire Brazil Live3.Garena Free Fire Brasil Live4.Garena Free Fire India Live5.Garena Free Fire Singapore Live6.Garena Free Fire Thailand Live#shorts #shortsfeed #shortsvideo #shortvideo #youtubeshorts #youtubeshort #freefirefacts #freefireshortsYour 1 like is 1 motivation for me#freefirefacts #factsaboutgarena #factsaboutfreefire #freefireamazingfacts #freefireinterestingfacts #freefireunknownfacts #kcharacter #alokcharacter #factsoffreefire#lokesh gamer is back#lokeshgamerisback#gyangamingisback#gyan gaming is backFree Fire gameplayJudwaa Brother's Vs Twin Brother's Racing Challenge ??#factfire"
"gCYob2_PT5w","Video - Pawan Singh | साड़ी से ताड़ी | Shilpi Raj Ft Smrity Sinha | Saree Se Tadi | Bhojpuri Song 2022","2022-05-17T01:15:15Z","UCy3ExvdZmbE--vRbUUSe_2A","Pawan Singh Official","10","22.18.05","saree se tadi song|saree se tadi video|saree se tadi vide song|sadi se tadi teaser|saree se tadi pawan singh|sadi se tadi smrity singha|saree se tadi shilpi raj|saree se tadi pawan singh shilpi raj|saree se tadi video song 2022|saree se tadi teaser video|pawan singh sadi se tadi|pawan singh or shilpi raj ka song|saree se tadi video song|saree se tadi|pawan singh official|pawan singh tadi song|pawan singh video|pawan singh|pawan singh song|tadi video song","5181186","322806","134592","https://i.ytimg.com/vi/gCYob2_PT5w/default.jpg","► Subscribe Now :- https://goo.gl/MXP6zM► Album :- Saree Se Tadi► Song :-  Saree Se Tadi► Singer :-Pawan Singh, Shilpi Raj► Lyrics :- Vijay Chauhan► Music Director :- Arya Sharma► Video Director :- Goldy Jaiswal► Choreographer - Bobby Jackson► DOP - Santosh Yadav, Sunil Baba► Editor - Pappu Verma► DI - Rohit Ji► Makeup - Pankaj Soni ► Collaboration :- Amit Singh► Concept :- Deepak Singh► Blessings :- Mata Pita & Ajit Singh Jokahari►Digital Managed By :- Inspire Music (Amit Singh)► Label / Company :- Pawan Singh OfficialMake your Reel - https://www.instagram.com/reels/audio/960088721343443/"
"REqFOV2A7sI","777 Charlie Trailer - Kannada | Rakshit Shetty | Kiranraj K | Nobin Paul | Paramvah Studios","2022-05-16T06:42:50Z","UCvBaJ5MfXVKfSiKP2beaNvw","Paramvah Studios","1","22.18.05","777 charlie|rakshit shetty|777 charlie movie|777 charlie trailer|777 charlie kannada movie|777 charlie kannada trailer|rakshith shetty|charlie 777|paramvah studio|rakshit shetty 777 charlie|charlie 777 trailer|charlie 777 kannada|rishab shetty films|rakshith shetty films|life of charlie|charlie 777 movie|rakshit shetty charlie|charlie kannada trailer|charlie trailer|charlie 777 kannada trailer|charlie trailer kannada|charlie 777 kannada movie|kannada","6432188","412463","13317","https://i.ytimg.com/vi/REqFOV2A7sI/default.jpg","Here is the official Kannada trailer of the upcoming movie, a Paramvah Studios production, 777 Charlie starring Rakshit Shetty, Sangeetha Sringeri, Raj B Shetty, Bobby Simha and Danish Sait amongst others. The film is written and directed by Kiranraj K, produced by GS Gupta and Rakshit Shetty.777 Charlie's official trailer covers a blink of all that the film is going to offer. It is a scurry through the beautiful saga of Dharma and his dearest Charlie. 777 Charlie Worldwide Release On 10 June 2022 All that you would like to explore and know about the movie 777 Charlie - https://bit.ly/777Charlie-BMSVisit us at: https://paramvah.comLike us on Facebook: https://www.facebook.com/777charlieFollow us on -Instagram: https://instagram.com/777charliemovieTwitter: https://twitter.com/777CharlieMovie Website: http://www.777charlie.com/Starring: Charlie, Rakshit Shetty, Sangeetha Sringeri, Raj B Shetty, Danish Sait, Bobby Simha and others.Produced By: G S Gupta and Rakshit Shetty Written & Directed By: Kiranraj KMusic and Background Score: Nobin Paul  DOP: Arvind S KashyapEditor: Pratheek ShettyDialogues: Kiranraj K, Raj B Shetty, Abhijit MaheshLyrics: Kiran Kaverappa, Nagarjun Sharma, Keerthan Bhandary, Saiesh Poi Panandikar, Alexis D'SouzaTrailer Music Credits:-Music: Nobin PaulVocals : Aarna Shetty Violin and Cello Solos: Rithu VysakhClarinet : NadhanFlutes : Josy Alapuzha Brass : Maxwell Rajan Music Programmed & Arranged by: Nobin Paul Strings Arranged by : Rithu VysakhConductor : B Yensone Strings Performed by : Chennai Strings Trailer Mixing : M R Rajakrishnan  Sound Design : OLI Sound Labs Music Premix : Balu Thankachen Costume Designer: Pragathi Rishab ShettyProduction Designer: Ullas Hydoor  Stunts: Vikram MorAudiography: M R RajakrishnanSupervising Producer: Krishna Banerjee   Executive Producers: Binay Khandelwal, Sudhee D SCanine Trainer: Pramod B CProduction Manager: Shashidhara B , Rajesh K SP.R.O: Sudheendra Venkatesh Colorist: Remesh CPTrailer Colourist: Remesh CPSound Effects: Oli Sound LabsOnline Editor: Rakshith KaupDirection Team: Sharath Mallesh, Sourabh A K, Nimisha Kannath, Karthik Vattikuti, Damini Dhanraj, Prasad Kanteerava, Nithin Ramachandra, Rakshith KaupPosters: Kreative Crew (Adarsh Mohandas)VFX Creative Head: Sachin B RaviVFX Supervisor: Rahul V GopalakrishnanVFX: Pinaka StudiosMarketing: Shraman Jain, Sindhura TPVisual Promotions: Rakesh Shetty, Manoj Vhr Digitally Powered By: Creative Guyz In Association with Divohttps://www.facebook.com/DivoKannada/http://www.facebook.com/divomovieshttps://twitter.com/divomovies#777Charlie #RakshitShetty #777CharlieTrailer #ParamvahStudios #777CharlieKannadaTrailer"
"FXp6cuaX17E","गंगा मेरी बीवी है तुम्हारी नहीं - परदेस बेस्ट सीन - शाहरुख़ खान - महिमा चौधरी - Pardes","2022-05-17T12:45:00Z","UCmL1WlDI8UkXDXCXcBQN9CA","Ultra Bollywood","24","22.18.05","shahrukh khan movies|srk movies|shah rukh khan movies|pardes|bollywood movies|pardes best scenes|amrish puri movies|mahima chaudhry movie|शाहरुख़ खान|अमरीश पूरी|महिमा चौधरी|परदेस|mahima chaudhary|pardes movie|pardes movie shahrukh khan|pardes picture|pardes hindi movie|shahrukh khan best scene|pardes movie best scenes hindi|shahrukh khan pardes movie|shahrukh khan pardes movie scene|shahrukh khan mahima chaudhary movie|best scenes of movies","2766317","17683","808","https://i.ytimg.com/vi/FXp6cuaX17E/default.jpg","गंगा मेरी बीवी है या तुम्हारी - परदेस - बेस्ट सीन - शाहरुख़ खान - महिमा चौधरी - Pardes Film: Pardes (1997)#ShahRukhKhan #MahimaChaudhary #Pardes► Subscribe to Ultra Bollywood - http://bit.ly/SubscribeUltraBollywood► Click To Watch Lata Mangeshkar Hit Songs : - https://bit.ly/LataMangeshkarHitSongs► Click To Watch Udit Narayan Hit Songs : - https://bit.ly/UditNarayanHitSongs► Click To Watch Kumar Sanu Hit Songs : - https://bit.ly/KumarSanuSongs► Click To Watch Alka Yagnik Hit Songs :- https://bit.ly/AlkaYagnikSongs► Click To Watch Kishore Kumar Songs : - https://bit.ly/KishoreKumarSong► Click To Watch Hindi Comedy Scenes : - https://bit.ly/HindiComedyScenes► Click To Watch Best Collections of Salman Khan : - https://bit.ly/SalmanKhanBestCollections► Click To Watch Best Aamir Khan Scenes : - https://bit.ly/AamirKhanComedyScenes► Click To Watch Evergreen Hindi Songs : -  https://bit.ly/EvergreenHindiSongs► Click To Watch Romantic Songs in 4K :- https://bit.ly/4KHindiRomanticSongs► Click To Watch Superhit Hindi Songs in 4K - https://bit.ly/4KHindiSongs► Website: http://www.ultraindia.com► Like us on Facebook: https://www.facebook.com/UltraHindi► Follow us on Twitter: https://twitter.com/UltraHindi► Circle us on G+: https://plus.google.com/+UltraHindi► Follow us on Pinterest: http://www.pinterest.com/ultrahindi/"
"SI33Za-CiE4","I DESTROYED JIMMY'S SUPERCAR | GTA V GAMEPLAY #145","2022-05-16T03:30:04Z","UCX8pnu3DYUnx8qy8V_c6oHg","Techno Gamerz","20","22.18.05","GTA|GTA 5|GTA ONLINE|PC|gta 5 gameplay|gta v hindi gameplay|gta 5 funny moments|gta 5 wins|gta 5 lamborghini|gta 5 stealing supercar|gta 5 stunts|gta 5 thug life|grand theft auto v|gta v online|gta 5|gta 5 epic moments|gta v funny moments|awesome gta 5 stunts|best moments|aj gaming|arish khan|hindustan gamer|chapati hindustani gamer|techno gamerz","11453332","1087926","50339","https://i.ytimg.com/vi/SI33Za-CiE4/default.jpg","I DESTROYED JIMMY'S SUPER | GTA V GAMEPLAY #145#145 #GTA5 #TechnoGamerzSubscribe to our Second YouTube Channel: https://www.youtube.com/c/UjjwalGamerShare, Support, Subscribe!!!Subscribe: http://bit.ly/technogamerzDiscord : https://bit.ly/ujjwaldiscordYoutube: https://www.youtube.com/c/TechnoGamerzOfficialTwitter:  https://www.twitter.com/ujjwalgamerFacebook: https://www.facebook.com/technogamerzFacebook Myself: https://www.facebook.com/ujjwalgamerInstagram: https://instagram.com/ujjwalgamerGoogle Plus: https://plus.google.com/+TechnoGamerzOfficialWebsite: https://technogamerz.in/Merchandise: https://shop.technogamerz.in/Business Email : technogamerzofficial@gmail.comAbout : Techno Gamerz is a YouTube Channel, where you will find gaming videos in Hindi, I hope this video was Useful and you liked it, if you did press the thumbs up button."
"1hS4S8BneSM","കണ്ടം Football | Alambanz Shorts #shorts #comedy","2022-05-17T13:55:27Z","UCNwQlYWHb_MQ5Swp1zW91dQ","Alambanz","23","22.18.05","alambanz|kandam Football|malayalam comedy|alambans shorts|Football shorts","576061","82505","451","https://i.ytimg.com/vi/1hS4S8BneSM/default.jpg","കണ്ടം Football scenes #shorts #youtubeshorts #comedy | Alambanz Shorts"
"L14LnoFNPp4","P #shorts #ashortaday","2022-05-16T13:09:25Z","UCuIpkP1H2Vb_NFu8dLIWoPw","CHANDAN ART ACADEMY","27","22.18.05","[none]","3545077","98965","484","https://i.ytimg.com/vi/L14LnoFNPp4/default.jpg",""
"_KNSy0-_mBk","Bingo! RINGA RINGA ROSA-EP11 | Karikku #shorts","2022-05-18T06:25:22Z","UC2bNrKQbJLphxNCd6BSnTkA","Karikku","23","22.18.05","karikku|malayalam|funny|comedy|webseries|lolan|george|karikk|karikke|film|trending|sketch|vine|flowerstv","1702248","171138","646","https://i.ytimg.com/vi/_KNSy0-_mBk/default.jpg","Story & Directed by : KCExecutive Producer : Nikhil prasadAssociate Director : Abijith KrishnanDOP : Binoy JohnEditor : Anand MathewsScreenplay : KC & Abijith Krishnan Music and BGM  : Jishnu thilakSound Mixing : KrishnanunniVFX : Binoy John, Abijith KrishnanProduction Controller : KarundasProduction Executives :Siraj udheen, Sandeep PradeepkumarArt : Siraj udheen, vishnu VitzzAssistant cinematographer : Abhishek A, Chandhu RadhakrishnanAssistant directors : Akshay S Kumar , ashwaghosh , Sandra C S Cast : sabareesh sajjin , Sumadevi, Anand Mathews, Abhishek A Special Thanks :Black House Media , Chandhu Radhakrishnan , Karundas , Vishnu Prakash kalathil, Meghuldas"
"E5BlE6oql7A","Beast Paavangal Ft. @Parithabangal | Gopi & Sudhakar | Beast | Netflix India","2022-05-17T05:52:24Z","UCZSNzBgFub_WWil6TOTYwAg","Netflix India","24","22.18.05","beast trailer|beast hindi trailer|beast song tamil|beast trailer tamil|beast review|beast telugu trailer|netflix|netflix shows|netflix india|beast movie scenes tamil|beast movie telugu|beast movie and trailer|beast movie vijay and pooja hegde|beast full movie and tamil|pooja hegde|pooja hegde beast|vijay beast|vijay thalapathy|thalapathy vijay|paritha bangal|gopi and sudhankar|vijay thalapathy telugu movies|vijay thalapathy new movie","1597280","111361","3987","https://i.ytimg.com/vi/E5BlE6oql7A/default.jpg","If we had to sum it up, this video is 11 minutes of Jolly-O-Gymkhana! 😂🕺Beast is now streaming in Tamil, Telugu, Malayalam, Kannada and Hindi, only on Netflix.Follow Netflix India on:Website: https://www.netflix.com/YouTube: http://bit.ly/NetflixIndiaYTInstagram: http://www.instagram.com/netflix_inFacebook: http://www.facebook.com/NetflixINTwitter: http://twitter.com/netflixindia#NetflixIndia #Beast #Parithabangal"
"4LoUGdxnUkw","Kale Ki Bahu | Sukki Dc | We Are One","2022-05-17T13:00:57Z","UCw5N06QIrXBg92OfOVpvWkg","We Are One","23","22.18.05","[none]","719593","65899","4030","https://i.ytimg.com/vi/4LoUGdxnUkw/default.jpg","signup- https://wlfairplayclub.adsrv.eacdn.com/C.ashx?btag=a_9b_1c_&affid=6&siteid=9&adid=1&c=vr1ytdgFairPlay Club is India’s first licensed betting exchange with the greatest odds in the market. Get a 200% first deposit bonus on registration and a FLAT 15% kickback on your losses every week!Register now and get, set, bet and WIN Follow us on instagram: https://www.instagram.com/team_weareone/Follow us on facebook: https://www.facebook.com/sukkidc123/Shoot by : Mohit BainslaEdited by : Krishan Bhardwaj , Mohit bainsla Background music : Dc Script by : Team We Are OneThumbnail : Raj Sharma sukki dc new videosukki dc funnyvideosukki dc comedywe are one comedywe are one funnyManaged by: Sociopool India private limited https://www.sociopoolindia.com"
"tfPXf3xf2zE","तलाक़😭 #motivation #inspiration #emotional","2022-05-15T14:00:47Z","UCN4NflpHqLeHQZ91kTUVCBw","Ishaan Ali 11","22","22.18.05","[none]","5866263","382169","777","https://i.ytimg.com/vi/tfPXf3xf2zE/default.jpg",""
"BH-Bsyg1e30","Kya me apni puri squad ko bhacha paunga Grandmaster squad - Garena free fire max #shorts","2022-05-17T10:25:13Z","UCRHbYSZHfDQvxZsJM3vbd4A","Hakson Pro Gaming","20","22.18.05","[none]","1216399","306287","1080","https://i.ytimg.com/vi/BH-Bsyg1e30/default.jpg",""
"roYau_XXsXU","Smoking 500 Cigarettes😳 #shorts","2022-05-16T12:30:32Z","UCufsqbhCy16gUWnfG2gjZsg","Mr.Village Vaathi","26","22.18.05","Smoking Cigarette experiment|What if i smoke 500 Cigarettes|Cigarettes experiment|smoking Cigarettes experiment|500 cigarettes experiment|cigarettes experiment in tamil|Cigarettes with water|cigarettes experiment lungs|cigarettes science experiment|e-cigarettes experimental study|vape vs cigarettes experiment|hookah vs cigarettes experiment|cigarette experiment with cotton balls|cigarette bottle experiment|smoking cigarettes experiment|cigarette social experiment","1172450","89216","481","https://i.ytimg.com/vi/roYau_XXsXU/default.jpg","#shorts #experiment #villagevaathi If  You Like This Video Hit The Like Button,and Subcribe and Support our ChannelContact mail ID:villagevaathi@gmail.comFollow us on Facebook:https://www.facebook.com/mr.villagevaathiofficial/Follow us on instagram : https://www.instagram.com/kalai_101"
"z41dtcH_NfI","Nikamma - Official Trailer | Abhimanyu D, Shilpa S, Shirley S | In Cinemas On June 17th","2022-05-17T06:30:18Z","UCvkthasgnjgjzqt0WvOemCQ","Sony Pictures Films India","24","22.18.05","Nikamma|Abhimanyu Dassani|Shirley Setia|Sunil Grover|Shilpa Shetty|Nikamma Movie|Nikamma Trailer|nikamma action movie|latetst movie 2022|Bollywood new movie|hindi movie trailer|sony pictures india|sony|sony pictures film|Bollywood|Tollywood|Movie 2022|Nikamma trailer announcement|Abhimanyu D|yt:cc=on|nikamma trailer|bollywood latest movie trailer|new release|nikamma comedy movie 2022","15184477","74645","19365","https://i.ytimg.com/vi/z41dtcH_NfI/default.jpg","Nikamma hona is an art aur dushmano ki kaise lagate hai vaat, yeh sikhane aa raha hai humara perfect hero #NikammaTaiyyar ho jaiye to welcome the new action hero!​Presenting the kickass trailer of Nikamma.#NikammaTrailer Out Now!#Nikammagiri #NikammaFilmTo avail offers on tickets:​Paytm: https://m.paytm.me/dl_nikammaBookmyshow: https://in.bookmyshow.com/movie-voucher/BSTR/2000861Starring: Shilpa Shetty Kundra, Abhimanyu Dassani, Shirley Setia, Samir SoniDirector: Sabbir KhanProducers: Sony Pictures International Productions & Sabbir Khan FilmsMusic: Amaal Malik, Javed Mohsin, Vipin Patwa, Gourov DasguptaLyrics: Kumaar, Danish SabriWritten by: Venu Sriram Additional Screenplay Sabbir KhanDialogues: Sanamjit TalwarCinematography: Hari K VedantamProduction Designer: Taj & Anshita SethiaEditor: Manan SagarAction: Anl Arasakumar, Sunil RodricksChoreography: Ganesh Acharya, Adil ShaikhAssociate Producer: Siraj KasmaniAssociate Director: Anshuman SinghExecutive Producer: Roshan SinghCostumes: Neeta lulla, Sonaakshi Raaj & Kartik DamaniBackground Score: John Stewart EduriSound Designer: Parikshit Lalwani & Kunal MehtaRe-recording Mixer: Justin Jose, CasPublicity Design: House Of AweMedia Consultant: Parag Desai (Universal Communications)DI: Ny di-waalaVfx: Image Device Pvt. LtdDI Colorist: Sunny SinghDI Head: Sameer ArekarMusic On: Zee Music Co.Visual Promotions: Just Right Studioz Nx"
"OlxsDYJmWFk","DHYAN SREENIVASAN |VINEETH SREENIVASAN #shorts","2022-05-16T06:35:41Z","UCs8kzX1I7yZj3akKIy1tlMw","Ginger Media Shorts","22","22.18.05","[none]","1376020","88708","123","https://i.ytimg.com/vi/OlxsDYJmWFk/default.jpg",""
