video_id,title,publishedAt,channelId,channelTitle,categoryId,trending_date,tags,view_count,likes,comment_count,thumbnail_link,description
"80iPIuSxnMI","Howrah Chaos : রণক্ষেত্র হাওড়ার ধূলাগড়, পুলিশকে লক্ষ্য করে ইটবৃষ্টি, কাঁদানে গ্যাসের শেল","2022-06-10T10:50:43Z","UCv3rFzn-GHGtqzXiaq3sWNg","ABP ANANDA","25","22.11.06","ABP Ananda|ABP Ananda LIVE|ABP Ananda Digital|ABP Ananda Bengali news|ajker khobor|khobor bangla|khabar bangla news|bangla news live|live news bangla|bengali news live|bangla khabar|ajker bangla khabar|bengali news|Bangla News|এবিপি আনন্দ|এবিপি আনন্দ লাইভ|Howrah|prophet|prophetcontroversy","1095458","10226","3425","https://i.ytimg.com/vi/80iPIuSxnMI/default.jpg","দিল্লির বিজেপি নেত্রীর পয়গম্বর সম্পর্ক নিয়ে বিতর্কিত মন্তব্যের বিরোধিতায় আজও হাওড়ার বিভিন্ন জায়গায় প্রতিবাদ ঘিরে উত্তেজনা। পথ অবরোধ ঘিরে রণক্ষেত্রের চেহারা নিল হাওড়ার ধূলাগড়। অবরোধ তুলতে গেলে পুলিশকে লক্ষ্য করে ইটবৃষ্টি। বিক্ষোভকারীদের ছত্রভঙ্গ করতে কাঁদানে গ্যাসের শেল ছোড়ে পুলিশ। হাওড়ার সলপে পুলিশকে লক্ষ্য করে বোমা ছোড়ার অভিযোগ। অন্যদিকে, হাওড়ার উলুবেড়িয়ায় ৬ নম্বর জাতীয় সড়ক অবরোধ ঘিরে উত্তেজনা ছড়িয়েছে। তীব্র গরমের মধ্যে অবরোধে আটকে পড়ে চরম ভোগান্তির শিকার হতে হল বহু মানুষকে।#Howrah #prophet #prophetcontroversy #abpananda #abpanandalive #banglanews ________________________________________________________________Subscribe to our YouTube channel here: https://www.youtube.com/user/abpanandatvAbout Channel:ABP Ananda is a regional news hub which provides you with the comprehensive up-to-date news coverage from West Bengal and all over India and World. Get the latest top stories, current affairs, sports, business, entertainment, politics, spirituality, and many more here only on ABP Ananda.ABP Ananda maintains the repute of being a people's channel. Its cutting-edge formats, state-of-the-art newsrooms commands the attention of million Bengalis weekly.Download ABP App for Apple: https://itunes.apple.com/in/app/abp-live-abp-news-abp-ananda/id811114904?mt=8Download ABP App for Android: https://play.google.com/store/apps/details?id=com.winit.starnews.hin&hl=enSocial Media Handles:Facebook: https://www.facebook.com/abpanandaTwitter: https://twitter.com/abpanandatvGoogle+: https://plus.google.com/+abpananda"
"Lt2kzOmoXvo","ALL WWE WRESTLERS vs 1 | SlayyPop","2022-06-10T13:30:09Z","UCSfxFZFzcpYMbOB3A1rWHAg","SlayyPop","20","22.11.06","slayypop|slayypoint|abhyudaya|gautami|wwe game|funny game|gameplay|hindi gaming|gaming channel|john cena","800922","79411","1549","https://i.ytimg.com/vi/Lt2kzOmoXvo/default.jpg","One day.....we'll learn how to play wwe.Instagram -  @Abhyudaya_Mohan & @GautamiKawalehttps://www.instagram.com/abhyudaya_mohan/https://www.instagram.com/gautamikawale/@Slayy Point second channelSlayyPop videos edited by Kshitij"
"odzMuUkTGWU","Adani Ka Bank Account #LLAShorts 283","2022-06-10T15:00:34Z","UCVOTBwF0vnSxMRIbfSE_K_g","Labour Law Advisor","27","22.11.06","escrow kya hota hai|escrow account in hindi|escrow account|what is escrow|escrow account meaning|LLA|LLA Shorts|share market|stock market|labour law advisor shorts|labour law advisor|adani buy ambuja cement|adani buys ambuja|adani ambuja cement|adani acc ambuja|what is escrow account in hindi|escrow account explained","430412","40670","332","https://i.ytimg.com/vi/odzMuUkTGWU/default.jpg","Open Zerodha A/c, start investing: https://link.labourlawadvisor.in/zerodha.....................................................Checkout LLA Courses, Videos & Apps: https://link.labourlawadvisor.in/shorts.....................................................COURSES: https://labourlawadvisor.in/link/LPTI .....................................................QuickPayroll: https://quickpayroll.in/.....................................................Explained in 1 MinuteEscrow Account | Adani Ka Bank Account.....................................................Editing: Prince SoganiResearch: Kunal PrajapatPresenter: Money Minded Mandeep, Jagruk RJ, Anadi Andy.....................................................Newsletter: https://labourlawadvisor.in/newsletter/Instagram: https://instagram.com/labourlawadvisorTwitter: https://twitter.com/AdvisorLaborLawTelegram: @JoinLLA#Shorts #LLA #escrow #sharemarket #stockmarket #adani"
"zvLtqtqUrtQ","Bewafa Tune Mujko Pagal Kar Diya | Bewafa Love story | KAJAL MAHERIYA | Maahi Queen | Sad Song 2022","2022-06-10T03:30:13Z","UC5hrMQx_OLBfTmkAODbcITQ","Maahi Queen","24","22.11.06","bewafa tune mujko pagal kar diya|new bewafa song|bewafa|kajal maheriya new song|latest bewafa song|thukra ke mera pyar|heart touching story|bewafa tune mujko pagal kar diya video song|bewafa nikli tu|bewafa pyaar|mujko pagal kar diya|pyar ki galion me mujhe badnam kar diya|new bewafa song 2019|Bewafa hai tu|Bewafa song|Tera naam|pachtaoge 2|Besharam boyz|guru randhawa song|teri meri kahani song|heart broken story|Tiktok viral song|maahi queen|Maahi","749173","15899","782","https://i.ytimg.com/vi/zvLtqtqUrtQ/default.jpg","Bewafa Tune Mujko Pagal Kar Diya | Bewafa Love story | KAJAL MAHERIYA | Maahi Queen | Sad Song 2022🎬Original Video Credit :Cast : Maahi, Aryan, Akash, Jeetu & LaxmiDirector : Arvind ChauhanStory By : MaaProducer : Jeetu Bhai Thumbnail by :-pk editing Cinematography & Editor : Arvind Chauhan (8850636912)--------------------------------------------------------------------------------👉  Connect for  inquir & sponsership - 8850636912 / 8767785787 👉 Email - (Jaanjeetu2@gmail.com)-----------------------------------------------------------------Original Song Credits:Singer - Kajal MaheriyaProducer - Manoj N JobanputraLyrics & Composer - Vijay Singh GolMusic - Rahul - RaviConcept - DOP - Editor - Director -Chanakya A ThakorActing - Yuvraj Suvada,Priyanka Nadiyadwala,Rakesh Pujara,Chhaya ThakorLyrics H...... O..........Ho......O...........Bewafa tune muje pagal hi kar diya.Bewafa tune muje pagal hi kar diyaHo pehle dil se lagaya fir begana hi kar diya.Ho pehle dil se lagaya fir begana hi kar diya.Bewafa tune muje pagal hi kar diyaO bewafa tune muje pagal hi kar diya.Ho dil me basa ke rakha tha tumhe.Sapno me mere sajaya tumhe.Ho khud se bhi jiyada chaha tha tumhe.Fir bhi yakin na aaya tumhe.Ho pyar ki galiyo me muje badnaam hi kar diya.Ho pyar ki galiyo me badnaam hi kar diya.Bevafa tune muje pagal hi kar diya.Ho bewafa tune muje pagal hi kar diya.Ho mujpe jo biti he tujhpe bitegi.Galti jab apni tumhe samaj aayegi.Ho yaado me meri Teri  ruh tadpegi.Mango ge phir bhi na mot aayengi.Ho gum ke aanshu se mere daman tumne bhar diya.Ho gum ke aanshu se mere daman tumne bhar diya.Bewafa tune muje pagal hi kar diya.Ho bewafa tune muje pagal hi kar diya.Pagal hi kar diya....Barbad hi kar diya...Pagal hi kar diya...All Rights to Music Label Co. & No Copyright infringement intended.Copyright Disclaimer Under Section 107 of the Copyright Act 1976, allowance is made for 'Fair Use' for purposes such as criticism, comment, news reporting, teaching, scholarship, and research, Fair use is a permitted by copyright statute that might otherwise be infringing, Non-profit, educational or personal use tips the balance in favor of fair use.Thanks For Watching Our Video..........Keep Supporting Us ! #hearttouchinglovestory​​​  #maahiqueen​​​  #NewStatus2020​​​ #StatusVideos​​​#StebinBen​​​ #EricaFernandes​​​ #HarshadChopda​ #jeetujaan"
"8AGESDMNroY","Ala Sujatha Dariki Cherina Subramanyam | Episode - 8 | Soniya Singh | Pavan Sidhu | Infinitum Media","2022-06-10T12:30:04Z","UCruMs8kL2fHjxNIymX53VSw","Vayyari Bhama","24","22.11.06","ala sujatha dariki cherina subramanyam|sujatha subramanyam ep 8|ala sujatha dariki cherina subramanyam ep 8|soniya singh|pavan sidhu|soniya singh pavan sidhu|sonia singh short films|pavan sidhu short films|pavan sidhu sonia singh short films|telugu web series|telugu short films|latest telugu short films new|telugu short films 2022|vayyari bhama|short films telugu|infinitum media|soniya singh pawan sidhu|pavan sidhu sonia singh|sonia singh new|sonia singh","538091","21205","480","https://i.ytimg.com/vi/8AGESDMNroY/default.jpg","Download the OctaFX Copytrading App at https://bit.ly/Bhama_Copy_OctaFX and get an exclusive 50% bonus! 🎁Start learning investing money with the principal trading partner of the Delhi Capitals - Octa🏆Ad  by-:Sociopool India Private Limitedhttps://www.sociopoolindia.com/Ala Sujatha Dariki Cherina Subramanyam is a Telugu Romcom Web Series featuring Soniya Singh & Pavan Sidhu as leads.Special Thanks :M Venkatesh Reddy(Boddavara RailwayStation Manager)Thanks To:Savithri (Shop)Kishore (house)Thatipudi villager'sCostume Designer: fasshion fairy  Cast:Pavan Sidhu, Soniya Singh, Ajay, Vedavathi Peddolla, Dhana Balla, Nikhil Lakshman, K  Siva Prasad, PRK RaoWritten & Directed by: Sunny Sanjay DOP: Seshu Raj DaddalaSujatha-Subramanyam title songMusic: Chandra Sekar & Ravi CherukuriViolin: Hemanth KashyapSingers: Shriya Ponduthi, Harini DarbhaFlute: Poornima Krishna EmaniMandolin: Saiganesh Mix and mastering: Ravi CherukuriEditing & DI: Nani LukkaAssociate Editor: DharanidharSFX: ManideepTitle Animation: Pavan Kumar kontePublicity Designer: Nikhil ChotuCo-Director: Shanmukh.DFocus Puller: BharathOperative Cameraman: Jay Chandra Associate cameraman: TarakLine Producer: Anish Reddy, Mohan, PavanExecutive Producer: Chandu JCCreative Producer: Sathwik G RoyProducer: Vandana Bandaru#PavanSidhu  #SoniyaSingh  #SujathaSubramanyam #Infinitummedia Presented by #Infinitum Media"
"ajgv6QYEXos","*FAKE CELEBRITY* IN PUBLIC PRANK🤣 (With 10 Bodyguards)- नकली अरबपति | Crazy Public Reaction","2022-06-10T07:06:09Z","UCebC4x5l2-PQxg46Ucv9CsA","Crazy XYZ","28","22.11.06","fake celebrity prank|fake celebrity prank in india|nakli celebrity|celebrity prank in india|celebrity with bodyguards pranks|10 bodyguards with fake celebrity|chunnilal shera|business man chunni lal shera|chunni lal shera prank|vvip fake celebrity|fake|vip|celebrity|best pranks in india|hindi pranks|indian pranks|millionaire prank|vip billionaire|crorepati chunni lal shera|vip celebrity|10 bouncers|hifi security prank","5945422","529055","49746","https://i.ytimg.com/vi/ajgv6QYEXos/default.jpg","Hello guys, is video me humne humare dost ko celebrity bana ke public me ghumaya hai.Our Unboxing Channel- https://www.youtube.com/channel/UCIcKN-VXhkZNpf5DRdHp9JAOur Shorts Channel- https://www.youtube.com/channel/UC7bZ8U3-WqDzHiyz6Hc6TmAFollow Me on Instagram- https://www.instagram.com/amit.yt/Follow Us On Facebook- https://www.facebook.com/CrazyXYZfb/"
"7hV5iQr473U","The Eggs Story | Part 4| Amazing Village Comedy 😍 | Creative Thinks","2022-06-08T14:08:41Z","UCowzbzrHpmp2GJ4TeqnQ0nw","Creative Thinks - A to Z","24","22.11.06","Telugu|village|village comedy|village culture|village show|the village|comedy|creative thinks|funny|#village|short films|village girl|village people|funny videos|my village|village nature|telugu short films|village fun|telugu funny videos|telugu comedy videos|creative thinks latest|creative thinks new|sri|telugu comedy|a to z|chinni|Childhood|Creative thinks a to z|Amazing|new|eggs|Trending|Viral","1203681","37516","5110","https://i.ytimg.com/vi/7hV5iQr473U/default.jpg","Don't waste your time, take part in the giveaway and earn more! Use my link: https://bit.ly/3PZhc70ఇది aa  Eggs Part 4 Thank you for your Response 😍Main Channel 👉  Www.youtube.com/creativethinks 😍3rd Channel 👉 www.youtube.com/creativethinksadventure  😎Written & Direction : శ్రీCinematography : Sri, Mounika rendlaMusic: VaniEditing : Sri, Mounika rendlaPoster design : Devendar RapellySubtitles :Raj Reddy Contact 👇Email: Creativethinks007@gmail.comలేదా Chat in 👇Instagram https://www.instagram.com/creative_thinks_official/Copyright © 2014-2022. Creative Thinks. All Rights Reserved."
"NxAtnqveR2Y","Tsunami - Teaser | Khesari Lal Yadav, Akshara Singh | Salim Sulaiman | Hindi Song","2022-06-11T03:30:08Z","UCdDDWwRdgJTgpD4iPtOZRUQ","Salim Sulaiman","10","22.11.06","salim sulaiman|salim|sulaiman|salim sulaiman songs|salim merchant|sulaiman merchant|merchant|merchant records|hindi songs|new hindi songs|khesari lal bhojpuri song|khesari lal hits|khesari lal song|bhojpuri song|bhojpuri gana|sad status|khesari lal romantic|Bhojpuri sad songs|khesari lal yadav|khesari lal yadav new song|khesari lal ka gana|akshara singh|anshuman sharma|khesari lal akshara|khesari akshara","278589","39379","5903","https://i.ytimg.com/vi/NxAtnqveR2Y/default.jpg","Pehli aandhi aayi thi, phir Toofan! Ab Tsunami aa rahi hai 12 June ko! Tsunami is presented by Merchant Records & Global Music JunctionKhesari Lal Yadav aur Akshara Singh ke saath. Music Composed by Salim-Sulaiman. Written by Surjeet Yadav, Shradha Pandit & Aditya Kalway. Music Produced by Anshuman Sharma, Raj Pandit & Muheet Bharti#Tsunami #KhesariLalYadav #AksharaSingh #khesariLal #KhesariLalyadavnewsong #Newhindi #newbhojpuri #salimsulaiman"
"9piApMeEidk","Does Humanity still exists ? 😂 #dushyantkukreja #shorts","2022-06-09T14:30:11Z","UCo6y9hnRawAqtyWhRhblXqg","Dushyant kukreja","24","22.11.06","humanity|dushyant kukreja","3634043","218347","493","https://i.ytimg.com/vi/9piApMeEidk/default.jpg","@Dushyant Kukreja Life"
"PMSl6S31WIQ","Liquid Nitrogen VS Beautiful Flowers | റോസാപൂവിനെ ഗ്ലാസ്‌ ആക്കി മാറ്റിയപ്പോൾ | M4 Tech |","2022-06-10T02:39:30Z","UClfll_TO6FpOPLUg4Aawhlw","M4 Tech","22","22.11.06","Liquid nitrogen|liquid nitrogen experiment|liquid nitrogen flower experiment|liquid nitrogen biscuit eating","1425240","104239","1553","https://i.ytimg.com/vi/PMSl6S31WIQ/default.jpg",""
"T-ZkN1W-M1c","iPhone 13 Pro VS Samsung S22 Ultra Drop Test | Durability Test | #iPhone #samsung I #droptest","2022-06-10T06:30:14Z","UCBM6AwaDl8uPVAN_BUIqPUw","Anurag Aggarwal","26","22.11.06","business coach|how to earn money|business tips|make money in business|how to grow your business|business tricks|business trainings|business trainer|business ideas|tricks in business|business competition|anurag aggarwal|Anurag Aggarwal: Business Trainer|public speaking courses|vivek bindra|Harshvardhan jain|Motivation|Ravish kumar|Ulta chasm uc|Him-eesh madan|The live tv|a2 motivators|arvind arora|a2 facts|shorts|youtubeshorts","358733","42568","332","https://i.ytimg.com/vi/T-ZkN1W-M1c/default.jpg","---------------------------------------------------------------Download Anurag Aggarwal's App. for FREE https://play.google.com/store/apps/details?id=co.arya.yqadlWebsite: http://anuragaggarwal.comE-MAIL: info@anuragaggarwal.comContact no.: 7834998181 (for joining courses)WhatsApp: 8076377221 (For Business Collaborations)BLOG: http://businessandpublicspeaking.inYOUTUBE (in English): https://www.youtube.com/aaipsenglishFACEBOOK: https://facebook.com/AnuragAggarwalInstituteofPublicSpeakingINSTAGRAM: https://instagram.com/anuragthecoachTWITTER: https://twitter.com/anuragthecoachLINKEDIN: https://www.linkedin.com/in/anuragthecoach#shorts #youtubeshorts #ytshorts"
"bvHvCMgpJmc","Chennai's First Ever Cruise Trip | Sivaangi Krishnakumar | Tamil Vlogs","2022-06-09T12:30:12Z","UC2iP6-PJXkrQ03C8WBC-NXQ","Sivaangi Krishnakumar","22","22.11.06","sivaangi|sivaangi vlog|sivaangi krishnakumar|sivaangi krishnakumar channel|super singer sivaangi|sivaangi cooku with comali|tamil vlogs|sivaangi live|sivaangi comedy|sivaangi krishnakumar songs|sivaangi song|sivaangi krishnakumar shorts|sivaangi new reel|cook with comali|ashwin shivangi|cook with comali 3|cwc season 3|sivaangi cruise trip|chennai cruise ship|chennai cruise trip|chennai cruise ship packages|cruise trip sivaangi krishnakumar","933607","40057","641","https://i.ytimg.com/vi/bvHvCMgpJmc/default.jpg","Hello Makkale! So excited to show you my experience on Chennai's First ever Cruise Trip 😍 It was exhilarating and so much fun! Checkout the video to find out more about the trip. Hope You Guys Enjoy this video! @Pickyourtrail  - https://pyt.li/CruiseChat #PickYourTrail #CordeliaCruiseFor More Videos Subscribe :- http://bit.ly/34aPOKT#Sivaangi​ #SivaangiKrishnakumar​ #ChennaiCruiseTrip************************************************Click Here To Watch :-Birthday Celebration ‘22 - https://youtu.be/ea0MVtlJRbwBangalore Food Street - https://youtu.be/9RcL7ex-NCY1 Day 2 Looks | Therukoothu Getup - https://youtu.be/Zc_Iw-vRCB0Pranking Manimegalai - https://youtu.be/VF0qqeVT_bMDriving for the First Time - https://youtu.be/pKLP7TODrZYAmazing Netherland Pavilion Inside Tour - https://youtu.be/siZRNbFQ0YUDubai Expo Day Vlog Part 1 - https://youtu.be/zO1PPfLByTkAs-Salam Alaykum Abu Dhabi | Dubai Trip with Family (Part 3) - https://youtu.be/KBC3ttaKWocDubai Mall VLOG | Dubai Trip with Family (Part 2) - https://youtu.be/pxzG1wILlssDubai Trip with Family (Part 1) - https://youtu.be/zBkiAj9ifE8சிவகாசி பட்டாசு VLOG - https://youtu.be/AqZ1hOkEbNITanjavore Traditional Home Tour : https://youtu.be/hrwuMGfxFpEA Musical Day Out : https://youtu.be/w4f99GAhMiIManga Piching & Kerala Style Manga Oorga : https://youtu.be/Q-IZtnAco0sMy Birthday VLOG : https://youtu.be/lBmkzDemonYFun Shopping With Amma! 😀: https://youtu.be/i9V4pIDdN0s​Inside Bigg Boss Set! : https://youtu.be/9uEhPg42Vt8​Fun Vlog At Super Singer Sets : https://youtu.be/VHCk8RW088I​Jimmikki Kammal Fun Vlog Part 2 : https://youtu.be/K_oxssXDIy4​Jimmikki Kammal Fun Vlog Part 1 : https://youtu.be/FR6VkiD86eA​Ellu Vaya Pookalaye Song Cover : https://youtu.be/YC2y_Vf29yY"
"nnM-i17PdS0","నాకు పెళ్ళి కావాలి 😀//Full funny video//junnu videos//sindhu mateti","2022-06-11T04:08:45Z","UC0u7Y9hLEW2kwO6lrWRIqPQ","5 Star Junnu","24","22.11.06","5star junnu|junnu videos|sindhu mateti videos|junnu comedy|creative thinks videos|trending videos|gangavva videos|prank videos|rasool videos|sathwika videos|my village show|5star channel videos|big boss videos|ipl videos","163133","5748","316","https://i.ytimg.com/vi/nnM-i17PdS0/default.jpg","https://play.google.com/store/apps/details?id=com.pelli.app (Android)Pelli App is Telugu community's most trusted and favorite matrimonial app. 100% verified members, no packages. no time limit, unlimited profiles, unlimited phone numbers. Just Rs. 500 onetime registration feehttps://apps.apple.com/in/app/pelliapp/id1618588538 (Apple)#junnuvideos #sindhumateti #marriage.......................................................................Written& direction: 5star venky goudco-writer:- Naresh chaitanyaCamera ;  Kuppi, Editing ; 5Star MDProduction : 5 Star junnu Teamposter design:- BunnyOur Village LocationVillage : Kondapur And AmbaripetMandal : VelgatoorDistrict : JagityalState : Telangana...........................................................................................#5starjunnu#junnucomedy#trendingvideos#teluguvideos#bigboss5#junnucomedy#ipl2022 #5starvenky#5starmd#01ontrending #02ontrending#trendingonyoutube"
"8FYsnGmc5zs","10 Second icecream Challenge 🤑🤑😱 hardworking boy selling ice cream🍦 😋 #shorts #icecream #challenge","2022-06-07T15:51:37Z","UCGuhUfGfaJGGkmUTeP6-ScQ","foodies aao","22","22.11.06","street food challenge|ice cream eating challenge|street food shorts|food shorts|viral video challenge","3292737","307318","1162","https://i.ytimg.com/vi/8FYsnGmc5zs/default.jpg","#youtubeshorts #trending #shortvideo #foodiesaao #viralvideo #short #indianstreetfood #challengevideo"
"RAqzC-f1RjY","🤣Friends-നെ പറ്റിക്കാൻ ഈ Smartphone Prank Try ചെയ്യൂ #mrperfecttech #shorts","2022-06-10T10:41:16Z","UCCya-YUszMuiTAR3lfYMuog","Mr Perfect Tech","28","22.11.06","[none]","443840","69393","374","https://i.ytimg.com/vi/RAqzC-f1RjY/default.jpg",""
"4DoGacXeSY8","She Owns 10 Private Planes! #268","2022-06-10T11:00:02Z","UCJsUvAqDzczYv2UpFmu4PcA","Nas Daily","19","22.11.06","Nas Daily|Nasmeanspeople|1minute|Travel|Nuseir Yassin|Nas Studio|英語学習|people|Nas Academy|Lesan.io|private planes|travel|innovation","892104","107643","1146","https://i.ytimg.com/vi/4DoGacXeSY8/default.jpg","#shorts"
"yFNDVWROedw","ബിഗ് ബോസ് സീക്രട്ട്  റൂമിലെ ഭീകരനുഭവങ്ങൾ | Dr Robin Exclusive Interview | #alicechristy #biggboss","2022-06-08T14:34:43Z","UCqEm-cr0PJ4pFwuWGLKvmew","Alice Christy","22","22.11.06","dr rohan interview|dr robin interview malayalam|dr robin bigg boss|dr robin re entry|dr robin family interview|bigg boss malayalam season 4|bigg boss live|bigg boss malayalam season 4 live|bigg boss live today|bigg boss live today episode|robin interview|robin bigg boss malayalam|dr robin bigg boss interview","1060460","55753","4587","https://i.ytimg.com/vi/yFNDVWROedw/default.jpg","Hello everyone Alice Christy here in this Video Dr. Robin talks about the bigg boss malayalam season 4 Watch Our exclusive interview with Dr. Robin,#alicechristy #robin #bigboss Location: Avoki Resort , kazhakootta, TVPM__________________________________________________© 2021 DSTAR Network Pvt.Ltd. All rights reserved.◆◆◆◆◆◆◆◆◆◆◆◆◆◆◆◆◆◆◆◆◆◆◆◆◆◆Email - alicechristyvlog@gmail.comFollow me on Instagram - alice christy"
"34i_MpZJ9N0","Bullettsong🔥 | sheethal elzha | sheethal vinu | sheethal | bullettsong | bullett |","2022-06-08T11:38:41Z","UCQZZRLQhT15dkY3XPdY1PXQ","Sheethal And Vinu","24","22.11.06","[none]","934063","49700","137","https://i.ytimg.com/vi/34i_MpZJ9N0/default.jpg",""
"lezwxOdhdtA","KHUDA HAAFIZ 2 - Agni Pariksha | TRAILER | Vidyut J, Shivaleeka O, Faruk K | 8th July in THEATRES","2022-06-08T07:27:40Z","UC47fJuLOxYsOOq5R3adUXQA","Panorama Studios","24","22.11.06","khuda haafiz chapter 2 Trailer|khuda haafiz 2 Trailer|khuda haafiz chapter 2|khuda haafiz 2|Khuda Haafiz|Khuda Haafiz Trailer|Hindi Movie|vidyut jammwal movies|shivaaleka oberoi movie|action movie|bollywood movie|bollywood movie trailer|action movie trailer|hindi movie trailer|film trailer|movie trailer 2022|panorama studio|latest bollywood trailers","27612458","861401","84066","https://i.ytimg.com/vi/lezwxOdhdtA/default.jpg","Sameer (Vidyut Jammwal) and Nargis (Shivaleeka Oberoi) after overcoming all odds, find a ray of sunshine when little Nandini enters their lives and their family is complete; But their happiness is short-lived. In a bizarre twist of fate, Nandini goes missing.Finding their daughter is the only thing that matters to the new parents and Sameer will go to any length to protect his family. Join Sameer and Nargis in their “Agni Pariksha” as they face unthinkable adversities that push them to their limits.#KhudaHaafizChapter2AgniPariksha #KhudaHaafiz2Trailer #vidyutjammwal #shivaleekaoberoi #traileroutnow Zee Studios, Cinergy and Panorama Studios present, A Panorama Studios Production - Khuda Haafiz Chapter 2 - Agni ParikshaWritten & Directed by - Faruk Kabir Produced by - Kumar Mangat Pathak, Abhishek Pathak Sneha Bimal Parekh, Ram Mirchandani Co-Producers -  Sanjeev Joshi, Aditya Chowksey, Hasnain Husaini, Santosh Shah Associate - Producer Murlidhar Chhatwani, Amit DalmiaCinematographer - Jitan Harmeet Singh Editor - Sandeep FrancisMusic - Mithoon, Vishal Mishra, Shabbir AhmedLyrics - Manoj Muntashir, Kaushal Kishore, Vishal Mishra & Faruk KabirAction Designed by - Faruk Kabir & Yannick BenAction Choreographed by - Yannick Ben, Amin Khatib, Vidyut Jammwal, Faruk KabirStunts - Andrew MckenzieProduction Designer - Ashwini ShrivastavBackground Music - Amar MohileDI - Ashirwad Hadkar (Prime Focus)Choreographer - Faruk Kabir Vfx  - G. Ranadheer Reddy  (Nyvfxwaala)Sound - Manoj M GoswamiCostume - Preeti Sharma 1st Assistant Director - Sanket Bhatia Line Producer - Zafar Mehdi, Pragya Singh Post Production - IndustrywalasPublicity Design - Brain On Rent Marketing - Priya RajeshCreative Producer - Vignesh ShettyContent Development - Shreya Dev VermaDigital & Social Media Agency - Hazelknight Media & EntertainmentMedia Consultant - Tree-Shul Media SolutionsPanorama Distribution - Ravi Auti, Darshan ShahSr. Manager Finance - Santosh AutiVisual Promo (Trailer) - Sandeep Francis Zee Studios TeamCbo - Shariq PatelAcquisition And Revenue Head- Bhumika TewariMarketing Head - Neeraj JoshiProduction And Commercial Head - Sumit KhuranaLegal Head - Sucheta BurmanFinance Head - Nilesh DeorahA Panorama Studios and Action Hero Films Pan India Release👉 Follow us on Social Media:👉 Facebook: https://www.facebook.com/PanoramaStudiosOfficial👉 Twitter: https://twitter.com/PANORAMAMOVIES👉 Instagram: www.instagram.com/panorama_studios"
