video_id,title,publishedAt,channelId,channelTitle,categoryId,trending_date,tags,view_count,likes,comment_count,thumbnail_link,description
"IDDcXTh8qqs","Share your favorite BTS moment using #MyBTStory💜 Only on YouTube Shorts. #BTS #방탄소년단 #YetToCome","2022-06-10T21:59:32Z","UCLkAepWjdylmXSltofFvsYQ","BANGTANTV","10","22.11.06","[none]","12641627","1195420","6924","https://i.ytimg.com/vi/IDDcXTh8qqs/default.jpg","Connect with BTS: https://ibighit.com/bts http://twitter.com/BTS_bighithttp://twitter.com/BTS_twt http://www.facebook.com/bangtan.official https://www.youtube.com/user/BANGTANTV http://instagram.com/BTS.bighitofficial https://channels.vlive.tv/FE619 https://www.tiktok.com/@bts_official_bighithttps://weverse.onelink.me/qt3S/94808190https://www.weibo.com/BTSbighithttps://www.weibo.com/BTSmembers http://i.youku.com/btsofficial http://btsblog.ibighit.com"
"zZLAGd5eNUI","These Indian TV Serials are so Stupid","2022-06-11T07:00:13Z","UCfLuT3JwLx8rvHjHfTymekw","Triggered Insaan","23","22.11.06","triggered insaan|live insaan|funny|comedy|indian tv serials|funny scenes|illogical scenes|reels","3097659","444779","29547","https://i.ytimg.com/vi/zZLAGd5eNUI/default.jpg","Today we are looking at some Indian TV Serial Scenes which are beyond illogical.Instagram ► https://www.instagram.com/triggeredinsaanFacebook ► https://www.facebook.com/realtriggeredinsaanGaming Channel ► https://www.youtube.com/liveinsaanDiscord ► https://discord.gg/liveinsaanTwitter ► https://twitter.com/triggeredinsaanAbout Me ► My name is Nischay Malhan. I'm from Delhi and I'm an engineering student. Now I am pursuing youtube Full Time. I make family friendly clean comedy videos on this channel for everyone to enjoy with their family. You don't need earphones to watch my videos😂Thanks For Reading😘"
"kXpOEzNZ8hQ","BTS (방탄소년단) 'Yet To Come (The Most Beautiful Moment)' Official MV","2022-06-10T03:59:38Z","UC3IZKseVpdzPSBaWxBxundA","HYBE LABELS","10","22.11.06","HYBE|HYBE LABELS|하이브|하이브레이블즈","61676165","8451329","1870401","https://i.ytimg.com/vi/kXpOEzNZ8hQ/default.jpg","BTS (방탄소년단) 'Yet To Come (The Most Beautiful Moment)' Official MVShare your favorite #MyBTStory 💜0:00 #MyBTStory 1:44 share your fav BTS story2:00 Only on YouTube ShortsCredits: Director: Yong Seok Choi (Lumpens)1st AD: Jihye Yoon (Lumpens)2nd AD: Ran Ro (Lumpens)Director of Photography: Nam Hyunwoo (MOTHER)B Camera Operator: EumkoFocus Puller: Kim Eunki, Lee Youngwoo2nd AC: Youngseo Park, Eunil LeeProduction Company: OUT OF OFFICE COExecutive Producer / Producer: Tiffany SuhProduction Supervisor: Sina ParsAssistant Production Supervisor: Linda NhemAssistant Production Supervisor / Travel Coordinator: Emily DiazTravel Coordinator: Veronica Zin 1st AD: Jesse Hays2nd AD: Mallory Chevalier Location Manager: Laura Dominguez Location Assistant: Ana ReyesSite Rep: John Miller1st AC: Victor Chon2nd AC: Massy Valenzuela-Castaneda Drone: Alex Castillo DIT: Jack Damon Technocrane: Maurico Rodriguez, Harrison Reilly, Erik CovarrubiasVTR / Playback: Avery Stone FishVTR Assistant: Jeffery PetroPlayback: Kai Morrison Gaffer: Kyle BrysonBest Boy Electric: Mark Mann Electric: Anthony Ortiz, Gerardo “Junior” Lara, Andrew Lopez Key Grip: Wadsworth PetersBest Boy Grip: Blake Danchik Grip: Richard Estrella, James Brazil Production Designer: Olivia McManus Art Director: Hensel Martinez Art Coordinator: Sara Barrett Prop Mater / Shopper: Amanda HumeLeadman: Logan BlueSet Dresser: Kyle KaminskyDresser / Driver: Kris IngramGreens: Brooke Benko, Nina GonzalesSchool Bus Transportation: Marlon SosaGang Boss: Rob NewcombeMoho Drivers: Stephen Hinze, Kevin Kasner, Rich Seitz, James “Bubba” BottoniStunt Coordinator: Nhan VoCraft Services: Danny Tilbury, Vic GodalesSet Medic: Dan DeBaunCCM: Matt MossCCA: Niko Galvez, Kasee ShamboraLocal Artist Security: Samuel Ford, Sully Crew, Raul Estevane, Pete MulryanPA: Adam Rosenberg, Joe Vizzini, Jason Vizzini, AJ, EJ Smith, Allen Amehi, Isiah Quince, Chris Fambro, Naushay Turner, Dariana Fly Buchatska, Cathy Kim, Ashley Lee, Bianca Yi, So Yun Um, Iris Jang, Sunny Park, Austin Barrett, Hollis Dohr, Jacqueline Nytes, Anna Tancredi, Sierra Badua, Dani Calderon DI: LUCID COLOURCOLORIST: Wonseok KoDI CREW: Jaeyeon Baek, Dain Kim, Serae HongDI PRODUCER: Sooyun HyunVFX: PLASTIC BEACHVFX Supervisor: OHZEONVFX Producer: Geoung Jeong, Ahn Sohyun3D Artist: Kim Doyeon, Jeon Jiwon, Kim Dongjin, Kim Hyeji, Lee Jeonghwa2D Artist: Lee Hyunjun, Jang KyutaeFX Artist: We Jungin, Kim YuminConcept Art: San GohSpecial thanks to San Bernardino County Film OfficeBIGHIT MUSIC. Rights are reserved selectively in the video. Unauthorized reproduction is a violation of applicable laws. Manufactured by BIGHIT MUSIC, Seoul, Korea.Connect with BTS: https://ibighit.com/bts http://twitter.com/BTS_bighithttp://twitter.com/BTS_twt http://www.facebook.com/bangtan.official https://www.youtube.com/user/BANGTANTV http://instagram.com/BTS.bighitofficial https://channels.vlive.tv/FE619 https://www.tiktok.com/@bts_official_bighithttps://weverse.onelink.me/qt3S/94808190https://www.weibo.com/BTSbighithttps://www.weibo.com/BTSmembers http://i.youku.com/btsofficial http://btsblog.ibighit.com#BTS #방탄소년단 #YetToCome #BTS_Proof #TheMostBeautifulMoment"
"ykpWl-gXZ6s","NBK107 First Hunt Teaser | Nandamuri Balakrishna | Shruti Haasan | Thaman S | Gopichandh Malineni","2022-06-09T12:41:01Z","UCKZSn5C-RzrLjuWJF8wWiDw","Mythri Movie Makers","24","22.11.06","NBK107 First Hunt Teaser|Nandamuri Balakrishna|Shruti Haasan|Gopichandh Malineni|Thaman S|Sai Madhav Burra|Rishi Punjabi|Mythri Movie Makers|NBK107|NBK107 Teaser|NBK107 Movie Teaser|Nandamuri Balakrishna Movies|NBK107 First Hunt|Shruti Haasan Movies|GopichandhMalineni Movies|Thaman Songs|Thaman Music|Sai Madhav Burra Dialogues|Teaser Launch|2022 New Teasers|2022 Latest Telugu Movies|New Movies Telugu 2022|Latest Telugu Teasers 2022|Happy Birthday NBK","11338155","334390","14863","https://i.ytimg.com/vi/ykpWl-gXZ6s/default.jpg","#NBK107 First Hunt Teaser on Mythri Movie Makers. Presenting our NATASIMHAM Nandamuri Balakrishna, Shruti Haasan and Varalaxmi Sarathkumar in NBK 107. The film has been Written and Directed by Gopichandh Malineni. Music composed by Thaman S. Cinematography helmed by Rishi Punjabi. Dialogues Penned by Sai Madhav Burra and Editing by Navin Nooli. Produced by Naveen Yerneni and Y Ravi Shankar, under the banner Mythri Movie Makers. #NBK107FirstHuntTeaser #NatasimhamNandamuriBalakrishna #ShrutiHaasan #GopichandhMalineni #SaiMadhavBurra #ThamanS #TeaserLaunch #NBK107FirstHunt #NBK107Teaser #HappyBirthdayNBK Movie Details: Cast : NATASIMHAM Nandamuri Balakrishna, Shruti Haasan and Varalaxmi SarathkumarStory-Screenplay-Direction : Gopichandh Malineni Producers : Naveen Yerneni and Ravi Shankar Yalamanchili CEO : Cherry Executive Producer : Chandu Ravipati Music : Thaman S Cinematographer : Rishi Punjabi Editing : Navin Nooli Production Designer : A.S. Prakash Fights : Stun Shiva, Ram-Laxman Dialogues : Sai Madhav Burra Lyrics : Rama Jogaiah Sastry Choreography : Sekhar VJ Chief-Co Director : Kurra Rangarao Co-Directors : Gulabi Srinu and Nimmagadda Srikanth Stills: Sai MagantiPRO : Vamsi – Sekhar Publicity Designer : Working Title Shiva Publicity : Baba Sai Kumar Marketing : First Show Line Producer : Bala Subrahmanyam KVVDI: Annapurna Studios Colorist : Vivek AnandClick here to watch:#NBK107 - Nandamuri Balakrishna : https://youtu.be/Wg-L56A5ObgAnte Sundaraniki Official Trailer : https://youtu.be/ZLvzIqM4QVoSarkaru Vaari Paata Official Trailer : https://youtu.be/tVr9v3o7iHYAnte Sundaraniki Teaser : https://youtu.be/OSV33DywiRsPrayer of Leela : https://youtu.be/MRVq70mH2vENani Barthhday Homam : https://youtu.be/C-8WKreAqGQZeroth Look of Sundar : https://youtu.be/Ot64eD0OST8Pushpa Official Trailer : https://youtu.be/Q1NKMPhP8PYPushpa Trailer Teaser : https://youtu.be/8KLCadalvfQIntroducing Pushpa Raj : https://youtu.be/Lk2oDvoonUcPrelude of Pushparaj: https://youtu.be/gbcpEbr6ECAPushpa launch Movie Launch : https://youtu.be/cs_drz6Ps5I​For more updates about #NBK107 & Mythri Movie Makers:Like - https://www.facebook.com/MythriMovieM...Subscribe - https://goo.gl/eJiVkt​​Twitter - https://twitter.com/MythriOfficial​​Instagram: https://instagram.com/MythriOfficial​"
"cVPI4ppiDSA","BB Ki Vines Productions - Taaza Khabar | Now Filming","2022-06-10T05:30:06Z","UCqwUrj10mAEsqezcItqvwEw","BB Ki Vines","24","22.11.06","Taaza Khabar|Disney|Hotstar Specials|Hotstar|Web series|web show|Bhuvan Bam|BB Ki Vines|thriller|drama|comedy","3785260","602439","18836","https://i.ytimg.com/vi/cVPI4ppiDSA/default.jpg","With good Karma on one’s side, can one man set out to become a master of his own destiny? Disney+ Hotstar’s upcoming fantasy-drama series, Hotstar Specials presents Taaza Khabar explores just this with the one of India’s most beloved content creator, Bhuvan Bam in the lead. Set in Mumbai, this one-of-a-kind uplifting series will take viewers on a riveting ride of a man stumbling upon a miracle and the ripples it creates in his humble life. The series is being directed by Himank Gaur who previously directed Dhindora and is produced by Rohit Raj under the banner of BB Ki Vines Productions. The show has been penned by powerful writer duo Hussain Dalal & Abbas Dalal and also stars Shriya Pilgaonkar, JD Chakravarthy, Deven Bhojani, Prathmesh Parab and Nitya Mathur in pivotal roles. Based on the life of a sanitation worker, the series light-heartedly depicts class-based poverty and the human desire to lead a better life. The Hotstar Specials series marks Bhuvan Bam’s first association with a streaming platform and will see him in an all-new fictional role.Instagram► https://www.instagram.com/bhuvan.bam22/           Facebook► https://www.facebook.com/BBkiVines/Twitter►https://twitter.com/Bhuvan_BamFollow @BB Ki Vines Productions  for BTS & more updates.#TaazaKhabarOnHotstar #BBKiVinesProductions #BhuvanBamABOUT: Bhuvan Bam is a comedian, singer-songwriter, actor and entrepreneur. He created the entire universe of BB Ki Vines, a content power house, to see more of his content follow him onCheckout Bhuvan Bam Originals: https://bit.ly/3BohxZKBuy my merchandise from www.youthiapa.com"
"ykj5PzvFA3c","Why I REJECTED ₹75 Crores Job Offer??","2022-06-10T11:06:08Z","UCiGyWN6DEbnj2alu7iapuKQ","Physics Wallah - Alakh Pandey","27","22.11.06","physicswallah|alakh Pandey 75 crores|physics wallah 75 crore offer|75 crores kyu reject kiya|alakh Pandey 75 crore|physics wallah motivational video|physics wallah motivation|alakh Pandey motivation|physics wallah sir","1366028","152718","1352","https://i.ytimg.com/vi/ykj5PzvFA3c/default.jpg",""
"ig6NiVr7TpE","Mere Humsafar Episode 23 | Presented by Sensodyne (English Subtitles) 9th June 2022 | ARY Digital","2022-06-09T16:00:14Z","UC4JCksJF76g_MdzPVBJoC3Q","ARY Digital HD","24","22.11.06","ary digital|ary digital drama|ary drama|pakistani drama|Mere Humsafar Episode 23 drama|watch new Episode Mere Humsafar Episode 23|Mere Humsafar Episode 23 New Episode|ary digital Mere Humsafar Episode 23|ary digital drama Mere Humsafar Episode 23|pakistani new drama Mere Humsafar Episode 23|ary digital drama Mere Humsafar Ep 23|ary digital drama Mere Humsafar|ary digital Pakistani Drama Mere Humsafar|Mere Humsafar Episode 23 9th June 2022|Farhan Saeed|Hania Aamir","13876185","293386","6669","https://i.ytimg.com/vi/ig6NiVr7TpE/default.jpg","For free HD live streaming download ARY Zap 👉🏽 http://l.ead.me/bb9zI1 or watch live at https://live.aryzap.com Mere Humsafar Episode 23 | Presented by Sensodyne | 9th June 2022 | ARY DigitalWatch All Episodes of #MereHumSafar Here : https://bit.ly/35j7UzOMere Humsafar The Poetic Tale Of Hala & Hamza.Mere Humsafar is the life story of Hala, born to a Pakistani father and foreign mother who leaves them after her birth.Written By: Saira RazaDirected By: Qasim Ali MureedCast:Farhan Saeed ,Hania Aamir,Waseem AbbasAly KhanSamina AhmedSaba HameedAamir QureshiTara MehmoodZoya NasirUmer Shehzad.Watch #MereHumsafar Every Thursday,at 8:00 pm, only on ARY Digital.#MereHumSafar #HaniaAmir #FarhanSaeed #WaseemAbbas #AlyKhan#SaminaAhmed #SabaHameed #AamirQureshiSubscribe: https://www.youtube.com/arydigitalasiaPakistani Drama Industry's biggest Platform, ARY Digital, is the Hub of exceptional and uninterrupted entertainment. You can watch quality dramas with relatable stories, Original Sound Tracks, Telefilms, and a lot more impressive content in HD. Subscribe to the YouTube channel of ARY Digital to be entertained by the content you always wanted to watch.#ARYDigital #entertainment #ARYNetwork #PakistaniDrama #HaniaAmirDrama"
"wCt7eDa_RBM","Rocking Rakesh Performance | Extra Jabardasth | 10th June 2022 | ETV Telugu","2022-06-10T21:30:07Z","UCnoqvTW4YZExfDeq7_Wmd-w","ETV Jabardasth","23","22.11.06","extra jabardasth|jabardasth|extra jabardasth 2020|etv extra jabardasth|extra jabardasth telugu|extra jabardasth 2028|extra jabardasth promo|etv jabardasth|extra jabardasth sudheer|sudigali sudheer|sudigali sudheer jabardasth|jabardasth sudheer|extra jabardasth sudigali sudheer|sudheer and rashmi","2861606","116160","3984","https://i.ytimg.com/vi/wCt7eDa_RBM/default.jpg","#extrajabardasth #telugucomedyshow #etvwin #RamPrasad #rashmi #immanuel #hyperaadi #anasuya #telugushow #roja #mano #bestofjabardasth #bestofextrajabardasth #jabardasthRocking Rakesh and his team come with a skit of Sudheer, Ramprasad and Sreenu's friendship and delight the viewers with their performance.To watch your ETV all channel’s programmes any where any time Download ETV Win App for both Android & IOS: https://f66tr.app.goo.gl/apps►Visit Website : http://etv.co.in► Like us on Facebook : https://www.facebook.com/etvwin► Follow us on Instagram : https://www.instagram.com/etvwin/► Follow us on Twitter : https://twitter.com/etvwin ► Visit Website : https://www.etvwin.com/► Pin us on Pinterest: https://in.pinterest.com/etv_win/ETV Telugu(Youtube) - http://bit.ly/2QR0yu9  ETV Jabardasth(Youtube) - http://bit.ly/35xdqtuETV Dhee(Youtube) - http://bit.ly/2Ok8zWFETV Plus India(Youtube) - http://bit.ly/2OlEAOgETV Abhiruchi(Youtube) - http://bit.ly/2OkEtTbETV Life(Youtube) - http://bit.ly/2OiKAY6ETV Telangana(Youtube) - http://bit.ly/33nRaAKETV Andhra Pradesh(Youtube) - http://bit.ly/2OKARZzETV Annadata(Youtube) - https://bit.ly/3BeZXXSETV Telugu Facebook - http://bit.ly/2L2GYYhETV Plus India Facebook - http://bit.ly/2DudC0tETV Abhiruchi Facebook - http://bit.ly/2OSrIhvETV Life Facebook - http://bit.ly/34tiqzkETV Telangana Facebook - http://bit.ly/37GkVQFETV Andhra Pradesh Facebook - http://bit.ly/2R0vs3kETV Annadata Facebook - https://bit.ly/3kGnkEb"
"Eu65eY3Fvgo","Kundali Bhagya - कुंडली भाग्य - Leap Promo - From 16th June, Mon to Fri, 9:30 PM - Promo - Zee TV","2022-06-11T05:30:05Z","UCppHT7SZKKvar4Oc9J4oljQ","Zee TV","24","22.11.06","Zee TV|ज़ी टीवी|हिन्दी चैनल|general entertainment channel|Hindi GEC TV channel|hindi tv serial|zeetv|hindi serial|zee tv show|entertainment|daily soaps|family|drama|comedy|horror|thriller|romance|romantic|hindi|free|download|mobile|story|episode|latest|scene|full episode|best scene|promo|video|youtube|tv|zee popular shows|zee5|ZEEL|Kundali Bhagya|कुंडली भाग्य|preeran|preeta|karan|special|leap promo","4080577","52206","2582","https://i.ytimg.com/vi/Eu65eY3Fvgo/default.jpg","Click Here To Watch Full Episodes: https://zee5.onelink.me/RlQq/d9bc3fb5Watch all Shows: https://zee5.onelink.me/RlQq/ytzee5sFree Subscription click here: https://bit.ly/SubscribetoZeetv Get notified about our Latest update by Clicking the Bell Icon 🔔Karan marries Preeta out of spite owing to a misunderstanding. Preeta tries to clear the air and wins him over whilst dealing with Sherlyn, Prithvi, and Mahira, a trio that becomes a thorn in her side.Paid Subscription ZEE5 click here: http://www.zee5.com/myaccount/subscription?plid=0-11-1503&utm_source=yt_zeetv&utm_medium=link_desc&utm_campaign=subscription_lpWatch tomorrow’s Premiere Episodes of ZEE TV serials today. Get the best of ZEE5 Originals, popular Alt Balaji shows, 1000+ superhit movies, favourite Zindagi shows, popular kids entertainment, Live TV channels and more.To Download Free ZEE5 Mobile app click the link below -Playstore: http://bit.ly/Zee5PlayStoreiTunes: http://bit.ly/Zee5ITunesConnect with Zee TV on Social MediaFacebook: http://bit.ly/ZeeTvFBInstagram: http://bit.ly/ZeeTvInstaTwitter: http://bit.ly/ZeeTVtwitterConnect with ZEE5 on Social MediaFacebook: http://bit.ly/Zee5FBInstagram: http://bit.ly/Zee5HindiInstaTwitter: http://bit.ly/Zee5twitter"
"ZleOrhZjqIw","2nd ODI | Highlights | West Indies Tour Of Pakistan | 10th June 2022","2022-06-10T21:20:32Z","UCOQNJjhXwvAScuELTT_i7cQ","SonyLIV","24","22.11.06","West Indies Tour Of Pakistan 2022|West Indies Tour Of Pakistan match|West Indies Tour Of Pakistan odi|West Indies Tour Of Pakistan match highlights|West Indies Tour Of Pakistan odi highlights|West Indies Tour Of Pakistan highlights|West Indies Tour Of Pakistan|Pakistan|West Indies|pakistan vs west indies 2022|pakistan vs west indies|Wesrt indies tour of pakistan|west indies tour of pakistan schedule|cricket|cricket highlights|cricket highlights 2022|pak vs wi","2034213","40320","961","https://i.ytimg.com/vi/ZleOrhZjqIw/default.jpg","Click here to subscribe to SonyLIV Channel: https://www.youtube.com/user/sonyliv Click here to watch all Highlights: http://bitly.ws/aFYkClick here to watch more: https://www.sonyliv.com/sports/cricket-west-indies-tour-of-pakistan-1700000920Click here to subscribe now: https://bit.ly/3Q78rHUPakistan elected to bat first and went on to score 275 runs thanks to Imam ul Haq and captain Babar Azam's vital knocks. West Indies were never in control during the chase as they kept on losing wickets and it was spin to win for the home side. West Indies perished quickly and Pakistan won by a massive margin of 120 runs. Mohammad Nawaz was named the player of the match for his four-wicket haul. Click here to subscribe: https://www.sonyliv.com/subscriptionFind Out: www.sonyliv.com or click on the below links to download the SonyLIV app:Android Play Store: https://play.google.com/store/apps/details?id=com.sonyliv App Store: https://apps.apple.com/in/app/sonyliv-live-cricket-tv-movies/id587794258"
"BRofDQkqSYo","Funny magic | Arjun talks","2022-06-10T08:55:02Z","UCKs86Ymu3EEiOvP3vS5w8fw","Arjun Talks Daily","22","22.11.06","[none]","658841","59795","100","https://i.ytimg.com/vi/BRofDQkqSYo/default.jpg","#shorts"
"4OgVvR7g1AA","హింసించే సవతి తల్లి || part-43 || wai for part-44 #shorts #youtube","2022-06-10T04:30:02Z","UCkLIGm__cmwW5Ix0XLgpE_g","Mini Star Entertainment","22","22.11.06","[none]","1109917","59022","75","https://i.ytimg.com/vi/4OgVvR7g1AA/default.jpg",""
"g7jHOlRWK1Y","If Only Rich People Can Afford Emotion Potions #funnyshorts #ytshorts #shorts","2022-06-10T06:39:45Z","UCxGzpNf5XOnSQOYC2nbMiyQ","THE BROWN SIBLINGS","24","22.11.06","If Only Rich People Can Afford Emotion Potions|A night before Exam|If You Can See Anyone's Future|you have to Charge yourself to survive|the Brown siblings POV|the Brown siblings charger|the Brown siblings superpower|the Brown siblings funny shorts|the Brown siblings shorts|the Brown siblings|trending shorts","2527712","279556","328","https://i.ytimg.com/vi/g7jHOlRWK1Y/default.jpg","If Only Rich People Can Afford Emotion Potions #funnyshorts #ytshorts #shortsMusic:https://youtu.be/uPUK0FnhZwwthanks for watching ❤️"
"-GY6vfEywpk","End Of Dream Boy in Himlands DAY 28","2022-06-11T05:15:00Z","UCLA7Q8kyGzvJW6hmkad8_qQ","DREAM BOY","20","22.11.06","minecraft|himland minecraft|himlands|himlands 2|himlands season 1|dream boy|dream boy minecraft|mysterious minecraft|himland|hogalalla|hogalalla secret|hogalala|hogalalaa|himlands new video|himlands season 4|herobrine|herobrine in himlands|wizard himlands|himlands day 28|dream boy himlands|dream boy killed|dream boy dead","935634","75504","8551","https://i.ytimg.com/vi/-GY6vfEywpk/default.jpg","End Of Dream Boy in Himlands DAY 28Himlands is a new series where me and my friends @YesSmartyPie @Ezio18rip  and @Mr FalanaG   Play TogetherDISCORD - https://discord.gg/J9VC5bAZccSUBSCRIBE NOW - https://www.youtube.com/c/DREAMBOYYTINSTAGRAM - https://www.instagram.com/dreamboy5656Twitter - https://twitter.com/DREAMBOY5656All songs by Kevin MacLeod (incompetech.com)Licensed under Creative Commons: By Attribution 4.0 Licensehttps://creativecommons.org/licenses/..."
"-Q13bm6pItE","Sanjay Raut on Rajya Sabha Election Results : मविआची १० मतं कुठे फुटली?| Devendra Fadnavis| Shivsena","2022-06-11T02:00:00Z","UCQ2W9GCHctD59vQpvLKVg3g","Mumbai Tak","25","22.11.06","Sanjay raut news today|sanjay raut press conference|Sanjay Raut on Rajya Sabha Election Results rajya sabha election 2022|rajya sabha election result|rajya sabha election result 2022|rajya sabha election|rajya sabha election result Maharashtra|rajya sabha election 2022 maharashtra|rajya sabha nivadnuk|rajya sabha elections Maharashtra|sanjay pawar|sanjay raut|anil bonde|praful patel|uddhav thackeray|shiv sena|bjp|imran pratapgarhi|sharad pawar|Kolhapur news","386397","2532","1777","https://i.ytimg.com/vi/-Q13bm6pItE/default.jpg","🔴लॉ़ग इन करा: https://www.mumbaitak.in/#RajyaSabha #SanjayRaut #UddhavThackeray #SanjayPawar राज्यसभा निवडणुकीत राऊतांचा विजय, पण सेनेच्या संजय पवारांची हार, संजय राऊत यांची पहिली प्रतिक्रिया---------डाऊनलोड करा Tak App. खालील लिंकवर करा क्लिक: https://newstak.app.link/fataakFollow us on :Website: https://www.mobiletak.in/mumbaitakGoogle News : https://news.google.com/publications/CAAqBwgKMLeLpAsw-pW8Aw?hl=mr&gl=IN&ceid=IN%3AmrFacebook: https://www.facebook.com/mumbaitakInstagram: https://www.instagram.com/mumbaitakTwitter: https://twitter.com/mumbai_takइंडिया टुडेच्या मुंबई तक या मराठी युट्यूब चॅनलवर आपलं स्वागत. इंडिया टुडे ग्रुपचे मॅगझिन, इंडिया टुडे टीव्ही आणि आज तक हे लोकप्रिय न्यूज चॅनल आपल्याला माहितीच आहे. त्यानंतर आता खास मराठी प्रेक्षकांसाठी आपण भारतीय प्रादेशिक भाषेतलं पहिलं मराठी चॅनल घेऊन आलोय. महाराष्ट्रासह राष्ट्रीय आणि आंतरराष्ट्रीयस्तरावरील महत्वाच्या बातम्या आणि घडामोडी आपल्याला अगदी सोप्या शब्दांत समजावण्याचा आमचा प्रयत्न असणार आहे. Namskar, Welcome to India Today group’s new Marathi YouTube channel – Mumbai Tak. Get all the latest important stories and updates from in and around Maharashtra in Marathi. Stay Tuned to Mumbai Tak for current affairs, politics, sports, business, entertainment, literature and many more in Marathi."
"h50IdNriTyQ","साड़ी पहन कर जेल से भागे कादर खान - अनुपम खेर - ज़बरदस्त डबल धमाल कॉमेडी - सदाशिव अमरापुरकर","2022-06-11T04:00:12Z","UCnofQ65yrqUslv1am59PWsw","Haste Raho","23","22.11.06","comedy|haste raho|kader khan comedy|kader khan hum hain kamaal ke|kader khan comedy hum hain kamaal ke|hum hain kamaal ke film|hum hain kamaal ke comedy|hum hain kamaal ke comedy movie|anupam kher kader khan comedy scene|hum hain kamaal ke movie ka comedy|कादर खान की ज़बरदस्त कॉमेडी|कादर खान अनुपम खेर कॉमेडी फिल्म|sadashiv amrapurkar comedy scenes|kader khan sadashiv amrapurkar comedy movie|कादर खान सदाशिव अमरापुरकर कॉमेडी सीन","3194435","17003","434","https://i.ytimg.com/vi/h50IdNriTyQ/default.jpg","साड़ी पहन कर जेल से भागे कादर खान - अनुपम खेर - ज़बरदस्त डबल धमाल कॉमेडी - सदाशिव अमरापुरकरFilm : Hum Hain Kamaal Ke #kaderkhancomedy #anupamkher #hasteraho Subscribe to Haste Raho now for super hit hindi comedy scenes - https://bit.ly/2Z4UcgS Chapters : 00:00 - 05:06 - Kader khan Anupam kher jail comedy 05:07 - 09:58 - Ladki ke roop mein bhaag nikle chor09:59 - 13:05 - Gaadi chalane ka license kisne diya13:06 - 16:18 - Naukrani ke saath ishq ladaaye"
"x3Jx9zqGnpo","Drink Water & Win Free Smartphone | पानी पीओ और जीतो स्मार्टफोन 😳","2022-06-10T13:26:09Z","UC2CBHC5hi5gwlL9gUUYakDw","The Experiment TV","28","22.11.06","the experiment tv|Alfaz sumra|the experiment tv challenge|the experiment tv mobile challenge|free smartphone|the experiment tv free smartphone|smart phone challenge|water drinking challenge|the experiment tv water drinking challenge","1228696","119611","3852","https://i.ytimg.com/vi/x3Jx9zqGnpo/default.jpg","Guys aaj hum water drinking challenge Karne wale hain.Instagram : https://www.instagram.com/thealfazsumra/Shop address: Umiya Mobile, Bus Stand Chowk, Opp. Vinod dining hall Near Gokul Cycle Store : Upleta, Rajkot"
