video_id,title,publishedAt,channelId,channelTitle,categoryId,trending_date,tags,view_count,likes,comment_count,thumbnail_link,description
"_CBj5591Bog","HE WAS CHEATING!! 😭🥲","2022-06-07T12:28:00Z","UCLymOPYwKKsSbyBLNzq8pdg","SjR Freestyle","17","22.11.06","funny football|football challenge|penalty challenge|penalty|penalty kick|soccer pranks|pranks|funny prank's|Malayalam football|Malayalam Short's|soccer challenge|YouTube short video's|football shorts|Malayalam prank's|funny malaylam|Short's malayalam|funny football malayalam|basith and sjr freestyle","513921","53604","88","https://i.ytimg.com/vi/_CBj5591Bog/default.jpg","#shorts #youtubeshorts #challenge"
"OFywZLXUceM","Dil Awaiz 2nd Last Episode 40 - Kinza Hashmi - Affan Waheed [Eng Sub] 9th June 2022 - HAR PAL GEO","2022-06-09T17:00:12Z","UCe9JSDmyqNgA_l2BzGHq1Ug","HAR PAL GEO","24","22.11.06","Har pal geo|geo dramas|latest pakistani drama|top pakistani dramas|best pakistani dramas|latest pakistani dramas|drama 2022|Kinza Hashmi|Affan Waheed|Seemi Raheel|Kashif Mehmood|Fazeela Qazi|Javeria Abbasi|Farhan Ali Agha|Raeed|Ayesha Gul|Yasra Rizvi|Janaan Hussain|Saife Hassan|Qudsia Ali|Raza Zaidi|Dil Awaiz 2nd Last Episode 40|Dil Awaiz Ost|Dil Awaiz 40|9th June 2022|2nd Last Episode 40 Dil Awaiz|Dil Awaiz","5357715","74063","1762","https://i.ytimg.com/vi/OFywZLXUceM/default.jpg","Thanks for watching Har Pal Geo. Please click here https://bit.ly/3rCBCYN to Subscribe and hit the bell icon to enjoy Top Pakistani Dramas and satisfy all your entertainment needs. Do you know Har Pal Geo is now available in the US? Share the News. Spread the word.Dil Awaiz 2nd Last Episode 40 - Kinza Hashmi - Affan Waheed [Eng Sub] 9th June 2022 - HAR PAL GEOThis is a story of a young girl named Dil Awaiz who despite living in her father's house is treated as an orphan and is deprived of love and care. Dil Awaiz’s father, Shahab Uddin is an influential and wealthy businessman who keeps his distance from his firstborn, Dil Awaiz due to her mother's past.Things take an unexpected turn when a handsome, young man Sikandar enters Dil Awaiz's life and once again she is expected to compromise and sacrifice herself in order to save her family’s honour and respect. Despite living like an outsider all her life will Dil Awaiz be able to make yet another sacrifice? Even after all the atrocities, will Dil Awaiz be able to gain due respect in the house?Cast :Kinza Hashmi - Dil AwaizAffan Waheed - Sikander Seemi Raheel - Aqa biKashif Mehmood - Shahab UddinFazeela Qazi - BushraJaveria Abbasi - Roshan AraFarhan Ali Agha - SubhanRaeed - KashanAyesha Gul - DurdanaSabeena Farooq - FariyaYasra Rizvi - TamannaJinaan Hussain - GeetiSaife Hassan - SarmadQudsia AliRaza Zaidi#DilAwaiz2ndLastEp40#HarPalGeo#Entertainment"
"iU5vbodePBY","KUCH TOH GADBAD HAI | Hindi Comedy Short Film | SIT","2022-06-09T09:06:10Z","UCqnW0v3DXxt0Svv0H64TVZQ","Shitty Ideas Trending","24","22.11.06","kuchh to gadbad hai|comedy short film|hindi comedy short film|comedy show|hindi comedy show|comedy show indian|best comedy show|new comedy show|comedy show video|indian comedy|indian comedy show|comedy serial|hindi comedy serial|comedy|comedy video|comedy hindi|husband wife comedy|comedy short films|comedy short films hindi|sit|shitty ideas trending|shitty ideas trending latest|sit videos|abhimanyu|baby|chhavi mittal|pracheen chauhan|pooja gor","391371","17470","740","https://i.ytimg.com/vi/iU5vbodePBY/default.jpg","A theft in the society causes ups and downs in a maid’s life. The resident blames the domestic help for stealing a diamond studded gold earring and now her reputation is at stake. Rohini and Rishi’s maid Baby cannot digest this and decides to investigate the matter. But Baby’s strange tactics invite Meera and Rohini’s suspicion and they decide to investigate her! Investigator being investigated causes much comedy to arise from the situation and we have a perfect recipe for entertainment! Watch this hindi comedy short film only on SIT (Shitty Ideas Trending) official YouTube channel.____________________________________Check out the new SIT MERCHANDISE: https://sit.themerchbay.com/Don’t forget to SUBSCRIBE to @Shitty Ideas Trending for a fun video every Thursday!Other channels: www.youtube.com/beingwomanwithchhavi                              https://www.youtube.com/besafebysit#Comedy #ComedyShortFilm #ComedyShow #IndianComedyABOUT SIT:Shitty Ideas Trending creates light-hearted, fun videos based on everyday situations. Husband wife comedy sketches, Web Series, relationship banter, couple humour and meaningful fictional short films. Whether you are glued to watching the cute and adorable husband Rishi with his wife Rohini, or the smart and suave Abhimanyu with his wife Meera, whether you love to watch the adorable yet eccentric maid Baby or are just addicted to little Jahaan’s smile, or maybe you like to get a dose of relationship tips from Abhimanyu or just want to avoid the mistakes that Rishi makes, SIT is the place for everybody who wishes to get a dose of entertainment when on the move. The videos are short and snackable and are for one and all. Ranging from THE BETTER HALF with Chhavi Mittal and Karan V Grover, PYAR KA PUNCH with Pracheen Chauhan and Pooja Gor, MAID IN HEAVEN with Shubhangi Litoria, or GRASS IS GREENER ON THE OTHER SIDE with a combination of Chhavi Mittal, Karan V Grover, Pracheen Chauhan, Pooja Gor, creator MOHIT HUSSEIN brings you a great mix of content.Credits:Created By: MOHIT HUSSEIN Produced By: WORKSHOP INC Directed By: MOHIT HUSSEIN Concept & Story: MOHIT HUSSEIN Written By: MOHIT HUSSEIN, AKHLAQUE KHAN Creative Director: CHHAVI MITTALCast: CHHAVI MITTAL, POOJA GOR, SHUBHANGI LITORIA, RIYA DEEPSISupporting Cast : FARZANA ANSARIHead of Production: EHTESHAM HUSSEINLine Producer: FRESHWATER FILMS AND TELEVISION DOP: KAMAL CHAURASIASocial Media Head: CHHAVI MITTALChief Editor: ASHISH JHASound Engineer: ANIL JENAAssistant Director: ASHISH ARYA, DHARMENDRA Camera Partner: PANASONIC LUMIX S1HAssociate Editor: SHIVAM NIKHRAProduction Manager: VIDIT KANOJIASocial Media Manager: PHANTOM WORDSMake Up: ASHOK GALPHADEProduction Boy: NAJBUL HUSSEIN, RAJENDRA YADAV, VINOD YADAVDressmen : VINAYLights : KHUSHI LIGHTSLight men : SUNIL KUMAR YADAV, ALOK KUMAR YADAV, RAVI PRAKASH, NIRBHAYArt : SHIV KUMAR, WASIM SHEIKH, KASHINATH GOGE, NISHAMANI MAHARANACaterers : SHARDA CATERERS Additional Equipment: VIDEO PLUSCamera Attendant: MUKESH PANDEY, MIHIR MALLICKLocation: R.D STUDIO_______________________________________Follow SIT:Facebook: https://www.facebook.com/SITofficial/Twitter: https://twitter.com/TeamShittyIdeasInstagram: https://www.instagram.com/shittyideastrending/FOR BUSINESS INQUIRIES: info@shittyideastrending.comVisit us on www.shittyideastrending.com____________________________________________________CHHAVI MITTAL’s: Instagram: https://bit.ly/3tQ2XF7CHHAVI MITTAL’s Facebook: https://bit.ly/3hwOPy2CHHAVI MITTAL’s Twitter: https://bit.ly/2RNd1BE__________________________________________________MOHIT HUSSSEIN:https://www.facebook.com/mohithusseinsithttps://www.instagram.com/mohithussein/_______________________________________________________DISCLAIMER:THIS VIDEO WAS CREATED WITHOUT ANY CONTACT WITH ANYBODY OUTSIDE THE HOUSE. THIS VIDEO IS CREATED PURELY FOR ENTERTAINMENT PURPOSES ONLY. THE CHARACTERS, DIALOGUES, SITUATIONS & OTHER THINGS ARE PURELY FICTIONAL. ANY RESEMBLANCE TO A PERSON LIVING OR DEAD IS PURELY COINCIDENTAL. THIS CHANNEL DOES NOT CLAIM TO BE FACTUAL OR POLITICALLY CORRECT AT ALL TIMES. THE CONTENT IS FICTIONAL AND MEANT ONLY FOR ENTERTAINMENT. ANY OFFENCE CAUSED IS SUBJECTIVE AND DEEPLY REGRETTED."
"xzspXLAozR4","തിളപ്പിച്ച പച്ചക്കറി എടുക്കാൻ എളുപ്പവിദ്യ👌🏻 |Kitchen Tips 2 - Easy Tongs Making","2022-06-06T08:30:12Z","UC0RBaZiyHXUwB_MyBQdrnNA","Our Smart Channel","26","22.11.06","Kitchen Tip 2|Easy Tong Making|#shorts|our smart channel","1291065","53839","143","https://i.ytimg.com/vi/xzspXLAozR4/default.jpg","Kitchen Tips 2 - Easy Tong Makingതിളപ്പിച്ച പച്ചക്കറി എടുക്കാൻ എളുപ്പവിദ്യ👌🏻 |Kitchen Tips 2 - Easy Tongs Making#oursmartchannel"
"oW2NHo1qnSQ","Divya, Rank-438, UPSC 2021 | Hindi Medium | Mock Interview | Drishti IAS","2022-06-06T14:30:14Z","UCzLqOSZPtUKrmSEnlH4LAvw","Drishti IAS","27","22.11.06","upsc mock interview 2021|Divya hindi medium topper|hindi meduim ias topper|Hindi Medium upsc topper|upsc mock interview 2021rishti ias mock interview|divya ias interview|divya upsc|upsc topper mock 2021|upsc topper 2022|upsc topper interview|divya hindi medium topper 2021|ias hindi medium topper|divya mishra upsc topper|hindi medium topper|ias topper interview in hindi|Divya UPSC Topper|first attempt in UPSC|Mock Interview Teaser|upsc result 2022","2144289","76018","3124","https://i.ytimg.com/vi/oW2NHo1qnSQ/default.jpg","Ms Divya has got 438th rank in UPSC-2021. We extend our heartiest congratulations to Divya on this great achievement and are gratified to have been a part of her journey to success.Presenting to you here, her mock interview video to provide you with an opportunity to imagine yourself in a similar interview setting, going through the same type of questions.Mock interviews help not only in familiarizing with interviews in general but also help identify areas that a candidate needs to work upon. Even though one can imagine oneself in an interview setting, it is strongly advised that you watch these videos and learn from the experiences of other people. The interviews being uploaded here are real interviews and not scripted. Hope this video helps you in your preparation and we look forward to your feedback in the comments section – don’t hesitate to ask!दिव्या ने 2021 की यूपीएससी परीक्षा में 438वीं रैंक हासिल की है। इन्होंने दृष्टि संस्थान में जो मॉक इंटरव्यू दिया था उसे दृष्टि आई.ए.एस चैनल पर अपलोड किया गया है ताकि यूपीएससी के सभी अभ्यर्थियों को लाभ मिल सके। इस वीडियो के जरिये अभ्यर्थी इंटरव्यू की प्रक्रिया को समझ पाएंगे और अपनी तैयारी को सही दिशा में आगे बढ़ा कर सफलता की मजबूत दावेदारी पेश कर सकेंगे। मॉक इंटरव्यू प्लेलिस्ट में हम समय-समय पर कई सफल विद्यार्थियों के वीडियोज़ अपलोड करेंगे।दृष्टि परिवार की ओर से दिव्या को एक सफल और सार्थक कॅरियर के लिये असीम शुभकामनाएँ।=̵=̵=̵=̵=̵=̵=̵=̵=̵=̵=̵=̵=̵=̵=̵=̵=̵=̵=̵=̵=̵=̵=̵=̵=̵=̵=̵=̵=̵=̵=̵=̵=̵=̵=̵=̵=̵=̵=̵=̵=̵=̵=̵=̵=̵=̵=̵=̵=̵=̵=̵=̵=̵=̵=̵𝐃𝐨𝐰𝐧𝐥𝐨𝐚𝐝 𝐃𝐫𝐢𝐬𝐡𝐭𝐢 𝐋𝐞𝐚𝐫𝐧𝐢𝐧𝐠 𝐀𝐩𝐩 𝐧𝐨𝐰 :https://drishti.link/app_download=̵=̵=̵=̵=̵=̵=̵=̵=̵=̵=̵=̵=̵=̵=̵=̵=̵=̵=̵=̵=̵=̵=̵=̵=̵=̵=̵=̵=̵=̵=̵=̵=̵=̵=̵=̵=̵=̵=̵=̵=̵=̵=̵=̵𝐆𝐒 𝐅𝐨𝐮𝐧𝐝𝐚𝐭𝐢𝐨𝐧 𝐂𝐨𝐮𝐫𝐬𝐞 (𝐏𝐫𝐞𝐥𝐢𝐦𝐬 + 𝐌𝐚𝐢𝐧𝐬) 𝐎𝐧𝐥𝐢𝐧𝐞/𝐏𝐞𝐧𝐝𝐫𝐢𝐯𝐞 𝐌𝐨𝐝𝐞:👉 For 𝐟𝐞𝐞, 𝐀𝐝𝐦𝐢𝐬𝐬𝐢𝐨𝐧 and 𝐨𝐭𝐡𝐞𝐫 𝐝𝐞𝐭𝐚𝐢𝐥𝐬 of this course visit this link: https://drishti.link/Online-Course or download the 𝐃𝐫𝐢𝐬𝐡𝐭𝐢 𝐋𝐞𝐚𝐫𝐧𝐢𝐧𝐠 𝐀𝐩𝐩.👉 To know the 𝐝𝐞𝐭𝐚𝐢𝐥𝐬 𝐨𝐫 𝐭𝐨 𝐫𝐞𝐠𝐢𝐬𝐭𝐞𝐫 through our website click on this link: https://drishti.link/foundation-course👉 𝐓𝐨 𝐠𝐞𝐭 𝐭𝐡𝐞 𝐝𝐞𝐭𝐚𝐢𝐥𝐬 about this 𝐖𝐡𝐚𝐭𝐬𝐀𝐩𝐩 𝐨𝐫 𝐒𝐌𝐒 𝐆𝐒 on this number: 𝟗𝟑𝟏𝟏𝟒𝟎𝟔𝟒𝟒𝟐=̵=̵=̵=̵=̵=̵=̵=̵=̵=̵=̵=̵=̵=̵=̵=̵=̵=̵=̵=̵=̵=̵=̵=̵=̵=̵=̵=̵=̵=̵=̵=̵=̵=̵=̵=̵=̵=̵=̵=̵=̵=̵=̵=̵𝐏𝐞𝐧𝐝𝐫𝐢𝐯𝐞 𝐂𝐨𝐮𝐫𝐬𝐞𝐬 (𝐇𝐢𝐧𝐝𝐢 𝐋𝐢𝐭𝐞𝐫𝐚𝐭𝐮𝐫𝐞 𝐚𝐧𝐝 𝐨𝐭𝐡𝐞𝐫𝐬):👉 For 𝐟𝐞𝐞, 𝐀𝐝𝐦𝐢𝐬𝐬𝐢𝐨𝐧 and 𝐨𝐭𝐡𝐞𝐫 𝐝𝐞𝐭𝐚𝐢𝐥𝐬 of 𝐏𝐞𝐧𝐝𝐫𝐢𝐯𝐞 𝐂𝐨𝐮𝐫𝐬𝐞 (Hindi Literature and other courses): http://bit.ly/2vGNj72👉 𝐃𝐞𝐦𝐨 𝐜𝐥𝐚𝐬𝐬 playlist- http://bit.ly/2qyY1cW=̵=̵=̵=̵=̵=̵=̵=̵=̵=̵=̵=̵=̵=̵=̵=̵=̵=̵=̵=̵=̵=̵=̵=̵=̵=̵=̵=̵=̵=̵=̵=̵=̵=̵=̵=̵=̵=̵=̵=̵=̵=̵=̵=̵👉 𝐏𝐫𝐞𝐥𝐢𝐦𝐬 𝐏𝐫𝐚𝐜𝐭𝐢𝐜𝐞 𝐒𝐞𝐫𝐢𝐞𝐬 की पुस्तकें (संपूर्ण सेट एक साथ) खरीदने के लिये निम्नलिखित लिंक्स का प्रयोग करें:𝐃𝐫𝐢𝐬𝐡𝐭𝐢 𝐖𝐞𝐛𝐬𝐢𝐭𝐞: https://bit.ly/30LLMbt𝐀𝐦𝐚𝐳𝐨𝐧: https://amzn.to/2VqvH8S𝐅𝐥𝐢𝐩𝐤𝐚𝐫𝐭: https://bit.ly/3odDQtv=̵=̵=̵=̵=̵=̵=̵=̵=̵=̵=̵=̵=̵=̵=̵=̵=̵=̵=̵=̵=̵=̵=̵=̵=̵=̵=̵=̵=̵=̵=̵=̵=̵=̵=̵=̵=̵=̵=̵=̵=̵=̵=̵=̵👉 𝐐𝐮𝐢𝐜𝐤 𝐁𝐨𝐨𝐤 𝐒𝐞𝐫𝐢𝐞𝐬 की पुस्तकें (संपूर्ण सेट एक साथ) खरीदने के लिये निम्नलिखित लिंक्स का प्रयोग करें:𝐃𝐫𝐢𝐬𝐡𝐭𝐢 𝐖𝐞𝐛𝐬𝐢𝐭𝐞: https://bit.ly/36u5qwD𝐀𝐦𝐚𝐳𝐨𝐧: https://amzn.to/3lvMjGX𝐅𝐥𝐢𝐩𝐤𝐚𝐫𝐭: https://bit.ly/37lO3NS=̵=̵=̵=̵=̵=̵=̵=̵=̵=̵=̵=̵=̵=̵=̵=̵=̵=̵=̵=̵=̵=̵=̵=̵=̵=̵=̵=̵=̵=̵=̵=̵=̵=̵=̵=̵=̵=̵=̵=̵=̵=̵=̵=̵👉 𝐌𝐚𝐢𝐧𝐬 𝐂𝐚𝐩𝐬𝐮𝐥𝐞 𝐒𝐞𝐫𝐢𝐞𝐬 की पुस्तकें खरीदने के लिये निम्नलिखित लिंक्स का प्रयोग करें:𝐃𝐫𝐢𝐬𝐡𝐭𝐢 𝐖𝐞𝐛𝐬𝐢𝐭𝐞: https://bit.ly/2L0efWP𝐀𝐦𝐚𝐳𝐨𝐧: https://amzn.to/2HYgpF9=̵=̵=̵=̵=̵=̵=̵=̵=̵=̵=̵=̵=̵=̵=̵=̵=̵=̵=̵=̵=̵=̵=̵=̵=̵=̵=̵=̵=̵=̵=̵=̵=̵=̵=̵=̵=̵=̵=̵=̵=̵=̵=̵=̵👉 𝐑𝐀𝐒 𝐒𝐞𝐫𝐢𝐞𝐬 की पुस्तकें खरीदने के लिये निम्नलिखित लिंक्स का प्रयोग करें:𝐃𝐫𝐢𝐬𝐡𝐭𝐢 𝐖𝐞𝐛𝐬𝐢𝐭𝐞: http://bit.ly/35hpX6T𝐅𝐥𝐢𝐩𝐤𝐚𝐫𝐭: https://bit.ly/380zfWu𝐀𝐦𝐚𝐳𝐨𝐧: http://amzn.to/3bbxw2L=̵=̵=̵=̵=̵=̵=̵=̵=̵=̵=̵=̵=̵=̵=̵=̵=̵=̵=̵=̵=̵=̵=̵=̵=̵=̵=̵=̵=̵=̵=̵=̵=̵=̵=̵=̵=̵=̵=̵=̵=̵=̵=̵=̵𝐅𝐨𝐫 𝐕𝐢𝐝𝐞𝐨 𝐮𝐩𝐝𝐚𝐭𝐞𝐬 𝐟𝐨𝐥𝐥𝐨𝐰 𝐮𝐬 𝐨𝐧 :👉 Facebook : https://www.facebook.com/drishtithevisionfoundation👉 Twitter : https://twitter.com/drishtiias👉 Instagram : https://www.instagram.com/drishtiias_hindi/👉 Telegram : https://t.me/drishtiiashindiofficial👉 LinkedIn : https://www.linkedin.com/company/3557219/admin/=̵=̵=̵=̵=̵=̵=̵=̵=̵=̵=̵=̵=̵=̵=̵=̵=̵=̵=̵=̵=̵=̵=̵=̵=̵=̵=̵=̵=̵=̵=̵=̵=̵=̵=̵=̵=̵=̵=̵=̵=̵=̵=̵=̵👉 𝐎𝐮𝐫 𝐑𝐞𝐠𝐮𝐥𝐚𝐫 𝐘𝐨𝐮𝐓𝐮𝐛𝐞 𝐏𝐫𝐨𝐠𝐫𝐚𝐦𝐬' 𝐏𝐥𝐚𝐲𝐥𝐢𝐬𝐭𝐬:1. Videos by Dr. Vikas Divyakriti: http://bit.ly/2TF34TZ2. Concept Talk- By Dr Vikas Divyakirti: https://goo.gl/xNVMrm3. Current News Bulletin: https://goo.gl/TRiKpS=̵=̵=̵=̵=̵=̵=̵=̵=̵=̵=̵=̵=̵=̵=̵=̵=̵=̵=̵=̵=̵=̵=̵=̵=̵=̵=̵=̵=̵=̵=̵=̵=̵=̵=̵=̵=̵=̵=̵=̵=̵=̵=̵=̵👉 डेली न्यूज़ और एडिटोरियल: https://drishti.link/daily-news-editorials👉 डेली करेंट अफेयर्स टेस्ट: https://goo.gl/PFwJ21👉 प्रैक्टिस टेस्ट: https://goo.gl/nKY3fu👉 लोकसभा और राज्यसभा टीवी डिबेट: https://goo.gl/hmtXgv👉 मैप के माध्यम से अध्ययन: https://goo.gl/4TsnpC👉 डेली मेंस आंसर राइटिंग प्रैक्टिस: https://goo.gl/3i5NXD#DrishtiIAS #MockInterview #upsctopper2021"
"UPRlFoBJpDo","About Santhwanam Serial❤️","2022-06-08T04:00:19Z","UCvbw_79QDxAc0CCHwXFdUBA","Manjusha Martin","24","22.11.06","[none]","543283","28889","1604","https://i.ytimg.com/vi/UPRlFoBJpDo/default.jpg",""
"aJIvS8sJrqo","Joining GOLD Family In GTA 5!","2022-06-07T07:07:42Z","UCvo_3BJWd8DRD0c5cnYmBGw","TheRealDude ","20","22.11.06","gta|gta 5|funny gta 5 gameplay|grand theft auto|grand theft auto 5|funny gta gameplay|funny gta 5 online|grand theft auto v|Gta 5 mods|gta 5 mod|checkpoint|officialcheckpoint|gta 5 without breaking laws|gta $1|gta but everything|gta but everything turns to gold|gta but everything i touch turns to gold|gta but gold|gta but golden|turns to gold|gta gold|gta 5 gold|joining gold family|gta gold plane|adopted by gold family|everything is gold","881520","16094","193","https://i.ytimg.com/vi/aJIvS8sJrqo/default.jpg","NEW CHANNEL: TheMegaDudehttps://www.youtube.com/channel/UCXnx...Download our Maps by clicking on the link below:https://thedudemaps.gumroad.com/l/pxwogJoining GOLD Family In GTA 5!Don't forget to leave a Like, Comment and Favorite, helps out a lot!!FOLLOW, LIKE AND JOIN ME ON:Discord : https://discord.gg/NFHrCrmyDR​Instagram - https://www.instagram.com/thelouddude/Facebook - https://www.facebook.com/DudeGamerz"
"6EwNlkdWk_Q","Real Struggle of Gyan Bhai🥺💔Old Home Tour *Must Watch* !!","2022-06-08T07:50:00Z","UCgsWayzDGwj9CclwicO_R3w","UnGraduate Gamer","22","22.11.06","Gyan Gaming|UNGRADUATE Gamer|uG ayush|Total Gaming|Desi gamers|Ajjubhai|Raistar|Tonde Gamer|Sooneeta|TSG|esports|free diamonds|Kolkata vlog|ug Ayush in Kolkata","720967","104868","1972","https://i.ytimg.com/vi/6EwNlkdWk_Q/default.jpg","🔊So , Hi Guys I'm Ayush and Welcome to our channel UnGraduate Gamer💓👋!!Don't forget to Subscribe our Channel😊. !!Join my channel to get access to perks:https://www.youtube.com/channel/UCgsWayzDGwj9CclwicO_R3w/join🔮Follow me on🔮💌Twitter💌 https://twitter.com/UngraduateG?s=09💌Instagram💌 https://www.instagram.com/ungraduate_ayush/?hl=en********************************************************🕹️Discord Server🕹️https://discord.gg/zkc3wyAGS4👉Currently I'm playing Free fire Battleground🔮My ingame UID & IGN🔮👉UID :- 256205699👉IGN :- HH-UG_Ayush👉If  you got any problem with copyright in this video , you can contact me via mail ankitdubey6662@gmail.com👉Thanks for reading my description😊👉Hope you Guys enjoyed this video❤️👉Don't forget to subscribe my channel😘💓Bye Have a great day ahead💓#hometour #gyangaming #gyan #kolkata #Vlog #shaktimaan#tournament #top1 #grandmaster #glitch #freefire #UnGraduateGamer#India#TotalGaming#Ajjubhai#amitbhai #desigamer #ujjwalgamer #trending #server @UnGraduate Gamer video@UnGraduate Gamer live@lokesh gamer video@lokesh gamer live@twosidegamer video@two side gamers live@two side gamers vlogs@two side gamers challenge video@carryislive@cerol ao vivo @NOBRU live@NOBRU ao vivo@gyansujan Live@Raistar Live@raistar Video@Total Gaming Video@Total Gaming live@ajjubhai live@ajjubhai video@amit bhai live@Desi Gamers live@Desi Gamers video@amit bhai video@gyansujan video@as gaming video@as gaming live@techno gamerz live@techno gamerz video@Ujjwal video@Ujjwal live@Live Insaan@Badge 99 video@Badge 99  liveFree Fire Bunny Mp40!Free Fire Tournament Free Fire Gameplay Free Fire GrandMaster PlayerGarena freefire Max India 🇮🇳 Freefire Max Two side Gamers Freefire Max TSG freefire Max Freefire Max New Updates New Maps In Freefire max New Lobby In Freefire MaxNew Characters in Freefire Max New High Graphics in Freefire Maxtwo side Gamers New Video free fire New Videogta 5playstation 4ps2gameboyps2 gamesconnect 4top up free firespider man miles morales ps4free firefree fire gamefree fire diamondtop up free firefree fire free diamondfree fire free firegame free firediamond free firefree fire diamond top upgarena free fire gameff garenafree fire garenadouble diamond top upgarena fffree diamonds in free fireff top upfree diamond free firefree fire 2021garena free fire top upfree fire diamond appfree diamonds for free firefree fire free diamond appfree fire officialfree fire diamond freefree fire free fire free firefree fire ki videotop up diamond fffree fire 2020free fire 20 diamond top upfree fire game videogarena free fire top up diamonds freefree fire shopgarena gamesff diamondgarena free fire top up diamondsfree diamond appdiamond top upfree fire game free fire gamefree fire double diamond top uptop up diamond free firefree fire india officialff free diamondfree fire playfree fire official websiteshop garena free firewww free firefree fire websiteplay free firefree fire newfree fire video gameff free firedouble diamond top up fffree fire game playpubg free firefree fire pubgfree fire freegarena free fire official websiteget free diamonds in free firefree fire diamond shopgarena free fire diamondnew free firefree fire onff diamond top upfree free firegarena free fire officialfree fire mobilefree fire video free fire videofree fire free top upfree fire free fire free fire free firedouble top up free firegarena officialtop up in free firegarena free fire videofree fire top up appfree fire meinfree fire storefree fire topfree fire 25 diamonds top upapp free firefire fire gamein free firefree fire free fire gamefree fire free diamond website newfree diamond top updiamond top up free firefree fire free diamond top upfree fire gamingfree free fire diamondfir fire gamefree fire ffdiamond shop free fireff officialfree diamond ffgame free fire gamefree diamonds in free fire 2021free top up in free fireFree Fire Top Country1.Garena Free Fire Indonesia Live2.Garena Free Fire Brazil Live3.Garena Free Fire India Live4.Garena Free Fire Singapore Live5.Garena Free Fire Thailand LiveFree fireGarena free fire Free fire IndiaBuying all rare items in subscriber accountRichest Player Of Free FireRichest Player Of IndiaDj Alok giveaway India's Richest Player collection versus1lakh rupees collection versus challengeGiving 1lakh rupees to friend challengeBest collection versus free fire@FreeFireLive@dj Alok Giveaway @Garena Free Fire Live @Free Fire Factory King @Get Free Diamonds @AWM King  @Richest Player @Fastest Player @New Factory King @AWM King 25 Kills@Solo Vs Squad King@Clash Squad King🔊Copyright Disclaimer under section 107 of the copyright act 1976, allowance is made for Fair use for purposes such as criticism, parody, comment, news reporting, teaching, scholarship and research."
"MjGMeMrH73I","M2 MacBook Air Impressions: Midnight Madness!","2022-06-08T20:58:06Z","UCBJycsmduvYEL83R_U4JriQ","Marques Brownlee","28","22.11.06","[none]","3319125","119061","6146","https://i.ytimg.com/vi/MjGMeMrH73I/default.jpg","Hands-on with the new MacBook Air with M2 chip!My 2022 WWDC Reactions/Recap: https://youtu.be/4U2ZxO7b8iMMKBHD Merch: http://shop.MKBHD.comTech I'm using right now: https://www.amazon.com/shop/MKBHDIntro Track: http://youtube.com/20sylPlaylist of MKBHD Intro music: https://goo.gl/B3AWV5~http://twitter.com/MKBHDhttp://instagram.com/MKBHDhttp://facebook.com/MKBHD"
"icjLroVahD0","Ammuchi 2 Official Trailer | an aha Original | Tamil Web Series #Nakkalites #PaatiVeetlaPanchayathu","2022-06-08T12:41:31Z","UCiPmhfdCL06cSVTXKabF0Zg","Nakkalites","23","22.11.06","nakkalites|alumbunaties nakkalites|nakkalites alumbunaties|#nakkalites|nakkalites in tamil|nakkalites alaparaigal|nakkalites new episode|nakkalites channel|nakkalites video|nakkalities|nakkalites tamil|nakkalites latest|nakalities|nakklites|nakkalites nakkalites|nakalaties|nakkalaites|naklaties|ammuchi 02|aha tamil|ammuchi season 2|ammuchi season 2 trailer|ammuchi nakkalites season 2|ammuchi official trailer|ammuchi trailer season 02|aha original series","379573","35296","1908","https://i.ytimg.com/vi/icjLroVahD0/default.jpg","We bring you the much-awaited aha original Ammuchi 2 trailer. So get ready to experience new love, rage, drama, and comedy - all in one!Subscribe to our channel, Nakkalites, and enjoy a glimpse of our latest series.#nakkalites #ammuchi2 #ahatamil ___________________________________________You love us? : Become a super fan to watch exclusive web-series Back to school S2 - Exclusive : on September 9 : https://www.youtube.com/channel/UCiPmhfdCL06cSVTXKabF0Zg/joinCreative HeadRajeshwar___________________________________________Follow Us Onhttps://www.instagram.com/nakkalites/https://twitter.com/Nakkaliteshttps://www.facebook.com/Nakkalites___________________________________________In Association with DIVO - Digital PartnerWebsite   - http://web.divo.in/Instagram - https://www.instagram.com/divomovies/Facebook  - http://www.facebook.com/divomoviesTwitter   - https://twitter.com/divomovies"
