video_id,title,publishedAt,channelId,channelTitle,categoryId,trending_date,tags,view_count,likes,comment_count,thumbnail_link,description
"3izlvPj-b3A","சிதைந்து கிடக்கும் Somalia | Day 2  | Tamil Trekker","2022-05-17T13:39:58Z","UCWKAAgM5L7bExQJkPZIbiaw","Tamil Trekker","22","22.18.05","mogadishu|mogadishu somalia|mogadishu travel vlog|somalia|somalia tarvel vlog|somalia tamil travel vlog|tamil trekker somalia|somalia tamil trekker|mogadishu vlog|somalia vlog|mogadishu now|mogadishu beach|tamil trekker|tamil trekker travel|tamil trekker youtube channel|tamil trekker channel|tamil trekker bhuvani|bhuvani tamil trekker|tamil travel vlogs|travel vlogger|tamil trekker latest video|tamil tracker|travel vlog in tamil|tamil trekker video","327736","20913","988","https://i.ytimg.com/vi/3izlvPj-b3A/default.jpg","Hey everyone! Welcome to Tamil Trekker's latest travel vlog! The particular video is about my visit to Mogadishu, the capital of Somalia.What does it feel like to be in Mogadishu? Is it possible to tour a scary place and still have a memorable travel experience? Watch the latest adventure travel vlog to know more.#Mogadishu #Somalia #TamilTrekker********************Haadi travels : https://www.youtube.com/c/HaadiTravelsVishnu Channek https://www.youtube.com/c/WanderingManiac********************Please Subscribe Us & Share the Videos & Let others get informed about this channel 👉 http://bit.ly/TamilTrekker​********************Checkout Our Existing Tamil Travel Videos Playlist:Uzbekistan - https://bit.ly/3lFHHBJDubai - https://bit.ly/3xpe6i8Thailand Vlog: http://bit.ly/ThailandTravelVlogMalaysia Vlog: http://bit.ly/MalaysiaTravelVlogsHitchhiking Vlog: hhttp://bit.ly/HitchhikingTravelVlogPakistan Vlog: http://bit.ly/PakistanTravelVlogTamil Travel Vlog: http://bit.ly/TamilTravelVlogManali Vlog: http://bit.ly/ManaliTravelVlogKerala Vlog: http://bit.ly/KeralaTravelVlogDarjeeling Vlog: http://bit.ly/DarjeelingTravelVlogMeghalaya Vlog: http://bit.ly/MeghalayaTravelVlogNorth East Vlog: http://bit.ly/NorthEastTravelVlogDelhi Vlog: http://bit.ly/DelhiTravelVlogKodaikanal Vlog: http://bit.ly/KodaikanalTravelVlogTentCampingVlog: http://bit.ly/2PnWiSaTravel Tips: http://bit.ly/2JoNyaOBudget Tour Plan: http://bit.ly/2pRrej0​********************நான் புவனி தரன், பேக் பேக்கர், ஹிட்சிகர், வோல்கர் & ட்ரெக்கர், உலகம் முழுவதும் பயணம் செய்து எனது அனுபவங்களை அனைவருடனும் பகிர்ந்து கொள்கிறேன்.புதிய இடங்களைப் பார்ப்பது, வெவ்வேறு கலாச்சாரத்தை அனுபவிப்பது, மக்களைப் பற்றி அறிந்து கொள்வது, இந்த அழகான உலகத்தை தமிழ் ட்ரெக்கர் வழியாக உங்களுக்குக் காட்ட முயற்சிப்பேன்.எனது இந்த பயணத்தில் அனைவரையும் வெளியே செல்லவும், ஆராயவும், அவர்கள் சந்திக்கும் ஒவ்வொரு சூழ்நிலையையும் சிறப்பாகப் பயன்படுத்தவும் ஊக்குவிப்பதாகும்.I'm Bhuvani Dharan, Solo travel enthusiast, Backpacker, hitchhiker, vlogger & trekker who travels the world and shares my experiences with everyone.My videos consist of my spontaneous everyday life as each day is a new adventure.Love to see new places, experience different culture, learn about people, taste different food and more. I will try to show you this beautiful world via Tamil Trekker.With an emphasis on traveling these vlogs are meant to encourage everyone to go out, explore & make the most out of every situation they come across.​********************To check out our travel & backpacking budget gears:  https://www.amazon.in/shop/tamiltrekkerFollow us on Social Media:FB - ttps://www.facebook.com/tamiltrekkerYT/Instagrm - https://www.instagram.com/tamiltrekker/Website - http://www.tamiltrekker.com/Patreon: https://www.patreon.com/tamiltrekkerFor Business enquiry, Sponsors & paid collaborations contact: info@tamiltrekker.com​********************In Association with DIVO - Digital PartnerWebsite   - http://web.divo.in/Instagram - https://www.instagram.com/divomovies/Facebook  - http://www.facebook.com/divomoviesTwitter   - https://twitter.com/divomovies​********************"
"ajkkpJeFpF8","SWIMMING POOL CHALLENGE || THE SHIVAM","2022-05-17T13:51:31Z","UCYjJCUo7Z4l0-fF875s-eEQ","The Shivam","24","22.18.05","swimmingpoolchallenge|swimming|swimmingpool|swimmingpoolshivam|theshivamswimmingpool|theshivam|theshivamnewvideo|newvideotheshivam|comedyvideoshivam|comedy|funnyvideo|middleclassfamily|viralvideo|trendingvideo|youtube|youtubeindia|sociopool|shivam|comedyvideo|2022newvideo|theshivamvideo|shivamvideo|shivamyadav|theshivamfunnyvideo|theshivamyoutube|trending|viral|trending1|newvideoshivam|newcontent|shivamyoutubevideo|theshivamcomedyvideo|shivamkivideo|poolparty|swimmingpoolparty|mastiinpool","333535","6448","281","https://i.ytimg.com/vi/ajkkpJeFpF8/default.jpg","Heard about Rummyculture?Use my referral code: SHIVAM, and enter into the world of awesomeness and also get a chance to meet me.What are you waiting for? Start playing now.https://bit.ly/3LquKF4Managed by-:Sociopool India Private Limitedhttps://www.sociopoolindia.com/ …JAI..BABA..KI… you for watching this video.keep supporting usLove You All 😊❤My Instagram link : https://instagram.com/my.shivam?igshi​​​...please share this video with your family and friends.Cast The Shivam : https://instagram.com/my.shivam?utm_m...Shivam DikroLokesh BhardwajShaitan RahulThe GaganTejasvi BachaniPyari VarshaChidi ManRohit Rawat And Team..D.O.P : KapilEdit : The ShivamScript : Khud hi karte hai bhyii Thumbnail by : Raj SharmaKeep Suppourting Us..❤️"
"EhcgLcU3QRE","ഒരു 50 ഇഞ്ച് TV അപാരത❗ |Foodie Sha|","2022-05-15T08:53:41Z","UCVr88XAkEc58RS1F2aoljGQ","Foodie Sha","22","22.18.05","Foodie Sha|food blog malayalam|food vlog malayalam|food review malayalam|food eating malayalam|Malabar food|Malappuram food|Food recipes|#foodiesha|#foodblog|#food|#foodblogmalayalam|#malayalam|#foodvlogmalayalam|#foodrecipe|##malappuram|#Malappuramfood|#malabarfood|#foodeatingmalayalam|#youtube|#youtubeshorts|#youtubetrending|#youtuber|#youtubechannel|#explorepage|#foodlover|#foodblogger|#healthyfood|#indianfood|#homecooking","898864","66520","201","https://i.ytimg.com/vi/EhcgLcU3QRE/default.jpg","#vlog #tv #television #inaguration #offer #inguraloffer #myg #kottakkal #malappuram #njanpettu@FoodieSha #FoodieSha #short #youtubeshorts"
"dIg2fN0ptFU","I BOUGHT A VACCUM CLEANER TO CLEAN MY GAS STATION","2022-05-18T03:30:07Z","UCX8pnu3DYUnx8qy8V_c6oHg","Techno Gamerz","20","22.18.05","gas station simulator|simulation gameplay|driving|craft|repair|clean|funny|adventure|ujjwal|techno gamerz","3733017","394025","12408","https://i.ytimg.com/vi/dIg2fN0ptFU/default.jpg","I BOUGHT A VACCUM CLEANER TO CLEAN MY GAS STATION | GAS STATION SIMULATOR #10#GasStationSimulator #Ujjwal #TechnoGamerzSubscribe to our Second YouTube Channel: https://www.youtube.com/c/UjjwalGamerShare, Support, Subscribe!!!Subscribe: http://bit.ly/technogamerzDiscord : https://bit.ly/ujjwaldiscordYoutube: https://www.youtube.com/c/TechnoGamerzOfficialTwitter:  https://www.twitter.com/ujjwalgamerFacebook: https://www.facebook.com/technogamerzFacebook Myself: https://www.facebook.com/ujjwalgamerInstagram: https://instagram.com/ujjwalgamerGoogle Plus: https://plus.google.com/+TechnoGamerzOfficialWebsite: https://technogamerz.in/Merchandise: https://shop.technogamerz.in/Business Email : technogamerzofficial@gmail.comAbout : Techno Gamerz is a YouTube Channel, where you will find gaming videos in Hindi, I hope this video was Useful and you liked it, if you did press the thumbs up button."
"aJTUUZ57T4c","மனைவியின் வலியை புரிந்து கொள்ளும் கணவன் கிடைத்தால் வாழ்க்கை இனிமையே. ♥️ #anuselva #shorts #madurai","2022-05-17T11:54:42Z","UCUifS47S3bIM5z09BMggWHQ","Anu Selva","24","22.18.05","[none]","235060","18369","84","https://i.ytimg.com/vi/aJTUUZ57T4c/default.jpg",""
"nd2QZF9PHR4","She made a HUGE MISTAKE on first day in TURKEY","2022-05-17T10:15:31Z","UCyYdwGP0ZbS_VmXg4M9il3Q","Wanderers Live","22","22.18.05","WANDERERS HUB|WANDERERS LIVE|PRERNA HARSH|PRERNA MALHAN|TURKEY|VLOGS|HINDI VLOGS|INDIA VLOGS|INDIA HINDI VLOGS|WANDERERS HUB VLOGS|PRERNA AND HARSH|PRERNA VLOGS|FUNNY VIDEOS|FUNNY VLOGS|ISTANBUL|ISTANBUL VLOGS|TURKEY VLOGS|WANDERERS LIVE VLOGS|FUNNY HINDI VLOGS","964364","50085","1322","https://i.ytimg.com/vi/nd2QZF9PHR4/default.jpg","SHE'S SO CARELESS.SUBSCRIBE!!! . . JOIN ME:Facebook - https://www.facebook.com/WHtravel/ Twitter - https://twitter.com/HubWanderers Instagram - https://www.instagram.com/wanderershub/ Pinterest - https://in.pinterest.com/WandererHub/ ..Read my travel stories: https://www.wanderershub.com/ ..About Me ► My name is Prerna Malhan. I'm from Delhi and I'm a WRITER. Now I am pursuing Youtube full-time. I make entertainment and GAMING videos on this channel. Thanks for reading."
"6WhhywlTVC0","Wakt wakt ki baat h 😎🔥 #shorts #bewafa","2022-05-10T02:30:19Z","UC5apxzE3aEOpvP0XkeuW8mw","Bobby chourasiya","22","22.18.05","[none]","126124006","8272067","11939","https://i.ytimg.com/vi/6WhhywlTVC0/default.jpg",""
"fGqzAfESEn4","First Award 🏆 #shorts","2022-05-17T04:58:40Z","UCxet15aj7KqTVVM14VMtg-Q","Mohak Narang","27","22.18.05","[none]","922154","74678","771","https://i.ytimg.com/vi/fGqzAfESEn4/default.jpg",""
"T39t_78X0EU","CONTROLLING MY BROTHER’S LIFE FOR 24 HOURS | Rimorav Vlogs","2022-05-16T13:31:42Z","UCaqULAbiq-6ZRlKmx0Uv_Cw","Rimorav Vlogs","24","22.18.05","Rimorav vlogs|Rimorav|MY SISTER CONTROLS MY LIFE FOR 24 HOURS|MY SISTER CONTROLS MY LIFE FOR 24 HOURS Rimorav Vlogs|Rishi dev|Diksha sharma|Sanjay Dutt|Is this that feeling song|Shykhar songs|Sheykhar songs|VYRL ORIGINALS|RI Vlogs|Springspoon|Fudge puttar|CONTROLLING MY BROTHER’S LIFE FOR 24 HOURS Rimorav Vlogs|CONTROLLING MY BROTHER’S LIFE FOR 24 HOURS","1834139","171763","4432","https://i.ytimg.com/vi/T39t_78X0EU/default.jpg","Watch CONTROLLING MY BROTHER’S LIFE FOR 24 HOURS | Rimorav Vlogs"
"ZtJwvdb1Ld4","Bingo! RINGA RINGA ROSA-EP9 | Karikku #shorts","2022-05-17T11:31:44Z","UC2bNrKQbJLphxNCd6BSnTkA","Karikku","23","22.18.05","karikku|malayalam|funny|comedy|webseries|lolan|george|karikk|karikke|film|trending|sketch|vine|flowerstv","1892990","195581","652","https://i.ytimg.com/vi/ZtJwvdb1Ld4/default.jpg","Story & Directed by : KCExecutive Producer : Nikhil PrasadAssociate Director : Abijith KrishnanDOP : Binoy JohnEditor : Anand MathewsScreenplay : KC & Abijith Krishnan Music and BGM  : Jishnu thilakSound Mixing : KrishnanunniVFX : Binoy John, Abijith KrishnanProduction Controller : KarundasProduction Executives :Siraj udheen, Sandeep PradeepkumarArt : Siraj udheen, vishnu VitzzAssistant cinematographer : Abhishek A, Chandhu RadhakrishnanAssistant directors : Akshay S Kumar , ashwaghosh , Sandra C S Cast :Sabareesh Sajin , Sumadevi, Anand Mathews Special Thanks :Black House Media , Chandhu Radhakrishnan , Karundas , Vishnu Prakash kalathil, Meghuldas"
"NYd7Th9zwWg","#CakeBomb ആദ്യമായി Try ചെയ്യുന്ന #Tiyakutty #Moj 1.1MillionFollowers #special #cakebomb #bombcake","2022-05-18T04:00:11Z","UCKiB29TN0fWr28pvafeiISw","Tiya & Advik Chathamkulam NimishaRajeesh Vlogs","22","22.18.05","[none]","539629","28180","117","https://i.ytimg.com/vi/NYd7Th9zwWg/default.jpg","#CakeBomb ആദ്യമായി Try ചെയ്യുന്ന #Tiyakutty ഇത്ര അടിപൊളി ആവും എന്ന് വിചാരിച്ചില്ല #Shocked #tiyakutty #Cakebomb #bombcake"
"1TggxAOlCp4","കണ്ണിൽ കർപ്പൂര ദീപമോ..Siblings❤️ #asianet #asianet #becheekha #blesslee #biggbossmalayalamseason4","2022-05-17T02:28:42Z","UCA9vQe9eWH-oKa9etcwbXPw","BECHEEKHA","23","22.18.05","[none]","227740","29921","272","https://i.ytimg.com/vi/1TggxAOlCp4/default.jpg",""
"atoeJjmbFdE","17 వేల అడుగుల ఎత్తులో విమానం నుంచి బయటకు వచ్చి ఎలా బ్రతికాడు 😲 || Flight 5390 in telugu || T Facts","2022-05-14T15:05:10Z","UCcXx6fsFAt9y3sOex0_eMOg","T Facts Telugu","24","22.18.05","shorts|T Facts Telugu|viral|trending|facts|telugu|flight 5390 in telugu|India|youtube|viral videos|top facts|new facts|trending videos|short video|short","1520161","139700","89","https://i.ytimg.com/vi/atoeJjmbFdE/default.jpg","17 వేల అడుగుల ఎత్తులో విమానం నుంచి బయటకు వచ్చి ఎలా బ్రతికాడు 😲 || Flight 5390 in telugu || T Facts || #shorts #Tfactstelugu #trending #viral #facts #telugu #short #India #youtube #Topfacts #flight5390 #5390telugu"
"ppkO4AFZzKQ","Summer Holidays || Uma Mahesh || Nischel || Dora Sai Teja || Infinitum Media","2022-05-17T11:56:25Z","UC9cpaBjhse6B76HP_gn4Rew","Dora Sai Teja","24","22.18.05","summer holidays|summer holiday short film|school holidays comedy|summer school holidays village comedy|uma mahesh|uma mahesh short film|nischel|summer holidays 2022|school students in summer holidays|telugu short films|telugu short film 2022 latest|telugu short films comedy|latest telugu comedy videos|college student life|college comedy videos telugu|telugu comedy short films|short films telugu 2022|dora sai teja|dora sai teja latest|infinitum media","156468","13759","196","https://i.ytimg.com/vi/ppkO4AFZzKQ/default.jpg","Play & Win Lakhs on Fun88:- http://fun88.com/in/aff/24200/regGuess the winning team in today's IPL match and win real cash. Download Now.Summer Holidays is a Telugu Comedy Short Film Featuring Uma Mahesh & Nischel as leads.A Tej India Creatives Works (TICW)Cast: Uma Mahesh, Nischel, Ranadheer, Naveen Darga.Creative Director: Dora Sai TejaExecutive Director: Uma MaheshDOP: RanadheerAssistant DOP:- yeshwanth Editing: Madhu KallepallyPoster Designer: Pratheep ChandraSound Engineer: Venkat, MaheshExecutive Manager: Naveen DargaProducer: Vandana Bandaru#SummerHolidays #UmaMahesh #DoraSaiTeja #TICW #InfinitumMediaProduced by #Infinitum Network SolutionsFollow Uma Mahesh on Instagram ( https://instagram.com/umamaheshthonangi?utm_medium=copy_link )  Follow Tej India on Instagram ( https://instagram.com/thetejindia?utm_medium=copy_link )Follow Infinitum Originals on Instagram ( https://instagram.com/infinitum_originals?utm_medium=copy_link ) We do not intend to promote investment/gambling of any kind.  Viewer discretion is advised. If your current residence is from Andhra, Assam, Odisha, Telangana, Nagaland, and Sikkim, you are advised to not participate."
"n5DVLkf_i6k","ପ୍ରେମମ୍ | Premam | Odia Movie | Official Trailer | Babushan | Prakruti Mishra | Siddhanta Mohapatra","2022-05-17T12:30:13Z","UC1EuA9aHCO81CRoJiAW5L2A","Amara Muzik Odia","10","22.18.05","Amara Muzik|latest songs|Orissa songs|Ollywood|odia music|amara music|odia|odia song|amar music|new odia song 2022|odia song 2022|Premam odia movie|Premam odiamovie song|Premam official trailer|Premam odia movie trailer|odia movie Premam|Premam full movie|Premam full odia movie|Premam|teaser odia movie premam|odia movie trailer premam|AmraMuzik|premam full movie|premam movie|premam odia movie|premam movie trailer|Babushan Mohanty|Babushaan New Film","613797","27321","1656","https://i.ytimg.com/vi/n5DVLkf_i6k/default.jpg","Sanju (Babushaan) can go to any limit for her love Padmini (Prakruti Mishra) but mean while Babu Rao (Siddhanta Mohapatra) comes in between. Premam is story about Sanju and Padmini. Babushaan as Sanju Prakruti Mishra as Padmini & Siddhant Mohapatro as Babu Rao. Music by Gaurav Anand. Directed by Tapas Sargharia. DOP Subrat K Khatoi, Editor Rajesh Dash, Choreographer Girish Mohanty, Produced by Sisir Kumar Sarangi under Emoji Films in association with Babushaan Films. Amara Muzik is the official promotion Partner of the film.Credits:Cast : Babushan Mohanty, Prakruti Mishra, Siddhanta MohapatraStory & Direction: Tapas Sargharia Screen Play & Dialogues: Bharadwaj PandaProducer: Sishir Kumar Sarangi DOP: Subrat K. KhatoiEditor: Rajesh DashChoreographer: Girish Mohanty Music Director: Gaurav AnandProduction House: Emoji FilmsPromotional Partner: Amara Muzik🔔 Get alerts when we release any new video. TURN ON THE BELL ICON on the channel! 🔔SUBSCRIBE to Amara Muzik channel for Odia Songs and movie videoshttp://bit.ly/2am9M9EConnect with us on ♦ Facebook: https://www.facebook.com/AmaraMuzik♦ Instagram: https://www.instagram.com/amaramuzik♦ Twitter: https://twitter.com/AmaraMuzik​#ପ୍ରେମମ୍ #Premam #AmaraMuzik © Amara Muzik 2022* ANTI-PIRACY WARNING *This content is Copyright to Amara Muzik. Any unauthorized reproduction, redistribution or re-upload is strictly prohibited of this material. Legal action will be taken against those who violate the copyright of the following material presented!Odia | Odia Songs | Odia Music | Odia Album | Odia Movie | Ollywood | Odisha | Odia Gita | Odia Song | Odia Music Video | Odia bhajan | Amara Muzik | Amara Muzik Odia | Odia Sad Song | Odia Romantic Song | Odia Video | Odia Full Film | New Odia Song"
"kIJdBtI9vjY","Spiderhead | Chris Hemsworth | Official Trailer | Netflix India","2022-05-17T14:15:05Z","UCZSNzBgFub_WWil6TOTYwAg","Netflix India","24","22.18.05","70s|80s|Black Mirror|Chris Hemsworth|Deadpool|Do You Acknowledge|Drip On|Escape From Spiderhead|Extraction|George Saunders|Hall & Oats|Herb Albert|Idiosyncratic|Incarcerated|Joseph Kosinski|Jurnee Smollett|Lovecraft Country|Maniac|Marvel Universe|Miles Teller|Minnie Ripperton|Morality|Music|Netflix|Netflix Film|Oblivion|Penitentiary|Shutter Island|Squid Game|Thor|Thor Love and Thunder|Top Gun Maverick|Tron Legacy|Zombieland|supertramp","2194155","63689","1137","https://i.ytimg.com/vi/kIJdBtI9vjY/default.jpg","Two inmates (Miles Teller & Jurnee Smollett) form a connection while grappling with their pasts in a state-of-the-art penitentiary run by a brilliant visionary (Chris Hemsworth) who experiments on his subjects with mind-altering drugs. Directed by Joseph Kosinski (Top Gun: Maverick, Tron: Legacy). Based on The New Yorker short story, “Escape From Spiderhead,” by George Saunders.Follow Netflix India on:Website: https://www.netflix.com/YouTube: http://bit.ly/NetflixIndiaYTInstagram: http://www.instagram.com/netflix_inFacebook: http://www.facebook.com/NetflixINTwitter: http://twitter.com/netflixindia#Spiderhead #NetflixIndia #ChrisHemsworth"
"WSgQgzs2SqM","Don - Promos | Sivakarthikeyan | SJ Suryah | Samuthirakani | Priyanka Mohan | Lyca Productions","2022-05-16T09:30:03Z","UCA7gwgLgmCZ8DSmdf2bhb8g","Lyca Production","1","22.18.05","Don|don movie trailer|Don songs|sivakarthikeyan|priyanka mohan|sj surya|anirudh ravichander|Lyca Productions|samuthirakani|sivaangi|bala saravanan|rj vijay|don movie|don tamil movie|Cibi Chakaravarthi|sivakarthikeyan interview|sj surya interview|sivaangi songs|don movie songs|don promo|don promo song|don promo sivakarthikeyan|don song|Bae|bae song|private party|private party song|Bae song promo|Private Party song promo|Jalabulajangu","1760426","63435","545","https://i.ytimg.com/vi/WSgQgzs2SqM/default.jpg","Don Tamil Movie Starring Sivakarthikeyan, Priyanka Mohan, SJ Suryah, Samuthirakani and Soori in the Lead Role. #Don #Sivakarthikeyan #LycaProductionsLyca Productions in association with Sivakarthikeyan Productions presents DONCast:  Sivakarthikeyan, Priyanka Mohan, SJ Suryah, Samuthirakani, SooriWriter And Director: Cibi Chakaravarthi Cinematography:  KM Bhaskaran Music: Anirudh Editor: Nagooran Production Designer: K Udaya Kumar Production Controller: Veera Sankar Stunt Master: Vicky Costume Designer: Anu Parthasarathy / Harikesh / Nithya Venkadesan Production Manager: M Manjunathan Make-Up: P Ganapathi Costumer: Perumal Selvam Dance Choreographer: Shobi, Sandy Stills: N Prithivirajan Publicity Designer: Tuney John (24am) SFX/Sound Mixing: Suren G - Alagiakoothan PRO: Suresh Chandra, Rekha D’oneTamil Kumaram & Kalai ArasuProduced by Subaskaran & SivakarthikeyanBanner: Lyca Productions in association with Sivakarthikeyan ProductionsLyca Productions onFacebook - https://www.facebook.com/LycaProductions Twitter - https://twitter.com/LycaProductionsInsta - https://instagram.com/Lyca_Productions"
"OWhCEhF6OdA","Mere HumSafar Episode 19 | Presented by Sensodyne (Subtitle Eng) 12th May 2022 | ARY Digital Drama","2022-05-12T15:50:29Z","UC4JCksJF76g_MdzPVBJoC3Q","ARY Digital","24","22.18.05","Pakistani Drama|top pakistani dramas|best pakistani dramas|ary digital drama|pakistani dramas ost|ary digital|Mere humsafar new episode|new drama pakistani 2022|ary|new drama pakistani 2021|Mere HumSafar Ep 19|Mere HumSafar Episode 19|drama Mere HumSafar Episode 19|watch new episode Mere HumSafar|watch latest episode Mere HumSafar Ep 19|Mere HumSafar drama|Mere HumSafar Episode 19 12th May 2022|hania amir|farhan saeed|mere hamsafar.","17819996","416201","14940","https://i.ytimg.com/vi/OWhCEhF6OdA/default.jpg","Mere HumSafar Episode 19 | 12th May 2022 | ARY Digital DramaSubscribe: https://www.youtube.com/arydigitalasiaMere Humsafar is the life story of Hala, born to a Pakistani father and foreign mother who leaves them after her birth.Written By: Saira RazaDirected By: Qasim Ali MureedCast:Farhan SaeedHania AamirWaseem AbbasAly KhanSamina AhmedSaba HameedAamir QureshiTara MehmoodZoya NasirUmer Shehzad.Watch Mere HumSafar every Thursday at 8: 00 PM on ARY Digital#MereHumSafar #HaniaAmir #FarhanSaeedSubscribe: https://www.youtube.com/arydigitalasiaDownload  ARY ZAP: https://l.ead.me/bb9zI1Pakistani Drama Industry's biggest Platform, ARY Digital, is the Hub of exceptional and uninterrupted entertainment. You can watch quality dramas with relatable stories, Original Sound Tracks, Telefilms, and a lot more impressive content in HD. Subscribe to the YouTube channel of ARY Digital to be entertained by the content you always wanted to watch.#ARYDigital #entertainment #ARYNetwork"
"rUdTQmSGcBU","✈️എന്നാലും ഇക്കാന്റെ അടുത്ത് നിന്ന് ഇങ്ങനൊരു ചതി പ്രതീക്ഷിച്ചില്ല 😥😯 Back to home after 3months","2022-05-17T09:47:34Z","UC-INCGCUTUoL6hzZ9RLllSQ","NabzvisioN","22","22.18.05","nabzvision|nabeela|familyvlog|dermavive|nutriderm|facewash|moisturiser|beautyproduct|dubai to kerala|abudhabi to kerala|pattambi","116671","2691","597","https://i.ytimg.com/vi/rUdTQmSGcBU/default.jpg","#familyvlog #nabzvision #backtohome Hi asalamualaikum alaikum ❤ഞാൻ വീഡിയോ യിൽ കാണിച്ച face wash and moisturizer വാങ്ങിക്കാൻ ഈ link click ചെയ്യുക  Dermavive Hydra Cleanser  https://www.amazon.in/gp/product/B00GSXY9NW  Neutriderm Moisturising Lotion  www.neutriderm.in🔸🔸🔸🔸🔸🔸🔸🔸🔸🔸🔸🔸🔸🔸🔸🔸 collaboration, business enquiries contact me ,👇👇 My Instagram:Nabzfirozekhan https://www.instagram.com/nabzfirozek... My Mail address nabeelafirozekhan@gmail.com                          Thnku so Much 🔸🔸🔸🔸🔸🔸🔸🔸🔸🔸🔸🔸🔸🔸🔸🔸🔸"
"vQWNYGwJybQ","ഒരു ആമീസ് സ്കൂട്ടർ അപാരത🥰","2022-05-14T09:44:04Z","UCv2c5G55dzgqYlq55tXHu0Q","Oru Al Mallu Family","22","22.18.05","#shorts|#youtubeshorts|#shortvideo|#sijurevavlog|#orualmallufamily|#trending|#trendingshorts|SIJU REVA VLOG|Oru Al Mallu Family","1581338","82025","125","https://i.ytimg.com/vi/vQWNYGwJybQ/default.jpg","ഒരു ആമീസ് സ്കൂട്ടർ അപാരത🥰#shorts #youtubeshorts #shortvideo #sijurevavlog #orualmallufamily #trending #trendingshorts"
"gXjf9588eNs","Visiting Marine World Aquarium | M4 Tech Vlog |","2022-05-14T15:42:55Z","UC4rKvhYJIN-2Pe6zGtxtIqw","M4 TECH VLOG","24","22.18.05","[none]","1525604","87154","2034","https://i.ytimg.com/vi/gXjf9588eNs/default.jpg","Register yourself on Relevel : https://relvl.co/o3s7"
"5rklcpqkNHw","Sad Ending 😭 Every Gamers - Must Watch 🙏 Free Fire 🔥 #Shorts #Short","2022-05-13T04:31:59Z","UCJxJpvWL1gxfLfM352EFatw","Sanjoy Das Official","24","22.18.05","SOLO VS SQUAD free fire|Free Fire Short video|Free Fire Short TikTok Video|Free Fire shorts|Free Fire WhatsApp Status|Solo VS Squad Short video Free Fire|Free Fire peak Rush Gameplay|Free Fire Attitude WhatsApp Status|Free Fire Grenade|Free Fire Grenade king|Op Booyah free fire|Last zone booyah|Factory Fist Fight Free Fire|Factory King of free fire|Free Fire Full Rush Gameplay|Only Rush Gameplay Free Fire|Sanjoy Das|Free Fire Funny Video|Free Fire","5651432","957645","1273","https://i.ytimg.com/vi/5rklcpqkNHw/default.jpg","Thanks for watching 😊 keep support 😘Follow me on Instagram👇https://www.instagram.com/sanjoydas_officialOfficial Facebook 👇https://www.facebook.com/SanjoyDasOfficial15Join my official discord 👇https://discord.link/sanjoydasofficialMY Twitter 👇https://twitter.com/sanjoydas015 Short Free Fire Video | Free Fire Short video | Free Fire #shorts WhatsApp StatusFree Fire Short videoFree Fire Short TikTok VideoFree Fire WhatsApp StatusFree Fire Short solo vs squad Gameplay Free Fire Funny Video Free Fire Funny Gameplay"
