video_id,title,publishedAt,channelId,channelTitle,categoryId,trending_date,tags,view_count,likes,comment_count,thumbnail_link,description
"mDr-SNEjJuc","Goundamani Ultimate Speech at Mr Ishari Velan Statue Opening Event | Kamal Haasan","2022-05-14T07:16:31Z","UCrn698AOJJ69zWN9Z_kTAKQ","Thi Cinemas","25","22.16.05","thi cinemas|isari velan statue opening|ishari velan staue opening event|pashanth entry|goundamani entry at isahari velan statue opening event|goundamani speech|goundamani latest speech|goundamani speech latest|goundamani nakkal speech|koundamani comesy speech|goundamani nakkal speech latest|goundamani speech at ishari velan staue opening event|goundamani about ishari velan statue opening event|goundamani movies|goundamani comedy|goundamani new movie","1019898","12338","319","https://i.ytimg.com/vi/mDr-SNEjJuc/default.jpg","#GoundamaniSpeech#GoundamaniLatestSpeech#IshariVelanStatueOpeningEvent#Cinema #Tamilcinema#TamilCinemaNews#TamilCinemaNewsLatest#LatestTamilNews#TamilMovieReviews#LatestTamilMovieReview#PublicReview#TamilMoviePublicReviews#LatestTamilMovieTrailers#LatestMovieTrailers#LatestTamilNaduNews#TamilCinemaUpdates#TamilCinemaReviews#LatestNewsUpdate#LatestTrendingNews#LatestTamilTrendingNews#LatestTamilCinemaTrendingNews#TrendingNews#MovieAudioLaunch#TamilMovieAudioLaunch#TamilCinemaPressMeetFor More Political & Cinema News , Reviews , Press Meet , Gossips , Audio Launch , Movie Updates  Subscribe Thi Cinemas and click notification bell to get notifications for regular updatesStay tuned to #thicinemas for more updates about #cinema HIT like and Share your commentsWeb: http://www.thicinemas.com/ Facebook - https://www.facebook.com/thicinemasTwitter- https://twitter.com/thicinemasKamlahaasan,kamal haasan entry,kamla haasan entry at ishari velan event, isahri velan statue opening event,ishari velan statue opening event,ishari velan silai thirappu vizha,ishari velan 35th ninaivu naal,ishari velan statue opening,celebs entry at ishari statue opening event,prashanth entry,koundamani entry,prashanth speech at isahri velan statue opening event,celebs speech at ishari velan statue opening event,kamal speech,kamal latest speech,kamal speech latest,prashant speech,prashanth speech latest,kaml vikram movie,kamal vikram movie audio launch,kamal vikram movie audio launch live,kamla haasan speech at vikram audio launch,kamal haasan speech,kamal haasan speech latest,kamal vikrm speech,kamal vikram movie,goundamani speech,goundamani nakka speech,goundamani comedy speech,goundamani speech at ishari velan statue opening,goundamani speech at ishari velan event,gomudamani movies,goundamani new movie,goundamani news,goundamani latest news, goundamnai latest speech,goundamani,goundamani senthil comedy,goundamani comedy,goundamani senthil best comedy,goundamani sathyaraj omedy,goundamani karthik comedy,goundamani interview,goundamani prabhu comedy,goundamani senthil,goundamani enthil vadivelu comedy,goundamani movies full tamil,goundamani comedy tamil,goundamani arasiyal comedy,goundamani rjun comedy,goundamani and senthil comedy,goundamani arabic kuthu,goundamani and sathyaraj comedy,goundamani frica uncle comedy,goundamani akka comedy,goundamani and karthik comedy,goundamani all in all azhagu raja comedy,goundamani arjun tea shop comedy,arabic kuthu goundamani,arjun goundamani comedy,arabic kuthu goundamani song,akka nalla irukingala goundamani comedy,arjun goundamani senthil tamil full movie,ajith goundamani comedy,arjun goundamani movies,actors about goundamani,arabic kuthu goundamani version,arabic kuthu goundamani comedy,goundamani beggar comedy,goundamani best comedy,goundamani bgm,goundamani blind comedy,goundamani banana comedy,goundamani body comedy,goundamani british ilavarasar charles comedy,goundamani barber comedy,goundamani bhagyaraj comedy,goundamani birthday comedy whatsapp status,banana comedy senthil goundamani,best goundamani senthil comedy,british ilavarasar charles goundamani,bhagyaraj goundamani comedy,british ilavarasar charles oundamani whatsapp status,beast song goundamani,balloon kandasamy goundamani comedy,baba goundamani comedy,brahma goundamani comedy scenes,best goundamani comedy,goundamani comedy whatsapp status,goundamani comedy scenes,goundamani comedy suriyan,goundamani counter dialogues,goundamani chinna thambi comedy,goundamani comedy dialogues,goundamani crazy mohan comedy,goundamani comedy collection,goundamani coconut comedy,goundamani comedy reaction,comedy goundamani senthil,chinna thambi comedy goundamani,comedy goundamani,comedy scenes tamil oundamani senthil,comedy goundamani senthil vadivelu,chinna gounder goundamani senthil comedy,comedy goundamani athyaraj,crazy mohan goundamani comedy,"
"dO6RFlcc75c","Pura Din Kharab KarDiya TATA Walo Ne 😕","2022-05-16T03:00:08Z","UCrBV4KLmgBJ9CbOW5BpYTBA","Anshu Bisht Vlogs","22","22.16.05","Gamerfleet|Vlogs|Daily vlogging|Sourav joshi vlog|Piyush joshi|Anshu bisht|NOtGamerFleet|Delhi vlog|Mumbai vlog|Travel|Car vlog|Tata harrier|Moto vlog|New video|Herobrine smp|Daily Vlog|Travelling Vlog|New car|New house|mumbai shoot|essex delhi|techno gamerz car|techno gamerz real life|tata service center","607790","58892","1251","https://i.ytimg.com/vi/dO6RFlcc75c/default.jpg","Thank you so much for watching, Don't forget to Subscribe Okkie ❤️️🤗Instagram: https://www.instagram.com/gamerfleetog/🤗Streaming Channel: https://www.youtube.com/c/GamerFleet❤️️Gaming Channel: https://www.youtube.com/c/anshubisht❤️️Our Own Discord Server! : https://discord.gg/gamerfleet🤗Twitter: https://twitter.com/GamerFleetOG❤️️Facebook: ​https://www.facebook.com/GamerFleetOG"
"v6BXwoEvKP4","Adipwoli Kidilan Comdey Rapid Fire | Nikhila Vimal | Jo & Jo | Pettupoyy | Milestone Makers #shorts","2022-05-13T03:28:35Z","UCAIhHcOFcJSsj-16kc_y4fw","Milestone Makers","22","22.16.05","[none]","1792596","112159","672","https://i.ytimg.com/vi/v6BXwoEvKP4/default.jpg",""
"bHmEPe_QTDA","Fevicol VS Dettol 😱💥 Who'S Better -Free Fire Max #shorts #freefireshorts","2022-05-10T14:09:07Z","UCtSKzRD5c2I2HmfAz3F8zoA","EXPERT GAMING","20","22.16.05","shorts|free fire|free fire shots|free fire shots video|ff shorts video|free fire facts|free fire facts video|ff facts video|garena free fire|free fire Max|Fevicol versus Dettol who is better|YouTube shorts|play free fire with Dettol|Dettol se khelkar Bano hacker|play free fire with Fevicol|Dettol versus Fevicol","9977067","2029306","4082","https://i.ytimg.com/vi/bHmEPe_QTDA/default.jpg","#freefire #freefireshorts #freefireshortsvideo#ffshortsvideo#ffshotts#freefirefacts#freefirefactsvideo#fffactsvideo#fffacts#garenafreefire #freefiremax#youtudeshorts #shortsvideo#short thanks for watching 😗😗"
"0TNxKLwldNk","Birothers Ka Ghar Khali Hai - Ep. 01 : Photoshoot | Realhit","2022-05-15T10:55:56Z","UCsSZyyGKf9FdpqDmynjVBcA","RealHit","24","22.16.05","birothers ka ghar khali hai|birothers|realhit|realhits|realhit new video|realhit web show|realhit new show|realhit comedy|realhit vines|birothers photoshoot|birothers episode 1|realhit birothers|birothers realhit|brothers|realhit latest video|deepak chauhan|piyush gurjar|shubham gandhi|deepak|shubham|piyush|web series|reralhit web series|web series 2022|real hit|real hits|realhit ep 01|ghar khali hai ep 01|funny video","268701","22558","429","https://i.ytimg.com/vi/0TNxKLwldNk/default.jpg","Aasha kerte hai maza aya hoga..maza aya toh apne hisab se Like Comm Sub. ker dena..SUBSCRIBE TO REALHIThttps://www.youtube.com/channel/UCsSZ​​...DSP Vlog Channel- https://www.youtube.com/channel/UCqEt​​... Facebook.  https://www.facebook.com/Realshitvide...  Shubham Gandhi Youtube Channel : https://youtube.com/channel/UCgqdqaR7...Deepak Chauhan Youtube Channel :https://www.youtube.com/channel/UCxUa...Piyush Gurjar Youtube Channel :https://www.youtube.com/channel/UCCY4...Instagram- @RealHithttps://www.instagram.com/realhit/​​Personal Instagram:  Shubham Gandhi- https://instagram.com/theshubhamgandh​​...Piyush Gurjar - https://instagram.com/thepiyushgurjar​​... Deepak Chauhan - https://instagram.com/thedeepakchauha​​... PRODUCED BY :RealHIT  CAST :SHUBHAM GANDHI PIYUSH GURJARDEEPAK CHAUHANKRITIKA NARULADIRECTOR :Team RealhitDOP : Deep SharmaWRITERS :Team Realhit and KundanEdit-Faizal , Hatke Sahil"
"yHeyJ3N1Uj0","Aisa batameez producer kisi ko na mile ! BTS of juttiyan song in Armenia | MUSKAN SHARMA vlog","2022-05-14T07:02:31Z","UCMEDV46mTBranzRKnZZplXg","Muskan Sharma","22","22.16.05","[none]","527794","32438","1282","https://i.ytimg.com/vi/yHeyJ3N1Uj0/default.jpg","Hi everyone!Here is the link of our song juttiyan 👇🏼https://youtu.be/tpEL1ZZ2ak8We shot this song in the month of February 2022. We were in armenia for 5 days. Ye share karna chahungi ke ye vlog in total 280 minutes ka tha . Humne puri koshish ki ke sab kuch dikha sake ek he vlog me aur isko 20 minutes ka kiya hai. Hope apko maaza aaya ho.Comment section me apni dil ki baat jo apko share karna ho ya batana ho zarur batana sabke comments dekh rahe hai.Also song jinhone nahi dekha zarur dekhna upar link hai.Tysm and love u ❤️😘"
"YXQi3cuwwZE","SIMAR DORRAHA : DHEE (Official Video) | RAKA | Latest New Punjabi Songs 2022 | UNDERDOG EP","2022-05-15T04:30:13Z","UCLYucD1lBugdk6xPXlwgKsQ","URBAN PENDU RECORDS","10","22.16.05","dhee new punjabi songs 2022|new punjabi songs 2022 dhee|dhee latest punjabi songs 2022|latest punjabi songs 2022 dhee|Simar dorraha new punjabi songs 2022|new punjabi songs 2022 Simar dorraha|Simar dorraha latest punjabi songs 2022|latest punjabi songs 2022 Simar dorraha|underdog simar doraha|simar doraha under dog|simar dorraha latest new punjabi songs 2021|latest new punjabi songs 2021 simar dorraha|under dog ep latest new punjabi songs 20022","175103","22017","2030","https://i.ytimg.com/vi/YXQi3cuwwZE/default.jpg","Urban Pendu Records & Kartik Skater presents Song- DheeSinger-Simar DorrahaMusic: RakaMix/Master: Hardeep PandherProducer: Kartik Skater & Aman MadaharPublicity Designs/Lyrical Video:  Aj ArtsCopyrights - Urban Pendu  Records Facebook -  https://fb.com/UrbanPendurecordsInstagram - https://www.instagram.com/urban_pendu...Subscribe Us For More Videos - http://bit.ly/UrbanPenduRecordsCompany Contact :  +91 98724-14306(Aman Madahar)"
"bhJcPcuWaoM","90's kids vs 2k Kids  Exam Pad | govinds thought","2022-05-12T13:50:51Z","UC6mgX01WbdmI95wrOsc_s2Q","Govind's Thought Shorts","22","22.16.05","[none]","1135795","78898","89","https://i.ytimg.com/vi/bhJcPcuWaoM/default.jpg","#govinds_thought follow me on:instagram/facebook/twitter - govindthought"
"cbGmzdjcAYw","Logan Paul & KSI Went Bald For Prime","2022-05-15T20:11:34Z","UCG8rbF3g2AMX70yOd8vqIZg","Logan Paul","24","22.16.05","logan paul vlog|logan paul|logan|paul|olympics|logan paul youtube|vlog|daily|comedy|hollywood|parrot|maverick|bird|maverick clothes|Logan Paul drink|ksi drink|drink prime|prime hydration|Logan Paul bald|ksi bald|bald heads|prime factory|ksi vs logan paul","2617243","264203","9675","https://i.ytimg.com/vi/cbGmzdjcAYw/default.jpg","Stay hydrated. Drink Prime ► https://drinkprime.comSUBSCRIBE FOR DAILY VLOGS! ► http://bit.ly/Subscribe2LoganWatch Previous Vlog (Logan Paul & KSI Go Undercover At Walmart) ► https://youtu.be/gHJaXRZElXsMusic by Too Many T'sSpotify: https://spoti.fi/3ytE743Apple: https://apple.co/399eV8kInsta/TikTok: @toomanyts Edited by: @HillierSmith INSTAGRAM: https://www.instagram.com/hhilliersmith/TWITTER: https://twitter.com/hhilliersmithShot By: https://instagram.com/kevingmovhttps://instagram.com/davidsonnADD ME ON:INSTAGRAM: https://www.instagram.com/LoganPaul/TWITTER: https://twitter.com/LoganPaulWatch our IMPAULSIVE Podcast ► https://www.youtube.com/impaulsiveOR IMPAULSIVE CLIPS ► https://www.youtube.com/impaulsiveclipsI’m a 27 year old creator living in Puerto Rico. This is my life.https://www.youtube.com/LoganPaulVlogs"
"MKcr494pZe8","నాన్న...😢","2022-05-13T11:13:13Z","UClUKCxS9NRJIDTldf1cH_GA","Charanprasad1430","22","22.16.05","[none]","1711125","126512","637","https://i.ytimg.com/vi/MKcr494pZe8/default.jpg",""
"-2CYiqoM3BA","Don review by prashanth","2022-05-13T05:43:13Z","UCZVcQLqXTn1DN-UcDwrc1gQ","tamilcinemareview","1","22.16.05","Tamil Cinema Review|Tamil Cinema Review prashanth|tamil cinema review latest|itisprashanth review|itisprashanth interview","435816","16151","1029","https://i.ytimg.com/vi/-2CYiqoM3BA/default.jpg","Call to  +917502443434 What’s app  +917502443434website www.smileytrips.comTecneics videos : https://youtu.be/-Tw2O17qexIReview about recently released tamil movie Don. The movie has Siva karthikeyan, priyanka mohan, shivaangi, RJ Vijay , Bala saravanan, SJ suryah , Samudrakani and many others playing pivotal roles. The movie is directed by Cibi Chakravarthy ."
"PuCQPmNo-aY","Tu Mera Sanam | Ishaan Khan | Faisu | Shivangi Joshi | Song | New Romantic Song | MK | Blive Music","2022-05-13T06:30:33Z","UCZI9-cG-C-mAL5WkpqMh9og","BLive Music","10","22.16.05","latest hindi song|new hindi song 2022|blive music|latest bollywood song|bollywood song 2022|Tu Mera Sanam latest song 2022|Tu Mera Sanam Ishaan Khan Song|Ishaan Khan|Tu Mera Sanam song|Tu Mera Sanam full song|Tu Mera Sanam official song|Romantic song 2022|ishan khan new song|ishaan khan latest song|Faisu new song|romantic song|hindi love songs|new hindi song|ishaan khan new song|hindi songs 2022|love song|Shivangi Joshi","6703798","141213","22813","https://i.ytimg.com/vi/PuCQPmNo-aY/default.jpg","BLive Music, Sanjay Kukreja & Remo D'souza presents official new hindi romantic song Tu Mera Sanam sung by Ishaan Khan featuring Faisu and Shivangi Joshi. The is music produced by Aishwarya Tripathi and Yakshaj Jagtap, Music is composed by Ishaan Khan and Lyrics are penned by Azeem Shirazi. Produced by Varsha Kukreja. This song is created by Mahesh Kukreja.#TuMeraSanam #IshaanKhan #NewLoveSongs2022 #Faisu #ShivangiJoshiAudio Credits :Song : Tu Mera SanamSinger & Composer : Ishaan KhanLyrics : Azeem ShiraziMusic : Aishwarya Tripathi, Yakshaj JagtapAdditional Aalap & Sargam : Sameer Khan Royal Backing Vocals : Sameer Khan Royal, Amaan Khan, Shadab Khan, Musharrat Khan, Fateh AliHarmonium : HanifTabla & Dholak : Narendra KrishnaGuitar & Mendolin : Chaitanya BhaidkarBass Guitar : Rinku NikhareAll Vocals and instruments dubbed by YASH TIWARI @ Studio WIBEMix By : Michael PillaiMaster By : Eric Pillai------------------------------------------------------------------------------------------------------------♪  Streaming On♪  iTunes - https://music.apple.com/in/album/tu-mera-sanam-single/1623784881♪  Apple Music - https://music.apple.com/in/album/tu-mera-sanam-single/1623784881♪  Gaana - https://gaana.com/album/tu-mera-sanam-hindi♪  JioSaavn - https://www.jiosaavn.com/album/tu-mera-sanam/dugmvurGQoI_♪  Wynk - https://wynk.in/music/album/tu-mera-sanam/pc_EK20350♪  Spotify - https://open.spotify.com/album/0930wG7faCmkcTZIFgADTS♪  Amazon - https://music.amazon.in/albums/B0B17ZPSDF♪  Hungama - https://www.hungama.com/album/tu-mera-sanam/87337742/♪  Resso - https://m.resso.com/ZSdHWWFRp/♪  Deezer - https://www.deezer.com/en/album/318092567♪  Pandora - https://pandora.app.link/sZZnhqpiZpb------------------------------------------------------------------------------------------------------------To Set Caller Tune Dial Below Codes♪  Tu Mera SanamFor Airtel Hello Tunes Dial 5432118310818Vodafone Caller Tunes Dial 53713251435For Idea Dialer Tones Dial 53713251435BSNL East & South SMS BT 13251435 to 56700MTNL Subscribers SMS PT 13251435 to 56789♪  Tu Mere Wajood Mein HaiFor Airtel Hello Tunes Dial 5432118310769Vodafone Caller Tunes Dial 53713251436For Idea Dialer Tones Dial 53713251436BSNL East & South SMS BT 13251436 to 56700MTNL Subscribers SMS PT 13251436 to 56789♪  Khwahish Hui Hai PuriFor Airtel Hello Tunes Dial 5432118310836Vodafone Caller Tunes Dial 53713251437For Idea Dialer Tones Dial 53713251437BSNL East & South SMS BT 13251437 to 56700MTNL Subscribers SMS PT 13251437 to 56789♪  Thoda Kareeb Tere Aaya HuFor Airtel Hello Tunes Dial 5432118310770Vodafone Caller Tunes Dial 53713251438For Idea Dialer Tones Dial 53713251438BSNL East & South SMS BT 13251438 to 56700MTNL Subscribers SMS PT 13251438 to 56789♪  Khushiya Kharidi MaineFor Airtel Hello Tunes Dial 5432118310768Vodafone Caller Tunes Dial 53713251439For Idea Dialer Tones Dial 53713251439BSNL East & South SMS BT 13251439 to 56700MTNL Subscribers SMS PT 13251439 to 56789-------------------------------------------------------------------------------------------------Video Credit :Directed by :- Dhruwal Patel & Jigar Mulani DOP :- Dhruwal PatelChief Assistant Director :- Shehzaan Khan Assistant DOP :- Ritik VermaSteadicam Operator :- Haninder Aujla Steadicam Assistant :- Robin VermaFocus Puller :- Shyam Jangra Art Director :- Deepak and TeamShivangi Costume Stylist :- Gursharan Kaur & Mini NarulaFaisu Costume Stylist :- Denish Hamirani & HarryShivangi Hair &  Makeup :- Jass Addy & TeamFaisu Hair & Makeup :- Shanu AnsariProduction By :- Reel Makers ProductionLine Producer :- Kaushal NayyarProduction Controler :- Jimmy ChaudharyBTS & Stills :- Shivam ChaurasiyaFocus Puller :- RamEditor : Abhishek Kumar SinghB-Live Music & Entertainment Team :Created by : MKProducer : Varsha KukrejaLegal Advisor : Adv. Sahil DewaniTravel Partner : Smart Flyers Holidays Pvt. Ltd.Channel Head : Sajan JhawarDigital Media Managers : Mansi Shah & Himani MhatrePublicity Design By : Vishnu NamdevMotion Graphic Artist : Abhimanyu Sahoo-------------------------------------------------------------------------------------------Connect With Ishaan Khan: Facebook: https://www.facebook.com/ishaankhanbliveInstagram: https://www.instagram.com/ishaankhanbliveTwitter: https://twitter.com/Ishaankhanblive-------------------------------------------------------------------------------------------Connect with BLive Music: Facebook: https://www.facebook.com/blivemusic.in/Instagram: https://www.instagram.com/blivemusic.in/Twitter: https://twitter.com/blivemusic_inCopyright BLive Music 2022"
"gGQw4kUrI4A","Maggi Ke Deewane | Guddu Bhaiya","2022-05-15T05:30:06Z","UCFLTZgzWmWs1DmdWJWCE3_g","Guddu Bhaiya","24","22.16.05","Maggi ke दीवाने Guddu bhaiya|Maggi comedy video|Chotu|Types of Maggi eaters|Chotu dada ki maggi|Maggi maggie|School main maggi|Maggi party|Maggi ki demands|Types of maggi|maggi recipies|Comedy video|Funny video|Guddu Bhaiya ki new video|Trending|Viral|Girls vs boys maggi|Maggi challenge video|Family challenge video|Maggi lovers|Guddu Bhaiya funny video|Maggi street food|Baklol video|Vibhu varshney|Guddu bhaiya|Guddu Bhaiya maggi|Maggie|Guddu maggi","233660","6958","330","https://i.ytimg.com/vi/gGQw4kUrI4A/default.jpg","Hello Friends ! Do follow me on my Instagram for more funhttps://www.instagram.com/dilsepaneerSo, I am here again with a new YouTube video which is  Maggi Ke Deewane  !In this video, I showed a fictional incident where Guddu and his friends decides to cook Maggi but they couldn’t able to cook because of many funny and relatable reasons ! You can see Types Of Maggi Eaters in this video !Do watch the video till the end to see, Will they finally able to have Maggi or not?This video is just for the entertainment purpose only.I hope you enjoy this “ Maggi Ke दीवाने ”.Cast - Vibhu Varshney ( Guddu Bhaiya )Ishank VermaSwati JayaWritten by - Kundan KumarEdited by -  Vibhu VarshneyThumbnail by - Raj SharmaManaged by - Pankaj SharmaDirector of Photography - Nitish GoelPlease Like | Share | Comment | Subscribe !Thank you for watching !"
"MJ22Oclhcn4","We transformed a doll into a magical mermaid || #Shorts","2022-05-08T16:00:16Z","UCO5gl04EhuLl4d6HZMQdg0A","Wood Mood","26","22.16.05","5 minute craft|5 minute crafts|5 minute crafts men|5 minutes craft|camp|camping|camping hacks|fixing|home repair|how to fix|how to make|how to repair|minor repairs|outdoor cooking|outdoors|repair|repairing|shorts|to fix|to repair|woodworking","17433493","839485","784","https://i.ytimg.com/vi/MJ22Oclhcn4/default.jpg","This activity is performed by actors in a controlled environment. Please use caution if you plan to replicate.Music by Epidemic Sound: https://www.epidemicsound.com/#craft #woodmood"
"g0Vq_TBY3v8","Mouna Raagam Season 2 | 16th to 20th May 2022 - Promo","2022-05-14T13:14:24Z","UCvrhwpnp2DHYQ1CbXby9ypQ","Vijay Television","24","22.16.05","Mouna Raagam|Mouna Ragam|New fiction|Redefining Entertainment|Star|Star Vijay TV|Tamil Shows|Tamil TV|Vijay|Vijay TV|hotstar|promo|டிவி|தமிழ்|தொலைக்காட்சி|விஜய்","3410710","75729","933","https://i.ytimg.com/vi/g0Vq_TBY3v8/default.jpg","#MounaRaagam #Season2 #VijayTV #VijayTelevision #StarVijayTV #StarVijay #TamilTV #RedefiningEntertainment #Sakthi #SakthiVelan மௌன ராகம் Season 2 - திங்கள் - வெள்ளி இரவு 7 மணிக்கு நம்ம விஜய் டிவில.. #MounaRaagam Click here https://www.hotstar.com/in/tv/mouna-raagam-2/13874 to watch the show on Disney+ Hotstar.."
"aB94IItmPyg","Tape experiment 😂 #shorts | Arun Karthick |","2022-05-12T11:37:28Z","UC_GYQT7DtaHaRbSeXyWBZyA","Arun Karthick","24","22.16.05","[none]","1242369","85549","165","https://i.ytimg.com/vi/aB94IItmPyg/default.jpg",""
"KUN5Uf9mObQ","Arabic Kuthu - Video Song | Beast | Thalapathy Vijay | Pooja Hegde | Sun Pictures | Nelson | Anirudh","2022-05-09T13:30:02Z","UCBnxEdpoZwstJqC1yZpOjRA","Sun TV","24","22.16.05","Arabic kuthu video song|halamithi habibo video|arbic kuthu song video|arabic kuthu music video|arabic kuthu full video|arabic kuthu song|Sun pictures|Beast movie song|arabic kuthu beast song|arabic kuthu video song|arabic kuthu video|Arabic kuthu|arabic kuthu song video|halamithi habibo song|halamithi habibo|halamithi habibo beast|arabic kuthu dance|arabic kuthu reels|arabic kuthu dance vijay|beast movie|Beast movie video|beast movie video song","26066028","999836","32264","https://i.ytimg.com/vi/KUN5Uf9mObQ/default.jpg","Watch the official video song of Arabic Kuthu - Halamithi Habibo from Thalapathy Vijay’s #BEAST by Sun Pictures, Lyrics by Sivakarthikeyan, Directed by Nelson & Music by Anirudh Ravichander. Star Cast : Vijay, Pooja Hegde, Selvaraghavan, Yogi Babu, Redin Kingsley, Bjorn Surrao, VTV Ganesh, Aparna Das, Shine Tom Chacko, Liliput Faruqui, Ankur Ajit Vikal & Others.Song Credits:Song Title: Arabic KuthuAlbum/Movie: BeastVocals: Anirudh Ravichander & Jonita GandhiComposed by Anirudh RavichanderLyrics: SivaKarthikeyanDop - Manoj ParamahamsaEditor - R. NirmalArt - DRK KiranAction - AnbarivChoreographer- Jani MasterSound Mix - Suren. GSound Design - Suren. R - S.AlagiakoothanCostume Designers - Pallavi Singh, V.SaiMakeup - P. NagarajanVFX Supervisor - Bejoy Apputharaj/Phanthom FXPro - Riyaz K AhmedPublicity Design - Gopi PrasannaaProduction Controller - R. Ramesh KuchirayarExecutive Producer - R. Udayakumar------------------------------------------------------------------------Listen to the Arabic Kuthu song on your favorite music service:YT Music - https://bit.ly/3p1Ojv5Spotify - https://spoti.fi/3HT1A0iWynk - https://bit.ly/3HTQIiNJiosaavn - https://bit.ly/3oOECQJGaana - https://bit.ly/34ZUecIApple Music - https://apple.co/3JtWg3XAmazon Prime Music - https://amzn.to/3HPGBeXResso - https://m.resso.com/ZSeWkuHK6/Hungama - https://bit.ly/3sFqjiq------------------------------------------------------------------------Musician Credits:Composed, Arranged & Programmed by Anirudh RavichanderElectric Guitar & Acoustic Guitars by AmalrajSolo Violin & Violas by AmalrajOud, Saz, Bazuki, Backing Vocals by AmalrajRecorded at Strings 7 Studio, ChennaiKeyboard, Synth & Rhythm Programmed by Anirudh RavichanderAdditional Rhythm Programmed by Kalyan & Shashank VijayAdditional Keyboard Programmed by Arish & Pradeep PJMusic Advisor - AnanthakrrishnanCreative Consultant - Sajith SatyaRecorded at Albuquerque Records, Chennai. Engineered by Srinivasan M, Shivakiran SMixed by Vinay Sridhar & Srinivasan M at Albuquerque Records, ChennaiStem Mix & Mastered by Sai Shravanam at Resound India, ChennaiMusic Coordinator - Velavan B------------------------------------------------------------------------#ArabicKuthuVideoSong #HalamithiHabibo #ThalapathyVijay #SunPictures #Anirudh #Nelson #Sivakarthikeyan #PoojaHegde #JonitaGandhiSong #JonitaGandhiSinger #BeastMovie #BeastFirstSingle #BeastVijay #BeastMovieSong #ThalapathyVijayBeast #BeastThalapathyVijay #SivakarthikeyanLyrics #BeastMovieUpdate #ArabicKuthuSong #ArabicKuthuSongLyrics #ArabicKuthuBeast #BeastArabicKuthu #BeastVideosongs #ArabicKuthuVideoSongTamil #ArabicKuthuvideo #HalamithiHabiboSong #HalamithiHabiboVideosong  #HalamithiHabiboTamilSong #HalamithiHabiboBeast #HalamithiHabiboAudioSong #ArabicKuthuFullsong #ArabicKuthuAudioSong #HalamithiHabiboFullAudio #HalamithiSong #HalamithiHabiboMp3 #ArabicKuthuMp3 #HalamithiHabibovideotamil------------------------------------------------------------------------"
"UdxQzzfuABE","அருளுக்கு பிரசவ வலி வந்துடுச்சு","2022-05-13T07:42:32Z","UCREVIdlxZ-1NCcreVLUKkIQ","Laksh Arul channel","24","22.16.05","#InShot","599500","19096","0","https://i.ytimg.com/vi/UdxQzzfuABE/default.jpg","Created by InShot:https://inshotapp.page.link/YTShare"
"_olzq-9LGCI","Kya ye couple tattoo he batao aap log #couple","2022-05-09T08:08:35Z","UCqTmCuf2W7IMrvYrxFlmufQ","Mahesh Chavan","24","22.16.05","Shorts|Shorts video|Youtube|Youtube shorts|Youtube video|Yts|Mahesh chavan|Mahesh chavan shorts|Mahesh chavan video|Trending|Trending shorts|Trending video|Couple","22235931","1489273","2892","https://i.ytimg.com/vi/_olzq-9LGCI/default.jpg",""
