video_id,title,publishedAt,channelId,channelTitle,categoryId,trending_date,tags,view_count,likes,comment_count,thumbnail_link,description
"xpXlhaf6flg","London Airport se Pehle Security ne ROK lia","2022-06-10T08:15:23Z","UCyYdwGP0ZbS_VmXg4M9il3Q","Wanderers Live","22","22.11.06","WANDERERS HUB|WANDERERS LIVE|PRERNA HARSH|PRERNA MALHAN|LONDON|VLOGS|HINDI VLOGS|HINDI VIDEOS|INDIA VLOGS|INDIA VIDEOS|COUPLE VLOGS|LONDON VLOGS|LONDON VIDEOS|AIRPORT|LONDON AIRPORT|WANDERERS HUB VLOGS|WANDERERS HUB VIDEOS|FUNNY VIDEOS|COMEDY VIDEOS","853125","46772","1078","https://i.ytimg.com/vi/xpXlhaf6flg/default.jpg","SUBSCRIBE!!! . . JOIN ME:Facebook - https://www.facebook.com/WHtravel/ Twitter - https://twitter.com/HubWanderers Instagram - https://www.instagram.com/wanderershub/ Pinterest - https://in.pinterest.com/WandererHub/ ..Read my travel stories: https://www.wanderershub.com/ ..About Me ► My name is Prerna Malhan. I'm from Delhi and I'm a WRITER. Now I am pursuing Youtube full-time. I make entertainment and GAMING videos on this channel. Thanks for reading."
"I5foz8XXFM4","Ye toh 8 Years ka ha lakin 🤯 gameplay hacker 👀 - Garena free fire max #shorts","2022-06-10T10:51:24Z","UCBjA3hciQQrdm8fHqlF9rHw","AM DUBAI Gaming","20","22.11.06","[none]","279719","53373","493","https://i.ytimg.com/vi/I5foz8XXFM4/default.jpg","follow on Instagram https://instagram.com/am_dubai_gaming?igshid=YmMyMTA2M2Y="
"E8iNBzHwNkA","2 Pro V badge Boys Vs 6 Noob Hater Girls 🤯 - आग लगा देंगे 😂 - Garena Free Fire","2022-06-10T05:14:06Z","UCa_i3rdR-iKCyS6DJRYiTrQ","ADITECH","20","22.11.06","Free Fire|Garena Free Fire|Free Fire Funny Video|Funny Video Free Fire|ADITECH|Aditech Funny Video|Grandmaster|Grandmaster Players|Ajjubhai94|Total Gaming|Ajjubhai94 Funny Video|Giveaway|Unlimited Diamond In Free Fire|Free Diamond In Free Fire","388088","40318","35361","https://i.ytimg.com/vi/E8iNBzHwNkA/default.jpg","2 Pro V badge Boys Vs 6 Noob Hater Girls 🤯 - आग लगा देंगे 😂 - Garena Free Fire20M like aim kardena Baki Subscribe Aur Share Toh Aap Karhi doge Kardoge na?✨Also Visit - 🔆 Aditech Army - https://www.youtube.com/channel/UC_pe... My Vlog Channel -https://www.youtube.com/channel/UC-4-... InstaGram - https://www.instagram.com/aditech_yt/... Discord - https://discord.gg/w7AdkGV72hBusiness Enquires - aditechthebusinessman@gmail.comVideo Duration - 20 Minutes Free Fire Top Country 1.Garena Free Fire Indonesia Live 2.Garena Free Fire Brazil Live 3.Garena Free Fire Brasil Live4.Garena Free Fire India Live5.Garena Free Fire Singapore Live6.Garena Free Fire Thailand#FreeFire#Garena#ADITECHThis Channel DOES NOT Promote or encourage Any illegal activities, all contents provided by This Channel is meant for EDUCATIONAL PURPOSE only. Copyright Disclaimer:Copyright Disclaimer - Under Section 107 of the Copyright Act 1976, allowance is made for fair use for purposes such as criticism, comment, news reporting, teaching, scholarship, and research. Fair use is a use permitted by copyright statute that might otherwise be infringing. Non-profit, educational or personal use tips the balance in favor of fair use.Thx For Watching!!"
"jJGPEzmE4jw","Affordable Meesho Summer Dress Haul 🌼 #shorts #ashortaday #summerdresses #meesho #meeshohaul","2022-06-09T07:40:20Z","UCGwlQJcNsISJtvvYKE6jlRA","The Sumedha","26","22.11.06","[none]","699499","28912","76","https://i.ytimg.com/vi/jJGPEzmE4jw/default.jpg","DOWNLOAD MEESHO APP VIA ANY OF THE FOLLOWING LINKS AND GET YOUR FIRST ORDER DISCOUNT OF ₹50 OR A FLAT 15% OFF.PRODUCT 1: Pink Floral Skirt DressProduct Code 👉 s-116071755             ( ₹314 )Purchase Link👉🏻 https://cutt.ly/DJF8fLyPRODUCT 2: Fancy Latest Women DressProduct Code 👉 s-59435234 (₹357)Purchase Link👉🏻 https://cutt.ly/aJF8lcpPRODUCT 3: One Peace Sunflower Print dressProduct Code👉 s-120401580 (₹275)Purchase link 👉🏻https://cutt.ly/tJF8vzc#MeeshoHaul #Collaboration #Meesho #Meeshoapp #YTshorts"
"XlVGr9xTeM4","Radha Gopalam || Episode - 12 || Ravi Siva Teja || Viraajita || Infinitum Media","2022-06-10T05:00:11Z","UCaooZvg_gT3gagtkbqJCxMw","Infinitum Theatre","24","22.11.06","radha gopalam|radha gopalam web series|radha gopalam episode 12|radha gopalam web series ep 12|ravi siva teja|virajitha sharma|ravi siva teja short films telugu|virajitha short films|virajitha telugu short films|ravi siva teja viraajitha|ravi siva teja web series|virajitha web series|telugu web series|virajitha|telugu short films 2022|short films telugu 2022|virajitha telugu web series|ravi siva teja new web series|infinitum media|telugu web series 2022","275420","18169","753","https://i.ytimg.com/vi/XlVGr9xTeM4/default.jpg","Download the OctaFX Copytrading App at https://bit.ly/Infinitum_Copy_OctaFX and get an exclusive 50% bonus! 🎁Start learning investing money with the principal trading partner of the Delhi Capitals - Octa🏆Ad  by-:Sociopool India Private Limitedhttps://www.sociopoolindia.com/Radha Gopalam is a Telugu Rom Com Web Series featuring Ravi Siva Teja & Viraajitha as leads.Cast: Ravi Siva Teja Paila, Viraajita, Raviteja Varma. M, Lokshitha Written & Directed by KkDOP:  Vinay SarukollaEditing & DI: Prem SuryaPublicity Designer: Nikhil ChotuTitle Design & Animation: Hemanth KorimiSound Engineer: Venkat, Mahesh K Music : Sudha Srinivas P, Srujan ShanakaLine Producer: Sheriff Nani Executive Producer: Chandu JCProducer: Vandana Bandaru#RadhaGopalam #RaviSivaTeja #Viraajita #InfinitumMedia Produced by #Infinitum Network Solutions.We do not promote any kind of direct trading/investment activity. Please trade at your own risk."
"7XpyUV6BfMA","Dil Awaiz Last Episode - Kinza Hashmi - Affan Waheed [Eng Sub] 10th June 2022 - HAR PAL GEO","2022-06-10T17:00:10Z","UCe9JSDmyqNgA_l2BzGHq1Ug","HAR PAL GEO","24","22.11.06","Har pal geo|geo dramas|latest pakistani drama|top pakistani dramas|best pakistani dramas|latest pakistani dramas|drama 2022|Kinza Hashmi|Affan Waheed|Seemi Raheel|Kashif Mehmood|Fazeela Qazi|Javeria Abbasi|Farhan Ali Agha|Raeed|Ayesha Gul|Yasra Rizvi|Janaan Hussain|Saife Hassan|Qudsia Ali|Raza Zaidi|Dil Awaiz Last Episode|Dil Awaiz Ost|Dil Awaiz Last|10th June 2022|Last Episode Dil Awaiz|Dil Awaiz","5300897","102006","5066","https://i.ytimg.com/vi/7XpyUV6BfMA/default.jpg","Thanks for watching Har Pal Geo. Please click here https://bit.ly/3rCBCYN to Subscribe and hit the bell icon to enjoy Top Pakistani Dramas and satisfy all your entertainment needs. Do you know Har Pal Geo is now available in the US? Share the News. Spread the word.Dil Awaiz Last Episode - Kinza Hashmi - Affan Waheed [Eng Sub] 10th June 2022 - HAR PAL GEOThis is a story of a young girl named Dil Awaiz who despite living in her father's house is treated as an orphan and is deprived of love and care. Dil Awaiz’s father, Shahab Uddin is an influential and wealthy businessman who keeps his distance from his firstborn, Dil Awaiz due to her mother's past.Things take an unexpected turn when a handsome, young man Sikandar enters Dil Awaiz's life and once again she is expected to compromise and sacrifice herself in order to save her family’s honour and respect. Despite living like an outsider all her life will Dil Awaiz be able to make yet another sacrifice? Even after all the atrocities, will Dil Awaiz be able to gain due respect in the house?Cast :Kinza Hashmi - Dil AwaizAffan Waheed - Sikander Seemi Raheel - Aqa biKashif Mehmood - Shahab UddinFazeela Qazi - BushraJaveria Abbasi - Roshan AraFarhan Ali Agha - SubhanRaeed - KashanAyesha Gul - DurdanaSabeena Farooq - FariyaYasra Rizvi - TamannaJinaan Hussain - GeetiSaife Hassan - SarmadQudsia AliRaza Zaidi#DilAwaizLastEp#HarPalGeo#Entertainment"
"QU5B36ndk14","Chota Aawara Got 99 Level Season 2 HipHop Account 😱 || Free Fire","2022-06-09T04:26:54Z","UCZzKzrAWxPAljUobIPi4S-w","Black Flag Army","20","22.11.06","Chota aawara want season 2|season 2 bundle|free fire season 2|garena gifted me|hiphop bundle free|season 2 account|chota aawara account|garena gifted season 2|garena gifted red criminal|garena gifted 5 criminal in my id|free fire rare bundle unboxing|total gaming|free fire|garena free fire|gifting to aawari|free fire id delete|free fire id sell|aawara007|solo vs squad|freefire|most views video|youtube recommend|as gaming","421275","42484","724","https://i.ytimg.com/vi/QU5B36ndk14/default.jpg","I Got 25000+ Diamond Gift From Garena1000+ Gun Crates OpeningGirlfriend Prank on AAWARI Crying FacePlaying With Ajjubhai94 ( total Gaming )Playing With AmitBhai (Desi Gamers )ɪɴsᴛᴀɢʀᴀᴍ ʟɪɴᴋ https://www.instagram.com/_aawara007_/ᴊᴏɪɴ ᴏᴜʀ ᴅɪsᴄᴏʀᴅhttps://discord.gg/pUTdx3K​​​ɪғ ᴜ ʜᴀᴠᴇ ᴀɴʏ ᴘʀᴏʙʟᴇᴍ ᴡɪᴛʜ ᴏᴜʀ ᴄᴏɴᴛᴇɴᴛ ᴏʀ ᴛʜɪɴᴋ ɪᴛ ɪs ᴏᴡɴᴇᴅ ʙʏ ᴏᴛʜᴇʀ ᴏʀ ᴀɴʏ ᴛʏᴘᴇ ᴏғ ᴄᴏᴘʏʀɪɢʜᴛ ɪɴғʀɪɴɢᴇᴍᴇɴᴛ ᴜ ᴄᴀɴ ᴄᴏɴᴛᴀᴄᴛ us on instagram  ᴄᴏᴘʏʀɪɢʜᴛ ᴅɪsᴄʟᴀɪᴍᴇʀ ᴜɴᴅᴇʀ sᴇᴄᴛɪᴏɴ 107 ᴏғ ᴛʜᴇ ᴄᴏᴘʏʀɪɢʜᴛ ᴀᴄᴛ 1976 ᴛʜᴇ ᴀʟʟᴏᴡᴀɴᴄᴇ ᴡᴀs ᴍᴀᴅᴇ ғᴏʀ ''ғᴀɪʀ ᴜsᴇ''  ғᴏʀ ᴘᴜʀᴘᴏsᴇ sᴜᴄʜ ᴀs ᴄʀɪᴛɪᴄɪsᴍs ᴄᴏᴍᴍᴇɴᴛ ɴᴇᴡs ʀᴇᴘᴏʀᴛɪɴɢ ᴛᴇᴀᴄʜɪɴɢ sᴄʜᴏʟᴀʀsʜɪᴘ ᴀɴᴅ ʀᴇsᴇᴀʀᴄʜ ғᴀɪʀ ᴜsᴇ ɪs ᴀ ᴄᴏᴘʏʀɪɢʜᴛ ʟᴀᴡ ᴛʜᴀᴛ ᴡɪʟʟ ᴡɪʟʟ ᴏᴛʜᴇʀᴡɪsᴇ ʙᴇ ɪɴғʀɪɴɢɪɴɢ ɴᴏɴ-ᴘʀᴏғɪᴛ ᴇᴅᴜᴄᴀᴛɪᴏɴ ᴏʀ ᴘᴇʀsᴏɴᴀʟ ᴜsᴇ ɪғ ʏᴏᴜ ʜᴀᴠᴇ ᴀɴʏ ᴘʀᴏʙʟᴇᴍ ᴄᴏɴᴛᴀᴄᴛ ᴜs ᴡᴇ ᴡɪʟʟ ʀᴇᴏᴍᴠᴇ ᴏᴜʀ ᴠɪᴅᴇᴏ ᴅᴏɴ'ᴛ ɢɪᴠᴇ ʜᴀᴛᴇ ᴛʜᴀɴᴋs About video : PRANK ON NAYAN ASSASSIN AND HIS OP REACTION 😂😂🤣🤣 - Garena free fire 1 Vs 2 With My Subscriber For Dj Alok & Elite Pass🥺 Who Will Win? Op Challange -Garena Free fire I Ask For Dj Alok From Random Players 😭| Emotional moment | I Gave Him Dj Alok  - Garena Free Fire 1  Vs 1 Challenge With My Subscriber🥺| Who WIll WIn? Dj Alok & Elite Pass - Garena Free Fire I Ask For Dj Alok From Random Player😢 | Crying moment | I Gave Him Dj Alok - Garena Free Fire with total gaming and loud who will win 1 Vs 1 With My Subscriber For Dj Alok & Elite Pass🥺| Who Will Win? $1000 Challange-Garena Free fire10 Years Boy Ask Me For Dj alok & Diamonds || I Gave Him Dj alok -Garena Free Fire2 Boys Ask Me For Dj Alok & Elite Pass | Emotional Moment Moment😭|I Gave Him DjAlok-Garena Free fire rs Boy Ask Me For Dj Alok & Diamonds | Crying Moment 😭 | I Gave Him Dj Alok - Garena Free fire9 Yrs Litle Boy Ask Me For Dj Alok & Elite Pass | Crying Moment😭| I Gave Him DjAlok-Garena Free fire10 Yrs Boy Ask Me For Dj Alok & Elite Pass | Crying Moment 😭 | I Gave Him Dj Alok - Garena Free fire 11 Yrs Boy Ask Me For Dj Alok & Diamonds | Crying Moment 😭 | I Gave Him Dj Alok - Garena Free fire9 Yrs Boy Ask Me😭 | I Gave Him Dj Alok - Garena Free fire 12 Yrs Boy Ask Me For Give Him Dj Alok😭 Crying moment 😥 - #Totalgaming​​​ #Desigamers​​​ #ajjubhai94​​​  #djalok​​​ #djalokfreefire​​​ #freefire​​​ #ikilleajjubhai94​​​ #ajjubhai​​​ #totalgaming​​​ # #Totalgamer​​​ #ajjubhaitotalgaming​​​ #Totalgamingfreefire​​​ #ajjubhaifreefire​​​ #ajjubhai94​​​ #totalgaming​​​ #Sath​​​ ##Ajjubhai​​​ #ajjubhai94​​​ #factoryfreefire​​​ #freefireindia​​​ #Bussgaming​​​ #Bussgamingfreefire​​​ #freefirefactory​​​ #totalgamingvideo​​​ #totalgamingfreefire​​​ #totalgaminglive​​​ #swamff​​​ #prankfreefire​​​ #9yearboyprank​​​ #prankon9yearboy​​​ #djalok​​​ #cryingmomentfreefire​​​ #djalokfreefire​​​ #freedjalok​​​ #howtogetdjalok​​​ #howtohackfreefirediamonds​​​ #diamondhacker​​​ #djalokhacker​​​ #FreeFire​​​ #pkgamers​​​ #FistFight​​​ #djaloklive​​​ #djalokgiveaway​​​ #freedjalok​​​ #djalokingold​​​#djalokfreefire​​​ #freedjalokforeveryone​​​ freedjalok #howtogetfreedjalok​​​ #boyaskmefordjalok​​​ #Totalgaming​​​ #Desigamers​​​ #ajjubhai94​​​ #freefiredjalok​​​ #djalokgiveawaylive​​​ #garenafreefiregiveaway​​​ #frediamondstrick​​​ #totalgamingvideo​​​ #freefirevideo​​​ #garenafreefire​​​ #Totalgamer​​​ #ajjubhaitotalgaming​​​ #Totalgamingfreefire​​​ #ajjubhaifreefire​​​ #ajjubhai94​​​ #totalgaming​​​ #totalgamingfreefire​​​ #desigamerfreefire​​​ #asgaming​​​#Ajjubhai​​​ #ajjubhai94​​​ #factoryfreefire​​​ #freefireindia​​​ #1v1withmysubscriber​​​dj alok free mein kaise le free fire,dj alok ko free mein kaise le,#freedjalok2020​​​ #freedjaloktrikes​​​#freediamondstrick​​​#freediamondsfreefire2020​​​#freediamondhackfreefire​​​dj alok character free mein kaise le,#garenafreefire​​​ #gift​​​##howtogetfreedjalokcharcterinfreefire​​​#getfreedjalokcharecterinfreefire​​​#howtogetdjalokcharcteringoldinfreefire​​​#freefiredjalokingoldcoins​​​#freefirefreedjalokcharcterinfrefire​​​#howtogetfreedaimondsinfreefire​​​ #djalokhack​​​#howtogetfreedjalok​​​#howtogetfreediamonds​​​#howtogetfreediamonds​​​#totalgamingnewvideo​​​#desigamersfreefire​​​#whygamenotopeinigfreefire​​​#djalokfreefirevideo​​​#freefirecryingmoment​​​#djalokforeveryone​​​#djalokgiveaway​​​#djalokgiveaway​​​#howtogetdjalok​​​#djalokgiveaway​​​#prank​​​ in clash squad and give dj Alok #1 :- How To Get Dj Alok Character In Free2 :- How To Get Dj Alok Character In Gold3 :- How To Get Alok Character In Free4 :- How To Get Free Dj Alok Character5 :- Get Free Dj Alok Character In Free Fire#titaniumgamer​​​ #garenafreefire​​​ #gift​​​#giftformysubscriberfreefire​​​About video :-How to climb truck on factory roof / factory पर truck चढ़ा दिया / Free fire tips and tricksHow to climb truck on factory roof / factory पर truck चढ़ा दिया / Free fire tips and tricksFree Fire best sniping place - FF fist fight in factory booyah /factory roof king [Garena free fire]Free Fire Factory King"
"iL9qtsrVfck","#BTS #방탄소년단 'Yet To Come (The Most Beautiful Moment)' Official Teaser - 뷔 (V)","2022-06-08T15:00:08Z","UC3IZKseVpdzPSBaWxBxundA","HYBE LABELS","10","22.11.06","HYBE|HYBE LABELS|하이브|하이브레이블즈","5394049","1338211","27379","https://i.ytimg.com/vi/iL9qtsrVfck/default.jpg","Proof 2022.06.10. 1PM KST | 0AM ET BIGHIT MUSIC. Rights are reserved selectively in the video. Unauthorized reproduction is a violation of applicable laws. Manufactured by BIGHIT MUSIC, Seoul, Korea.Connect with BTS: https://ibighit.com/bts http://twitter.com/BTS_bighithttp://twitter.com/BTS_twt http://www.facebook.com/bangtan.official https://www.youtube.com/user/BANGTANTV http://instagram.com/BTS.bighitofficial https://channels.vlive.tv/FE619 https://www.tiktok.com/@bts_official_bighithttps://weverse.onelink.me/qt3S/94808190https://www.weibo.com/BTSbighithttps://www.weibo.com/BTSmembers http://i.youku.com/btsofficial http://btsblog.ibighit.com#YetToCome #BTS_Proof #TheMostBeautifulMoment"
"TXp4sUDMQz8","കല്യാണം കഴിക്കാൻ പുരുഷന്മാർ ഇല്ലാത്ത ഗ്രാമം","2022-06-09T13:30:11Z","UCD1qhnwbkg9bf5TOx3IM4mQ","yaseen vlogs","22","22.11.06","[none]","195842","5626","457","https://i.ytimg.com/vi/TXp4sUDMQz8/default.jpg","Download CashKaro App- https://cashk.app.link/zNLe2vHxGqbDownload CashKaro from the link above and get ₹25 instantlyOR Download the CashKaro app from the Playstore or the App Store and use refer code –  YASEEN25 to get the ₹25 signup bonus! GIVEAWAY RULES:1. Join CashKaro from the link /code 2. Make any transaction"
"fkPtrRAJzhA","What to do when people judge you ?","2022-06-10T13:25:47Z","UCmXZxX_qexEZxhb5_vQKPCw","Aman Dhattarwal","24","22.11.06","[none]","281194","40532","257","https://i.ytimg.com/vi/fkPtrRAJzhA/default.jpg",""
"5mc6PizVwoY","Tom and Jerry (Jerry &Mom) Part 27 #shorts","2022-06-10T07:31:00Z","UCL5nlHWXVLeOsSjKH2fhmsg","KL BRO Biju Rithvik","24","22.11.06","#shorts|#kl bro biju rithvik","1743897","104021","0","https://i.ytimg.com/vi/5mc6PizVwoY/default.jpg","#shorts #klbrobijurithvik"
"VzOUwM4Wf1Q","Short Highlights | Pakistan vs West Indies | 1st ODI 2022 | PCB | M12T","2022-06-08T21:32:34Z","UCiWrjBhlICf_L_RK5y6Vrxw","Pakistan Cricket","17","22.11.06","Full Highlights|Pakistan|West Indies|Pakistan vs West Indies Match|Pakistan vs West Indies Live|Pakistan vs West Indies ODI|Pakistan vs West Indies 1st ODI 2022|Pakistan Batting|Pakistan Bowling|West Indies Batting|West Indies Bowling|Pakistan vs West Indies Highlights|Pakistan Batting highlights|West Indies Batting Highlights|Pakistan vs West Indies|West Indies vs Pakistan|1st ODI 2022","1046622","26800","945","https://i.ytimg.com/vi/VzOUwM4Wf1Q/default.jpg","Short Highlights | Pakistan vs West Indies | 1st ODI 2022 | PCB | M12T#PAKvWI | #KhelAbhiBaqiHai An inspiring tale of resilience and determination 🙌: https://youtu.be/9_uMJocfma4Buy official Pakistan Cricket merchandise:https://shop.pcb.com.pk/Welcome to the official page of Pakistan Cricket Board. Get all your Pakistan Cricket updates here!You can access exclusive player interviews, match highlights, practice sessions, press conferences, coaching videos and other beyond-the-boundary content.Subscribe to our YouTube channel:https://bit.ly/SubscribePakistanCricketLike us on Facebook:https://www.facebook.com/PakistanCricketBoardVisit our website: https://www.pcb.com.pk/"
"duyIpSeaWeM","SIMAR DORRAHA : NASHEDI AKHAN (Official Video) | DEEPAK DHILLON | Latest New Punjabi Songs 2022","2022-06-07T05:13:09Z","UCLYucD1lBugdk6xPXlwgKsQ","URBAN PENDU RECORDS","10","22.11.06","Nashedi akhan latest punjabi songs 2022|Latest punjabi songs 2022 nashedi akhan|Nashedi akhan new punjabi songs 2022|New punjabi songs 2022 nashedi akhan|Simar dorraha latest punjabi songs 2022|Latest punjabi songs 2022 simar dorraha|Simar dorraha new punjabi songs 2022|New punjabi songs 2022 simar dorraha","1632081","50647","2170","https://i.ytimg.com/vi/duyIpSeaWeM/default.jpg","Urban Pendu Records & Kartik Skater presents Song- Nashedi AkhanSinger-Simar Dorraha & Deepak DhillonLyrics- Simar DorrahaMusic: RakaMix/Master: Hardeep PandherProducer: Kartik Skater , Aman Madahar & Gaurav AnjaanGta Video:  Birring Productionshttps://www.instagram.com/birringproductions/Lyrics:Tainu Tension a kahdi Jihada Akiya tu RehnaBacha Bacha Janda a Jihada Dakiya tu Rehna.Main ta bhalla hi bass chauni a teraVe Ja ta Nashe Patte Chad de Ja Chad tu sath Jatta Mera ____2Sari Duniya nu Pata Meri ki Kahani teri Soh lage mainu jama jhuth na tu Jani_2Nashe chad te Rakane main ta sareNi Akhan Ne Nashedi MeriyaMera koi na kasoor mutiyare ni Akhan ne Nashediyan meriya __2Soh tu Jhuthiyan tu KhaveMera kar le yakeenVe Tu high Rehna BahlaPaira Thale A JameenTere Bare Kita PataSidha Mere Kolo PuchCheck Pocketa KrwaiTainu labhna ni kuchTere Jahe Tahi Rehnde Ne KuwareNi Akhan Ne Nashedi MeriyaNi Mera koi na kasoor mutiyare Ni Akhan Ne Nashediyan meriya __2Hun Akha Kato BandRati Suta Ni RakaneMera Manna ni BappuKato Launi a BahaneKine Sal Ho Gye SofiLoki Jhuth Ta Nahi Kehnde.Kine Dasiya E tainuJihade Tere Nal RehndeBanda Dass Mutiyare Mainu KeraVe Ja Nashe Patte Chad de Ja Chad tu sath Jatt Mera ____2Tera Nam BadnamMashoor a RakaneKithe Painda e DorahaBadi Door a RakaneTera Pindo Kita PataSale Lagde Ne LokiTainu Lagda SimarFad Mar da ni fokiSach Bolde ve launa Kato LareNi Akhan ne Nashedi MeriyaNi Mera koi na kasoor mutiyare Ni Akhan Nashediyan meriya __2Copyrights - Urban Pendu  Records Facebook -  https://fb.com/UrbanPendurecordsInstagram - https://www.instagram.com/urban_pendu...Subscribe Us For More Videos - http://bit.ly/UrbanPenduRecordsCompany Contact :  +919501114600(Kartik)"
"IjePbP4dpc8","Golu vs chinki 😆 #shorts #comedy #aslimonaofficial","2022-06-06T08:30:02Z","UCkaMZOILqfN5EYmQM0MmkIQ","Asli Mona Official","23","22.11.06","[none]","7764591","510530","0","https://i.ytimg.com/vi/IjePbP4dpc8/default.jpg","Golu vs chinki 😆Love You All YouTube Family❤️Keep Supporting✌🏻Like,Comments,Share & Subscribe ➡️ Asli Mona Official For daily updates Follow me on Instagram 👇🏻👇🏻Asli mona singh : https://instagram.com/aslimonasingh?utm_medium=copy_link"
"ORul3SjO23Q","माँ 😭 || A Story Of True Love || #shorts","2022-06-06T09:07:15Z","UClT9y_afOfhgG5pxluFOvOw","shuaib011","24","22.11.06","shorts|short|youtubeshorts|shortsyoutube|humanity video|heart touching video|emotional video|emotions video|maa love|maa","5444790","633799","1183","https://i.ytimg.com/vi/ORul3SjO23Q/default.jpg","I hope you will Enjoy This Video.If you do, then do Like, Share, Comment and Subscribe For More Entertaining Videos.This video is made under personal choice of Interest. If you have any suggestions for this video, please put them in the comments below......#shorts #short #youtubeshorts #shortsyoutube #humanity #maa #maalove #truestory #emotional #emotions"
"A4KuahaqdWo","Alright! | Date With Senior | EP 4 | Long Distance Relationship | Ft. Parikshit, Kanikka & Tithi","2022-06-10T10:05:14Z","UCCKjHsAIxvjtWG8KOcLuG8Q","Alright!","24","22.11.06","alright|rusk media|date with senior|lying to your partner|tithi raaj|parikshit joshi|date with office senior|tithi raaj new web series|dating senior|dating video|parikshit joshi web series|Tithi raaj new video|college romance|the alright squad|filtercopy|girlfriend|timeliners|the dice media|couples|Kanikka Kapur|kanikka kapur new serial|office ka pyar alright|entertainment|tvf|relationship|date with senior episode 4|long distance relationship","512501","30863","747","https://i.ytimg.com/vi/A4KuahaqdWo/default.jpg","Alright in association with Skinnsi and Jupiter present Date With Senior -  Long Distance Relationship starring Parikshit, Kanikka, Tithi Raaj, and HarshPal.#Datewithsenior  #Entertainment  #DatingVideos #ParikshitJoshi #KanikkaKapoor #TithiRaajIf you wish to have smooth skin, no hassles of frequent parlor visits, a painless experience, and an entire treatment backed by dermats, then book your appointment with skinnsi now. Click on the link below and use the Coupon code RUSK35 to get a flat 35% off on Skinnsi’s Laser hair reduction service. Check out Skinnsi.in - https://just.skinnsi.in/3NLqVfbJupiter Pro is the Salary account offering from Jupiter, a banking app for the NOW generation. With a Jupiter Pro salary account, you can get On Demand Salary, where you can withdraw your salary basis the number of days you’ve worked, any day of the month. To avail this and other great offers, download the Jupiter app here! – Download Jupiter App here - https://jptr.onelink.me/TOMp/6yvhzbrbConnect with #theAlrightSquad hereFB: https://www.facebook.com/TheAlrightSquadIG: https://www.instagram.com/thealrightsquad/Check out our latest playlist: https://www.youtube.com/playlist?list=PL6JPnhhI175lIVAlfnHy1vR0hlXTseAdJBuy our official MERCH here: https://bit.ly/3ezUDnt  👈  😍Follow our actors hereParikshit Joshi: https://www.instagram.com/parikshitjoshi_/?hl=enTithi Raaj: https://www.instagram.com/tithiraaj/?hl=enKanikka Kapur: https://instagram.com/kanikkakapur?utm_medium=copy_linkHarsh Singh: https://www.instagram.com/absurd_sard/?hl=enAlright is a part of Rusk Media. At Rusk, we believe that conversations in #India are best transformed into path-breaking ideas over a cup of steaming hot chai! If you wish to watch entertainment videos, dating videos, and new episodes of Date with senior, you must watch Alright’s new video Long distance relationship. This new video stars Parikshit Joshi, Kanikka Kapur, and Tithi Raaj is perfect to watch as a couple and crush. The Alright Squad has been successful in creating Hindi entertainment videos that deal with the day-to-day life struggles of every Indian middle-class #family and the romance of #couples. Be it a relationship with your father, a fight that happens between every dadi and Nani, or thoughts that couples go through while dating or on their #honeymoon, we have been successful in depicting the real-life problems of every Indian family. Alright is your one-stop shop for when you're looking for some Hindi entertainment comic relief in life? When life gets too hard and you need to lighten the mood, tune into Alright. Date with senior episode 4  Long distance relationship starring Parikshit Joshi, Kanikka Kapur, and Tithi Raaj is perfect to watch as a couple and crush. The #funnyvideos and sketch Hindi comedy on Alright will have you smiling in no time at all. #trendingvideos2022 #viralvideos2022 #ComedyVideos"
