video_id,title,publishedAt,channelId,channelTitle,categoryId,trending_date,tags,view_count,likes,comment_count,thumbnail_link,description
"bX6P5KyW1Mw","ONDC to break the monopoly Of Large E-Commerce Firms? Effect on Amazon, Flipkart I UPSC GS-3 Economy","2022-05-16T15:00:10Z","UCrC8mOqJQpoB7NuIMKIS6rQ","Study IQ education","27","22.18.05","studyiq|study iq|Open Network for Digital Commerce|Open Network for Digital Commerce upi based platform|reliance retail|e-commers monopoly|reliance vs amazon|ecommerce|ecommerce business|ondc|online business|what is ondc|what is ondc platform|ondc ecommerce|ondc india|ondc platform news|digital commerce|open network|startup india|digital marketing|digital business|online sales|flipkart vs Open Network for Digital Commerce|amazon market in India","690389","21733","379","https://i.ytimg.com/vi/bX6P5KyW1Mw/default.jpg","Buy StudyIQ's Smart Courses at very affordable price. Get 40% Discount an all the Smart Courses, Only for our YouTube viewers. Use Coupon code YT40 Download the App - https://bit.ly/StudyIQAPPVisit Website - www.studyiq.comWhatsapp Support for all your queriues - http://wa.me/917703861353UPSC Foundation Course - Must have course to CRACK UPSC CSE ExamUPSC/IAS (Pre + Mains) - https://bit.ly/3rlSN0GFeatures of the GS Foundation Module2500+ videos given in a Structured Manner5000+ Topic, Subtopic & Subject wise MCQs Comprehensive Study material like Lecture Notes, Snippets, Quizzes, PPT & Current affairs updates with every video. Daily & Monthly Current Affairs updatesRegular Mains Answer WritingWeekly Live Doubts Solving Session cum MentorshipCourse also includes SIP (Success in Prelims)SIP module starts every year in January targeting only CSE Prelims This module is designed to Crack CSE Prelims in Short & Precise Manner All GS Subjects will get finished in 360 Hours only.1500 MCQs throughout the course Click here https://bit.ly/3rlSN0G to subscribe todayGaurav Sir Courses - One-Stop Solution for Current Affairs of all Government Exams.Gaurav Sir Current Affairs                                                   https://bit.ly/3jwDRsvComplete Static GK by Dr. Gaurav Garg                         https://bit.ly/3O0FaxEBanking Awareness (Static) by Dr Gaurav Garg             https://bit.ly/36dElAIVipan Sir Courses - Courses to help you gain an edge with MCQs preparation10000 MCQs of GA by Vipan Sir                                        https://bit.ly/367qqMiGS - Dr. Vipan Goyal                                                                   https://bit.ly/3vbslbn5000+ MCQs for BPSC (Bihar GK + India GS)                  https://bit.ly/3uCr9Pe5000+ MCQs for OPSC (Odisha GK + India GS)               https://bit.ly/37gtVR55000+ MCQs for UPPSC (UP GK + India GS)                   https://bit.ly/3JB7fZa5000+ MCQs for MPPSC (MP GK + India GS)                  https://bit.ly/3rnyy2OState PSCs State Courses cover the syllabus end to end including all Static and Current topics in depth. In static portion, special focus has been given to Polity, Economy, Geography and History.Current affairs which form the backbone of the exam are regularly updated.Click here to know more https://bit.ly/3ET2nxu  Judiciary ExamsComprehesive coverage of syllabus of state judiciary exams with personalised support and answer writing practice.Click here to know more: https://bit.ly/3xQign3 UPSC OptionalsOptionals can make or break your chances to get selected for exams.Click here to know more: https://bit.ly/3k6LCFE SSC Exams https://bit.ly/3viQk9A Banking & Insurance https://bit.ly/3OBGQhs Defense Exams https://bit.ly/3keznHl RBI & SEBI Exams https://bit.ly/3xWgmBp Railways Exams https://bit.ly/3xWlLZ1 SSC JE Exams https://bit.ly/3KoPRXQDMRC Exams https://bit.ly/38qSWt0 GATE Exams https://bit.ly/3KlCeZB Professional Courses https://bit.ly/38rfYQwNABARD and Agri Exams https://bit.ly/3LgTv7oUGC Net https://bit.ly/3EOgO6h#StudyIQ_Smart_Courses #Affordable_Education #Download_App"
"IKLyKsDvyEg","The Pro Player 😂😂 #comedy #shorts","2022-05-15T06:35:00Z","UCNLLgtPIKew9vHNVAQmdVGQ","VENDY YADUWANSHI","24","22.18.05","[none]","1470837","169022","151","https://i.ytimg.com/vi/IKLyKsDvyEg/default.jpg",""
"9FQTE3qdg5E","5 Billion Celebration With Family 😍","2022-05-16T02:30:01Z","UCjvgGbPPn-FgYeguc5nxG4A","Sourav Joshi Vlogs","22","22.18.05","sourav joshi|sourav joshi vlog|sourav joshi arts|vlog|vlogs|daily vlogger|daily vlogs|lifestyle vlogs|funny vlogs|family vlogs|travel videos|ps5 vlog|ps5 game|unboxing ps5|finally bought ps5","5505659","595053","21168","https://i.ytimg.com/vi/9FQTE3qdg5E/default.jpg","Follow me on Instagram- https://www.instagram.com/souravjoshivlogs/?hl=en I hope you enjoyed this videohit likes.And do subscribe to my channelThank you so much for watchinggod bless you all.lots of  ❤️( For Collaboration - officialsouravjoshivlogs@gmail.com"
"5WeseXWeS1c","Our Indian Wedding | Dhruv x Juli","2022-05-13T14:59:55Z","UCjNgqJ_FMLntYVzq7daw1TQ","Dhruv Rathee Vlogs","22","22.18.05","Dhruv rathee|Dhruv Rathee vlogs|Dhruv Rathee vlog|vlog|Dhruv Rathee girlfriend|dhruv|rathee|travel|travel vlog|indian vlogger|flying beast|Europe travel|Europe trip|Tourism|indian wedding|european wedding|Dhruv Rathee marriage|dhruv Juli wedding|haldi function|haldi ceremony|indogerman couple|indian white couple|indian white marriage|interracial relationship|indogerman|foreign bhabhi","2880388","144376","13276","https://i.ytimg.com/vi/5WeseXWeS1c/default.jpg","A small vlog of all four functions of our Indian wedding. After India opened up its borders for tourists again, Juli's family flew all the way from Germany to attend celebrations in India. We had the most wonderful days celebrating with our loved ones and will cherish this memory forever. Hope you enjoy it :) Join my Course: https://nasacademy.com/dhruvNote: There's a 33% Discount for first 1000 people. It is automatically applied if you are among the first 1000 people to purchase it. Subscribe for more such videos!---------------------------------------------------- LISTEN TO MY PODCAST: Learn about how India works, only on Maha Bharat with Dhruv Rathee: https://spoti.fi/3IhBW51MY FAVOURITE EQUIPMENT: 🎥 Studio Camera: https://amzn.to/2McQ8Vs🔎 Studio Camera Lens: https://amzn.to/365fYSs📸 Vlogging Camera: https://amzn.to/2Y6hoaP🥢 Vlogging Tripod: https://amzn.to/2KKdcuq🎙 Podcast Mic: https://amzn.to/3qLPkpq📖 MY FAVOURITE BOOKS: Sapiens - https://amzn.to/38QX56dHomo Deus - https://amzn.to/3o1nzIBMahatma Gandhi - https://amzn.to/3n5fQYNJuli’s Hindi Learning Book - https://amzn.to/3bhAcvxINSTAGRAM:🙋🏼‍♀️ Follow Juli: https://instagram.com/juli_lbr🙋🏻‍♂️ Follow Dhruv: http://www.instagram.com/dhruvrathee YOUTUBE CHANNELS:▶️ Main Channel: http://www.youtube.com/dhruvrathee 🎦 Vlog Channel: http://www.youtube.com/dhruvratheevlogs----------------------------------------------------"
"ef-oBQagE0c","THAT മണ്ടൻ 🤪","2022-05-16T09:34:08Z","UCLa-ASLMIpWEOlZsJ4_CLUg","Akhil Nrd","22","22.18.05","[none]","1249746","183140","228","https://i.ytimg.com/vi/ef-oBQagE0c/default.jpg",""
"0z-CBnbc0Jk","Tom and Jerry (Anu& Rithvi) Part 7 #shorts","2022-05-16T07:31:01Z","UCL5nlHWXVLeOsSjKH2fhmsg","KL BRO Biju Rithvik","24","22.18.05","#kl bro biju rithvik|#shorts","2196141","135579","0","https://i.ytimg.com/vi/0z-CBnbc0Jk/default.jpg","#shorts #klbrobijurithvik"
"ErUvfzxXIQE","MY GANGSTER MERCEDES C-CLASS MODIFICATIONS | A QUICK LEG WORKOUT | SEHAJ ZAILDAR","2022-05-16T08:30:05Z","UCZNI_S7xTn5w6evaKQGA59g","Sehaj Zaildar","22","22.18.05","mercedes|mercedes c class|mercedes modification|mercedes price|mercedes second hand price|mercedes c class review|mercedes e class|mercedes s class|mercedes c 63|mercedes alloy wheel|mercedes maybach|mercedes car|sehaj zaildar new vlog|sehaj zaildar reels|sehaj zaildar leg workout|best leg workout|leg workout for beginners|leg workout in gym|leg workout with dumbbells|leg workout motivation|modified mercedes|gangster mercedes|mafia mercedes|benz|gym","175025","16347","614","https://i.ytimg.com/vi/ErUvfzxXIQE/default.jpg","I hope you guys liked the video. If yes then give this video a big thumbs up. Okay Comment down your suggestions about the video. Also share this video with your friends. Don’t forget to subscribe the channel and press the bell icon to stay updated. Buy Bigmuscles Nutrition Essential EAA from the links belowWebsite: https://bit.ly/3umnROIAmazon: https://amzn.to/3wuFGxuFind Me On :Instagram -  http://Instagram.com/sehaj.zaildarSnapchat - https://www.snapchat.com/add/sehajzaildar1 Email for Promotions or Collaborations - sehajzaildarbusiness@gmail.comKeep Loving. Keep Supporting #sehajzaildar #mercedes #cclass Peace Out ✌🏻"
"M9l2XOkOTos","Filmymoji || Middle Class Madhu || Theertha yatra Final Episode || Teerani Yatra || MCM","2022-05-15T14:07:08Z","UCjNVDW-rkDYR0aOKp3E-2wg","Filmymoji","24","22.18.05","Filmymoji Middle Class Madhu Theertha yatra|filmymoji middle class madhu|middle class madhu|filmymoji|mcm|filmymoji telugu|filmymoji comedy|filmy moji|filmymoji middle class madhu latest episode|filmymoji middle class madhu latest|filmymoji madhu|middleclassmadhu comedy|filmymoji latest episode|filmymoji new episode|filmymoji comedy videos in telugu|filmymoji comedy video|filmymoji comedy episodes|Teerani Yatra|Final Episode|vijayawada|durgamma songs|Yatra","2273920","171112","5393","https://i.ytimg.com/vi/M9l2XOkOTos/default.jpg","Filmymoji || Middle Class Madhu || Theertha yatra Final Episode || Teerani Yatra || MCMRegister yourself on Relevel : https://relvl.co/8hfzBe a Part of our FILMYMOJI Family :- https://linktr.ee/filmymojiFilmymoji releases its final and biggest episode of Teertha Yatra Series where 1A master, Middle class Madhu and Naatu Guntala gang and their families are all fitted tightly into one sumo by the driver. Once they get down to have Darsanam of Lord Shiva in Srikalahasthi which would have got it’s name from a Spider, Snake and an elephant offering prayers to the idol. Meanwhile Middle class Madhu tries to have a secret conversation with his girlfriend Komali taking an idea from Mekujuttu Mahesh. All of them meets the violent TT in the train who kicks them out of the train as the travel agent wouldn’t have prebooked tickets in a hurry. Again the agent takes them to Vijayawada in a passenger train. Madhu, Mahesh and 1A master gets their horoscope told by a computerised Robo Raju which reveals about a very hopeless day for our 1A master. Watch the full episode to find out whether Middle class Madhu succeeds in expressing his love for Komali and whether the robot’s prediction on 1A master future comes true.👇👇👇👇👇Follow Our Team On Instagram For More Updates👇👇👇👇👇Filmymoji :- https://instagram.com/filmymoji?igshid=YmMyMTA2M2Y=Written & Directed by (Saikiran Andaluri) :- https://instagram.com/saikiranandaluri?igshid=YmMyMTA2M2Y=Co-Writers (Varun venum):- https://instagram.com/varun_venum?igshid=YmMyMTA2M2Y=Producer (karthick Reddy Chirra0 :- https://instagram.com/karthickchirra?igshid=YmMyMTA2M2Y=Middle Class Madhu (Saikiran Andaluri) :- https://instagram.com/saikiranandaluri?igshid=YmMyMTA2M2Y=Macchaleni Mahesh (Naveen Varma) :- https://instagram.com/naveen_varma_siruvuri?igshid=YmMyMTA2M2Y=Mother (Swathi Kotu Chirra) :- https://instagram.com/chocobudsbuddy?igshid=YmMyMTA2M2Y=Edit & Sound Design (Susmitha Chari):- https://instagram.com/miss_graphical?igshid=YmMyMTA2M2Y=     Associate Editor:- https://instagram.com/kethineediaishwarya?igshid=YmMyMTA2M2Y=VFX (Nagendra Kolli):- https://instagram.com/nagiawesome?igshid=YmMyMTA2M2Y=        (Sanjay):- https://instagram.com/sansakolli?igshid=YmMyMTA2M2Y=#TheerthaYatra #Filmymoji #MCM #MiddleClassMadhu #Family #FilmymojiTeluguComedy #TeluguComedy #FinalEpisode #TeluguFunnyVideos #FilmymojiVideos #Tirupati #OotyTrip #Ooty #TirumalaExpress #Summer #trip #ComedySeries ----------------------------------------------------------------------------------------Our Social Media:► Filmymiji Youtube @ https://goo.gl/zP7gQe► Twitter @ https://goo.gl/TYXbWa► Facebook @ https://goo.gl/8zXu6e► Instagram @ https://goo.gl/oghEhh----------------------------------------------------------------------------------------Stay tuned for more Fun and cuteness every day"
"rJk9BmoaTko","Dooola Teerindi 😬 Biryani 🥘 Part 3 #melodymocktail #teluguvlogsfromusa #telugucomedy #nri #usa","2022-05-14T03:39:24Z","UCmQkxAxAdKSj2U_a3RvV97A","Melody Mocktail","24","22.18.05","[none]","613191","61362","273","https://i.ytimg.com/vi/rJk9BmoaTko/default.jpg",""
"ugJoBwnq2RM","NEW! Taarak Mehta Ka Ooltah Chashmah - Ep 3460 - 17 May 2022 - Teaser","2022-05-17T15:30:19Z","UC6-F5tO8uklgE9Zy8IvbdFw","Sony SAB","24","22.18.05","तारक मेहता|Ooltah Chashmah|sab tv channel|sab tv serials|taarak mehta latest episodes|taarak mehta ka ooltah chashmah|hindi comedy show|sab tv funny show|taarak mehta ka ulta chashma|taarak new episode|hindi tv serial|ulta chashma|tarak mehta ka ultah chashma|taarak full episode|jethalal|babita|champak chacha|anjali bhabhi|tapusena|comedy show|taarak mehta ep 3460|jethalal funny|indian comedy shows|taarak mehta|tmkoc funniest episode ever|Bhide|tmkoc","903007","14453","455","https://i.ytimg.com/vi/ugJoBwnq2RM/default.jpg","Click here to watch the full episode of Taarak Mehta Ka Ooltah Chashmah:https://www.sonyliv.com/dplnk?schema=sony://asset/1000171409Click here to subscribe to SAB TV: https://www.youtube.com/channel/UC6-F5tO8uklgE9Zy8IvbdFw?sub_confirmation=1Click here to subscribe to SonyLIV: http://www.sonyliv.com/signinEpisode 3460: Popatlal In Yellow Attire---------------------------------------------------------In today's episode of Taarak Mehta Ka Ooltah Chashma, everybody is ready in yellow attire and awaits Popatlal. Besides, Popatlal comes downwards in yellow attire with a bouquet full of yellow flowers. Also, he takes the blessing of Champaklal. Hence, everyone praises Popatlal. Popatlal tells Bhide to take his Sakharam and we both will go on Sakharam. Stay tuned and watch the full episode.Show Name – Taarak Mehta Ka Ooltah ChashmahStar Cast –  Dilip Joshi, Disha Vakani, Amit Bhatt, Raj AnankatEpisodes No - 3460, 17 May  2022Produced By - Asit Kumar Modi#TaarakMehtaKaOoltahChashmah #तारकमेहताकाउल्टाचश्मा #SABAbout The Show----------------------------------------------------------------------The show is inspired by the famous humorous column 'Duniya Ne Undha Chasma' written by the eminent Gujarati writer Mr. Tarak Mehta. This story evolves around happenings in Gokuldham Co-operative Society and covers topical issues that are socially relevant. The show predominantly - revolves around 'Jethalaal' (Dilip Joshi) who is an uneducated Gujarati businessman. Your 'Taarak Mehta' (Sailesh Lodha), is his neighbor. 'Jethalaal' finds a friend and philosopher in 'Taarak Mehta' and often goes to him for advice whenever he is in trouble. Jethalaal's family includes his simpleton wife 'Daya Ben' (Disha Wakani) and a mischievous son 'Tapu' (Raj Anankat). Tapu is a menace and a constant source of trouble to all the members of Gokuldham. They have often warned 'Jethalaal' to reform 'Tapu' or else be prepared to leave the premises.NEW! Taarak Mehta Ka Ooltah Chashmah - Ep 3460 - 17 May 2022 - Teaser"
"MQnrlaUIGho","Playing RCB v MI - The Ultimate IPL Battle | SlayyPop","2022-05-13T13:30:10Z","UCSfxFZFzcpYMbOB3A1rWHAg","SlayyPop","20","22.18.05","mumbai indians|royal challengers bangalore|ipl|slayy point|slayypop|cricket game|funny game|abhyudaya|gautami","1862528","157062","4570","https://i.ytimg.com/vi/MQnrlaUIGho/default.jpg","Playing IPL in Cricket 22.Instagram -  @Abhyudaya_Mohan & @GautamiKawalehttps://www.instagram.com/abhyudaya_mohan/https://www.instagram.com/gautamikawale/SlayyPop videos edited by - Kshitij"
"H_zCTBc6Z8g","Bagha is No More in Minecraft .. R.I.P Bagha 😭😭| Carry depie","2022-05-13T06:55:29Z","UClqifC6Nd7v-IfTqce4k62A","Carry Depie","20","22.18.05","minecraft|minecraft java edition|minecraft hindi gameplay|minecraft bedrock|mythpat minecraft|andreobee minecraft|epicdipic minecraft|chapati hindustani gamer minecraft|techno gamerz minecraft|beastboyshub minecraft|live insaan minecraft|minecraft tiktok hack|hindustani gamer loggy minecraft|herobrine smp|carry depie|carry depie new video|proboiz 95 minecraft|jethiya|carry dipic|babuji|giant alex|chapati bhai|bagha in minecraft|bagha minecraft|herobrine","1613475","40255","1633","https://i.ytimg.com/vi/H_zCTBc6Z8g/default.jpg","in this video bagha is no more in minecraft....✔️Business Email : umairq7850@gmail.com✔️ Instagram:- https://www.instagram.com/carrydepieVoice Recorder :- Redmi Note 9 ProEdited By:- Adobe Premiere Pro#minecraft#carrydepie#chapatihindustanigamer"
"qmET7InFpJc","HIMLANDS - WIZARD VS SMARTYPIE | Minecraft [S-4 part 6]","2022-05-14T06:30:05Z","UCZ9lCUhUOUrwqVJmfBkN92A","YesSmartyPie","20","22.18.05","Yes smarty pie|SmartyPie|Smarty pie|YesSmartyPie Minecraft|yessmartypie himlands|yessmartypie himlands new video|revenge from friends in Minecraft|revenge|YesSmartyPie revenge|YesSmartyPie revenge series|my friends Minecraft hindi|friends revenge series|himland new video|hogalalla vs yessmartypie|my friends minecraft hindi|HIMLANDS WIZARD|himlands season 4|himlands last video|himlands s3 last video|himlands season 4 ep 6|wizard vs smartypie in himlands","2853226","294889","29345","https://i.ytimg.com/vi/qmET7InFpJc/default.jpg","#Minecraft #HimlandsPrevious Episode ~ https://youtu.be/plXR3uE9dWEHIMLANDS - WIZARD VS SMARTYPIE | Minecraft [S-4 part 6]Follow me on Instagram ~ https://www.instagram.com/hitesh.khangtaVlog Channel ~Hitesh Khangta Vlogs ~ https://www.youtube.com/channel/UCwCk4ZRlwu5mX_i_CckcWvwYesSmartyPie Shorts ~https://youtube.com/channel/UCjWM0iY1NoLJE4MHwy2J9QgFollow me on Loco ~ https://loco.onelink.me/65Kg/YesSmartyPieOPBecome a Channel Member for some extra benefits 😁.https://www.youtube.com/channel/UCZ9lCUhUOUrwqVJmfBkN92A/joinDiscord link ~ https://discord.gg/Hc5x6vDB7ZGame Name - MinecraftMusic in Background ~ By Kevin MacLeod & Epidemic Soundsif you see this ~ comment #YesSmartyPie"
"6MNdFX-nCIs","Tha Pathukalaam... | VIKRAM trailer details exposed | Kamal Haasan | Lokesh Kanagaraj | Open Pannaa","2022-05-15T16:06:45Z","UCtjXR5FGh735EEtn5PoyYNg","Open Pannaa","1","22.18.05","vikram trailer|vikram trailer reaction|vikram trailer review|vikram official trailer|vikram|vikram kamal movie|vikram title teaser|vikram trailer tamil|kamal haasan vikram title teaser|vikram movie trailer|vikram kamal haasan title teaser|vikram 2020 movie|vikram official trailer hindi|vikram official trailer reaction|vikram 2022 trailer|vikram trailer in hindi|vikram trailer release date|vikram official trailer review|vikram songs|fahad fasil|vjs","139161","6236","278","https://i.ytimg.com/vi/6MNdFX-nCIs/default.jpg","Follow Us www.facebook.com/openpannaawww.twitter.com/openpannaawww.instagram.com/openpannaa"
"ouK24rbiEmE","If Job Was A Person | Funcho","2022-05-14T16:15:28Z","UCB_l9j53BhS-UNxXO4y282A","Funcho","23","22.18.05","funcho|funny videos|viral videos|comedy videos|sketch comedy|indian funny videos|funyy viral videos|indians funny|dhruv & shyam|daily fun videos|indians funny videos|indians vines|vines funnny|comedy vines|shyam sharma|dhruv shah|if job was a person|job as human|job funny video|office funny video","1040353","94978","2831","https://i.ytimg.com/vi/ouK24rbiEmE/default.jpg","Aap bhi apna career Sarthak ki tarah bana sakte hai, register on Relevel: https://relvl.co/8550What if we treat Job as a human! What if we treat him as a friend? As a partner? As a companion?To answer all these questions we made this video and we hope we answered them correctly 😂Subscribe our channel and we’ll see you in our next video.Subscribe to our 2nd channel - @Dhruv & Shyam for BTS,  Vlogs & more..Follow us on Instagram - Shyam Sharma - https://www.instagram.com/shyam_sharma/Dhruv Shah - https://www.instagram.com/shahdhruv1994/https://www.instagram.com/funcho/Follow the team - Nishit Shah - https://www.instagram.com/shahnishit08/DOP -Prathamesh Vyas - https://www.instagram.com/pratham_vyas/Editor -Zenith Sandil - https://www.instagram.com/zenith_sandil/In this video: Dhruv Shah, Shyam Sharma, Nishit Shah, Zenith Sandil#Funcho #BachiegangFor business inquires, mail us at - funcho@nofiltr.social"
