video_id,title,publishedAt,channelId,channelTitle,categoryId,trending_date,tags,view_count,likes,comment_count,thumbnail_link,description
"dJpyEqNUfNw","ഇതുപോലെ ചെയ്തിട്ടുണ്ടോ 😁🤭 #shorts #malayalamshorts #lockdowncomedy #kaarthikshankar","2022-05-14T05:01:47Z","UCXuzoZKMoRjISfcy7N8Lv4Q","Kaarthik Shankar","24","22.18.05","[none]","1253550","79015","231","https://i.ytimg.com/vi/dJpyEqNUfNw/default.jpg",""
"q07YBMx9kH4","Best Braces Snack - Skittles Edition!! #shorts","2022-05-14T11:15:05Z","UC7u9o8BHiJyH2_cef_nC7tQ","Dental Digest","22","22.18.05","[none]","6731191","327289","468","https://i.ytimg.com/vi/q07YBMx9kH4/default.jpg","Let’s Find Out Which Snacks Are Approved For Braces!? Sour Patch Jell-O / Squishy Skittles / Giant Frozen SkittlesSmile On :)#FaTGLoB #dentaldigest #Braces #sour #badbreath #toothbrush #dental #teeth #asmr #satisfying #disclosingtablets #disclosingtime #YouTube #sourpatch #skittles"
"oLBUoSzOM1E","कोर्ट में मुझे पहले एक बुलेट प्रूफ जैकेट और हेलमेट दिया जाए | Tada | Sadashiv Amrapurkar Funny Scene","2022-05-17T11:49:23Z","UCw6qK47Hh_Mhy1ubt4DeASw","Filmy Duniya","1","22.18.05","TADA HD SCENE|dharmendra ki movie|tada film dharmendra|dharmendra action film|dharmendra movie scene|tada movie dharmendra|rami reddy dialogues|rami reddy best scenes|tada movie scene|tada movie rami reddy|dharmendra movies|rami reddy hindi movie|tada movie|tada hindi movie dharmendra","119832","618","22","https://i.ytimg.com/vi/oLBUoSzOM1E/default.jpg","कोर्ट में मुझे पहले एक बुलेट प्रूफ जैकेड और हेलमेट दिया जाए | Tada | Sadashiv Amrapurkar Funny SceneTada is a Hindi action drama film of Bollywood directed by Shisir P. Mishra and it stars Dharmendra, Sharad Kapoor, Rami Reddy, Mukesh Khanna and Sadashiv Amrapurkar in lead roles.#Dharmendra #MukeshKhanna #FilmyDuniya"
"p9aPPQhWOrg","#VIDEO | #Khesari Lal Yadav | दुरे रही राजा जी | #Raksha Gupta | Dure Rahi Raja Ji | New Song 2022","2022-05-14T01:00:19Z","UCJfeUWkrU4JwIJfP-usd-_w","Khesari Music World","10","22.18.05","khesari lal yadav|dure rahi raja ji|दुरे रही राजा जी|Khesari lal yadav new song|Khesari lal yadav ka naya gana|Khesari lal bhojpuri song|Khesari lal yadav bhojpuri song|Khesari lal ka gana|Khesari lal ka bhojpuri song|Khesari lal|Bhojpuri song|Bhojpuri gana|New bhojpuri song|Khesari lal song|Khesari lal gana|Khesari lal Raksha Gupta|Khesari lal naya gana|Khesari lal new bhojpuri song 2022|Khesari music world","2861295","174868","14725","https://i.ytimg.com/vi/p9aPPQhWOrg/default.jpg","Subscribe Now:-  https://goo.gl/j2d2ThIf you like Bhojpuri song, Bhojpuri full film and bhojpuri movie songs, Subscribe Now:- https://goo.gl/j2d2ThVisit our website to download our songs and videos: http://www.khesarientertainment.inLike Us On Facebook - https://www.facebook.com/khesarimusicworld/Make your ♪♪REELS♪♪ :- https://www.instagram.com/reels/audio/543250714027709/♪ Album :- Dure Rahi Raja Ji♪ Song :- Dure Rahi Raja Ji♪ Singer :- Khesari Lal Yadav♪ Lyrics :- Akhilesh Kashyap, Santosh Raja♪ Music :- AB Gupta♪ Video Director :- Ashish Satyarthi♪ D.O.P :- Sahil Ji♪ Editor :- Prabhat♪ D.I :- Rohit Singh♪ Choreographer :- Anuj Maurya♪ Digital Partner :- Global Music Junction Pvt. Ltd.♪ Company/Label - Khesari Music World♪ Listen to your trending star Khesari Lal Yadav latest song on all OTT Stores  ♪♪ WYNK :- https://wynk.in/u/sW8r7tktA♪ Resso :- https://m.resso.com/ZSd9UXQ7o/♪ Apple Music :- https://music.apple.com/us/album/dure-rahi-raja-ji-feat-raksha-gupta/1624031326?i=1624031501♪ Amazon Music :- https://music.amazon.in/albums/B0B18SM6GW?marketplaceId=A21TJRUUN4KGV&musicTerritory=IN&ref=dm_sh_ZNBy3qQJbyFnlMRzZHu2s3EQt♪ Spotify :- https://open.spotify.com/album/5PBHNYQkBwMQfRmDpNpzLG?si=uIRiC6huTQOZdWfm38UYbwGaana :- https://gaana.com/song/duri-rahi-raja-jiJioSaavn :- https://www.jiosaavn.com/song/duri-rahi-raja-ji/PDEEQS10fn0"
"0ujZo5_XBMA","Teri Jatti: Kaur B (Official Video) | New Punjabi Song 2022 | T-Series","2022-05-16T05:30:18Z","UCcvNYxWXR_5TjVK7cSCdW-g","T-Series Apna Punjab","10","22.18.05","new punjabi song 2022|punjabi songs|punjabi songs new|punjabi songs latest|punjabi|latest punjabi songs 2022|latest punjabi songs|new punjabi songs|latest punjabi song|punjabi song|new punjabi song|songs|tseries|tseries songs|tseries punjabi songs|punjabi song 2022|punjabi songs 2022|teri jatti|teri jatti kaur b|kaur b|kaur b new song|kaur b song|kaur b songs|kaur b all song|jatti|gabru|marde kayi gabru ve|black virus|bablu sodhi","2237868","27524","769","https://i.ytimg.com/vi/0ujZo5_XBMA/default.jpg","Presenting official video of our New Punjabi Song  Teri Jatti  by Kaur B in which music is given by Black Virus & the lyrics of this latest punjabi song are penned by Bablu Sodhi.#NewPunjabiSong2022 #Kaurb #TeriJatti #PunjabiSongs #LatestPunjabiSongs #PunjabiSong2022 #LatestPunjabiSongs2022 #NewPunjabiSongs2022 #tseries ♪Full Song Available on♪ JioSaavn: https://bit.ly/3FPrfHhSpotify: https://spoti.fi/3FPrFgPHungama: https://bit.ly/3yzdQRYGaana: https://bit.ly/3FPrfHhApple Music: https://apple.co/3sCJqufWynk: https://bit.ly/38toYVPiTunes: https://apple.co/3le86oJCheck Out The Playlists of Your Favourite Artists here :Ranjit Bawa SuperHits - https://bit.ly/3xIltoLShivjot SuperHits - https://bit.ly/3vA07XYSharry Mann SuperHits - https://bit.ly/3Ov0g7vBabbu Maan SuperHits - https://bit.ly/3OFlCiSHarsimran SuperHits - https://bit.ly/3rImqd0♪Song: Teri Jatti♪Singer: Kaur B♪Music: Black Virus♪Lyrics/Composer: Bablu Sodhi♪Video: Dimple Bhullar♪Music Label: T-Series---------------------------------------------------------------Connect with T-SERIES APNAPUNJAB----------------------------------------------------------------For Latest Punjabi video's and songs stay connected with us!! SUBSCRIBE - http://www.youtube.com/tseriesapnapunjabLIKE US - http://www.facebook.com/tseriesapnapunjabInstagram - https://www.instagram.com/tseriesapnapunjabofficial"
"qGwfYVqhw80","Time for Celebrations 🎉 | Prateek Rathee","2022-05-17T04:30:08Z","UCTcTU9JvQEKKRCdwQiZlB_w","Prateek Rathee","22","22.18.05","[none]","189694","9996","239","https://i.ytimg.com/vi/qGwfYVqhw80/default.jpg","Real Estate Course: https://gateway.homezop.com/Early Bird Offer: Don't Miss OutHomezop Channel: shorturl.at/buTU0My Instagram: https://instagram.com/prateekrathee | @prateekratheeIn this video You'll learn how to i make money and about my sources of income/earning. My Real Estate Course: https://gateway.homezop.com/I am Prateek Rathee an Entrepreneur based out of Gurugram Delhi. I am also the founder and creator at https://Homezop.com and a Civil Engineer.I love sharing the knowledge that I have accumulated in the past 9 years of being in business and scaling multiple successful bootstrapped and funded companies. So, People around me call the Man on a Mission // Soccer Maniac // Find me in Meditations & practicing Yoga in my free time, I am an avid Travel Enthusiast and a keen follower and preacher of The Lean movement and processes of doing business."
"GRTIfDI6Xlw","ICE - CREAM KA  मौसम || Shaitan Rahul","2022-05-17T05:55:33Z","UC30iCxYezu_WlEbjpOVZdUA","Shaitan Rahul","24","22.18.05","ICE - CREAM KA मौसम|comedyvideo|fun masti|icecream|garmi|shaitanrahul|shivamdikro|the shivam|tejasvibachani|rachitrojha|jarvish|dog|youtube|trending","151498","2426","89","https://i.ytimg.com/vi/GRTIfDI6Xlw/default.jpg","Thanks for watching this video.Keep supporting.💖🙏🏻Please share this video with your family and friends.💖Don't forget to like,comment,share And Subscribe My Channel And Also Click Notification Bell.🔔Cast:-Shaitan Rahul :- https://instagram.com/shaitan_rahul?i​​​...Shivam DikroTejasvi BachaniJarvish ( Dog )MilanManish ModiJaduThumbnail By:- Raj Sharma DOP:- Manish ModiWritten By:- Tejasvi bachaniEdit :- Milan,Shaitan Rahul#ICECREAMKAमौसम  #ComedyVideo #ShaitanRahul"
"f5XFGnPfBMU","[Hindi] Round 4 - Day 3 | iQOO BMOC Powered By Loco","2022-05-14T17:59:12Z","UCe31NPEeRGO0hcznx6Tdb-g","BATTLEGROUNDS MOBILE INDIA","20","22.18.05","BATTLEGROUNDS MOBILE INDIA|BATTLEGROUNDSMOBILEINDIA|BATTLEGROUNDS MOBILE|BATTLEGROUNDS|BATTLEGROUNDS MOBILE INDIA OFFICIAL CHANNEL|BATTLEGROUNDS MOBILE INDIA YOUTUBE|BGMI|BATTLEGROUNDS MOBILE INDIA Release date|BATTLEGROUNDS MOBILE INDIA Teaser","2245067","97943","1049","https://i.ytimg.com/vi/f5XFGnPfBMU/default.jpg","Are the challengers giving a hard time to the pros?Official broadcast of Round 4 - Day 3 of iQOO BMOC Powered By Loco.Schedule for the day:05:12 PM - Erangel05:53 PM - Miramar06:41 PM - Sanhok07:33 PM - Erangel08:22 PM - Miramar09:03 PM - ErangelDownload LOCO now!: https://loco.onelink.me/65Kg/BGMIYTC*Contest T&C - https://bit.ly/3stR9e1Be sure to also follow us on:iQOO Esports - https://www.instagram.com/iqooesports/Loco Facebook: https://www.facebook.com/getloconow Loco Instagram: https://www.instagram.com/getloconow/ Loco Twitter: https://twitter.com/getloconowBGMI YouTube: https://www.youtube.com/channel/UCe31NPEeRGO0hcznx6Tdb-g BGMI Esports: https://www.youtube.com/channel/UCugG6-k5QGbq_iDEPAnG4NQ Facebook: https://www.facebook.com/BattlegroundsMobileIN BGMI Instagram: https://www.instagram.com/battlegroundsmobilein_official/ BGMI Esports Instagram: https://instagram.com/bgmiofficial_esports?utm_medium=copy_link Website: https://esports.battlegroundsmobileindia.com #CHALLENGEEVERYTHING #BATTLEGROUNDSMOBILEINDIA #INDIAKABATTLEGROUNDS #INDIAKAGAME #PLAYNOW #BMOC #BGMI #iQOO #getloconow"
"PmU9TvBVA4Q","Padisham- one of the most requested word.","2022-05-15T02:52:11Z","UC8qPi_UNRTEFaTabpzOrFOA","That Telugu family vlogs","22","22.18.05","[none]","1131618","69186","586","https://i.ytimg.com/vi/PmU9TvBVA4Q/default.jpg",""
"BmQeDhYvqxs","Minecraft Village VS 1000 Evokers😱| Minecraft Hindi","2022-05-15T07:42:42Z","UC3iZua_igo3KkTYPtpGRDtg","MineFlux","20","22.18.05","minecraft|minecraft hindi|techno gamerz|minecraft world record|yessmartypie|yessmartypie manhunt|yes smarty|live insaan minecraft|mr gamer|mrgamerjay|pro boize 95|proboiz 95|proboiz|minecraft defense system|techno gamerz minecraft","449280","34804","421","https://i.ytimg.com/vi/BmQeDhYvqxs/default.jpg","today in this video i am going to protect minecraft village from 1000 evokers#minecraft #minecrafthindi #minecraftpocketedition #minecraftjavaedition"
"7OYy695Sayc","Kabhi aisa hua apke sath?😂😁 choona lg gaya😂 #shorts","2022-05-13T12:06:13Z","UCXTyWqKtLLzaom6XwaJu7xw","Salman Noman","24","22.18.05","[none]","17054481","1135952","537","https://i.ytimg.com/vi/7OYy695Sayc/default.jpg",""
"oVOBEb9UAp4","Reel Moment Real ஆனா எப்டி இருக்கும்?😍 | #Shorts | Sidhu & Shreya","2022-05-12T12:30:21Z","UCdgV1sW_G6-OgnxWVY_Y77A","Sidhu & Shreya","24","22.18.05","sidhu shreya|sidhu shreya shorts|sidhu shreya youtube channel|sidhu shreya channel|sidhu shreya vlogs|shreya anchan|sidhu shreya latest videos|sidhu vijay tv|sidhu shreya latest|cute couple sidhu shreya|shreya sidhu|sidhu shreya anchan|sidhu and shreya|sidhu shreya couple|couple goals|sidhu shreya shorts video|cute couples|ad shoot|pregnant|pregnancy|couple shorts|trending|trending shorts|fun shorts|shorts video|fav couple|favourite couple|cute|yt","3862117","150824","432","https://i.ytimg.com/vi/oVOBEb9UAp4/default.jpg","Here's a little sneak peek of our latest Ad shooting that will excite you to know more. Watch the favorite BTS of our Ad shoot in this video.#SidhuShreya #Shorts #Sidhu #Shreya #AdShoot______________________________________Follow Us on Instagram:Sidhu: https://instagram.com/sidhu_sid_official?utm_medium=copy_linkShreya: https://instagram.com/shreyaanchan_official?utm_medium=copy_link______________________________________In Association with DIVO - Digital PartnerWebsite   - http://web.divo.in/Instagram - https://www.instagram.com/divomovies/Facebook  - http://www.facebook.com/divomoviesTwitter   - https://twitter.com/divomovies"
"jAsxtJ1jpGU","Chaddi Gang | Part 2 | Vinayak Mali | Agri Koli Comedy","2022-05-14T03:19:10Z","UCSB-L3HN2tJoizsxR45vUFQ","Vinayak Mali","22","22.18.05","[none]","1070240","59897","1589","https://i.ytimg.com/vi/jAsxtJ1jpGU/default.jpg","All the characters in this video are fictional The story is also fictional Part 1 link https://www.youtube.com/watch?v=zAA9fmbok_YCameramanVikrant MumbaikarmusicGajar Tujha Morya - Official Song | Rohit Raut | Sachin Kamble | Kunal - Karan | Ganapati Song 2021https://www.youtube.com/watch?v=5OQEb...Armutya | Official Song | Vinayak Mali | Nagesh Morvekar, J-SUBODH | Kunal Karanhttps://www.youtube.com/watch?v=JIhjcq1hqNUCastRaju bholeSirin thombareRam shilotresujit raikarganesh takpirvaibhav chaudharisandeep patilJoy  pragati josisunaina raam shilotrereshma shelepreeti gharatsadanand mhatre sirprabhakar patil sirvasudev mhatrekalmaakar patilrohit patilg bha lilabai patilminakshi patilग,भा,गंगुबाई पाटीलramkrushna patilharsh taresagar mohitegaurav rathorrohit patil shubham patilchiraag patiljinesh patilom patildeep madhviyash patiltanmay patilkunaal patilsagar patilharesh patilnishant patiluday patilvinay kenipraful daivihilkarlokesh vadgharchandrakant nivas ,sarpanch shushma jalander patiltai bai nivas, sunder gauru patillakshuman s ,patilThumbnail byabhi creation managing team Kamlaakar patilHarsh mhatreMayur madhviomkar swamirohanother musicamit phuloreakshay patilViren patilDj owns LocationBhiwandi"
"ulhTHA8bEF4","Injured Prank on yashi 😨","2022-05-17T07:30:14Z","UC15EM1xKwmLdwr8L04s17vw","Suyash Vlogs","22","22.18.05","suraj pal singh|yashi tank|suyash|suyash vlogs|daily vlogs|daily vlogging|couple vlogs|couple goals|family vlogs|friends vlog|prank|injured prank|prank on gf|prank on friends","418442","47351","1094","https://i.ytimg.com/vi/ulhTHA8bEF4/default.jpg","Thank you Suyash Family for all your love and support ❤️🙏 Suyash fashion - https://youtu.be/eqco5FEbgm8 ''Your Attire is our Prior! Shop our collection - https://suyashfashion.comFollow Suyash clothing on Instagram - https://instagram.com/suyashclothing?utm_medium=copy_linkFollow us on instagram   Yashi - https://openonapp.com/insta/HXTZ9L Suraj pal singh  - https://openonapp.com/insta/9Z8R2RSuyash vlogslakhneet vlogslakhneettraveltravel vlogsomg vlogs"
"BqCgxe5AH-M","Hi","2022-05-16T17:00:19Z","UCAov2BBv1ZJav0c_yHEciAw","Samay Raina","20","22.18.05","samay raina|samay raina comedy|samay raina chess|standup comedy|comedy|trending|samay funny|samay|comicstaan|streaming chess|chess|chess funny","274997","27806","703","https://i.ytimg.com/vi/BqCgxe5AH-M/default.jpg","Join my Subreddit: https://www.reddit.com/r/SamayRaina/MERCH: https://www.redwolf.in/samay-rainaBECOME DIAMOND MEMBER HERE: https://go.chess.com/samayJOIN MY CLUB: https://www.chess.com/club/samay-raina-officialJoin this channel to get access to perks:https://www.youtube.com/channel/UCAov2BBv1ZJav0c_yHEciAw/joinAmbani OP Patreon link: https://www.patreon.com/samayraina?fan_landing=trueFollow me on instagramhttps://www.instagram.com/maisamayhoon/Join my discord:https://discord.gg/maisamayhoon-----------------------------------------------------------------------------------------------------------------------------------Use my code SAMAY2021 for 20% off at Mamaearth  Check out Mamaearth's Onion Range : https://bit.ly/3tLHDSeCheck out Mamaearth's Rice Range :  https://bit.ly/2RYQyBKDownload the Mamaearth App : https://bit.ly/3e6GMGe"
"dO6RFlcc75c","Pura Din Kharab KarDiya TATA Walo Ne 😕","2022-05-16T03:00:08Z","UCrBV4KLmgBJ9CbOW5BpYTBA","Anshu Bisht Vlogs","22","22.18.05","Gamerfleet|Vlogs|Daily vlogging|Sourav joshi vlog|Piyush joshi|Anshu bisht|NOtGamerFleet|Delhi vlog|Mumbai vlog|Travel|Car vlog|Tata harrier|Moto vlog|New video|Herobrine smp|Daily Vlog|Travelling Vlog|New car|New house|mumbai shoot|essex delhi|techno gamerz car|techno gamerz real life|tata service center","787605","69475","1475","https://i.ytimg.com/vi/dO6RFlcc75c/default.jpg","Thank you so much for watching, Don't forget to Subscribe Okkie ❤️️🤗Instagram: https://www.instagram.com/gamerfleetog/🤗Streaming Channel: https://www.youtube.com/c/GamerFleet❤️️Gaming Channel: https://www.youtube.com/c/anshubisht❤️️Our Own Discord Server! : https://discord.gg/gamerfleet🤗Twitter: https://twitter.com/GamerFleetOG❤️️Facebook: ​https://www.facebook.com/GamerFleetOG"
"EbbdJsUYFVw","Na Birthday lolli | Akhil Jackson","2022-05-16T06:35:09Z","UCm96d4-ZUg2kwDV-JB93Hmw","Akhil Jackson Vines","24","22.18.05","Summer Season Ochesindhi|Na Pelli Lolli|akhil jackson comedy|akhil jackson vines|akhil jackson kids online class|akhil jackson|akhil videos|akhil new videos|akhil jackson videos|akhil comedy|akhil jackson kids|trending|akhil jackson latest videos|kids online class|dhayam cinema chusthe?|guppedantha manasu serial|mehndi designs|english rhymes|Ammo Intlo Dhayam|Modern Mommy Vs Mana Mommy|Thondara Padaku Sundara Vadhana|Na Birthday Lolli|dance|telugufunny","492788","30003","1791","https://i.ytimg.com/vi/EbbdJsUYFVw/default.jpg","#akhiljackson #akhiljacksonvines #nabirthdaylolliNa birthday celebrations video chusi enjoy enjoy cheyyandi idhi appudu manam friends andharam kalisi into celebrate chesthe entha fun untadho same anthe fun untadhi video chusaka."
"FP3wJH6gSBg","Pandian Stores - Baakiyalakshmi | Maga Sangamam - Promo","2022-05-14T14:22:51Z","UCvrhwpnp2DHYQ1CbXby9ypQ","Vijay Television","24","22.18.05","Comedy Show|Redefining Entertainment|Star|Star Vijay TV|Stree Buster Show|Tamil Shows|Tamil TV|Thamizhum Saraswathiyum|Vijay|Vijay TV|டிவி|தமிழ்|தொலைக்காட்சி|விஜய்","4880768","102315","1423","https://i.ytimg.com/vi/FP3wJH6gSBg/default.jpg","#PandianStores #Baakiyalakshmi #MagaSangamam #NewFiction #VijayTV #VijayTelevision #StarVijayTV #StarVijay #TamilTV  பாண்டியன் ஸ்டோர்ஸ் - பாக்கியலட்சுமி மகா சங்கமம் திங்கள் - சனி வரை இரவு 8 மணிக்கு நம்ம விஜய் டிவில.."
"IpaeGwcdF88","ആണും പെണ്ണും എന്ന വേർതിരിവ് ആദ്യം മാറേണ്ടത് വീട്ടിൽ നിന്നാണ്.... #shorts","2022-05-13T10:30:03Z","UC71fc__9LvohNOAnT5g4s8w","Vishnu Porkulam","24","22.18.05","[none]","1921315","219547","1093","https://i.ytimg.com/vi/IpaeGwcdF88/default.jpg",""
"d2iQL3tzyI0","Limboda Limboda  || Effects Of Limbu Bhav Vadharo - kamineyfrendzz Comedy Video","2022-05-15T13:41:07Z","UCaIttCdoMRliuXajByIbUxQ","Kaminey Frendzz","23","22.18.05","gujrati|comedy|video|kaminey|frendzz","204116","28296","640","https://i.ytimg.com/vi/d2iQL3tzyI0/default.jpg","Download Junglee Rummy app and Get Rs 8850 Welcome Bonus - https://jrum.my/VTvHkSubscribe to the Telegram Channel for regular offers and updates - https://t.me/junglee_rummy Subscribe to their Youtube Channel to know all the updates - https://www.youtube.com/channel/UCx1MdTBer_z79REx6EKyOVQThumbnail - GE EDIThttps://instagram.com/ivimal_p?igshid=YmMyMTA2M2Y=Click to Subscribe - https://bit.ly/2zzFMFeFollow us on :FaceBook : https://www.facebook.com/kamineyFrendzz/Instagram : https://www.instagram.com/kaminey_frendzz/Google+ : https://plus.google.com/109504742227443883101#KamineyFrendzz #KF Managed & Powered by - Apricot Media & EntertainmentFor any query - info@apricotentertainment.com niravpatel@apricotentertainement.comFacebook - https://www.facebook.com/apricotmediaentertainment/Do Comment Like Share & Subscribe My official Channel."
"S8Fc7282fHA","Shataan ladka🤣🤣 / comedy / shorts #comedy #funny #shorts #ashortaday","2022-05-13T16:06:44Z","UCatY6oDkDTWQhDoxrcG_62g","Sam Sharma TBC","24","22.18.05","[none]","1978501","189682","61","https://i.ytimg.com/vi/S8Fc7282fHA/default.jpg",""
"eJG-_-joGcA","അങ്ങനെ അമ്മയോടൊപ്പം ഞാനും ഡാൻസ് കളിച്ചു | Diamond Couples","2022-05-14T05:22:59Z","UCjebeDgtmv4Ogg1dlmoJG_A","Diamond Couples","22","22.18.05","[none]","801559","35624","174","https://i.ytimg.com/vi/eJG-_-joGcA/default.jpg",""
"D2fGtAzEC-Y","Rishtey A Grand Celebration | New Hindi Dubbed Movie 2022 | Naga Chaitanya, Rakul Preet Singh","2022-05-11T14:30:02Z","UC3ar28GS6o1p0m_wabfk2zw","Pen Movies","1","22.18.05","Rishtey A Grand Celebration full movie|Rishtey A Grand Celebration new hindi dubbed movie|Rishtey A Grand Celebration movie hindi dubbed|Rarandoi Veduka Chudham|Rarandoi Veduka Chudham full movie|Rarandoi Veduka Chudham trailer|Rarandoi Veduka Chudham movies songs|Naga Chaitanya movies|Naga Chaitanya hindi dubbed movies|Rakul Preet Singh movieds Rakul Preet Singh south movies|rishtey a grand celebration hindi dubbed movie","11707011","196467","3841","https://i.ytimg.com/vi/D2fGtAzEC-Y/default.jpg","Rishtey A Grand Celebration | New Hindi Dubbed Movie 2022 | Naga Chaitanya, Rakul Preet SinghA young woman, who dreams of marrying a prince, falls in love with a charming man from another village. However, an old family rivalry resurfaces and becomes an obstacle in their relationship.#RishteyAGrandCelebration #NagaChaitanya #RakulPreetSingh #RarandoiVedukaChudhamEnjoy Super Hit 4K Movies Collection :- Pralay The Destroyer:  https://youtu.be/Tmd__luCPu0Aravind Sametha:  https://youtu.be/4jtbe0I1e1cTholi Prema:  https://youtu.be/J4nBcaYMuI4For your favorite Bollywood Movies, Subscribe now: http://bit.ly/2VXistYSUBSCRIBE for the best Bollywood clips, movies and scenes all in your PEN Multiplex channel http://bit.ly/2QxELp3For your favorite Gujarati Movies, Subscribe now: http://bit.ly/2VZm9Q6For Action-Packed Movies, Click on the below link now...Pen Action: http://bit.ly/2XaSS6tDownload our App for latest news & gossips: http://bit.ly/2HHJstALog On To Our Official Website: http://penindia.in/Enjoy & stay connected with us! Like us on Facebook: https://www.facebook.com/PenMoviesFollow us on Twitter: https://twitter.com/penmoviesFollow us on Instagram: https://www.instagram.com/penmovies"
