video_id,title,publishedAt,channelId,channelTitle,categoryId,trending_date,tags,view_count,likes,comment_count,thumbnail_link,description
"Ho5Pcn3ZJN8","अनजान रिश्ता 😞 #sadstory #ytshorts #shorts","2022-05-16T04:30:06Z","UCYJeN7hmAnHfSjv03kjcMyQ","shagun style","22","22.16.05","[none]","2336186","107897","175","https://i.ytimg.com/vi/Ho5Pcn3ZJN8/default.jpg",""
"SI33Za-CiE4","I DESTROYED JIMMY'S SUPERCAR | GTA V GAMEPLAY #145","2022-05-16T03:30:04Z","UCX8pnu3DYUnx8qy8V_c6oHg","Techno Gamerz","20","22.16.05","GTA|GTA 5|GTA ONLINE|PC|gta 5 gameplay|gta v hindi gameplay|gta 5 funny moments|gta 5 wins|gta 5 lamborghini|gta 5 stealing supercar|gta 5 stunts|gta 5 thug life|grand theft auto v|gta v online|gta 5|gta 5 epic moments|gta v funny moments|awesome gta 5 stunts|best moments|aj gaming|arish khan|hindustan gamer|chapati hindustani gamer|techno gamerz","7305636","850040","35906","https://i.ytimg.com/vi/SI33Za-CiE4/default.jpg","I DESTROYED JIMMY'S SUPER | GTA V GAMEPLAY #145#145 #GTA5 #TechnoGamerzSubscribe to our Second YouTube Channel: https://www.youtube.com/c/UjjwalGamerShare, Support, Subscribe!!!Subscribe: http://bit.ly/technogamerzDiscord : https://bit.ly/ujjwaldiscordYoutube: https://www.youtube.com/c/TechnoGamerzOfficialTwitter:  https://www.twitter.com/ujjwalgamerFacebook: https://www.facebook.com/technogamerzFacebook Myself: https://www.facebook.com/ujjwalgamerInstagram: https://instagram.com/ujjwalgamerGoogle Plus: https://plus.google.com/+TechnoGamerzOfficialWebsite: https://technogamerz.in/Merchandise: https://shop.technogamerz.in/Business Email : technogamerzofficial@gmail.comAbout : Techno Gamerz is a YouTube Channel, where you will find gaming videos in Hindi, I hope this video was Useful and you liked it, if you did press the thumbs up button."
"tfPXf3xf2zE","तलाक़😭 #motivation #inspiration #emotional","2022-05-15T14:00:47Z","UCN4NflpHqLeHQZ91kTUVCBw","Ishaan Ali 11","22","22.16.05","[none]","3392168","233337","508","https://i.ytimg.com/vi/tfPXf3xf2zE/default.jpg",""
"OKBMCL-frPU","VIKRAM - Official Trailer | Kamal Haasan | VijaySethupathi, FahadhFaasil | LokeshKanagaraj | Anirudh","2022-05-15T14:30:04Z","UCn4rEMqKtwBQ6-oEwbd4PcA","Sony Music South","10","22.16.05","Sony Music South|Sony Music|Latest Song|Tamil song|Tamil Latest Song|Tamil Latest Songs 2020|Tamil Latest Songs 2021|Latest songs in Tamil|Songs in Tamil|Latest Tamil Movies|Tamil Movie Songs|Latest Video Songs Tamil|latest Tamil Love Songs|Latest Tamil Hit Songs|Telugu Songs 2021|New Tamil Songs|Songs in Telugu|Telugu Movie Songs|Video Songs Telugu|new Telugu Songs","14938722","985790","41411","https://i.ytimg.com/vi/OKBMCL-frPU/default.jpg","#VikramTrailer #VikramAudioLaunch #VikramInAction #VIKRAM WORLDWIDE THEATRICAL RELEASE ON JUNE 3RD. Movie : VIKRAM Starring: Kamal Haasan, Vijay Sethupathi, Fahadh Faasil. Banner: Raaj Kamal films International Produced by : Kamal Haasan & R.Mahendran Written & Directed by Lokesh Kanagaraj Music: Anirudh Ravichander Cinematographer: Girish Gangadharan Action: Anbariv Editor: Philomin Raj Dance Choreography: Sandy Art Direction: N. Sathees Kumar Costume designers: Pallavi Singh, V.Sai, Kavitha.J Make-Up: Sasi Kumar Dialogue Writer: Rathna Kumar ,Lokesh Kanagaraj PRO: Diamond Babu Stills: G.Anand Kumar Publicity Designer: Gopi Prasannaa Sound Designer: SYNC Cinemas Sound Mixer :Kannan Ganapat VFX: UNIFI Media, VFX Phantom, Real Works Studio DI: IGENE Production Controller: M.Senthil Associate Director: Magesh Balasubramaniam, Santhosh Krishnan, Sathya, Venki, Vishnu Edavan, Madras Logi Vignesh. Making Video Edit : P.Sarath Kumar Digital Marketing : Pulse Executive Producer: S.DisneyComposed, Arranged & Programmed by Anirudh Ravichander Electric & Acoustic Guitar - Keba Jeremiah Bass Guitar - Naveen Napier Keyboard, Synth & Rhythm Programmed by Anirudh Ravichander Additional Rhythm Programmed by Kalyan & Krishna Kishor Music Advisor – Ananthakrrishnan Creative Consultant - Sajith Satya Recorded at Albuquerque Records, Chennai. Engineered by Srinivasan M, Shivakiran S Mixed & Mastered by Vinay Sridhar & Srinivasan M at Albuquerque Records, Chennai Music Co Ordinator - Velavan B Music Label - Sony Music Entertainment India Pvt. Ltd.© 2022 Sony Music Entertainment India Pvt. Ltd.Subscribe Now: http://bit.ly/SonyMusicSouthVevoSubscribe Now: http://bit.ly/SonyMusicSouthYTFollow us: https://www.instagram.com/sonymusic_south/Follow us: Twitter: https://twitter.com/SonyMusicSouthLike us: Facebook: https://www.facebook.com/SonyMusicSouth"
"LCfAzjciLf4","Adam Becomes a Don and Alok Wants to do deal with him 😂 #shorts","2022-05-14T06:15:00Z","UCx99som_I27iPKCde2FqDsA","Fearless Man FF","20","22.16.05","[none]","7678658","958210","1869","https://i.ytimg.com/vi/LCfAzjciLf4/default.jpg",""
"6xoB4ZiKKn0","THE LAST RIDE - Offical Video |  Sidhu Moose Wala | Wazir Patar","2022-05-15T12:30:13Z","UC9ChdqQRCaZmTCwSJ49tcbw","Sidhu Moose Wala","10","22.16.05","sidhu moosewala|sidhu moosewala latest song|sidhu moosewala leaked songs|sidhu moosewala official videos|sidhu moosewala official song|latest punjabi song 2020","2637174","313370","50929","https://i.ytimg.com/vi/6xoB4ZiKKn0/default.jpg","Song : The Last RideSinger, Lyricist : Sidhu Moose WalaMusic: Wazir PatarMix, Master: DenseVideo : Gurjant PanesarSpecial Thanks : Rubbal GTR Digital Powered by: One Digital EntertainmentLabel : Sidhu Moose Wala   Also Available on :- Spotify -https://spoti.fi/3ldSEckJioSaavn - https://bit.ly/3lfV3DniTunes - https://apple.co/3FUhDebApple Music :- https://apple.co/3FUhDebResso - https://bit.ly/3PrgPlAGaana - https://bit.ly/39rjxXmAmazon Music -https://amzn.to/3MhpjcZHungama - https://bit.ly/3NiaS8AYT Music - https://bit.ly/3MgmbhpWynk Music - https://bit.ly/3NljyepAnghami - https://bit.ly/3yGEKaIDeezer - https://bit.ly/3Lhfb2uAudioMack - https://bit.ly/3yIMrwSBoomplay - https://bit.ly/3yzmnV0This Is Official Channel Of Punjabi Singer SIDHU MOOSE WALA This Channel is Made For Live Video And Other Events Broadcast, V LogsDo Subscribe & Be A Part Of My Life - https://bit.ly/SidhuMooseWalaSubscribeEnjoy And Stay Connected With Artist || SIDHU MOOSE WALAClick to Subscribe - https://bit.ly/SidhuMooseWalaSubscribeTwitter - https://www.twitter.com/iSidhuMooseWalaFacebook - https://www.facebook.com/SidhuMooseWalaInstagram - https://instagram.com/Sidhu_MooseWalaSnapChat - https://www.snapchat.com/add/SidhuShubh"
"6WhhywlTVC0","Wakt wakt ki baat h 😎🔥 #shorts #bewafa","2022-05-10T02:30:19Z","UC5apxzE3aEOpvP0XkeuW8mw","Bobby chourasiya","22","22.16.05","[none]","114421534","7629091","11750","https://i.ytimg.com/vi/6WhhywlTVC0/default.jpg",""
"BzLqCr2U3EY","രണ്ട് കോടിയുടെ പുതിയ വീട് basheeer bashi |New house warming |Masterpiece vlog","2022-05-15T15:13:59Z","UCLgQX_z0TnOCyUqSyhdTb8w","MasterPiece Vlog","27","22.16.05","basheeer bashi|basheeer bashi New house warming|new house warming basheeer bashi|Suhana world|Suhana Basheer|Mashura Basheer|Masterpiece|basheeer bashi New","1178274","22564","1493","https://i.ytimg.com/vi/BzLqCr2U3EY/default.jpg",""
"JMjdaiMmKvk","The Warriorr Teaser (Telugu) | Ram Pothineni, Krithi Shetty | DSP | Lingusamy","2022-05-14T12:01:14Z","UCNApqoVYJbYSrni4YsbXzyQ","Aditya Music","10","22.16.05","The Warriorr Teaser (Telugu)|Ram Pothineni|Krithi Shetty|DSP|Lingusamy|ram pothineni|krithi shetty|the warrior trailer|the warrior movie|the warrior movie teaser|the warrior trailer ram|the warrior|the warrior ram pothineni|the warriorr teaser|warrior|the warrior trailer telugu|the warrior full movie|the warrior release date|the warrior movie telugu trailer|ram pothineni movies telugu|new movie trailers telugu|ram pothineni birthday|new trailers telugu","11559427","306341","6492","https://i.ytimg.com/vi/JMjdaiMmKvk/default.jpg","Watch & Enjoy The Warriorr Teaser (Telugu).#TheWarrior #RamPothineni #KrithiShetty CASTRam Pothineni Aadhi Pinnishetty Krithi Shetty Akshara Gowda Nadhiya MoiduCREWProducer: Srinivasaa Chitturi Presents: Pavan Kumar Banner: Srinivasa Silver ScreenDirector: N. Lingusamy Music Director: Devi Sri PrasadCinematography: Sujith Vassudev Editor: Navin Nooli Production Design: DY Sathya NarayanaProduction controller: Radha Krishnan JDi: Annapurna studiosColorist: Vivek Costume Design: Deepali, Harmann Kaur, Ashwin, Srinu TadalaStillls: Venkatnaidu MurariCo-Directors: Kanagu Sabapathy, Satyam BellamkondaManagers: Sathya Narayanan, Sravan Kumar Goud, SriramAccountant: Siva Direction Team: Santhosh, Suseendhiram Ravi, Madhu, Prabu, Vishnu Ram, Murali Krishna, Bharath, Galla Ramesh, Bharath Seeni, Rajesh, Harish Chief Associate Cinematographer: Sarvanan Associate Cinematographer: Kannan, Udhai Assistant Cinematographer: Narayanan, Pradeep, AnilGaffer: Sanal & Team  Associate Editor:  N Durga Prakash Assistant Editor: Anoop VemasaniSpot Editors: Arikathota Akhil, Lakshman Assistant Production Design: V. Srinivas, Nikhil Apprentice Assistant Production Design: Pandu Thantarapallly Keyboards: KP & Vikas BadisaRhythm: Kalyan Frets: Subhani Album Mixed & Mastered By: A. Uday Kumar @ Brindavan–The Garden Of Music Album Recorded By: A. Uday Kumar, T. Uday Kumar & Suresh Kumar Taddi. Vox Mix Asst: SP Abhishek Orchestra In-Charge: Murugan Studio Asst: Pugalendhi & V Dhinakaran Album Co-Ordinator: B. ManikandanEFX Project Co-Ordinator: Viswa Prakash EFX Co-Ordinator: Venkat, Ramji  Line Producers: Srinivas  Sr. QC: Baskar  PRO: Pulagam Chinnarayana, Suresh Chandra, Rekha Digital Media: Vishnu Thej Putta Digital Media Company: TagMe Digital Music Label: Aditya Music Pvt. Ltd.------------------------------------------------------------------------------------------Enjoy and stay connected with us!!►Subscribe us on Youtube: http://bit.ly/adityamusic►Like us on Facebook: http://www.facebook.com/adityamusic►Follow us on Twitter: http://www.twitter.com/adityamusic►Follow us on Instagram: https://www.instagram.com/adityamusicindia►Follow us on LinkedIn: http://bit.ly/2Pp6ze3SUBSCRIBE Aditya Music Channels for unlimited entertainment:►For New Movies in HD: http://www.youtube.com/Adityamovies►For Songs with Lyrics: https://www.youtube.com/AdityaMusic►For Devotional Songs: http://www.youtube.com/AdityaDevotional►For Kids Educational: http://www.youtube.com/AdityaKids→మా పాట మీ నోట Telugu Lyrical Songs - http://bit.ly/1B2EcJG→Latest Tollywood Lyric Video Songs - http://bit.ly/1Km97mg→Ever Green Classics - https://goo.gl/1fZEDy→Popular Jukeboxes - https://goo.gl/LNvAIo→Telugu Songs with Lyrics - https://goo.gl/7ZmgWT© 2021 Aditya Music India Pvt. Ltd."
"aC20OtIJ75E","Teaser - Pawan Singh | साड़ी से ताड़ी | Shilpi Raj Ft. Smrity Sinha | Saree Se Tadi | Bhojpuri Song","2022-05-16T01:15:16Z","UCy3ExvdZmbE--vRbUUSe_2A","Pawan Singh Official","10","22.16.05","saree se tadi song|saree se tadi video|saree se tadi vide song|sadi se tadi teaser|saree se tadi pawan singh|sadi se tadi smrity singha|saree se tadi shilpi raj|saree se tadi pawan singh shilpi raj|saree se tadi video song 2022|saree se tadi teaser video|pawan singh sadi se tadi|pawan singh or shilpi raj ka song|saree se tadi video song|saree se tadi|pawan singh official|pawan singh tadi song|pawan singh video|pawan singh|pawan singh song|tadi song","1163331","85598","18886","https://i.ytimg.com/vi/aC20OtIJ75E/default.jpg","► Subscribe Now :- https://goo.gl/MXP6zM► Album :- Sadi Se Tadi► Song :-  Sadi Se Tadi► Singer :-Pawan Singh, Shilpi Raj► Lyrics :- Vijay Chauhan► Music Director :- Arya Sharma► Video Director :- Goldy Jaiswal► Choreographer - Bobby Jackson► DOP - Santosh Yadav, Sunil Baba► Editor - Pappu Verma► DI - Rohit Ji► Makeup - Pankaj Soni ► Collaboration :- Amit Singh► Concept :- Deepak Singh► Blessings :- Mata Pita & Ajit Singh Jokahari►Digital Managed By :- Inspire Music (Amit Singh)► Label / Company :- Pawan Singh Official"
"OWhCEhF6OdA","Mere HumSafar Episode 19 | Presented by Sensodyne (Subtitle Eng) 12th May 2022 | ARY Digital Drama","2022-05-12T15:50:29Z","UC4JCksJF76g_MdzPVBJoC3Q","ARY Digital","24","22.16.05","Pakistani Drama|top pakistani dramas|best pakistani dramas|ary digital drama|pakistani dramas ost|ary digital|Mere humsafar new episode|new drama pakistani 2022|ary|new drama pakistani 2021|Mere HumSafar Ep 19|Mere HumSafar Episode 19|drama Mere HumSafar Episode 19|watch new episode Mere HumSafar|watch latest episode Mere HumSafar Ep 19|Mere HumSafar drama|Mere HumSafar Episode 19 12th May 2022|hania amir|farhan saeed|mere hamsafar.","16171250","397306","14528","https://i.ytimg.com/vi/OWhCEhF6OdA/default.jpg","Mere HumSafar Episode 19 | 12th May 2022 | ARY Digital DramaSubscribe: https://www.youtube.com/arydigitalasiaMere Humsafar is the life story of Hala, born to a Pakistani father and foreign mother who leaves them after her birth.Written By: Saira RazaDirected By: Qasim Ali MureedCast:Farhan SaeedHania AamirWaseem AbbasAly KhanSamina AhmedSaba HameedAamir QureshiTara MehmoodZoya NasirUmer Shehzad.Watch Mere HumSafar every Thursday at 8: 00 PM on ARY Digital#MereHumSafar #HaniaAmir #FarhanSaeedSubscribe: https://www.youtube.com/arydigitalasiaDownload  ARY ZAP: https://l.ead.me/bb9zI1Pakistani Drama Industry's biggest Platform, ARY Digital, is the Hub of exceptional and uninterrupted entertainment. You can watch quality dramas with relatable stories, Original Sound Tracks, Telefilms, and a lot more impressive content in HD. Subscribe to the YouTube channel of ARY Digital to be entertained by the content you always wanted to watch.#ARYDigital #entertainment #ARYNetwork"
"aMLybcChP7s","Relatable?😂","2022-05-15T06:14:26Z","UCr-KG8Ffr6xztQwV5MAyh3Q","Ketan mehta","22","22.16.05","[none]","1583544","59729","134","https://i.ytimg.com/vi/aMLybcChP7s/default.jpg",""
"7NF90ggg1M8","[Hindi] Round 4 - Day 4 | iQOO BMOC Powered By Loco","2022-05-15T21:18:34Z","UCe31NPEeRGO0hcznx6Tdb-g","BATTLEGROUNDS MOBILE INDIA","20","22.16.05","BATTLEGROUNDS MOBILE INDIA|BATTLEGROUNDSMOBILEINDIA|BATTLEGROUNDS MOBILE|BATTLEGROUNDS|BATTLEGROUNDS MOBILE INDIA OFFICIAL CHANNEL|BATTLEGROUNDS MOBILE INDIA YOUTUBE|BGMI|BATTLEGROUNDS MOBILE INDIA Release date|BATTLEGROUNDS MOBILE INDIA Teaser","1973238","81368","906","https://i.ytimg.com/vi/7NF90ggg1M8/default.jpg","The final clash between the challengers and the pros. Who will qualify?Official broadcast of Round 4 - Day 4 of iQOO BMOC Powered By Loco.Schedule for the day:05:12 PM - Erangel05:53 PM - Miramar06:41 PM - Sanhok07:33 PM - Erangel08:22 PM - Miramar09:03 PM - ErangelDownload LOCO now!: https://loco.onelink.me/65Kg/BGMIYTC*Contest T&C - https://bit.ly/3stR9e1Be sure to also follow us on:iQOO Esports - https://www.instagram.com/iqooesports/Loco FB: https://www.facebook.com/getloconow Loco IG: https://www.instagram.com/getloconow/ Loco Twitter: https://twitter.com/getloconowBGMI YouTube: https://www.youtube.com/channel/UCe31NPEeRGO0hcznx6Tdb-g BGMI Esports: https://www.youtube.com/channel/UCugG6-k5QGbq_iDEPAnG4NQ FB: https://www.facebook.com/BattlegroundsMobileIN BGMI IG: https://www.instagram.com/battlegroundsmobilein_official/ BGMI Esports Instagram: https://instagram.com/bgmiofficial_esports?utm_medium=copy_link Website: https://esports.battlegroundsmobileindia.com #CHALLENGEEVERYTHING #BATTLEGROUNDSMOBILEINDIA #INDIAKABATTLEGROUNDS #INDIAKAGAME #PLAYNOW #BMOC #BGMI #iQOO #getloconow"
"D4dQ0SjLcSw","Eruma Saani | Il Thaka Saiya | EP - 1 | 2022 Tamil Romance Comedy Family Web Series | @Eruma Saani","2022-05-15T13:17:11Z","UCPyFYlqbkxkWX_dWCg0eekA","Eruma Saani","23","22.16.05","Eruma Saani|Tamil Comedy Videos|Films|Movies|Harija|Short|Film|Eruma Sani|Eruma Saani Videos|Eruma Saani Short Film|Eruma Saani Comedy|Eruma Saani Harija","612041","51820","1321","https://i.ytimg.com/vi/D4dQ0SjLcSw/default.jpg","Download the OctaFX Copytrading App at https://bit.ly/ESaani_OctaFX and get an exclusive 50% bonus! 🎁 Start earning extra money with the principal sponsor of the Delhi Capitals - OctaFX🏆#ErumaSaani After 'Lockdown Kadhal' & 'Jungle Resort' we're excited to bring 'Il Thaka Saiya' with plenty of romance & comedy starting  @Vijay Viruz , Harija, Badava Gopi, Reshmi Karthigeyan, Haritha Badava Gopi and others. Presenting you Episode 1 our #IlThakaSaiyaThank you all for you support throughout our journey. Extend your love and support for our new series. Episodes launching soon Written and Directed by- @prabhakaran_2403Cinematographer - @karikkalanajiEditor - @the_cuts_makerDI Colorist - @siva.mp4Music - @jen_marttinSound design - Elton O' connorDubbing - @updatestudios @fxstudiotz Lee media Public designs - @shynumashVfx - I-matte media Assistant DirectorCostumes @mimi_kertArt @raamkiran__m@sumeshvariath@iamkamalesh_28Assistant cinematographer @kamz_lee_@lalithkumar.18Associate EditorDineshkumarAssistant Editor@editor__vishnuExecutive Producer @nitheashvzStill photographer - @nishaanthshivaMakeup @abi_makeup_artistStyling @shyn_fascinoCast @vijayviruz @harijaofficial @badavagopi@reshmikarthigeyan@harithabadavagopi@kevinfelson@jaiseelan_sivaram@ebirajhn@_sania_s_@_kevin_roz@dhiviyathirunavukarasu@s.e.r.i.a.l_c.h.i.l.l.e.r@sumeshvariath#vijayharija #webseriesFor brand collaboration & advertising drop a mail to erumasaaniads@gmail.comSubscribe to our YouTube ChannelCatch our updates on our social media pages:https://www.fb.com/ErumaShithttps://www.twitter.com/Eruma_Saanihttps://www.instagram.com/ErumaSaaniSocial Media PartnerCinema Calendar: https://www.youtube.com/cinemacalendarDigital Partner: Luxe Entertainmenthttps://www.instagram.com/luxeentinDownload the OctaFX Copytrading App at https://bit.ly/ESaani_OctaFX and get an exclusive 50% bonus! 🎁 Start earning extra money with the principal sponsor of the Delhi Capitals - OctaFX🏆For brand collaboration & advertising drop a mail to erumasaaniads@gmail.comSubscribe to our YouTube ChannelCatch our updates on our social media pages:https://www.fb.com/ErumaShithttps://www.twitter.com/Eruma_Saanihttps://www.instagram.com/ErumaSaaniSocial Media PartnerCinema Calendar: https://www.youtube.com/cinemacalendarDigital Partner: Luxe Entertainmenthttps://www.instagram.com/luxeentin"
"SeoSSK1pFjg","Insaaniyat ❤️😊 | gogo2728 | deepesh_zo | mr_roshan | shubham | #firecracker  #jayeshbhaijordaar","2022-05-12T12:30:06Z","UCUpS9qH3N5rFy51Ft-rYsnA","gogo 2728","22","22.16.05","[none]","11255735","708948","727","https://i.ytimg.com/vi/SeoSSK1pFjg/default.jpg","https://youtu.be/GX6T2c6QH4Q"
"SenClIIneMI","KR$NA - Lil Bunty | Official Music Video (Prod. Flamboy)","2022-05-14T05:30:01Z","UChDX4wagpTQS0aTm4eyhJaw","KRSNA","10","22.16.05","Krsna|kr$na|krsna new song|krsna rap|krsna song|hip hop songs|krsna hip hop|indian hip hop|desi rap|krishna songs|emiway bantai|diss track|krsna lil bunty|lil bunty|krsna diss emiway|kalamkaar","3623468","271642","77765","https://i.ytimg.com/vi/SenClIIneMI/default.jpg","Click to subscribe:- http://bit.ly/KrsnaOfficialListen to 'Lil Bunty' on audio stores- https://bfan.link/lil-bunty.yde Spotify: https://bfan.link/lil-bunty/spotifyWynk: https://bfan.link/lil-bunty/wynkGaana: https://bfan.link/lil-bunty/gaanaApple Music: https://bfan.link/lil-bunty/appleMusicYoutube Music: https://bfan.link/lil-bunty/youtubeMusic Audio credits:Artist - KR$NA Song - Lil BuntyWritten and performed by - KR$NA Produced by - Flamboy Mixed and mastered by - Ryan SummerTeam Believe Artist Services - https://www.instagram.com/believeasd/ Video credits:Directed and Edited by: Director GrimFollow KR$NA on:Instagram:- https://www.instagram.com/realkrsnaFacebook :- https://www.facebook.com/krsnamusicTwitter :- https://twitter.com/realkrsnaDigital Partner - Believe DigitalFor licensing enquiries - Email - sync-india@believedigital.comAudio on Kalamkaar Music Pvt. Ltd. (C) 2022#LilBunty #Krsna #Kalamkaar #DesiHipHop #DesiRap #Rap #HipHop"
"gXjf9588eNs","Visiting Marine World Aquarium | M4 Tech Vlog |","2022-05-14T15:42:55Z","UC4rKvhYJIN-2Pe6zGtxtIqw","M4 TECH VLOG","24","22.16.05","[none]","1175739","74667","1800","https://i.ytimg.com/vi/gXjf9588eNs/default.jpg","Register yourself on Relevel : https://relvl.co/o3s7"
"vQWNYGwJybQ","ഒരു ആമീസ് സ്കൂട്ടർ അപാരത🥰","2022-05-14T09:44:04Z","UCv2c5G55dzgqYlq55tXHu0Q","Oru Al Mallu Family","22","22.16.05","#shorts|#youtubeshorts|#shortvideo|#sijurevavlog|#orualmallufamily|#trending|#trendingshorts|SIJU REVA VLOG|Oru Al Mallu Family","1089142","63515","112","https://i.ytimg.com/vi/vQWNYGwJybQ/default.jpg","ഒരു ആമീസ് സ്കൂട്ടർ അപാരത🥰#shorts #youtubeshorts #shortvideo #sijurevavlog #orualmallufamily #trending #trendingshorts"
"FP3wJH6gSBg","Pandian Stores - Baakiyalakshmi | Maga Sangamam - Promo","2022-05-14T14:22:51Z","UCvrhwpnp2DHYQ1CbXby9ypQ","Vijay Television","24","22.16.05","Comedy Show|Redefining Entertainment|Star|Star Vijay TV|Stree Buster Show|Tamil Shows|Tamil TV|Thamizhum Saraswathiyum|Vijay|Vijay TV|டிவி|தமிழ்|தொலைக்காட்சி|விஜய்","4760231","101417","1460","https://i.ytimg.com/vi/FP3wJH6gSBg/default.jpg","#PandianStores #Baakiyalakshmi #MagaSangamam #NewFiction #VijayTV #VijayTelevision #StarVijayTV #StarVijay #TamilTV  பாண்டியன் ஸ்டோர்ஸ் - பாக்கியலட்சுமி மகா சங்கமம் திங்கள் - சனி வரை இரவு 8 மணிக்கு நம்ம விஜய் டிவில.."
"y0p46-SU6fc","Android vs iPhone Chipset Comparison","2022-05-15T07:02:09Z","UCoL68NLLSUQqEDwMZPvrdEg","TechBurner Shorts","28","22.16.05","[none]","1229798","108612","442","https://i.ytimg.com/vi/y0p46-SU6fc/default.jpg","#shorts #tech #tricks Main Channel -  http://bit.ly/techburner"
"dJpyEqNUfNw","ഇതുപോലെ ചെയ്തിട്ടുണ്ടോ 😁🤭 #shorts #malayalamshorts #lockdowncomedy #kaarthikshankar","2022-05-14T05:01:47Z","UCXuzoZKMoRjISfcy7N8Lv4Q","Kaarthik Shankar","24","22.16.05","[none]","1139412","72566","214","https://i.ytimg.com/vi/dJpyEqNUfNw/default.jpg",""
"EhcgLcU3QRE","ഒരു 50 ഇഞ്ച് TV അപാരത❗ |Foodie Sha|","2022-05-15T08:53:41Z","UCVr88XAkEc58RS1F2aoljGQ","Foodie Sha","22","22.16.05","Foodie Sha|food blog malayalam|food vlog malayalam|food review malayalam|food eating malayalam|Malabar food|Malappuram food|Food recipes|#foodiesha|#foodblog|#food|#foodblogmalayalam|#malayalam|#foodvlogmalayalam|#foodrecipe|##malappuram|#Malappuramfood|#malabarfood|#foodeatingmalayalam|#youtube|#youtubeshorts|#youtubetrending|#youtuber|#youtubechannel|#explorepage|#foodlover|#foodblogger|#healthyfood|#indianfood|#homecooking","339897","28562","109","https://i.ytimg.com/vi/EhcgLcU3QRE/default.jpg","#vlog #tv #television #inaguration #offer #inguraloffer #myg #kottakkal #malappuram #njanpettu@FoodieSha #FoodieSha #short #youtubeshorts"
"RhCwkmNUV-s","Ek Badnaam… Aashram Season 3 - Official Trailer | Bobby Deol | Prakash Jha | MX Player","2022-05-13T06:15:20Z","UC6q2O2pOJ-LiFKm4w2EW73w","MX Player","24","22.16.05","MX Player|MXPlayer|Entertainment|Web Series|Bollywood|Movies|Films|Celebrities|Actor|Actress|Bobby Deol|Aaditi Pohankar|Chandan Roy Sanyal|Darshan Kumaar|Anupria Goenka|Adhyayan Summan|Tridha Choudhury|Vikram Kochhar|Tushar Pandey|Sachin Shroff|Anuritta Jha|Rajeev Siddhartha|Parinitaa Seth|Tanmaay Ranjan|Preeti Sood|Kanupriya Gupta|Navdeep Tomar|Aashram|Ram Rahim|Prakash Jha|Aashram web series|Aashram 3|Ashram|latest series|official trailer","4486742","121284","13225","https://i.ytimg.com/vi/RhCwkmNUV-s/default.jpg","SEASON 3 TRAILER IS HERE! Baba Nirala - Swarupi ya Behrupi? Kya khulenge raaz ya hoga Baba ka raaj? Ek Badnaam… Aashram Season 3 releases 3rd June.Directed by Prakash JhaKey Cast: Bobby Deol, Aaditi Pohankar, Chandan Roy Sanyal, Darshan Kumaar, Anupria Goenka, Adhyayan Suman, Tridha Choudhury, Vikram Kochhar, Tushar Pandey, Sachin Shroff, Anuritta Jha, Rajeev Siddhartha, Parinitaa Seth, Tanmaay Ranjan, Preeti Sood, Esha Gupta, Jahangir Khan, Kanupriya Gupta and Navdeep TomarAbout Aashram Season 3: Ek Badnaam Aashram revolves around the megalomaniac baba, who continues to bend every rule to suit himself and has become a power-hungry adversary. He believes to be above all and thinks he's God. The power of Aashram is at it's peak. This ‘badnaam’ Aashram continues to exploit women, indulge in the drug trade and control the politics of the town. On the other hand, Pammi is having sleepless nights to seek revenge from Bhagwaan Nirala. Will Ujagar Singh be able to help Pammi seek justice and expose the ‘badnaam’ Aashram?#Aashram3 #Aashram #BobbyDeol #PrakashJha #AaditiPohankar #ChandanRoySanyal #DarshanKumaar #AnupriaGoenka #AdhyayanSumman #TridhaChoudhury #VikramKochhar #TusharPandey #SachinShroff #AnurittaJha #RajeevSiddhartha #ParinitaaSeth #TanmaayRanjan #PreetiSood #JahangirKhan #KanupriyaGupta #NavdeepTomar #EshaGupta #MXOriginalSeries #MXPlayer------------------------------About MX Player:MX Player is the world’s best video player, and now it’s one of India’s largest streaming platforms. Watch your favourite Movies, TV Shows, Web Series, Sports, Music Videos, Live TV Channels, International Shows and much more for free. Enjoy 100,000 hours of entertainment online and cool features offline for the ultimate viewing experience.Available on Google Play Store, App Store, and web for FREE!Google Play Store: http://bit.ly/2Mxt6ru App Store: https://apple.co/2EGX4FmWeb: https://www.mxplayer.in/Stay connected with us on:Facebook: https://www.facebook.com/mxplayerTwitter: https://www.twitter.com/mxplayerInstagram: https://www.instagram.com/mxplayer"
