video_id,title,publishedAt,channelId,channelTitle,categoryId,trending_date,tags,view_count,likes,comment_count,thumbnail_link,description
"nbh9GNoSwPA","എന്തുകൊണ്ട് ലൗ ആക്ഷന്‍ ഡ്രാമ ഇഷ്ടപ്പെട്ടില്ല.. ? Dhyan Sreenivasan | Interview Part 2 | The Cue","2022-05-23T14:15:12Z","UCarJ0vXukNHIopDXFwgl6NA","The Cue Studio","24","22.24.05","the cue|the cue interview malayalam|the cue studio|maneesh narayanan interview|maneesh narayanan|dhyan sreenivas|dhyan sreenivasan|dhyan sreenivas interview|dhyan sreenivas latest|dhyan sreenivas the cue interview|dhyan sreenivas thug|dhyan sreenivas thug life|vineeth sreenivasan and dhyan sreenivasan interview|udal|udal movie|udal scenes|udal trailer|durga krishna udal","97005","3149","174","https://i.ytimg.com/vi/nbh9GNoSwPA/default.jpg","ആള്‍ക്കാരെ വീഴ്ത്താന്‍ പറ്റുന്ന കുറച്ച് സാധനങ്ങളൊക്കെ പുള്ളീടെ കൈയ്യിലുണ്ട്, മ്യൂസിക്ക് കൊണ്ട് ഒരു ആവറേജ് സിനിമ എങ്ങനെ ഹിറ്റാക്കാമെന്ന് പുള്ളിക്ക് അറിയാം, അതാണ് ചേട്ടന്റെ കൈയ്യില്‍ നിന്ന് പഠിച്ചത്, ധ്യാന്‍ ശ്രീനിവാസന്‍ പറയുന്നു...#dhyansreenivasan #udal #thecueFollow Us On :Facebook - https://www.facebook.com/www.thecue.in/Instagram - https://www.instagram.com/thecue_offi...Website - https://www.thecue.in/WhatsApp - https://bit.ly/37aQLHnTwitter - https://twitter.com/thecueofficialTelegram - https://t.me/thecue"
"YvPxFOwpYYg","Sneak Peak Of My Chocolate Factory","2022-05-23T22:43:25Z","UC4-79UOlP48-QNGgCko5p2g","MrBeast Shorts","22","22.24.05","mrbeast","1788840","156113","4378","https://i.ytimg.com/vi/YvPxFOwpYYg/default.jpg","who you pushing into the chocolate river??"
"7zf6WBs3H7A","Bihar ke Sonu Kumar tak Pahuncha PW | Alakh Sir ne promise kia education main support 🙏 #shorts","2022-05-22T07:11:50Z","UCiGyWN6DEbnj2alu7iapuKQ","Physics Wallah - Alakh Pandey","27","22.24.05","Sonu|Sonu nitish Kumar|physics wallah Sonu|PW Sonu|Sonu viral video|viral video Sonu|Sonu alakh sir|alakh sir with Sonu|Sonu Bihar|Sonu Kumar bihar|Bihar Sonu Kumar|Bihar Sonu viral video","418973","57587","1648","https://i.ytimg.com/vi/7zf6WBs3H7A/default.jpg","Bihar"
"2VYjrHNU9g8","ബാലനും കുടുംബവും തറവാട്ടുവീട്ടിൽ... ശിവനും അഞ്ജുവും ഇനി അല്പം റൊമാന്റിക് ടൈം.","2022-05-24T02:00:45Z","UCp_r6Z-Oh0YTf-ym71z5Nqg","Asianet","24","22.24.05","[none]","1245923","29745","400","https://i.ytimg.com/vi/2VYjrHNU9g8/default.jpg","ബാലനും കുടുംബവും തറവാട്ടുവീട്ടിൽ... ശിവനും അഞ്ജുവും ഇനി അല്പം റൊമാന്റിക് ടൈം.Santhwanam || Today at 7 PM || Asianet  #Santhwanam #Chippy #Asianet #AsianetSerials  #GopikaAnil #Sajin #RakshaRaj #GireeshNambiar #AchuSugandh #RajeevParameshwar #Sreedevi #Shivanjali #Happu"
"W-NdLTx2apc","Raat ke 3 baje dulhan ki khwahish ki puri | Armaan Malik","2022-05-24T04:31:20Z","UCum5kIr4aqgn9Dc21JdYCWA","Armaan Malik","22","22.24.05","[none]","1058835","45002","1721","https://i.ytimg.com/vi/W-NdLTx2apc/default.jpg","Follow Us On Instagram for Live Updates: Armaan Malik - https://instagram.com/armaan__malik9My Facebook Page - https://www.facebook.com/Kritika-Mali..._____________________________Writer director & edited by Armaan MalikDisclaimer : DISCLAIMER : Please don’t go out of your way to or hate on anyone I talk about in my videos, this channel is to entertain people and I usually focus on joking about what the people are doing not the individual themselves, please don’t go spreading hate it’s all for laughs Copyright Disclaimer Under Section 107 of the Copyright Act 1976, allowance is made for “fair use” for purposes such as criticism, comment, news reporting, teaching, scholarship and research. Fair use is a use permitted by copyright statute that might otherwise be infringing. Non-profit, educational or personal use tips the balance in favor of fair use.#armaanmalik #kritikamalik #payalmalik #chirayumalik #armaanmalikvlog #kritikamalimvlog #payalmalikvlog #fitnessfamily #vloggingfamily"
"uTLf2wPGcss","Sundari - Promo | 24 May 2022 | Sun TV Serial | Tamil Serial","2022-05-23T15:22:32Z","UCBnxEdpoZwstJqC1yZpOjRA","Sun TV","24","22.24.05","Sundari|Sundari today|Sundari serial|Sundari promo|Sundari serial promo|Sundari sun tv serial|Sun TV Serial|Sun TV Serials|sun tv tamil serial|SunTV Serial Today|sun tv serial today|Sun tv full episodes|Sun tv tamil full episodes|Sun tv tamil shows|sun tv shows|Tamil Serials|tamil serials sun tv|Tamil Serial episodes","1705134","23663","345","https://i.ytimg.com/vi/uTLf2wPGcss/default.jpg","Watch the latest promo of popular Tamil Serial #Sundari that airs on Sun TV. Watch all Sun TV Serials FREE on SUN NXT App. Offer valid only in India till 31st May 2022.Download here:Android - http://bit.ly/SunNxtAdroidiOS: India - http://bit.ly/sunNXTWatch on the web - https://www.sunnxt.com/   SUNDARI is the story of an ordinary girl and the struggles faced by her in this society. At every step of her life, Sundari needs to fight twice as hard to keep her spirit intact. This is the life journey of an ordinary girl with an ambition.   #SunTV #TamilSerial #Promo #SunTVPromo Don't forget to SUBSCRIBE to Sun TV YouTube channel - http://bit.ly/suntvsubscribe --------------------------------------------------  Download SunNXT here:  Android: http://bit.ly/SunNxtAdroid iOS: India - http://bit.ly/sunNXT iOS Rest of the World - http://bit.ly/ussunnxt  Watch on the web - https://www.sunnxt.com/ --------------------------------------------------  Follow Us for More Latest Updates:   Facebook: https://www.facebook.com/SunTV Twitter: https://twitter.com/SunTV Instagram: https://www.instagram.com/suntv --------------------------------------------------  #SunTV #SunNXT #SunTVSerials #SunTVProgram #SunTVPromos #TamilSerials --------------------------------------------------"
"KicvxWtadmo","Friction ആണ് പോലും🤣|#shorts #trending #experiment #reaction","2022-05-23T12:10:27Z","UCl02kk49M9ZLaEOKvI6_ONQ","Alrins Tech","24","22.24.05","[none]","64308","4341","62","https://i.ytimg.com/vi/KicvxWtadmo/default.jpg",""
"2oEHeD4CXz8","relatable ആണോ? 🤪","2022-05-23T11:09:02Z","UCLa-ASLMIpWEOlZsJ4_CLUg","Akhil Nrd","22","22.24.05","[none]","941586","138721","201","https://i.ytimg.com/vi/2oEHeD4CXz8/default.jpg",""
"TxeRFnnZFaQ","मुँह मीठा Karke Jao😂 II #shorts","2022-05-23T04:30:11Z","UCAgAsH5n26IHMDyzwhF3wIw","SEVENGERS","23","22.24.05","[none]","3083564","371820","1297","https://i.ytimg.com/vi/TxeRFnnZFaQ/default.jpg","Love You All Youtube Family❤️Keep Supporting🙌 Like,Comments,Share & Subscribe ➡️SevengersFor daily routine updatesFollow on Instagram👇👇Masterji : https://instagram.com/master_jii_officialBunny : https://instagram.com/nadeem_bunnyhttps://www.facebook.com/Sevengersofficial/"
"i-FzCfulxok","கறி விருந்துல நடந்த சம்பவம் |  Foldable bucket #Shorts Creative Experiment","2022-05-23T12:00:34Z","UCfmHFLgOMImOZ1XWJWuN_qw","Creative Experiment","26","22.24.05","CreativeExperiment|creativexperiment|CE|ce|Crazymachans","68623","6809","21","https://i.ytimg.com/vi/i-FzCfulxok/default.jpg","For business enquirers only mail us at : creativeexperiment@yahoo.com#CrazyMachans #CeBala #CeMuthuOur Vlog Channel link: https://www.youtube.com/channel/UCb7VfUwrwI5i3ElxfH266qwFollow me on Social Media for behind the scenes and extrasInstagram:https://www.instagram.com/creative_experiment_official/Facebook: https://www.facebook.com/Creative-Experiment-103182304459229/MoJ Link:  https://mojapp.in/@creativeexperiment123WARNING: This video is only for entertainment purposes. Do not attempt to recreate any of the acts in this video, as they may be dangerous if not done correctly, and could result in serious injury. If you rely on the information portrayed in this video, you assume the responsibility for the results. Have fun, but always think ahead, and remember that every project you try is at YOUR OWN RISK."
"RyoNm8k1hog","Pandavar Illam - Promo | 24 May 2022 | Sun TV Serial | Tamil Serial","2022-05-23T16:32:06Z","UCBnxEdpoZwstJqC1yZpOjRA","Sun TV","24","22.24.05","Pandavar Illam|Pandavar Illam promo|Pandavar Illam serial|Pandavar Illam today|Pandavar Illam serial today|Pandavar Illam sun tv serial|Sun TV Serial|Sun TV Serials|sun tv tamil serial|SunTV Serial Today|sun tv serial today|Sun tv full episodes|Sun tv tamil full episodes|Sun tv tamil shows|sun tv shows|Tamil Serials|tamil serials sun tv|Tamil Serial episodes","847545","17053","628","https://i.ytimg.com/vi/RyoNm8k1hog/default.jpg","Watch the Latest Promo of popular Tamil Serial #PandavarIllam that airs on Sun TV. Watch all Pandavar Illam Full episodes FREE on SUN NXT App. Offer Valid only in India, till 31st May 2022.Download here:Android - http://bit.ly/SunNxtAdroidiOS: India - http://bit.ly/sunNXTWatch on the web - https://www.sunnxt.com/ Pandavar Illam is a family drama on Sun TV. ‘Pandavar Illam’, the huge ancestral house of Periya Sundaram and his five grandsons, the Sundaram brothers, is strictly barred for women. This 'only men' family take a vow against marriage, after losing their brother on the day of his wedding. On the other hand, a warm-hearted and spirited village belle, Kayal has her heart set on marrying the youngest Sundaram, while a vindictive Zamindar’s daughter, Vedavalli is fanatically against the Sundaram brothers getting married. Will ‘Pandavar Illam’ open its doors to women?  #SunTV #TamilSerial #PandavarIllamPromo #Promo Don't forget to SUBSCRIBE to Sun TV YouTube channel - http://bit.ly/suntvsubscribe  --------------------------------------------------   Download SunNXT here:  Android: http://bit.ly/SunNxtAdroid iOS: India - http://bit.ly/sunNXT iOS Rest of the World - http://bit.ly/ussunnxt  Watch on the web - https://www.sunnxt.com/ --------------------------------------------------  Follow Us for More Latest Updates:   Facebook: https://www.facebook.com/SunTV Twitter: https://twitter.com/SunTV Instagram: https://www.instagram.com/suntv --------------------------------------------------  #SunTV #SunNXT #SunTVSerials #SunTVProgram #SunTVPromos #TamilSerials --------------------------------------------------"
"bE5StLgsZek","100 Years of Youtube Videos","2022-05-22T20:00:34Z","UC4-79UOlP48-QNGgCko5p2g","MrBeast Shorts","22","22.24.05","[none]","2509297","185503","2155","https://i.ytimg.com/vi/bE5StLgsZek/default.jpg","#shorts"
"1ihCLKquBCQ","JHADU WALA BHOOT | #Horror Comedy Movie #Family | Ruchi and Piyush","2022-05-21T08:30:00Z","UC0H6I4rKiHmtceSdTCM-DKQ","Ruchi and Piyush","24","22.24.05","ruchi and piyush show|comedy family|hindi family short movie|Ruchi and Piyush new video|Ruchi and Piyush 2022|Hindi sitcom|Ruchi and Pihu show|Indian family drama|horror story|Indian horror stories|scary video|horror comedy series|Hindi horror comedy|funny horror","1557502","37428","4550","https://i.ytimg.com/vi/1ihCLKquBCQ/default.jpg","Friends aaj hamare ghar me phir se ek naya drama ho gaya !!Ghar mein ajeeb o gareeb cheeze ho rahi hai !!Lagta hai koi bhoot aagaya hai !Jaanne ke liye video end tak dekhe!!We make family-friendly content, which the whole family can watch and enjoy together.Hope you will support us and share the videos with your loved and dear ones.Ruchi and Piyush - https://bit.ly/2K3cd5OOur Family channel - https://goo.gl/EHTnu3You can follow us hereWebsite - https://bit.ly/3EgX4rrInstagram - https://www.instagram.com/ruchiandpiyush/Face book - https://www.facebook.com/ruchiandpiyush/We are always open for suggestions....Copyright @ Ruchi and Piyush Any unauthorized reproduction of this content (videos / small clips / pictures) in any form will result in immediate action against the concerned video / channel.Music by - Hidden Agenda by Kevin MacLeod is licensed under a Creative Commons Attribution 4.0 licence. https://creativecommons.org/licenses/by/4.0/Source: http://incompetech.com/music/royalty-free/index.html?isrc=USUAN1200102Artist: http://incompetech.com/Longing and Concern by Kevin MacLeod is licensed under a Creative Commons Attribution 4.0 licence. https://creativecommons.org/licenses/by/4.0/Source: http://incompetech.com/music/royalty-free/index.html?isrc=USUAN1100511Artist: http://incompetech.com/Blue Sizzle - Madness Paranoia by Kevin MacLeod is licensed under a Creative Commons Attribution 4.0 licence. https://creativecommons.org/licenses/by/4.0/Source: http://incompetech.com/music/royalty-free/index.html?isrc=USUAN1100385Artist: http://incompetech.com/"
"ww-tSidTXJM","Please respect old age peoples 🙏🏻🙏🏻🙏🏻#youtubepartner #shorts","2022-05-23T13:16:29Z","UC_6dHtrFIhcGo3r6TqtBriA","CHINNU_6542","24","22.24.05","[none]","923005","93735","149","https://i.ytimg.com/vi/ww-tSidTXJM/default.jpg",""
"4sR-3vSEL2Q","Kayal - Promo | 24 May 2022 | Sun TV Serial | Tamil Serial","2022-05-23T16:32:03Z","UCBnxEdpoZwstJqC1yZpOjRA","Sun TV","24","22.24.05","Kayal|Kayal serial|Kayal serial promo|Kayal today|Kayal promo today|serial|sun tv serial|Kayal serial sun|Kayal sun tv serial|Kayal tamil serial today|Kayal todays episode|Kayal episode|Kayal sun tv serial today|tamil serial","655784","12741","123","https://i.ytimg.com/vi/4sR-3vSEL2Q/default.jpg","Watch the Latest Promo of popular Tamil Serial Kayal that airs on Sun TV. Watch all Sun TV Serials FREE on SUN NXT App. Offer valid only in India till 31st May 2022.Download here:Android - http://bit.ly/SunNxtAdroidiOS: India - http://bit.ly/sunNXTWatch on the web - https://www.sunnxt.com/ #KayalPromo #TamilSerial #SunTV #Promo Abandoned by her father & coping with an alcoholic brother, Kayal works as a nurse to become her family's sole provider. She finds happiness in her sacrifice to meet the needs of her brother & sisters. Watch Kayal stand tall in her selfless journey. Don't forget to SUBSCRIBE to Sun TV YouTube channel - http://bit.ly/suntvsubscribe  --------------------------------------------------  Download SunNXT here:  Android: http://bit.ly/SunNxtAdroid iOS: India - http://bit.ly/sunNXT iOS Rest of the World - http://bit.ly/ussunnxt  Watch on the web - https://www.sunnxt.com/ --------------------------------------------------  Follow Us for More Latest Updates:   Facebook: https://www.facebook.com/SunTV Twitter: https://twitter.com/SunTV Instagram: https://www.instagram.com/suntv --------------------------------------------------  #SunTV #SunNXT #SunTVSerials #SunTVProgram #SunTVPromos #TamilSerials --------------------------------------------------"
"Nb8yiqkfOUg","THOR LOVE AND THUNDER Official Trailer REACTION | Marvel Studios | Chris Hemsworth, Taika Waititi","2022-05-24T02:35:10Z","UCLJvwQ-173AlbFt7zvPl-CQ","GETJaby","24","22.24.05","[none]","230126","14691","494","https://i.ytimg.com/vi/Nb8yiqkfOUg/default.jpg","We get our first look at Christian Bale as Gorr The God Butcher in this new trailer from Thor Love and Thunder and he's looking great! More laughs, more action and an incredibly buff looking Chris Hemsworth as Thor (can someone give us his trainer's phone number lol). Looking forward to a summer of more great marvel content. We've got Ms Marvel coming to Disney+ in a matter of weeks and more upcoming projects in the future like She-Hulk, The Marvels, Secret Invasion and Spider-Man 4!Thor Love and Thunder is directed by Taika Waititi and stars Chris Hemsworth (Thor), Natalie Portman (Jane Foster/ Mighty Thor), Karen Gillan (Nebula), Chris Pratt (Peter Quill/ Star-Lord), Taika Waititi (Korg), and Christian Bale as Gorr The God Butcher. __________________OTHER REACTIONS YOU'LL ENJOY!• She-Hulk Trailer Reaction: https://youtu.be/PIhKALA_eUM• Mission Impossible 7 Reaction: https://youtu.be/9M2rhufQu2I• Thor Love and Thunder Teaser Reaction: https://youtu.be/Fx3WDOSxmIw• Moon Knight 1x5 Reaction: https://youtu.be/3VANJKtLTj8• Ms Marvel Trailer Reaction: https://youtu.be/W5Qrjbd5JY4• The Batman Non-Spoiler Review: https://youtu.be/8mU5TEAx6io• Moon Knight Official Trailer: https://youtu.be/TCmx6zqgP34• Moon Knight Official Trailer Breakdown: https://youtu.be/tJnUg5WTkV0 • Oscar Isaac & Ethan Hawke's Reaction to Moon Knight Trailer: https://youtu.be/1dMoF343kNY• Moon Knight 73 Easter Eggs: https://youtu.be/8F9RvbzRsjs• Doctor Strange Multiverse of Madness Teaser Breakdown & Easter Eggs: https://youtu.be/IHdWkWNbeNo• Watched DOCTOR STRANGE MULTIVERSE OF MADNESS Trailer in 0.25 Speed: https://youtu.be/5VDauxIJhBY• DOCTOR STRANGE 2 Scarlet Witch ERASED X-Men & Mutants?! https://youtu.be/q8SW7REkWkE• Spider-Man Across the Spider-Verse: https://youtu.be/sM-H9u29Vtw• Andrew & Tobey React to Spider-man No Way Home Trailer 2: https://youtu.be/ZHyi4OagT_Q• Spider-man No Way Home Redemption https://youtu.be/qCbVBfnEU1U• How Spider-man Far From Home Should Have Ended: https://youtu.be/4Mw7wX7SzBo• Eternals Movie Premiere Vlog & Non-Spoiler Review: https://youtu.be/iECkKKmDsLo• Avengers Gag Reel: https://youtu.be/D0QeQLzLlgc• Venom Pitch Meeting Reaction: https://youtu.be/XEQhPuyLPv8• What If Episode 9 Season Finale Reaction & Review: https://youtube.com/watch?v=f8uHUzOBJ0g• House of the Dragon GOT Teaser Reaction:https://www.youtube.com/watch?v=P4-id...• Venom Let There Be Carnage Easter Eggs Breakdown: https://youtube.com/watch?v=-A3DHVcFiE4• What If Episode 8 Reaction & Review: https:/youtube.com/watch?v=xLzIv5e_d4Y• Spider-man No Way Home Trailer Reaction: https://youtube.com/watch?v=s6P-XXYLqNw• Marvel Dr Strange Gag Reel: https://youtube.com/watch?v=r19HEMn9Hxo• What If Episode 7 Breakdown and & Easter Eggs New Rockstars: https://youtube.com/watch?v=CWC1IBX52SMReaction Gear: https://amzn.to/2QgTwk2 (affiliate)Original Trailer Upload:https://www.youtube.com/watch?v=Go8nTmfrQd8___________________________________________________SOCIAL MEDIA:~ACHARA KIRK~Twitter & Instagram: @AcharaKirkhttp://youtube.com/Achara~JABY KOAY~YouTube, Twitter, Instagram: @GETJabyFacebook: http://www.facebook.com/followjaby___________________________________________________Jaby Koay ASIA:https://youtube.com/JabyTVJaby Koay INDIA:https://youtube.com/JabyKoayJABY KOAY'S SHORT FILMS PLAYLIST:https://www.youtube.com/playlist?list=PL34B19BA788E18384Click here to subscribe and know when the next video drops:http://www.youtube.com/subscription_center?add_user=jabykoayThanks for watching!!!__________________________________________________Credit of my favorite movie reviews song:Highlight Reel Kevin MacLeod (incompetech.com)Licensed under Creative Commons: By Attribution 3.0 Licensehttp://creativecommons.org/licenses/by/3.0/Song used during intro:Acid Jazz Kevin MacLeod (incompetech.com)Licensed under Creative Commons: By Attribution 3.0 Licensehttp://creativecommons.org/licenses/by/3.0/Song Used During Outro:Easy Jam Kevin MacLeod (incompetech.com)Licensed under Creative Commons: By Attribution 3.0 Licensehttp://creativecommons.org/licenses/by/3.0/"
"Pjpu7hTpfKU","girte girte bacha aaj to 😧 / offroading with KTM duke","2022-05-22T02:45:01Z","UC49EgySW0Guwy5ThcN11ehQ","Sahil joshi Vlogs","22","22.24.05","[none]","842784","90579","4445","https://i.ytimg.com/vi/Pjpu7hTpfKU/default.jpg","My Instagram = https://www.instagram.com/official_sahiljoshi/My second channel = https://youtu.be/ZYSXlBYz8_A .Music used = https://youtu.be/RrIt6U4RE-E"
"V763cbhHlSo","Dhagad Web Series || Season 2 || Episode - 7 || Chandoo Sai || Bramarambika || Infinitum Media","2022-05-22T05:30:05Z","UC3ptrBkAhr5O6oduXsDzCOw","Chandoo Gadu","24","22.24.05","dhagad|dhagad web series|dhagad season 2|dhagad web series season 2|dhagad 2|dhagad season 2 episode 7|chandoo sai|chandoo sai dhagad|chandoo gadu|dhagad chandoo gadu|chandoo sai web series|chandoo sai latest|chandoo sai short films|chandoo sai bramarambika|bramarambika short films|chandu sai new short films|telugu web series|telugu short films|telugu short film 2022|dhagad ep 7|short film telugu 2022|dhagad episodes|infinitum media|dhagad chandu sai","430994","32548","1462","https://i.ytimg.com/vi/V763cbhHlSo/default.jpg","Play & Win Lakhs on Fun88:- http://fun88.com/in/aff/24266/regGuess the winning team in today's IPL match and win real cash. Download Now.Dhagad 2  is a Telugu Web Series Featuring Chandoo Sai & Bramarambika as Leads.Cast: Chandoo Sai, Sashank Manduri, Dhulipala Ravindra babu, Rajendra, Sekhar, Mohan, Naveen, Dhanalakshmi, Lakshmi , Jhanavi.Story, Direction & Screenplay: Chandoo Sai  Writen by M. Sekhar(Bunny)Co-director: Kiran Gangu  Music: PoonikDop: Kala Pavan, Bhanu Prakash MusumuriEditing: MA Vijay Kumar, ManideepTitle Animation: Hemanth Korimi Bramarambika Voice Dubbing: Swetha Naidu   Title Designing: Graphic Designer TeluguPoster Designer: Nikhil Chotu, Pratheep ChandraSound Engineer: Venkat, Mahesh Costume Designer: Kalpana VogetiAssistant Director: Janaki RamFinance Manager: Chandu JC Line Producer: Janaki RamExecutive Producer: KP Kalidindi Producer: Vandana Bandaru#Dhagad2 #ChandooSai #InfinitumMediaProduced by #Infinitum Network SolutionsWe do not intend to promote investment/gambling of any kind.  Viewer discretion is advised. If your current residence is from Andhra, Assam, Odisha, Telangana, Nagaland, and Sikkim, you are advised to not participate."
"kE8lGFypsAE","दो बहनों ने मनाई एक पति से सुहागरात | Crime World - Saali Adhi Gharwali | Full Episodes","2022-05-18T14:30:07Z","UC5crEdQIbHcsVwOILpJrXHQ","Shemaroo TV","22","22.24.05","crime stories|savdhaan india|crime patrol|hindi tv serial|new episode|new web series|crime story|crime patrol 2021 latest episode|extramarital affair of married women|boyfriend married women|pati patni or boyfriend|पति पत्नी और वो|web series on youtube|web series new|crime episode|crime episode new|crime episode hot new|crime episode india|crime cases|crime series|crime duniya|crime scene","8096130","54526","9996","https://i.ytimg.com/vi/kE8lGFypsAE/default.jpg","Airtel - Ch. No. 132TataSky - Ch. No. 181D2H - Ch. No. 149Dish TV - Ch. No. 139DD Free DIsh - Ch. No. 28NXT Digital - Ch. No. 178IN DIGITAL Mumbai - Ch. No. 188Digiana - Ch. No. 147शेमारू टीवी लाया है एंटरटेनमेंट आपके पूरे परिवार के लिए। यहाँ देखिये देवों के देव…महादेव, गीत…हुई सबसे परायी, दिल से दी दुआ सौभाग्यवतीभव:, ग्रेट इंडियन लाफ्टर चैलेंज, श…फिर कोई है, माता की चौकी, घर एक सपना, हॉन्टेड नाइट्स और जय जय जय बजरंग बलि जैसे शोज जो आपके परिवार के हर सदस्य को पसंद आएंगे। आने वाले एपिसोड्स की जानकारी के लिए हमें फॉलो और सब्सक्राइब करें:1. https://www.youtube.com/channel/UC5cr...2. https://www.facebook.com/ShemarooTV3. https://www.instagram.com/shemaroo.tv/"
"M46IfsIj6Us","Bindhu Madhavi After Bigg Boss Non Stop Title Winning #shorts #bindhumadhavi","2022-05-21T17:46:09Z","UCnkJqM6PA4WE8QQouruInAw","TFPC","24","22.24.05","[none]","743910","32738","150","https://i.ytimg.com/vi/M46IfsIj6Us/default.jpg",""
