video_id,title,publishedAt,channelId,channelTitle,categoryId,trending_date,tags,view_count,likes,comment_count,thumbnail_link,description
"94nQ6wHhQ6M","I love u Maa jarur likhna ❤️ #shorts #azhan5star #youtube","2022-05-23T14:34:52Z","UCY-at5vWhDoMJ8y0kIPFwDA","Azhan5star","24","22.24.05","[none]","6222438","387481","4083","https://i.ytimg.com/vi/94nQ6wHhQ6M/default.jpg",""
"Go8nTmfrQd8","Marvel Studios' Thor: Love and Thunder | Official Trailer","2022-05-24T01:46:47Z","UCvC4D8onUfXzvjTOM-dBfEA","Marvel Entertainment","24","22.24.05","marvel|comics","20303597","1093886","43828","https://i.ytimg.com/vi/Go8nTmfrQd8/default.jpg","“Let me tell you the story of the space viking, Thor Odinson…”Watch the brand-new trailer for Marvel Studios’ Thor: Love and Thunder and witness it only in theaters July 8.► Watch Marvel on Disney+: https://bit.ly/2XyBSIW► Subscribe to Marvel on YouTube: http://bit.ly/WeO3YJFollow Marvel on Twitter: ‪https://twitter.com/marvelLike Marvel on Facebook: ‪https://www.facebook.com/marvelWatch Marvel on Twitch: https://www.twitch.tv/marvelReward your Marvel fandom by joining Marvel Insider!Earn points, then redeem for awesome rewards.Terms and conditions apply. Learn more at https://www.marvel.com/insider?Osocial=YT&CID=MarvelInsiderFor even more news, stay tuned to:Tumblr: ‪http://marvelentertainment.tumblr.com/Instagram: https://www.instagram.com/marvelPinterest: ‪http://pinterest.com/marvelofficialReddit: http://reddit.com/u/marvel-official"
"49AnvYv_Hac","When you have a innocent wife 😂 wife uruttugal - 17 😂 #shorts #satheeshshanmu | Spread Love","2022-05-24T06:38:41Z","UCIWHm3sTOREKnwCSoIkE8Uw","Spread Love - Satheesh Shanmu","24","22.24.05","satheeshshanmu|satheeshshanmu shorts|uruttugal|couple uruttugal|couple vlogs|vlog|Comedy video|Shorts|Shorts Video|Youtube Shorts|Shorts Youtube|spread love satheesh shanmu|tamil couple vlogs|spread love - satheesh shanmu|satheesh shanmu|spread love|uruttu|couple channel|couples|fun couples|funny|reels|spread love uruttugal|youtube shorts|spread love shorts|yt|insta reels|husband uruttugal|yt shorts|reel|funny shorts|fun|comedy|funny reels|fun shorts","2214113","150346","391","https://i.ytimg.com/vi/49AnvYv_Hac/default.jpg","Here it is the next fun episode from wife uruttugal shorts series#shorts #SatheeshShanmu #SpreadLove #Uruttugal_______________________________________________________Spread love Satheesh Shanmu is a couple YouTube channel, we will upload lots of fun couple challenge videos, vlogs, and important happenings in our life, with our full-fledged fun, you will be entertained for sure, kindly subscribe & support us.For Promotions/Collaboration - satheeshshanmuofficial@gmail.com*********************************************************Follow our social media accts :https://www.youtube.com/channel/UCLj8iO6A3RSFfTJZMNPz7qQ - Chintuhttps://www.facebook.com/spreadlovesatheeshshanmu - Facebook pagehttps://instagram.com/satheeshshanmu?utm_medium=copy_link - Satheesh Shanmuhttps://instagram.com/imsatheeshv?utm_medium=copy_link - Satheeshhttps://instagram.com/impriyasatheesh?utm_medium=copy_link - Shanmuhttps://www.instagram.com/chintusatheeshshanmu/ - Chintu's Insta*********************************************************In Association with DIVO - Digital PartnerWebsite   - http://web.divo.in/Instagram - https://www.instagram.com/divomovies/Facebook  - http://www.facebook.com/divomoviesTwitter   - https://twitter.com/divomovies*********************************************************"
"84BkV1F8tMQ","💥🤯Beach-ல தொங்குனா Gift கொடுக்குறாங்களா  ..⁉️💢 #Shorts","2022-05-23T13:47:35Z","UC26ostnW8IbSxcD35YiAJgw","Aarif's MindVoice","22","22.24.05","aarifs mind voice|chennai juice shop|chennai juice kadai|chennai juice wrld|chennai mixed fruit juice|chennai fruit juice|fresh juice chennai|chennai marina juice shop|chennai street food shorts|chennai street food biryani|chennai street food in tamil|chennai best street food|t nagar shopping|t nagar street food|t nagar food|t nagar street shopping|t nagar andhra mess|madurai bun parotta|madurai street food|cashew fry in tamil|kathuvakkula rendu kadhal","1896704","189786","395","https://i.ytimg.com/vi/84BkV1F8tMQ/default.jpg","💥🤯Beach-ல தொங்குனா Gift கொடுக்குறாங்களா  ..⁉️💢 #ShortsBeach Hanging : 9962342031❤️Follow me on Instagram💥....https://aarifmindvoice.page.link/Instagram 🎉#blueooththermalprinter #thermalprinter#billingprinter#BesantNagarAkkaKadai #IliPoochi #SeaFoods #pakodaboyz #foodreviewtamil #pakodaboys #tamilfoodreview #foodshorts #tamilfoodshorts #chennaifoods #pakodaboyzchannel #biryanireview #bestfoodreviewtamilYou Can Help Me By Funding Below: https://rzp.io/i/eo9ZJKlznuGPAY/PAYTM/PHONEPE 7401014412Note* : All Funded Members Will be Mentioned in Thanks Video of the Month.For Promotions Contact :blackdots.online@gmail.comWhats app :7401014412#RaniCoolBar#chennaifoodie #chennaifoodreview #chennaifoodchannel #chennaifoodlovers #chennaifoodfestival #chennaifoodwalks #chennaistreetfood #chennaistreetshopping#tamilvlog #Aarif'sMindVoice #vlogintamil #peppafoodie#tnagarrmkv #tnagarmothilalstreetkalanjiyamstores  chennai chennai street food non veg chennai street food vegetarian chennai street food shorts chennai street food biryani chennai street food in tamil chennai best street food chennai marina beach street food chennai parrys corner street food chennai central street food peppa foodie shorts, peppa foodie shawarma, peppa foodie biryani, idris explores, irfans view, food review tamil #foodreview #shorts #jambazaar #chennaistreetfoods  #shorts #idrisexplores #peppafoodie #foodreviewtamil #tamilvlog #tamilvlogs #chennai#IdrisExplores #PeppaFoodie #FoodReviewTamil #TamilVlogs #TamilVlog #TamilVlogger #Chennai #ChennaiVlogs #ChennaiVlog |  #chennaifoodie #chennaifoodreview #chennaifoodchannel #chennaifoodlovers #chennaifoodfestival #chennaifoodwalks #chennaifoodtour #dosabatter food non veg chennai street food vegetarian chennai street food shorts chennai street food biryani chennai street food in hindi chennai street food in tamil veg chennai street food veg chennai street food atho chennai street food beef chennai street food bread omelette chennai street food breakfast chennai street food beef biryani chennai street food blog chennai best street food chennai marina beach street food chennai street food chicken fried rice chennai street food channel chennai street food chicken chennai street food chat chennai street food chicken 65 chennai street food chilli chicken chennai street food fried rice chennai street food fish chennai street food famous chennai street food food ranger chennai famous street food in tamil fish fry street food chennai chennai famous street food places chennai street food golgappa ganapathy street food chennai chennai street food hindi chennai street food hunt kurtosshhh hungarian street food chennai kurtosh hungarian street food chennai healthy street food chennai chennai street food in telugu chennai street food in tamil biryani chennai street food in tamil latest chennai street food ice cream chennai street food in tamil atho chennai street food kizhi parotta chennai street food kalan chennai street food kothu parotta kora food street r street food kora food street chennai review chennai street food lunch chennai street food latest chennai street food list chennai #biriyanibrothers #biriyanirecipe #biriyanichallenge #biriyanimalayalammovie #biriyanieating #biriyanilovers #biriyanieatingshow #biriyanimovie #biriyaniabirami #biriyanibykilo #biriyanicenter #biriyanieatingcompetition #biriyanifestival #biriyanigirl #biriyanihot #biriyanikathirikai #biriyanilove #biriyaniman #biriyanimasala #biriyanipot #biriyanirecipe #biriyanirecipeinassamese #biriyanisinhalarecipe #biriyanitamil #biriyani24hours #tamilvlog #Aarif'sMindVoice #vlogintamil #Marriagemuttonbiryani #MuttonBiryanichennai street foods,chennai best shops,jambazzar lassi,street food,best food review tamil nadu,chennai street food review,chennai street food tamil,chennai best street food,chennai cheap street food,chennai food reviews,cheapest food shops,cheapest hotels in india,tamil food vlog,tamil food review,street food chennai dosa,street foods in chennai,zam bazaar lassi shop,Aarif Mind Voice,badam milk,Sutta Koli,Chicken,grilled chicken,barbecue chicken masala tea, masala chai#maduraifood #maduraimuthucomedy #maduraivlog #maduraibunparotta #maduraichickencurry #maduraidaytodayshop #maduraijigarthanda #maduraikaridosai #maduraiperiyarbusstand #maduraiprivatebuses #maduraispecial #maduraistreetfood Chennai Tea"
"X1Jg0S1BDUI","NEW! Ep 3465 -  Popatlal Hungover?! | Taarak Mehta Ka Ooltah Chashmah | तारक मेहता का उल्टा चश्मा","2022-05-23T15:45:01Z","UCnSFZ-olBoLGLRUS_3RI2Aw","Taarak Mehta Ka Ooltah Chashmah","24","22.24.05","Taarak Mehta Ka Ooltah Chashmah|तारक मेहता|hindi comedy show|taarak mehta funny|popatlal|taarak mehta comedy|taarak mehta comedy scenes|bhide|jethalal babita funny|funny taarak mehta videos|jethalal|babita|tmkoc|daya|tapu sena|taarak episode|tmkoc latest episode|tarak mehta ka ulta chashma|taarak mehta ka ulta chashma|तारक मेहता का उल्टा चश्मा|tarak mehta|जेठालाल|tarak mehta new episode|જેઠાલાલ|NEW episode|popatlal ki shaadi|tmkoc new epi|popat ki shaadi","2851515","51023","1174","https://i.ytimg.com/vi/X1Jg0S1BDUI/default.jpg","Click here to Subscribe to Taarak Mehta Ka Ooltah Chashmah Official Channel: https://www.youtube.com/taarakmehtakaooltahchashmah?sub_confirmation=1 Click here to watch all your favorite Episode videos: https://www.youtube.com/watch?v=gqFEadNxmd8&list=PLPbh-P_C0BzRYOkpGxKL-6QmvYSL_ZuCu We bring to you the best videos from your favorite show Taarak Mehta Ka Ooltah Chashmah. So, get your daily dose of laughter with Jethalal, Taarak Mehta, Daya, Champaklal and their neighbors in Gokuldham Society.About Taarak Mehta Ka Ooltah Chashmah:--------------------------------------------------------------------The show is inspired from the famous humorous column 'Duniya Ne Undha Chasma' written by the eminent Gujarati writer Mr. Tarak Mehta. This story revolves around daily happenings in Gokuldham Co-operative Society and covers topical issues which are socially relevant. The show predominantly - revolves around 'Jethalal' (Dilip Joshi) who is an uneducated Gujarati businessman. Your 'Taarak Mehta' (Shailesh Lodha), is his neighbor. 'Jethalal' finds a friend and philosopher in 'Taarak Mehta' and often goes to him for advice whenever he is in trouble. Jethalaal's family includes his simpleton wife 'Daya Ben' (Disha Wakani) and a mischievous son 'Tapu' (Bhavya Gandhi / Raj Anadkat). Tapu is a menace and a constant source of trouble to all the members of Gokuldham. They have often warned 'Jethalal' to reform 'Tapu' or else be prepared to leave the premises. Lost hopes of being heard by his son push Jethalaal' to call his father 'Champaklal' (Amit Bhatt) from the village. This was his great idea of leashing some control over the mischievous Tapu. The opposite happens and the grandfather joins hands with the grandson to make life a roller coaster troublesome ride for Jethalal.Cast:---------Dilip Joshi as Jethalal Champaklal GadaDisha Vakani as Daya Jethalal GadaRaj Anadkat / Bhavya Gandhi as Tipendra Jethalal Gada (Tapu) Amit Bhatt as Champaklal Jayantilal GadaShailesh Lodha as Taarak MehtaSunayana Fozdar / Neha Mehta as Anjali Taarak MehtaTanuj Mahashabde as Krishnan Subramaniam IyerMunmun Dutta as Babita Krishnan IyerMandar Chandwadkar as Aatmaram Tukaram BhideSonalika Joshi as Madhvi Aatmaram BhideNidhi Bhanushali / Palak Sidhwani as Sonalika Aatmaram Bhide (Sonu) Gurucharan Singh/ Balwinder suri as Roshan Singh Harjeet Singh SodhiJennifer Mistry Bansiwal as Roshan Kaur Roshan Singh SodhiKavi Kumar Azad / Nirmal Soni as Dr. Hansraj Hathi Ambika Ranjankar as Komal Hansraj HathiKush Shah as Gulabkumar Hansraj Hathi (Goli)Shyam Pathak as Popatlal PandeySharad Sankla as AbdulAzhar Shaikh as Pinku Ghanshyam Nayak as Nattu KakaTanmay Vekaria as BaghaMonika Bhadoriya as BawriProduced By: Neela Asit Modi, Asit Kumarr Modi Special Thanks: Mahesh Vakil, Indu Tarak MehtaSet Design: Jayant DeshmukhOn-Air Promotion  ( SAB): SAB OAPCostume Designer: Alka MehtaCostume Stylist: Ekta BrahmbhattSound Recordist: Shakeel Mansuri Cameraman: Aamir ViraniProduction Head: Arvind MarchandeProduction Controler: Vinod ShishupalBackground Music: Sunil PatniOnline Editors: Vishal Tambe, Sandeep Singh Executive Producer: Jatin Yogesh BajajEditor: Dinesh Gosavi, Kaushal Mistry, Devang Modi, Vinod MauryaCreative Supervision: Krunal KhakhkharOperation Head: Sohil RamaniWritten By: Raju Odedra & Rajen UpadhyayDirectors: Harshad Joshi, Malav Suresh RajdaTelevision Adaptation and Designed By: Asit Kumarr ModiMore Useful Links : * Like us on Facebook : http://www.facebook.com/tmkoc.sabtv* Follow us on Instagram : http://www.instagram.com/taarakmehtakaooltahchashmahnfp * Follow us on Twitter : http://www.twitter.com/tmkoc_ntf* Visit us at : http://www.tmkoc.com#tmkoc #taarakmehta #tmkocsmileofindia"
"kS8n4PXHueg","Dost Ki Id Me Airdrop Nikala🤑Dekhiye Kya Kya Mila Pura Dekho😎🔥  #shorts","2022-05-23T11:45:34Z","UCz4ZDaeNoJqnTB6jTyRdbZw","DecoR Gaming","20","22.24.05","[none]","1541902","273373","1999","https://i.ytimg.com/vi/kS8n4PXHueg/default.jpg","Dost Ki Id Me Airdrop Nikala🤑Dekhiye Kya Kya Mila Pura Dekho😎🔥  #shorts"
"91n9f1hyfRM","Pawan Singh - जिन्दगी 2 मुलाकात (Video) | Zindagi 2 Mulaqaat | Vinay V, Deepesh | Bhojpuri Song 2022","2022-05-24T04:30:01Z","UC3cLf6pTB23nDry7awtxSZQ","VYRL Bhojpuri","10","22.24.05","vyrl bhojpuri|pawan singh new song|pawan singh|pawan singh ke gana|pawan singh new song 2022|zindagi|pawan singh zindagi song|pawan singh zindagi|zindagi 2 pawan singh|zindagi 2|zindagi 2 mulaqaat|zindagi 2 mulakat|pawan singh zindagi 2|new song|bhojpuri song|bhojpuri gana|new bhojpuri song|new bhojpuri song 2022|jindagi pawan singh|latest bhojpuri song|bhojpuri new song|bhojpuri song 2022|bhojpuri sad song|pawan singh song|new song 2022|bhojpuri","1557766","188903","72336","https://i.ytimg.com/vi/91n9f1hyfRM/default.jpg","एक सुपरस्टार की कहानी, पावर स्टार पवन सिंह की जुबानी। देखिये ज़िन्दगी का पार्ट २ - 'ज़िन्दगी २ मुलाक़ात' और कमैंट्स में बताये आपको कैसा लगा।Listen to ‘Zindagi 2 Mulaqaat here: https://UMGIndia.lnk.to/Zindagi2#ज़िन्दगी2मुलाक़ात #VYRLBhojpuri #PawanSingh --------------------------------------------------------------------------------------------------------------------------------------------------------------🎧 Audio Credits: 🎤 Singer: Pawan Singh 🎶 Music & Composition: Vinay Vinayak ➟ Lyrics:  Pinku Baba➟ Pluck: Amar Sangam Recorded @Dhvani Music World by KR Wahi  ➟ Guitar: Radharaman Vinayak➟ Vocals Recorded by: Kashyap ji @ SV Records Studio ➟ Mix & Master: BeenuV@V2 Studio➟ Song Arranged/Programming by: Vinay Vinayak🎬 Video credits:➟ Starring: Pawan Singh➟ Director/Editor: Deepesh Goyal ➟ DOP: Shoeb Siddique➟ Asst Director: Ashish, Vicky, Moksh➟ Choreographer: Ankit Thapa➟ EP: Richa Prinja, Deepesh Rakheja➟ Line Production: Muneer Khan➟ Hair: Sanju➟ Reels promotion by Rinku Singh➟ Special thanks to Amit Singh➟ Label: VYRL Bhojpuri--------------------------------------------------------------------------------------------------------------------------------------------------------------📝 Lyrics:Ek din zindagi se ho gayilMulaqaat fursat me -2Te puch lihni asliyat keKuch savalat fursat meKi ek din zindagi se ho gayilMulaqaat fursat meTe puch lihni e sohrat ka hoyiE naam ka hoyi -2Ki duniya se milal daulatE sab pehchaan ka hoyi -2Baris gayil hamar ankhiyaGazab barsaat fursat meKi ik din zindagi se ho gayil Mulaqaat fursat meBharal ba bheed se duniya magarAapan na kehu ba -2Kehu se kam na kehu baKahe ke sath ba sabhiMagar hamdam na kehu baChinahil ba Pawan PinkuSabhe hit naat fursat meKi ik din zindagi se ho gayilMulaqaat fursat meFollow & Subscribe to VYRL Bhojpuri: YouTube Channel: https://bit.ly/vyrlbhojpuriFollow us on Instagram: https://bit.ly/vyrl_bhojpuriFollow us on Facebook: https://bit.ly/vyrl-bhojpuriFollow us on Sharechat: https://sharechat.com/vyrlbhojpuri©Universal Music India Pvt. Ltd."
"kDVdi11qp74","Is Korean Noodles Ne Rula Diya | Sabse Spicy Korean Ramen 😱😱😱","2022-05-23T11:00:19Z","UCm3uwvJw2KHp4aWRjj_IWTQ","So Saute","26","22.24.05","spicy korean ramen|spicy korean ramen noodles|ramen|korean food|mukbang|spicy|korean ramen|noodles|spicy ramen noodles|spicy ramen challenge|spicy ramen|eating show|fire noodles|spicy noodles|instant ramen|instant noodles|spicy noodles challenge|korean spicy ramen challenge|spicy challenge|korean noodles|ramen noodles|so saute|so saute shorts|so saute new challenge|so saute new|so saute video|food challenge|spicy ramen noodles challenge🔥","1659070","160168","3115","https://i.ytimg.com/vi/kDVdi11qp74/default.jpg","Spice Lovers video like karo and sweet lovers comment down below..Don't Forget to LIKE, SHARE, and SUBSCRIBE Subscribe to my channelhttps://bit.ly/sosauteFollow me on INSTAGRAM https://www.instagram.com/sooosaute/Business Mail ID:sosaute@qyuki.com"
"cAnJ9sB2k20","👆One Click Trick..!🤩  #Shorts #Uninstall","2022-05-23T13:40:47Z","UCnKhQkCUS1oCEvjuTfU4xIw","Tech Boss","28","22.24.05","Techboss","714263","68931","312","https://i.ytimg.com/vi/cAnJ9sB2k20/default.jpg","---Media Partner : Adada CreatorsEmail : techboss@adadacreators.com😄 Subscribe😄 : http://bit.ly/2JmvIXbIt would make my day if you could also follow me on:📞 TeleGram: https://bit.ly/3dCwOJk🌈 Instagram: http://bit.ly/2JkdyVI🐦 Twitter: http://bit.ly/2xw0mZi😊 Facebook: http://bit.ly/2sk5fPVTo Shop on Amazon & Flipkart:Amazon : https://amzn.to/2H5y5Z2Flipkart  : http://fkrt.it/5ZmjeLuuuN"
"SB8siyx_BsU","This is how we welcomed him! | He's here!! | Nita Shilimkar","2022-05-23T13:30:03Z","UCslZq6pHE_qEIUoPxoYil8w","Nita Shilimkar","22","22.24.05","[none]","1163172","105369","2823","https://i.ytimg.com/vi/SB8siyx_BsU/default.jpg","Finally he's here! Soon he will be meeting my parents. :)Hope you all liked this one too!! Trying my best to bring out as many vlogs as I can... Stay tuned & keep watching my vlogs. If you liked this video then let me know in the comment section. Don't forget to hit the like button.Follow me on Instagram: https://bit.ly/2SqoOTj​​​Add me on Snapchat: https://bit.ly/36LVBL3​​​You can email me at:  nita.shilimkar2121@gmail.com#nitashilimkar #welcometoindia"
"zlopcf9pxsc","Playground Live Player Auction |  @CarryMinati, @Triggered Insaan, @MortaL &  @sc0ut | Playground","2022-05-23T12:50:00Z","UCDvcxk7hYgNzf4s8lTmM4zg","PLAYGROUND","24","22.24.05","Playground player auction|Playground live player auction|Playground live stream|Playground player auction live|Playground players|Playground|carryminati new video|carryminati|triggered insaan new video|triggered insaan|mortal new video|mortal|scout new video|scout|gaming|entertainment|gaming entertainment|#GameKyaHai|#GamingEntertainmentFullPower|gaming india|rusk media|Playground contestants|best auditions playground|live streaming","2820530","205846","4705","https://i.ytimg.com/vi/zlopcf9pxsc/default.jpg","Live Match Day 1 to start today at 4 PM 🏆Check out all the episodes of Playground Tryouts only on Amazon miniTV for free https://amzn.to/3PqbzP7About Playground: Playground is the world’s first gaming entertainment championship featuring four of the biggest Gaming entertainers of India leading their team of 4 players each to compete against each other over a period of 28 days to determine the winning team & one Individual champion. Pick your side & support them through the championship.This show is powered By MAACCheck out https://www.maacindia.com/ MAAC is India’s leading premier institute that provides career-oriented and short-term courses in Animation, Visual effects, Gaming, Filmmaking, Multimedia, Broadcast, and augmented and virtual reality.Our Special Partners For This ShowKFC: Check out amazing KFC deals and order your meal here https://bit.ly/3MK5ZFjPredict the Auction Result on PROBO and EARN BIG 🏆 https://probo-in.onelink.me/1kre/playgroundFollow Probo on https://www.instagram.com/probo_india/?igshid=YmMyMTA2M2Y=#Gaming  #Entertainment #CarryMinati  #TriggeredInsaan  #BestAuditions   #Mortal  #Scout#PowerPhoenixes – To support @MortaL’s Power Phoenixes follow https://instagram.com/powerphoenixes?igshid=YmMyMTA2M2Y=#AAAWerewolves – To support @Triggered Insaan’s AAA Werewolves follow https://instagram.com/aaa_werewolves?igshid=YmMyMTA2M2Y=#OPUnicorns – To support @sc0ut’s OP Unicorns follow https://instagram.com/op_unicorns?igshid=YmMyMTA2M2Y=#DareDragons – To support @CarryMinati’s DareDragons follow: https://instagram.com/dare_dragons?igshid=YmMyMTA2M2Y=Follow Playground onYouTube: https://www.youtube.com/c/PLAYGROUND_GLOBALFacebook: https://www.facebook.com/PlaygroundbyRusk/?Instagram: https://instagram.com/playground_global?Discord: https://discord.gg/gByrKFJpJxTwitter: https://twitter.com/team_playgroundLinkedIn: https://www.linkedin.com/company/playgroundofficial/"
"kOw1DZd9yHY","Driver Ki Setting - | Elvish Yadav |","2022-05-23T08:30:06Z","UCbmu9wfzxKls40WkCzvqtRA","Elvish yadav","23","22.24.05","driver ki setting elvish yadav|driver ki setting|elvish yadav|Elvish Yadav|Elvish Yadav Driver Ki setting|elvish yadav video|driver ki setting elvish|Elvish|yadav|elvish yadav new video|latest video elvish yadav|love story|comedy|adult comedy|elvish yadav vlogs|ahana goyal|chahat yadav|anoop chahal|love kataria|ajju0008|ajju0008 elvish yadav","1783418","258628","15433","https://i.ytimg.com/vi/kOw1DZd9yHY/default.jpg","Driver Ki Love StoryDownload Public App-https://bit.ly/publicapp_ElvishElvish Yadav Vlogs Channel- https://www.youtube.com/channel/UCHxj​​​...Written by: Elvish Yadav, Anoop Chahal (Faridabad Rockers)Directed by: Elvish yadavDirector of Photography: Imran KhanAssistant DOP: fareed AhmedEdited by:Shanu Ahmed, Elvish YadavColor Correction: Shanu AhmedExecutive Producer: Elvish yadavThumbnail: Shanu Jannat ProductionCastElvish yadavAjju0008Chahat YadavLove KatariaAnoop Chahal Lakshay KaushikAhana GoyalAnd Team FOLLOW MY SOCIAL MEDIA HANDLESINSTAGRAM-    http://instagram.com/elvish_yadav​​​FACEBOOK. -    http://facebook.com/theindianviner​​​TWITTER-         http://twitter.com/elvishyadav​​​SNAPCHAT -   @elvishyadav"
"F-ApSHW8dsI","Police Aagyi Gharpe 😓","2022-05-24T04:04:19Z","UCjvgGbPPn-FgYeguc5nxG4A","Sourav Joshi Vlogs","22","22.24.05","sourav joshi|sourav joshi vlog|sourav joshi arts|vlog|vlogs|daily vlogger|daily vlogs|lifestyle vlogs|funny vlogs|family vlogs|travel videos|ps5 vlog|ps5 game|unboxing ps5|finally bought ps5","6760786","735031","35126","https://i.ytimg.com/vi/F-ApSHW8dsI/default.jpg",""
"fhPp0RXOTGQ","Minecraft, But If I See A Tree The Video Ends...","2022-05-23T12:57:55Z","UC9GmTDKB0ttKEnzKsMRYRTA","Mc addon","20","22.24.05","minecraft|mcaddon|herobrine smp|techno gamerz herobrine smp|herobrine|minecraft but|minecraft java edition|minecraft pocket edition","869442","95464","452","https://i.ytimg.com/vi/fhPp0RXOTGQ/default.jpg","Minecraft, But If I See A Tree The Video Ends...#shorts #minecraft #mcaddon"
"2m1drlOZSDw","Mission: Impossible – Dead Reckoning Part One | Official Teaser Trailer (2023 Movie) - Tom Cruise","2022-05-23T13:00:00Z","UCF9imwPMSGz4Vq1NiTWCC7g","Paramount Pictures","1","22.24.05","[none]","7388730","224332","14240","https://i.ytimg.com/vi/2m1drlOZSDw/default.jpg","We all share the same fate. Watch the official teaser trailer for #MissionImpossible – Dead Reckoning Part One starring Tom Cruise. Coming to theatres 2023.Connect with #MissionImpossible Facebook: https://www.facebook.com/MissionImpossible/Twitter: https://twitter.com/missionfilm/Instagram: https://www.instagram.com/missionimpossible/Paramount Pictures Corporation (PPC), a major global producer and distributor of filmed entertainment, is a unit of Viacom (NASDAQ: VIAB, VIA), home to premier global media brands that create compelling television programs, motion pictures, short-form content, apps, games, consumer products, social media experiences, and other entertainment content for audiences in more than 180 countries. Connect with Paramount Pictures Online:Official Site: http://www.paramount.com/Facebook: https://www.facebook.com/ParamountInstagram: http://www.instagram.com/ParamountPicsTwitter: https://twitter.com/paramountpicsYouTube: https://www.youtube.com/user/Paramount"
"bjuqipImE1U","Spin The Wheel & Get The Lucky Colour Challenge #shorts #short","2022-05-23T12:10:29Z","UCsgy7HHlnPbgX417Ik6Mc2A","ADHARV & COUSINS JOURNEY","24","22.24.05","[none]","1314512","50350","56","https://i.ytimg.com/vi/bjuqipImE1U/default.jpg",""
