video_id,title,publishedAt,channelId,channelTitle,categoryId,trending_date,tags,view_count,likes,comment_count,thumbnail_link,description
"LCEMoVCaUOw","Nikamma - Releasing 17th June | Shilpa Shetty, Abhimanyu, Shirley | Javed Mohsin, Dev, Payal, Danish","2022-05-24T05:30:02Z","UC56gTxNs4f9xZ7Pa2i5xNzg","Sony Music India","10","22.24.05","Nikamma|Shilpa Shetty|Abhimanyu Dassani|Shirley Sethia|Javed Mohsin|Shirley Sethia Songs|Shirley Sethia Movie|Nikamma Songs|Nikama|Mohsin|Dev Negi|Payal Dev|Deane Sequeira|Shilpa Shetty Movie|shilpa shetty dance|Dance Song|nikamma trailer|Kabhii Tumhhe|Latest Hindi Song|Trending Songs|New Music Hindi|Latest Hit Song|Latest Bollywood Song|Songs 2022|New Song|New Hindi Song|Best Bollywood Song|New Song 2022|Sony Music|Latest Hits","4640491","104412","6428","https://i.ytimg.com/vi/LCEMoVCaUOw/default.jpg","Pehli nazar mein hi main hil gaya,Dhoondha tha jisko mujhe mil gaya 💃Presenting the absolute classic “Nikamma” in a fresh avatar, starring Shilpa Shetty, Abhimanyu Dassani and Shirley Sethia. The track is composed by Javed Mohsin, written by Danish Sabri and Sanjay Chhel, and sung by Javed – Mohsin, Dev Negi, Payal Dev and Deane Sequeira. We bet you won’t be able to stop grooving to this track!#Nikamma #ShilpaShetty #AbhimanyuDassani #ShirleySethiaAudio creditsComposed by: Javed – MohsinSingers: Javed – Mohsin Feat. Dev Negi, Payal Dev, Deane SequeiraLyrics by: Danish Sabri and Sanjay ChhelSong Arranged, Programmed, Mixed & Mastered by: Aditya DevAdditional Programming by: CeAzer & Viplove RajdeoBackup Vocals by: CeAzer, Sarfaraz Siddiqui & Abdullah khanDev Negi’s vocals recorded at: Aditya dev studio & Geet Audio craft studio by Moon dekaPayal Dev’s vocals recorded at: Aditya dev studioDeane Sequeira’s rap vocals recorded at: Seven heaven studio by A.Mani VannanLive seeti (Whistle) by – Sehran GazdarLive mandolin by: Akhtar khanChorus by: Arun Ingle & TeamJaved-Mohsin’ Assisstant’s  - Subodh Sharma, Abdullah Khan, Sameer KhanOriginal song creditsSong Name: Nikamma Kiya Is Dil NeMovie: Kyaa Dil ne KahaaComposer: Himesh ReshammiyaSingers: Shaan & SanjivaniLyricist: Sanjay ChhelSony Pictures International Productions presentsA Sabbir Khan Films ProductionMusic on – Sony MusicChoreographer – Ganesh AcharyaDirected By – Sabbir KhanLyrics:Pehli nazar mein hi , main hil gaya Dhoondha tha jisko mujhe milgayaNikammmaaaa.......NikammmmAaa..... Pehli nazar mein hi main hil gaya ,Dhoodha tha jisko mujhe mil gaya Tu peeche padha hai Kyu zidd pe adha haiKya kehte hai tujhkoTere daddy Amma ???NikkammmmaaaaaaaaaaaaaaaDobara mat pooochnaNikkammma kiya iss dil ne Iss dil ne kiya hai nikkammaNikkamma kiya iss dil ne Iss dil ne kiya hai nikkammaaa( Dobara mat Poochna )Haan Haan...Bottle on bottle,Haan,body on bodyWe can take it back to mine for an after-partyYou with the 6 pack,  girls going off track Hit it , hit it , hit it Yeah the queen is backBa ba ba bad boy yeah you come my way With all that action I need a replayMake way, Make way, Make way I’m heading to the top and I’m here to stayChadhke sar se utrena, teri nighaaon mein woh ek nasha haiTeri freaky baaton ne najane kyu mera dil chu liya haiiiiMohabbat mein teri , Yeh Haalat hai meri Dhadak ke yeh dil bole uiiiiii AmmaaaaaaaaNikkammaaaaaaaaaaa( Kripya dhiyaan se sune )Nikkamma kiya iss dil ne , Iss dil ne kiya hai NikkammaaNikkamma kiya iss dil ne, Iss dil ne kiya haiiiiiiiiiiiiiiiiii( Dobara mat Poochna )Caution:Lover boy's investments are subject to Market risk, please read all the scheme related documents carefullyLabel: Sony Music India(C) 2021 Sony Music Entertainment India Pvt. Ltd.Audio on Sony Music Entertainment India Pvt. Ltd(C) 2021Stay connected with us on:👉 Subscribe To Sony Music India YouTube - http://bit.ly/SonyMusic_YouTube​👉 Like us : Facebook - https://www.facebook.com/SonyMusicIndia​ 👉 Follow us : Instagram - https://www.instagram.com/sonymusicin...👉 Follow us : Twitter - https://twitter.com/sonymusicindia"
"dpoKuM-r2x8","Geojit “Sebastiante Velliyazhcha” | EP1 | Webseries | Fliq","2022-05-21T13:30:20Z","UC6RsQGglWCXre5du9GuLX2A","Karikku Fliq","24","22.24.05","KARIKKU|karikkufliq|webseries|malayalam|funny|comedy|plustwo|flowerstv|movies|vlog","2491434","191149","4620","https://i.ytimg.com/vi/dpoKuM-r2x8/default.jpg","Brand Partner: Mercely’sInstagram: https://instagram.com/mercelysindia?igshid=YmMyMTA2M2Y=https://www.facebook.com/mercelysindia/https://youtu.be/sfGPKCJj3T8Credits:Direction and Cinematography-SIDHARTH KT Executive producer-NIKHIL PRASADStory and Screenplay - ADITHYAN CHANDRASHEKAR  Editor- PINTO VARKEY Music- VISHNU VARMA  Sync and Sound design - JISHNU RAM  Art team- AJAY KRISHNAN - ANEX NELLICKALBrand partnership- UNNI MATHEWS Colorist -BILAL RASHEED Production Controller - ARUN RATAN Direction Team- MUHAMMED JASEEM- SACHIN RAJU- ADWAITH MRProduction Team- RAHUL RAMESH- AJEESH CPAssistant Cinematographer- VIVEK V BABUAssistant Editor- AKHIL TACostumes- ROSHIN VARGHESEHelicam- SHARATH UDAYCamera- SENSOR FILMSFocus Pullers- RAHUL ALEX- VISHNU CHANDRANMusic production- ARAVIND R WARRIER- CEBE BABUStudio- NEONWAVE RECORDSLyrics- JISHNU PAVITHRAN- CHITRA PRADEEPSingers- VISHNU VARMA- AJIT SATHYANRecording Engineer- LE CHARLES BLUEStills- RAHUL RAMESH- BIJU NARAYAN - VIVEK BABU  Vfx and Posters- BINOY JOHN Titles-APARNA MURALIDHARANSubtitles-arjjun menon"
"frA_SzdWsTM","Last To Leave Car Wins ₹100,000!","2022-05-24T05:00:12Z","UCMrvxKTx9hLhZcOvJkYOnAw","A_S Gaming","20","22.24.05","a_s gaming|as gaming|24 hours in car|24 hours in mustang|as gaming challenge video|challenge|24 hours challenge|as gaming vs as rana|sahil rana|as rana|as army|sahilrana vlogs|as gaming funny video|as gaming new video|family friendly|funny|car challenge|as gaming mustang|mustang gt|as gaming live|24|sahil|mr beast|sourav joshi vlogs|lokesh gamer","524460","60040","1510","https://i.ytimg.com/vi/frA_SzdWsTM/default.jpg","Last To Leave Car Wins ₹100,000!📷INSTAGRAM  - https://www.instagram.com/sahilrana/🎮Facebook  :-https://www.facebook.com/ASgaming.sahilrana/☄️DISCORD - https://discord.gg/asgaming🕊️TWITTER -  https://twitter.com/ytasgaming🕹My Pc Gaming Chanel - https://www.youtube.com/channel/UCQnZPHf1ka2YkAp8evQmwOA🎬My Brother Chanel - https://www.youtube.com/channel/UCS5wKBMLOOn0l0wOSnspyZQFor Business Work - (Asg@xnetork.gg)GAME NAME - Garena Free Fire📝Disclaimer :- This is a Gameplay/Entertainment Video Made For Entertainment Purpose Only For Gamers Audience ( Garena Free Fire ) . No Any Harmful Contents in this video. Its Just For Fun And Entertainment Only - As GamingNote :- Copyright Disclaimer under Section 107 of the copyright act 1976, allowance is made for fair use for purposes such as criticism, comment, news reporting, scholarship, and research. Fair use is a use permitted by copyright statute that might otherwise be infringing. Non-profit, educational or personal use tips the balance in favour of fair use.Thank You 🔥 Like Share & Subscribe My Channel.Tags - #asgaming #lamborghini  #asarmy #diamond #djalok #skylervsdjalok #funny #hunted #ghost #ghostchallange  #ringgame #game #drawing #drawchallenge #24hoursinforest #forest #24hoursforestday2 #lasttoleave #circle #drinkchallenge #challenge #iphone #buying #everything #neweventfreefire #freefireprank  #asgamingbreakingphone #maggichallenge  ​​#neweventfreefire #freefire #freefireprank #neweventfreefire #asgamingvshacker​​ #freefireprank​​ #asgaminglive​​ #diamondsforfreefire​​​ #freedjaloklive"
"JXg7TNEhyJg","School Project Scam By Balli 😂🔥 | Zamaanaa #shorts","2022-05-24T05:14:38Z","UCugqOjnkPkUX9T6GcmuTX-g","Zamaanaa","24","22.24.05","[none]","218647","32336","91","https://i.ytimg.com/vi/JXg7TNEhyJg/default.jpg",""
"VIjgfXvkmMw","SHINCHAN OPENING BIGGEST GOD HULK'S & AVENGERS LUCKY BLOCKS IN GTA V !","2022-05-23T05:47:06Z","UCRkr9FQwM97a5HPTJZJfg3Q","ShivGam Gaming","20","22.24.05","shivgam gaming|shinchan gta 5|LUCKY BOX|Opening BIGGEST GOD HULK|LUCKY|BOX|in|GTA5|gta 5 mods|gta 5 shinchan|lucky box|opening hulk lucky blocks|opening god hulk lucky blocks|opening lucky blocks|god hulk|shivgam|shivgam lucky blocks|gta v opening lucky blocks|gta 5 god hulk|gta 5 lucky box|GTA5 AVENGERS|opening biggest lucky blocks|lucky blocks gta 5|lucky box gta v|hulk lucky box|god hulk lucky blocks|mega lucky blocks|shinchan lucky blocks","303334","5515","99","https://i.ytimg.com/vi/VIjgfXvkmMw/default.jpg","#shivgamgaming #shinchangta5 #godhulkSHINCHAN OPENING BIGGEST GOD HULK'S & AVENGERS LUCKY BLOCKS IN GTA V !_______________________________________________________Instagram:-https://www.instagram.com/shivgam_yt/...Join Discord👇👇👇👇👇👇👇👇https://discord.gg/Pc9QY3YPFor Business InquiryEmail: sg@visualgaming.in________________________________________________________Watch Our Other Videos:-https://youtu.be/tpMoHtTrB48                                           - https://youtu.be/NfAwQsPgfHESUBSCRIBE my channel for more videos and drop a like❤️ If u like this part then please comment down.and Comment you want more part of this type of series.Thank you"
"iqlan_BUi2I","JUGJUGG JEEYO - OFFICAL TRAILER | Varun Dhawan Kiara Advani Anil Kapoor Neetu Kapoor | Raj Mehta","2022-05-22T09:30:10Z","UCKQKIY2YlI4L5QVg7hhfjrQ","Dharma Productions","1","22.24.05","karan johar|dharma productions|dharma movies|anil kapoor|neetu kapoor|neetu singh|varun dhawan|kiara advani|maniesh paul|manish paul|prajakta koli|mostlysane|dum dum army|bollywood|new trailer|bollywood news|cinema|family film|drama|family film 2022|alia bhatt|ranbir kapoor|divorce|indian weddings|punjabi|punjabi music|Jug jug jio|jugjug jeo|jugjug jeeo|jug jug jeeyo|jugjug jeeyo|jug jug jeeyo dharma|dharma new trailer|varun new movie","39274243","547323","159737","https://i.ytimg.com/vi/iqlan_BUi2I/default.jpg","JugJugg Jeeyo is a story set in the heart of Patiala and much like the city, it’s full of love and laughter, colour and drama. It’s about family and its values, unresolved yearnings, and unexpected reconciliations. In cinemas 24th June, 2022.Viacom18 Studios & Dharma Productions presentA Dharma Productions FilmJUGJUGG JEEYOStarring Varun Dhawan, Kiara Advani, Anil Kapoor, Neetu Kapoor, Maniesh Paul & Prajakta Koli.Directed by Raj MehtaProduced by Hiroo Yash Johar, Karan Johar, Apoorva MehtaStory by Anurag SinghScreenplay and Dialogues by Rishhabh SharrmaScreenplay by Anurag Singh & Sumit Bhateja Music Supervised by Azeem Dayani Music by Mithoon, Tanishk Bagchi, Kanish Seth & Kavita Seth, Diesby, PozyLyrics by Mithoon, Tanishk Bagchi, Dhruv Yogi, Diesby, Ginny DiwanPre-book your tickets on: BMS - https://bookmy.show/JJJVoucherPaytm - https://m.paytm.me/dl_jugjuggjeeyo#DharmaProductions #DharmaMovies #KaranJohar #VarunDhawan #KiaraAdvani #AnilKapoor #NeetuKapoor #ManieshPaul #PrajaktaKoli #Bollywood #NewTrailer #Bollywood #BollywoodTrailer #BollywoodNewsSubscribe for Regular updates:http://goo.gl/tBtxtt​Like us on: http://www.facebook.com/DharmaMovies​Follow us on: http://www.twitter.com/DharmaMovies​​https://www.instagram.com/dharmamovies"
"7VaUDfcmJx8","Kamal Sir-க்கு நான் BLOOD MAKEUP போட்டேன்! Lokesh Kanagaraj Vikram Exclusive | VJS | Fahad","2022-05-23T10:07:09Z","UCjF5ecCYXFDvR0UY9GcfnoA","Cinema Vikatan","24","22.24.05","tamil cinema songs|tamil cinema full movie|tamil cinema news|tamil cinema padam|tamil cinema review|tamil cinema movie","310990","12747","464","https://i.ytimg.com/vi/7VaUDfcmJx8/default.jpg","#VIKRAM #Lokeshkanagaraj #kamal This is an Exclusive and Special Interview of Lokesh Kanagaraj, Here He Speaks about his Recent Movie Vikram, and his Working Experience with Kamal Hassan, Vijay Sethupathi, Suriya, and Fahad Fazil, Also Why he Choose Suriya for the Vikram movie and This movie is Continuation of Kaithi are all Spoken here, Watch the full Interview and Come across the comments.CREDITSResearch - Krishna, Kathirvelan, My Bharathiraja Host -  KrishnaCamera - Suresh Krishna & SandeepEdit - LeninChannel Manager - Hari BabuAppappo App Link: http://bit.ly/2WDTNNa Vikatan App - https://bit.ly/vikatanAppSubscribe Cinema Vikatan : https://goo.gl/zmuXi6Subscribe to Vikatan Digital Magazine Subscription: https://bit.ly/3uEfyiY"
"hnQItbbuiFI","💔Breakup Naale 1.5 Lakh Wasted..⁉️🥴☠️ | Idris Explores | #shorts","2022-05-23T14:30:12Z","UCkaPZziKEd4TpOehs5WHjnQ","Idris Explores","22","22.24.05","[none]","435398","54567","110","https://i.ytimg.com/vi/hnQItbbuiFI/default.jpg","#shorts #idrisexplores #AshortAday #tamil #Tamilshorts #tamilvlog #Tamilvlogs #Tamil #Trending |_______________________________📧 Contact For Collaboration/Promotions (or) Inquiries : idrisexplores@gmail.com/❤️️ Follow me on Instagram! : https://www.instagram.com/idris.explores/_______________________________Disclaimer: This video is only for entertainment purposes. No Copyright intended.Idris Explores ❤️️"
"kBG-y6CBPUE","Bingo! RINGA RINGA ROSA-EP25 | Karikku #shorts","2022-05-24T07:31:30Z","UC2bNrKQbJLphxNCd6BSnTkA","Karikku","23","22.24.05","karikku|malayalam|funny|comedy|webseries|lolan|george|karikk|karikke|film|trending|sketch|vine|flowerstv","1737341","187834","733","https://i.ytimg.com/vi/kBG-y6CBPUE/default.jpg","Story & Directed by : KCExecutive Producer : Nikhil PrasadAssociate Director : Abijith KrishnanDOP : Binoy JohnEditor : Anand MathewsScreenplay : KC & Abijith Krishnan Music and BGM  : Jishnu thilakSound Mixing : Krishnanunni, Ajil kurianVFX : Binoy John, Abijith KrishnanProduction Controller : KarundasProduction Executives :Siraj udheen, Sandeep PradeepkumarArt : Siraj udheen, vishnu VitzzAssistant cinematographer : Abhishek A, Chandhu RadhakrishnanAssistant directors : Akshay S Kumar , ashwaghosh , Sandra C S Cast : Sabareesh sajjin, Sumadevi, Abhishek A Special Thanks :Black House Media , Chandhu, Radhakrishnan , Karundas , Vishnu Prakash kalathil, Meghuldas, Prathuish Vijayan"
"5_i9o2iVLD0","INDIA'S NUMBER 1 PROFESSOR PT. 2","2022-05-23T14:30:11Z","UC0rE2qq81of4fojo-KhO5rg","Tanmay Bhat","23","22.24.05","AIB|Stand Up Comedian|Jokes|Funny|Vlog|Indian Vlogger|Vlogger|Comedy|Comedian|Trending|All India Bakchod|Funny Video|Funny Sketch|Funny Jokes|Tanmay Bhat|Live|Live Stream|Tanmay Bhat Live","2079338","213446","3767","https://i.ytimg.com/vi/5_i9o2iVLD0/default.jpg","FOLLOW:• Nishant: https://www.instagram.com/nishanttanwar/• Rohan: https://www.instagram.com/mojorojo/• Vishal: https://www.instagram.com/dayamaged/CHECK OUT MY OTHER CHANNELS• Honestly by Tanmay Bhat: https://www.youtube.com/channel/UCneQdPbDLwZ__ZXP0YVwiag• Bot Army Clips: https://www.youtube.com/channel/UCZTA61g-fKb_UeFkkmQD7Dg• SuperTeam Podcast: https://www.youtube.com/channel/UCi-pkXLbm7sqXFhV1NBLUfQ------------------FOLLOW ME• Instagram: https://www.instagram.com/tanmaybhat/• Twitter: https://twitter.com/thetanmay• LinkedIn: https://in.linkedin.com/in/thetanmay------------------APPS I USE TO INVEST:₹ Open your Demat Account at: https://zerodha.com/open-account?c=ZMPTHF₹ Buy your favourite stocks at Smallcase: https://link.smallcase.com/discover-smallcases₹ Learn and Research stocks on Tickertape: https://ttape.in/getTickertape​₹ Get 100 Rs. Free Bitcoin by using Tanmay100 Here:  https://bit.ly/3sGoxeJ------------------Video edited by Varun Prajapati: https://www.youtube.com/c/SkrAch69------------------#onlineclasses #memes #reactions"
"7dGuurPHk5M","Bingo! RINGA RINGA ROSA-EP23 | Karikku #shorts","2022-05-23T09:51:48Z","UC2bNrKQbJLphxNCd6BSnTkA","Karikku","23","22.24.05","karikku|malayalam|funny|comedy|webseries|lolan|george|karikk|karikke|film|trending|sketch|vine|flowerstv","2231710","212058","583","https://i.ytimg.com/vi/7dGuurPHk5M/default.jpg","Story & Directed by : KCExecutive Producer : Nikhil PrasadAssociate Director : Abijith KrishnanDOP : Binoy JohnEditor : Anand MathewsScreenplay : KC & Abijith Krishnan Music and BGM  : Jishnu thilakSound Mixing : KrishnanunniVFX : Binoy John, Abijith KrishnanProduction Controller : KarundasProduction Executives :Siraj udheen, Sandeep PradeepkumarArt : Siraj udheen, vishnu VitzzAssistant cinematographer : Abhishek A, Chandhu RadhakrishnanAssistant directors : Akshay S Kumar , ashwaghosh , Sandra C S Cast : Sabareesh sajjin, K C, Vishnu Vitzz, Binoy john, Najjah Special Thanks :Black House Media , Chandhu, Radhakrishnan , Karundas , Vishnu Prakash kalathil, Meghuldas, Prathuish Vijayan, Hasan Ikka"
"K7Z9WPPXn4A","Bingo! RINGA RINGA ROSA-EP24 | Karikku #shorts","2022-05-23T15:10:04Z","UC2bNrKQbJLphxNCd6BSnTkA","Karikku","23","22.24.05","karikku|malayalam|funny|comedy|webseries|lolan|george|karikk|karikke|film|trending|sketch|vine|flowerstv","1959539","197635","684","https://i.ytimg.com/vi/K7Z9WPPXn4A/default.jpg","Story & Directed by : KCExecutive Producer : Nikhil PrasadAssociate Director : Abijith KrishnanDOP : Binoy JohnEditor : Anand MathewsScreenplay : KC & Abijith Krishnan Music and BGM  : Jishnu thilakSound Mixing : KrishnanunniVFX : Binoy John, Abijith KrishnanProduction Controller : KarundasProduction Executives :Siraj udheen, Sandeep PradeepkumarArt : Siraj udheen, vishnu VitzzAssistant cinematographer : Abhishek A, Chandhu RadhakrishnanAssistant directors : Akshay S Kumar , ashwaghosh , Sandra C S Cast : Sabareesh sajjin, K C, Vishnu Vitzz, Binoy john, Abhishek A Special Thanks :Black House Media , Chandhu, Radhakrishnan , Karundas , Vishnu Prakash kalathil, Meghuldas, Prathuish Vijayan"
"e1fgVZSzmmM","എന്തോരം മീൻ വാങ്ങിയിട്ടും ഈ രഹസ്യം ഞമ്മൾ അറിയാതെ പോയെല്ലോ","2022-05-23T09:11:37Z","UCMBfNlOh2wFi4NM6GdS-Iwg","Malappuram Thatha Vlog by ridhu","22","22.24.05","[none]","63404","1788","122","https://i.ytimg.com/vi/e1fgVZSzmmM/default.jpg",""
"hv1GVT6i7XI","Advertisement  Vs Reality | 4 Heads","2022-05-23T14:25:25Z","UC_8RJKzqCTKIZZcQNGLvtqw","4 Heads","22","22.24.05","4 heads|4 heads new video|ads vs reality|ads vs reality food|ads vs reality funny videos|ads vs reality in hindi","226333","4135","134","https://i.ytimg.com/vi/hv1GVT6i7XI/default.jpg","Social Media Links= FourHeads (insta) -https://www.instagram.com/fourheads.official/1) Neha - https://www.instagram.com/nehapatil_28/​ 2) Nitesh - https://www.instagram.com/nitesh_free​... 3) Sanket - https://www.instagram.com/shanky6444/4) Priti - ​ https://www.instagram.com/priti.mhatre/Cast – Neha,Sanket,Priti,NiteshEdited By -  Saurabh GhanekarDOP - Bibin P Cherian Production - Akash Shetye Background Music By - Youtube Library & Epidemic Music"
"ESKOwBZjQkg","Naslen Bloopers | Success Teaser |Chathopadhyay | Makal Movie BTS | Sathyan Anthikad |Jayaram| Meera","2022-05-22T13:46:05Z","UC8YL4SAAzcNyxhs6Jdk9vUw","Anoop Sathyan","1","22.24.05","[none]","1148763","32376","376","https://i.ytimg.com/vi/ESKOwBZjQkg/default.jpg","The fun actor Naslen.Edit & Voiceover: Anoop SathyanOriginal background score: Rahul RajGraphics: Jishnu#Naslen #MakalScenes #MakalMovie"
"MhcHe13YaLY","Sathya | Kannada TV Serial | Ep - 378 | Best Scene | Zee Kannada","2022-05-23T16:15:01Z","UC4xZrjsfEiomEbE9OUjN4-g","Zee Kannada","24","22.24.05","Sathya|Best Scene|Kannada|entertainement|tvserial|zeeKannada|famous|indian|Kannada tv serial|zee Kannada Serials|serial|television|zee5|daily soap|Indian Tv Show|online|free|download|show|family drama|Romantic tv serial|popular|Kannada serial|tv show|star|Drama","246474","2124","11","https://i.ytimg.com/vi/MhcHe13YaLY/default.jpg","Click here to watch Full Episode  : https://zee5.onelink.me/RlQq/7c41c2ddZee5 Paid Subscription Link : https://bit.ly/32gxIJ4Sathya is a Kannada romantic series regarding the lives of Sathya and Karthik Prabhu. Sathya is a tomboy in nature, who works hard to keep up the promise that she gave to her father. Kartik prepares for his marriage with Divya, Sathya's elder sister, but on the day of the wedding, Divya leaves him for a richer man. The show depicts how Sathya overcomes this problem and how her and Kartik's relationship evolves.To Free Download ZEE5 Mobile app click the link belowhttps://zee5.onelink.me/RlQq/be0f8316Connect with Zee Kannada on Social MediaFacebook - http://bit.ly/ZeeKannadaFBInstagram - http://bit.ly/ZeeKannadaInstaTwitter  - http://bit.ly/ZeeKannadaTwitterConnect with Zee5 on Social MediaFacebook : http://bit.ly/Zee5KannadaFBInstagram : http://bit.ly/Zee5KannadaInstaTwitter : http://bit.ly/Zee5KannadaTwitter"
"puFxLEpGrIs","LOSLIYA PLAYS YES OR NO #losliya #Losliyamariyanesan #darshan #losliyamovie #suryanfm #shorts","2022-05-23T14:00:31Z","UCRrC-24ktw9_VMdDyD4l4Vg","Suryan FM","24","22.24.05","losliya mariyanesan|bigg boss losliya|losliya yes or no|suryan fm|darshan|losliya about darshan","164626","10232","27","https://i.ytimg.com/vi/puFxLEpGrIs/default.jpg","Subscribe - http://bit.ly/SuryanFMsubscribe .. We will work harder to generate better content. Thank you for your support.Join Telegram: https://t.me/SuryanFMofficial Visit our website for more videos: http://www.suryanfm.in Facebook: https://www.facebook.com/SuryanFMInsta: https://www.instagram.com/SuryanFMTwitter: https://www.twitter.com/SuryanFMYoutube: https://www.youtube.com/SuryanFMSharechat : https://sharechat.com/SuryanFM______________________________________________* Copyright Disclaimer Under Section 107 of the Copyright Act 1976, allowance is made for fair use for purposes such as criticism, commenting, news reporting, teaching, scholarship, and research. Fair use is a use permitted by copyright statute that might otherwise be infringing. Non-profit, educational or personal use tips the balance in favour of fair use.-This video has no negative impact on the original works (It would actually be positive for them)-This video is also for teaching purposes.-It is not transformative in nature.-We only used bits and pieces of videos to get the point across where necessary."
"j9ayrAS2ZWo","share with that fellows 🤪 #nihasisters #niharikaplatinum #ashortaday #telugucomedy","2022-05-23T06:47:48Z","UCHsy1_kQ_7Wgv-U_0igOt8g","niha sisters","24","22.24.05","[none]","295650","22596","158","https://i.ytimg.com/vi/j9ayrAS2ZWo/default.jpg",""
"1YdXw0eASig","Jo&Jo | EllolamThari Ponnenthina | Wedding Teaser |Nikhila Vimal, Mathew, Neslen | Arun D Jose","2022-05-22T07:30:01Z","UCFwEpCT0lOvK6sqL-0R9RJA","Anusree Productions","10","22.24.05","[none]","1682059","64197","1049","https://i.ytimg.com/vi/1YdXw0eASig/default.jpg","Click Here To Subscribe Now.........https://goo.gl/QUWmL9🔔 Get alerts when we release any new video. TURN ON THE BELL ICON on the channel! 🔔P © All copyrights reserved &* ANTI-PIRACY WARNING * This content is Copyright Anusree Audios And VideosCall & Whats App 09847413555 Mukeshhttps://www.facebook.com/anusreevideo...Mukesh Anusreehttps://www.facebook.com/Mukeshanusre...Set Your Caller Tunes Now  💗💘If you haven't subscribed to our channel yet, do subscribe now.  . So help us grow by subscribing.💘CREWStory, direction: Arun D JoseProduced by: Harris Desom, Adarsh Narayan, P B Anish, Anumod BoseDop: Ansar ShahMusic : Govind VasanthaEditor: Chaman ChakkoScreenplay & dialogue: Arun D Jose, Raveesh NathLyrics: Suhail Koya, Titto P ThankachenSound design :Sachin Sudhakaran, Hariharan M (Sync Cinema)Sound mixing: Vishnu SujathanArt director: Nimesh M ThanoorCostume designer : Sujith C SMake up: Sinoop RajProduction controller: Rinny DivakarDirection team :  Raveesh Nath, Rejivan Abdhul Basher, Vishnu Visiga, Archana Rudraksh, Jishnu RathnakaranAsso editors: Muhammad Shabeer, Thomas P Sebastian Cinematography team: Jithin George, Azeem sha, Ramesh Kumar NG, AnirudhSubtitle: Ranjini AchuthanProduction executive: Vinosh KaimalFinance controller: Vijeesh RaviProduction managers: Sujeed daan, Indrajith babuPro : A S DineshDigital marketing: 10GmediaVfx: Accel MediaDi studio: Poetic Prism and Pixels CochinColourist: Srik VarierTrailer cuts:  Chaman chakkoStills: Shijin RajPoster designer: Manu Davinci, yellowtoothsProduction house: Imagin Cinemas & Signature StudiosDistribution: Icon cinemasAnusree Productions Worldwide YouTube Network Music Production, Promotion And Distribution ,Contact For Enquiries...Call & Whats App 09847413555 Email Id : promotionteamolakkademoodu@gmail.com * ANTI-PIRACY WARNING * This content is Copyright to Anusree Videos. Any unauthorized reproduction, redistribution or re-upload is strictly prohibited of this material. Legal action will be taken against those who violate the copyright of the following material presented!bollywood actresses latest photoshoot 2021| Fashion Shoot | Bigg Boss Fame Remya Panicker Photoshoot Making Video | Remya Panicker | Bigg Boss Malayalam | tamil actress photoshoot| Malayalam PhotoshootMalayalam Film songs | Malayalam Movie songs | Malayalam songs | Malayalam music | Malayalam Cinema | Malayalam Latest songs | Malayalam latest hits | Malayalam Latest songs | Malayalam latest | Malayalam Mappila Album songs 2019  |Malayalam Serial | malayalam web series | malayalam web series |malayalam cover songs | Olakkade Moodu ഒലക്കടെ മൂട്#AnusreeAudiosAndVideos#AnusreeVideos#AnusreeProductions"
"AGJ_EULdHVo","Come On Baby Let's Go On The Bullet 🏍️🎊 #thewarrior #thoufiq24 #bulletsong #rapo#shorts#paati #love","2022-05-23T13:50:27Z","UCLpZtYj0ZYn_FWkZCriURTg","Thoufiq24","22","22.24.05","[none]","146160","6521","93","https://i.ytimg.com/vi/AGJ_EULdHVo/default.jpg",""
