video_id,title,publishedAt,channelId,channelTitle,categoryId,trending_date,tags,view_count,likes,comment_count,thumbnail_link,description
"DYpFw2_ysrQ","Pawan Singh - जिन्दगी 2 मुलाकात (Teaser) | Zindagi 2 Mulaqaat | Vinay V, Deepesh| Bhojpuri Song 2022","2022-05-21T04:30:37Z","UC3cLf6pTB23nDry7awtxSZQ","VYRL Bhojpuri","10","22.24.05","vyrl bhojpuri|pawan singh new song|pawan singh|pawan singh sad song|pawan singh ke gana|pawan singh new song 2022|zindagi|pawan singh zindagi song|pawan singh zindagi|zindagi 2 pawan singh|zindagi 2|zindagi 2 mulaqaat|zindagi 2 mulakat|pawan singh zindagi 2|new song|bhojpuri song|bhojpuri gana|new bhojpuri song|new bhojpuri song 2022|jindagi pawan singh|jindagi 2|latest bhojpuri song|bhojpuri new song|bhojpuri song 2022|sad song|bhojpuri sad song","964998","71821","16285","https://i.ytimg.com/vi/DYpFw2_ysrQ/default.jpg","पेश है आपके अपने सुपरस्टार की कहानी की एक झलक।  तैयार रहिये गा 24 मई सुबह 10 बजे, मिलते है VYRL भोजपुरी के यूट्यूब चैनल पर।  #ज़िन्दगी2मुलाक़ात #VYRLBhojpuri #PawanSingh Audio Credits: Singer: Pawan Singh Music & Composition: Vinay Vinayak Lyrics:  Pinku BabaPluck: Amar Sangam Recorded @Dhvani Music World by KR Wahi  Guitar: Radharaman VinayakVocals Recorded by: Kashyap ji @ SV Records Studio Mix & Master: BeenuV@V2 StudioSong Arranged/Programming by: Vinay VinayakVideo credits:Starring: Pawan SinghDirector/Editor: Deepesh Goyal DOP: Shoeb SiddiqueAsst Director: Ashish, Vicky, MokshChoreographer: Ankit ThapaEP: Richa Prinja, Deepesh RakhejaLine Production: Muneer KhanHair: SanjuSpecial thanks to Amit SinghLabel: VYRL BhojpuriFollow & Subscribe to VYRL Bhojpuri: YouTube Channel: https://bit.ly/vyrlbhojpuriFollow us on Instagram: https://bit.ly/vyrl_bhojpuriFollow us on Facebook: https://bit.ly/vyrl-bhojpuriFollow us on Sharechat: https://sharechat.com/vyrlbhojpuri©Universal Music India Pvt. Ltd."
"5lLOEdY0o0s","Bigg Boss OTT Telugu Winner Bindu Madhavi Father About Nataraj Master || Sakshi TV Cinema","2022-05-23T15:30:10Z","UC19Izyf_K31Tpbws9AEippg","Sakshi TV Cinema","24","22.24.05","Bigg Boss OTT Winner Bindu Madhavi Father Interview|bindu madhavi father about nataraj master|About Nataraj Master Bad Behaviour|Bindu Madhavi Father Discussion with Nataraj Master|Bigg Boss OTT Telugu Winner Bindu Madhavi|Bindu Madhavi Parents|bigg boss non stop winner bindu madhavi father exclusive interview|About Bindu Madhavi - Nataraj Master Clash|Bindu Madhavi Father Strong Reply to Nataraj Master|Sakshi TV Cinema","176755","3746","496","https://i.ytimg.com/vi/5lLOEdY0o0s/default.jpg","Bigg Boss OTT Telugu Winner Bindu Madhavi Father About Nataraj Master || Sakshi TV Cinema#BiggBossOTTWinner #BinduMadhaviFather #NatarajMaster #SakshiTVCinema"
"PCeVoPfxCOU","Vaadi Vaasal Video Song | The Legend | Legend Saravanan | Harris Jayaraj | J.D –Jerry","2022-05-20T04:35:14Z","UCLbdVvreihwZRL6kwuEUYsA","Think Music India","10","22.24.05","[none]","10919661","162418","35715","https://i.ytimg.com/vi/PCeVoPfxCOU/default.jpg","Presenting the Video Song #VaadiVaasal from #TheLegendMovie starring #LegendSaravanan Music Director: J.Harris JayarajSingers: Benny Dhayal, Jonita Gandhi, Additional Voice--Sri VidhyaLyricist: SnehanChoreography : Raju SundaramCredits –Harmonies : Senthil Dass, Sam.P.Keertha,Yogi Sekar, Ranjith Unni, Feji Ashwin , Srividhya, Sujatha Venkatraman, SharmilaPercussions : Jaycha, Lakshmi Narayana, Raju Derick, Vikram, Kaviraj, SruthiNaadhaswaram : BalasubramaiyamTabala : BaluVeenai : HarithaFlute : KirankumarBass Guitar : Keith PeterAcoustic Guitar : Vijay JosephMixed By : J.Harris JayarajMastered By : JayfrancoRecording Engineer : M.Ramesh D.F.T.Studio Manager : K.S.RamkumarRecording Assistant Sound Engineer :  S.Paul Dinakaran#TheLegend #TheNewLegendSaravanaStoresProductionsDirector : JD - JerryProduced by : Legend SaravananCast : Legend Saravanan, Urvashi Rautela, Geethika, Vivek, Nasser, Prabhu, Vijayakumar, Yogi Babu & OthersDOP : R.VelrajEditor : RubenArt : S.S.MoorthyLyrics: Kaviperarasu Vairamuthu, Kabilan, Pa Vijay, Snehan, Madhan KarkyChoreography : Raju Sundaram, Brinda, DineshDialogue : Pattukottai PrabhakarStunts : Anl ArasuAudiography : Suren.G - S.Azhagiya KoothanDI : Navin shettyDI studio: Nube CirrusCG : R.Harihara Suthan - Sanath T.G & Sathish C.DCostumes : Sathya NJ, Tina RosarioCo-directors : A.P.Rajan & A.Siva KumarProduction Executive : Ambikapathy and Raghunathan Production Managers : Chinnamanur K.Sathish Kumar & A.Munish Publicity Design : Reddot PawanPRO : Nikkil MurukanCreative Promotions : BeatRouteAudio Label : Think Music© 2022 SPI Music Pvt. Ltd.For All Latest Updates:Website: https://thinkmusic.in/Subscribe to us on: http://www.youtube.com/thinkmusicindiaFollow us on: https://twitter.com/thinkmusicindiaLike us on: https://www.facebook.com/ThinkmusicofficialFollow us on: https://www.instagram.com/thinkmusicofficial"
"hFJ-XV7abIw","World’s FASTEST Roller Coaster🎢  *VLOG* #shorts #vlog","2022-05-23T17:21:41Z","UCVaSUu1B_Y4R2rFLUpvRmlA","The Formal Edit","26","22.24.05","World’s fastest roller coaster|Roller coaster|fastest|world’s fastest|swings|theme park|uae|abu dhabi|indian vlogger|vlogger|sourav joshi|karan sehgal|msk vlogs|jatt prabhjot|flying beast|gaurav taneja|best indian vlogger|funny videos|desi comedy|Comedian|comedy|haha|sambhavana seth","868970","102755","184","https://i.ytimg.com/vi/hFJ-XV7abIw/default.jpg",""
"0tDZ2M7XDAU","Hogalalla VS YesSmartyPie House| Minecraft Hindi","2022-05-22T06:30:00Z","UC3iZua_igo3KkTYPtpGRDtg","MineFlux","20","22.24.05","minecraft|minecrafthindi|yes smarty pie|yes smarty pie minecraft new video|himlands season 4|himlands|yessmartypie new video|yessmartypie new video himland|techno gamerz|techno gamerz minecraft|proboiz 95|proboiz 95 gamer|mrgamerjay mods|mrgamerjay minecraft|mineflux|mythpat minecraft|mythpat minecraft part 1|live insaan minecraft|live insaan|Hogalalla VS YesSmartyPie House| Minecraft Hindi","562275","28265","365","https://i.ytimg.com/vi/0tDZ2M7XDAU/default.jpg","Today in this video i am going to protect YesSmartyPie house from Hogalalla #minecraft #minecraftjavaedition #minecraftpocketeditionClips credit- Maizen and BlockFacts ....thank you both of you for giving such great ideas and making minecraft audience more stronger day by day"
"rJW8DJLhNVQ","No Count (Official Video) | Tarsem Jassar ft Japji Khaira | Latest Punjabi songs 2022 | TPZ Records","2022-05-20T04:29:18Z","UCx9mUNPNVTtDZHbnLjZgAWA","TPZ RECORDS","10","22.24.05","tpz records songs|tarsem jassar|no count|tarsem jassar new song|tarsem jassar song|tarsem song|no count teaser|tarsem jassar teaser|punjabi song teaser|Japji khaira|japji khaira all song|japji khaira song|japji khaira punjabi song|latest tarsem jassar song|no count tarsem jassar and japji khaira|japji khaira tarsem jassar|new punjabi songs 2022|punjabi songs|new songs|latest punjabi song 2022|tarsem jassar song 2022|2022 hit songs|trending song 2022","3300223","82993","2111","https://i.ytimg.com/vi/rJW8DJLhNVQ/default.jpg","No Count (Official Video) | Tarsem Jassar ft Japji Khaira | Latest Punjabi songs 2022 | TPZ RecordsTPZ Records presents the No Count official Video to make your playlist more energetic yet melodious 💥 in the Voice of our favorite Tarsem Jassar & the very talented Japji Khaira is featured in this rocking Song. Lyrics and Composed by Tarsem Jassar, and the music is given by Deosi. The video is Produced by Gs sandhu & Pinkeesh Devedaa ( Talent Promoterz ). #tarsemjassar #japjikhaira #Nocount  #tpzrecordsEnjoy & Stay connected. 'LIKE' if you ♥ this song.Subscribe To TPZ Records Channel For Amazing Songs.✅ Subscribe!  ➜ https://bit.ly/TPZRECORDS🔔 Click On The Bell + Turn On Notifications.—————————————————————————————♪ Stream / Download Full Song ♪♪Spotify: https://spoti.fi/3lqybkq♪Apple: https://apple.co/3G4mZnb♪Amazon Prime Music - https://amzn.to/3wu3qkV♪ ITunes - https://apple.co/3G4mZnb♪YouTube Music: https://bit.ly/3G19jcF♪Gaana : https://bit.ly/3G11inY♪Resso - https://bit.ly/3PvOnPo♪Hungama - https://bit.ly/3lEQ3YU♪Jio Saavn - https://bit.ly/3yQT4gI♪Wynk - https://bit.ly/3lxeFmw————————————————————————————Song Credits:- Song Name - No CountSinger/Lyrics/Composer - Tarsem JassarMusic - DeosiFeaturing - Japji KhairaAppearance - Gurmeet Sajan, Nisha Bano, Malkit Rauni & Money Romana , Bindu BhullarDirector - Sujal FerozepuriaAsst. Dirt - Gurwinder WarwalProject by - Deep boparai Production - aman production Poster Design - Garry nawaabMakup -  Jimmy makoverSpecial thanks - Manjeet singh tony,Vikram GillConceived by - Gurmaan BrarLabel - TPZ RecordsProduced by - #Gssandhu & Pinkeesh Devedaa ( Talent Promoterz )Online Promotion - TPZ DigitalYoutube Promotion - BIGMedia—————————————————————————————Enjoy & stay connected with us!👉Subscribe to TPZ Records: https://bit.ly/2KG0UTT 👉Subscribe to TPZ Beatz: https://bit.ly/3p7davO 👉Subscribe to TPZ Haryanvi: https://bit.ly/32vQ6NM 👉Subscribe to TPZ Bhakti : https://bit.ly/3cz9fDp 👉Subscribe to TPZ Gurbani: https://bit.ly/31M2JDS—————————————————————————————Follow us on Social Media!👉Facebook: https://www.facebook.com/tpzrecords 👉Twitter: https://twitter.com/TpzRecords 👉Instagram: https://www.instagram.com/tpzharyanvi/ 👉Pinterest: https://in.pinterest.com/tpzrecordsof... 👉Chingari: https://chingari.io/tpzrecords 👉Snapchat: https://www.snapchat.com/add/tpzrecords🌐Official Website: http://www.tpzrecords.com​​​🌐Official Website: http://www.talentpromoterz.com​​—————————————————————————————Email: Artist@tpzrecords.comContact Us on : +91 7011110681Music Audio and Video All Copyrights rights reserved @TPZ Records 2022 Punjabi song 2022"
"38Xyu759zLk","लो आ गई कच्चे आम की नई रेसिपी आजसे पहले न कभी खाई होगी न देखी होगी बिना भूख के ही 4-5 रोटी खा जाएंगे","2022-05-24T05:46:18Z","UCUIUs2UztaAWN_KEReUXWUA","Raksha ki Rasoi","22","22.24.05","deshi food recipe|aam ki chutney|chutney recipe|aam ki launji|aam ki sabji|mango recipe|kachche aam ki sabji|kachhe aam ki recipe|mango recipe by rakshakirasoi|rakshakirasoi|आम का अचार|aam ka achar|aam ka achar recipe|new style aam ka achar|aam ka achar banane ka naya tarika|mango pickle recipe|achar recipe","237554","1910","76","https://i.ytimg.com/vi/38Xyu759zLk/default.jpg","Hii friends welcome to my channel Raksha ki Rasoi.......🙏🙏🙏kulfi mouldhttps://amzn.to/3s4ae3eआज आपकी रक्षा आपके लिए एक नई रेसिपी लेकर के आई है अगर फ्रेंड आपको को मेरी रेसिपी पसंद आए तो वीडियो को लाइक शेयर जरूर करें और अगर आप हमारे चैनल पर नए हैं पहली बार आए हैं तो चैनल को सब्सक्राइब करना बिल्कुल मत भूलें......😊🙏🙏🙏🙏🙏Ingredients-..................................................................................................Follow me on-my facebook page Raksha ki Rasoihttps://www.facebook.com/rakshakirasoi/2nd facebook page Cook with Rakshahttps://www.facebook.com/cookwithraksha/ 2nd youtube channelCook with Rakshahttps://www.youtube.com/channel/UC10B7kU5wsrpMdRZ2JCHtNgInstagramhttps://www.instagram.com/rakshakirasoi/My other popular videos1-बेकरी जैसा केक सिर्फ तीन चीजों सेhttps://youtu.be/AJo493M-qDc2- 2 गिलास दूध से आधा किलो रसमलाई बनाने का तरीकाhttps://youtu.be/nrw43LRzJ7M3- बिना तंदूर बिना ओवन बनाएं रेस्टोरेंट जैसी नान रोटीhttps://youtu.be/nrw43LRzJ7M4- बिना रेत बालू के घर पर झटपट भूने गरमा गरम चनाhttps://youtu.be/q1LGiSNd8C05- मीठा खाने का मन हो तो सिर्फ 5 मिनट में बनाएं ऐसी रेसिपी जिसके आगे केक पेस्ट्री भी फेलhttps://youtu.be/2VuWA1kPbbQ6- सिर्फ 10 मिनट में रसीली कुरकुरी जलेबी बनाएंhttps://youtu.be/j2hkp9jOxTA7- दो चीजों से बनाएं सूजी की बहुत ही टेस्टी मिठाईhttps://youtu.be/fJgGM3gZ7hQ8- स्पेशल देशी रायता जिसके आगे सभी रायता भी हो जाएंगे फेलhttps://youtu.be/UDE8tQ5yrWU9- नींबू के छिलकों की स्पेशल रेसिपीhttps://youtu.be/e4TMZmwnWX010- बिना अंडा के अंडा करी खाई है कभी? खाकर असली अंडा करी खाना भूल जाएंगेhttps://youtu.be/hwfe9Nk50s4........................................................................................................अगर आप केक बनाने के शौकीन है तो केक और क्रीम से जुड़े सारे वीडियोस नीचे दी गई लिंक पर जाकर देख सकते हैंMy cake and cream recipe videoGhee se whipped cream banayehttps://youtu.be/PsAfhOEUKQADudh se whipped cream banayehttps://youtu.be/gJrgWaR1XkgMy other cake ki new recipehttps://youtu.be/AJo493M-qDchttps://youtu.be/lLDao9rQN8khttps://youtu.be/PqEoGKhQUkIhttps://youtu.be/de0mTloArgsHomemade chocho chipshttps://youtu.be/hGTcvc9KzgIHomemade nozelhttps://youtu.be/uPLFgC2piqQ.........................................Product that I used if you buy then click this link👇👇👇कुछ स्पेशल प्रोडक्ट जो मैं अपने वीडियोस में इस्तेमाल करती हूं अगर आप खरीदना चाहे तो नीचे दी गई लिंक पर खरीद सकते हैंNonstick tawahttps://amzn.to/30akbQupizza cutterhttps://amzn.to/30d10Wi16 pc storage sethttps://amzn.to/2lN9gwBflower masala boxhttps://amzn.to/2lX1UGIoil bottle brushhttps://amzn.to/2npKJhhdish drying rackhttps://amzn.to/2mZo8ryrefrigerator storage sethttps://amzn.to/2nv83u5sink water flexible nozzelhttps://amzn.to/2mS5zG2sink drain coverhttps://amzn.to/2n0wZczproduct that I usedMy ....gas chulha-https://amzn.to/2lhBChUnonstick cookware set-https://amzn.to/2lcWkQ7Pizza cutter -https://amzn.to/2lcXACPwooden spatula set-https://amzn.to/2mkWHIqoil brush-https://amzn.to/2mFMiHvmixer grindershttps://amzn.to/2mjhoofhand blender whiskerhttps://amzn.to/2mj9dIypressure cookerhttps://amzn.to/2mNxfvL......................................................................................केक से जुड़े कुछ जरूरी सामानPik chocolate whipped creamhttps://amzn.to/2Zh3qmuWhipped cream whitehttps://amzn.to/2YDTjJzChocolate syruphttps://amzn.to/3dCjtAOVanilla flavorhttps://amzn.to/2BGHIQUFood colour combohttps://amzn.to/3i9BdqoCherryhttps://amzn.to/31s6jUBTutti fruithttps://amzn.to/386Ah1JCake sprinkler Colourfulhttps://amzn.to/2NxRK9HSilver pearlshttps://amzn.to/3dA8veVChocolate singlehttps://amzn.to/2B5ktQMCombohttps://amzn.to/2NxZyIH 😊😊😊😊😊😊😊😊"
"H1TVe0hAnBA","NEW! Ep 3465 - Kahan Hai Popatlal?! | Taarak Mehta Ka Ooltah Chashmah | तारक मेहता का उल्टा चश्मा","2022-05-23T15:15:00Z","UCnSFZ-olBoLGLRUS_3RI2Aw","Taarak Mehta Ka Ooltah Chashmah","24","22.24.05","Taarak Mehta Ka Ooltah Chashmah|तारक मेहता|hindi comedy show|taarak mehta funny|popatlal|taarak mehta comedy|taarak mehta comedy scenes|bhide|jethalal babita funny|funny taarak mehta videos|jethalal|babita|tmkoc|daya|tapu sena|taarak episode|tmkoc latest episode|tarak mehta ka ulta chashma|taarak mehta ka ulta chashma|तारक मेहता का उल्टा चश्मा|tarak mehta|जेठालाल|tarak mehta new episode|જેઠાલાલ|NEW episode|popatlal ki shaadi|tmkoc new epi|popat ki shaadi","920109","16838","264","https://i.ytimg.com/vi/H1TVe0hAnBA/default.jpg","Click here to Subscribe to Taarak Mehta Ka Ooltah Chashmah Official Channel: https://www.youtube.com/taarakmehtakaooltahchashmah?sub_confirmation=1 Click here to watch all your favorite Episode videos: https://www.youtube.com/watch?v=gqFEadNxmd8&list=PLPbh-P_C0BzRYOkpGxKL-6QmvYSL_ZuCu We bring to you the best videos from your favorite show Taarak Mehta Ka Ooltah Chashmah. So, get your daily dose of laughter with Jethalal, Taarak Mehta, Daya, Champaklal and their neighbors in Gokuldham Society.About Taarak Mehta Ka Ooltah Chashmah:--------------------------------------------------------------------The show is inspired from the famous humorous column 'Duniya Ne Undha Chasma' written by the eminent Gujarati writer Mr. Tarak Mehta. This story revolves around daily happenings in Gokuldham Co-operative Society and covers topical issues which are socially relevant. The show predominantly - revolves around 'Jethalal' (Dilip Joshi) who is an uneducated Gujarati businessman. Your 'Taarak Mehta' (Shailesh Lodha), is his neighbor. 'Jethalal' finds a friend and philosopher in 'Taarak Mehta' and often goes to him for advice whenever he is in trouble. Jethalaal's family includes his simpleton wife 'Daya Ben' (Disha Wakani) and a mischievous son 'Tapu' (Bhavya Gandhi / Raj Anadkat). Tapu is a menace and a constant source of trouble to all the members of Gokuldham. They have often warned 'Jethalal' to reform 'Tapu' or else be prepared to leave the premises. Lost hopes of being heard by his son push Jethalaal' to call his father 'Champaklal' (Amit Bhatt) from the village. This was his great idea of leashing some control over the mischievous Tapu. The opposite happens and the grandfather joins hands with the grandson to make life a roller coaster troublesome ride for Jethalal.Cast:---------Dilip Joshi as Jethalal Champaklal GadaDisha Vakani as Daya Jethalal GadaRaj Anadkat / Bhavya Gandhi as Tipendra Jethalal Gada (Tapu) Amit Bhatt as Champaklal Jayantilal GadaShailesh Lodha as Taarak MehtaSunayana Fozdar / Neha Mehta as Anjali Taarak MehtaTanuj Mahashabde as Krishnan Subramaniam IyerMunmun Dutta as Babita Krishnan IyerMandar Chandwadkar as Aatmaram Tukaram BhideSonalika Joshi as Madhvi Aatmaram BhideNidhi Bhanushali / Palak Sidhwani as Sonalika Aatmaram Bhide (Sonu) Gurucharan Singh/ Balwinder suri as Roshan Singh Harjeet Singh SodhiJennifer Mistry Bansiwal as Roshan Kaur Roshan Singh SodhiKavi Kumar Azad / Nirmal Soni as Dr. Hansraj Hathi Ambika Ranjankar as Komal Hansraj HathiKush Shah as Gulabkumar Hansraj Hathi (Goli)Shyam Pathak as Popatlal PandeySharad Sankla as AbdulAzhar Shaikh as Pinku Ghanshyam Nayak as Nattu KakaTanmay Vekaria as BaghaMonika Bhadoriya as BawriProduced By: Neela Asit Modi, Asit Kumarr Modi Special Thanks: Mahesh Vakil, Indu Tarak MehtaSet Design: Jayant DeshmukhOn-Air Promotion  ( SAB): SAB OAPCostume Designer: Alka MehtaCostume Stylist: Ekta BrahmbhattSound Recordist: Shakeel Mansuri Cameraman: Aamir ViraniProduction Head: Arvind MarchandeProduction Controler: Vinod ShishupalBackground Music: Sunil PatniOnline Editors: Vishal Tambe, Sandeep Singh Executive Producer: Jatin Yogesh BajajEditor: Dinesh Gosavi, Kaushal Mistry, Devang Modi, Vinod MauryaCreative Supervision: Krunal KhakhkharOperation Head: Sohil RamaniWritten By: Raju Odedra & Rajen UpadhyayDirectors: Harshad Joshi, Malav Suresh RajdaTelevision Adaptation and Designed By: Asit Kumarr ModiMore Useful Links : * Like us on Facebook : http://www.facebook.com/tmkoc.sabtv* Follow us on Instagram : http://www.instagram.com/taarakmehtakaooltahchashmahnfp * Follow us on Twitter : http://www.twitter.com/tmkoc_ntf* Visit us at : http://www.tmkoc.com#tmkoc #taarakmehta #tmkocsmileofindia"
"LNt0mqr7VXU","Unnale Unnale Song Making #Vinay #UnnaleUnnale #actorvinayrai #harrisjayaraj #shorts #suryanfm","2022-05-21T15:00:13Z","UCRrC-24ktw9_VMdDyD4l4Vg","Suryan FM","24","22.24.05","vinay rai|unnale unnale|unnale unnale songs|suryan fm|vinay rai interview in tamil|unnale unnale song","392998","29616","55","https://i.ytimg.com/vi/LNt0mqr7VXU/default.jpg","Subscribe - http://bit.ly/SuryanFMsubscribe .. We will work harder to generate better content. Thank you for your support.Join Telegram: https://t.me/SuryanFMofficial Visit our website for more videos: http://www.suryanfm.in Facebook: https://www.facebook.com/SuryanFMInsta: https://www.instagram.com/SuryanFMTwitter: https://www.twitter.com/SuryanFMYoutube: https://www.youtube.com/SuryanFMSharechat : https://sharechat.com/SuryanFM______________________________________________* Copyright Disclaimer Under Section 107 of the Copyright Act 1976, allowance is made for fair use for purposes such as criticism, commenting, news reporting, teaching, scholarship, and research. Fair use is a use permitted by copyright statute that might otherwise be infringing. Non-profit, educational or personal use tips the balance in favour of fair use.-This video has no negative impact on the original works (It would actually be positive for them)-This video is also for teaching purposes.-It is not transformative in nature.-We only used bits and pieces of videos to get the point across where necessary."
"wibl8e2RoPs","Let Us 'C' || Episode-02 || Web Series || Godavari Express || Capdt","2022-05-22T10:30:14Z","UC9oYsyIZ_hziMNc7cqCvF2w","Godavari Express","24","22.24.05","[none]","154802","7921","410","https://i.ytimg.com/vi/wibl8e2RoPs/default.jpg","Download the LOKAL APP⬇️ https://go.onelink.me/ayLY/9g7ttnwiHello Godavari Express StudentsHere is the 2nd Lesson of our new Web Series Let Us 'C'....Episode-02Written & Directed by Gopinath AdimulamCastGopinath AdimulamSapna  ChuganiSurya AkondiMali DeepakRasamsetty J.AbhinaySatyanarayanaMagapu KoushikSai KarthikProduction ManagerSasi kanth BKDubbingSV AudiographyDurga DasariPublicity DesignsRC DesignsAssistant DirectorPavan Sathish PavlaVFXSathish AnimatorCinematographyChandu KrrishUday VeeruEditingChinnaaPavan Kumar JSai Chinna SettyDIChinnaaMusicBharat ManchirajuProduced bySarath Ankit NadimintiChinna Vasudeva ReddySincere thanks toMarrella varalakshmi garu's family Surya Akondi garu Special thanks to Aaravapalli Bhavani garu,Ayyappa flower stall,kakinada,Peddamarket owners,kakinadaViswanatham garu Sincere thanks toSatish.PPrudhvi DameraMadhu Murali pemmadiYogendra Surya Kiran DileepSpecial thanks toAadapa someswarao garu peddamarket,kakinqdaAadapa bujji garu, pedda market kakinada"
"39ynwXvhSFk","Tom and Jerry (Anu& Rithvi) Part 14 #shorts","2022-05-23T07:31:00Z","UCL5nlHWXVLeOsSjKH2fhmsg","KL BRO Biju Rithvik","24","22.24.05","#kl bro biju rithvik|#shorts","3884178","198214","0","https://i.ytimg.com/vi/39ynwXvhSFk/default.jpg","#shorts #klbrobijurithvik"
